date of comment,main comment,comment,depth,PTR Sentiment,Flair Sentiment,Flair Outlook
,,Shorting it to nubs,0,0.495,0.998,NEGATIVE
,,That seems to be the plan,1,0.512,0.988,POSITIVE
,,Soxs,2,0.5,0.885,NEGATIVE
,,Also had inversed by buying sosx. Up 15 percent. Huge market sell off this last week.,2,0.608,0.999,NEGATIVE
,,It just went up 7% today???,2,0.588,0.999,NEGATIVE
,,"Today’s news that Morgan Stanley increased Nvidia’s rating is noteworthy, but it’s worth approaching with caution, as it could still be a form of market manipulation. Over the past two weeks, bearish investors have been signaling their intentions, and now Morgan Stanley, a traditionally bullish player, is revealing its stance. Nvidia’s stock may exhibit both downward and upward trends in anticipation of earnings reports.It’s essential to wait for full confirmation before making any decisions. After all, it’s your money, and you have the final say in how you use it. I offer this insight simply as a sharing of knowledge.Lately, the market has been trending in a bearish direction. Investors are understandably hesitant to lose faith, and major players may take whatever actions they deem necessary to protect their interests. They might even announce a cut in their rating after earnings are revealed, a move that would be inconsequential for them but could have broader market implications.",3,0.53,0.982,NEGATIVE
,,"10k of NVDA? That’s nothing. Well, for a guy like him that is.Short play or what?",0,0.513,1.0,NEGATIVE
,,4 Million dollars worth of nvda and 27 million dollars worth of AMD ain't nothing for anybody.,1,0.642,1.0,NEGATIVE
,,"10k shares, ya dingus 😂",1,0.501,0.996,NEGATIVE
,,"What?He’s having billions to invest, but chooses to buy 10k or $4,5m. That’s pocket change for him.Thus. Playing a short play or a gamble? He knows damn well nVidia is way overvalued at this price.",2,0.529,1.0,NEGATIVE
,,,3,,,
,,Never go full regard. If you hold you’re going to regret it when this retests $300 and then $200.The people that bought it were large banks and funds that are now selling that to move it to blue collars/medical/money markets. Much safer assets than a big speculative bubble in NVIDIA. If they miss expectations this quarter then this thing will flop before it regains it’s market Dominance and retests ATHs.,4,0.526,1.0,NEGATIVE
,,10k shares are quite still big. Even if he has good amount of money still. He must have invested thinking something. My point is right now nvidia share is dumping quite hard. Maybe if the retail investors are viewing this as an opportunity to pump a little bit and then dump it.,2,0.526,1.0,NEGATIVE
,,"none of these massive funds buy (or sell) their position outright. they invest and divest over months. If they go all in all at once, they cant move the market. Also I think there legal restrictions on how much they can buy/sell without scheduling it advance with the sec, so as not to ""manipulate"" the market",1,0.556,1.0,NEGATIVE
,,"If it's a 13-F (which I didnt check) most likely the filing is made for the quarter ending 30 June 2023. Maybe he has already exited by now. We'll know in about 3 months at the next 13F filing.Also, for all practical purposes the new patriarch of the family is his son. George is already like 200 years old and I bet that shriveled fuck's day to day only consists of molesting his nurses...",0,0.536,1.0,NEGATIVE
,,I believe it is. This is not a current reflection of his positioning or sentiment. Could've been mid tech run for all we know,1,0.521,0.851,NEGATIVE
,,Misleading- Soros doesn’t manage his money anymore- someone else is running his family office. And he’s not the devil either.,0,0.503,1.0,NEGATIVE
,,also his fund has loose accounting and is crashing after hindenburg's report. i wouldnt trust his investments at all now.,1,0.533,1.0,NEGATIVE
,,Seriously he's 93.,1,0.5,0.996,NEGATIVE
,,"And he’s not the devil either.Oh he is, what he did to the bank of england, his cultural and political influence a lot of people despise him",1,0.505,0.997,NEGATIVE
,,"He simply sold the pound first and bought it back after. Most people buy first and sell later. This was at a time when the pound was being propped up by the corrupt establishment. All his political work has been about promoting open societies and democracy. His dad got his family out of Hungary when racist right wingers started getting violent on the Jews. Some people have tried to turn him into the devil, but most appreciate his work.",2,0.516,0.908,POSITIVE
,,If he loaded then I’m shorting.,0,0.497,1.0,NEGATIVE
,,Stock up to tax sale later. Either way he makes money,0,0.571,0.976,POSITIVE
,,what,1,0.5,0.982,POSITIVE
,,,0,,,
,,For what?,1,0.5,0.97,NEGATIVE
,,Don’t be a Fox News muppet,1,0.522,0.97,NEGATIVE
,,Qanon moron focusing on stupid shit. Plz don’t invest. Ppl like you are morons. I’m doing you a favor trust me,1,0.505,0.997,NEGATIVE
,,George sore ass?,0,0.502,1.0,NEGATIVE
,,Time to short both. Pltr suffered greatly because of that bastard,0,0.51,1.0,NEGATIVE
,,Time to buy,0,0.643,0.99,POSITIVE
,,"The article does not mention when he did that. Could have been well before the run up. Anyway to tell when this transaction happened? For a retail investor it does not make sense to jump in now. If you are a whale though, go crazy.",0,0.518,1.0,NEGATIVE
,,"He's a notorious short seller who used to own CNBC.Don't believe a thing he publicizes.Honestly who's stupid enough to buy NVDA at the fkiing top of the market, that's primed to crash",0,0.529,0.996,NEGATIVE
,,Oooo…. If OpenAI closes shop… that would be interesting.,0,0.507,0.691,NEGATIVE
