date of comment,main comment,comment,depth,PTR Sentiment,Flair Sentiment,Flair Outlook
,,It also gained the same amount in pre market when it was up to $140,0,0.611,0.914,NEGATIVE
,,So we lost 2 today. Big!,1,0.567,0.541,POSITIVE
,,"It wasn't much for me, but I sold what I had when it hit 140 then it dipped right after 😂",2,0.509,1.0,NEGATIVE
,,Can’t wait for the turnaround!,2,0.505,0.998,POSITIVE
,,Same.,3,0.5,0.917,NEGATIVE
,,Wow that says a lot about the current marketWhat is Intel?(Clarifying the jk bc I know how annoying the stupid questions can be),1,0.526,0.997,NEGATIVE
,,"At least $12Shortened form of intelligence. Used in a sentence: “Soap, get the intel to stop the launch”",2,0.521,1.0,NEGATIVE
,,What kind of name is Soap?,3,0.507,0.969,POSITIVE
,,Soap MacTavish my guyhttps://callofduty.fandom.com/wiki/John_%22Soap%22_MacTavish,4,0.505,0.755,NEGATIVE
,,"Yeah, and what's the first thing Price asks when he meets Soap?",5,0.52,0.69,NEGATIVE
,,This is why people say Reddit is mostly bots and everyone’s being manipulated,4,0.494,1.0,NEGATIVE
,,"It's a joke, not a dick. Don't take it so hard.",5,0.504,0.972,NEGATIVE
,,I’m talking about the unmelted ice guy you were responding to. Although your response does seem very chat bot-ty too.,6,0.5,0.995,NEGATIVE
,,"...and yet if you bought it a couple weeks ago, you're still up",0,0.516,0.687,POSITIVE
,,My fault guys. I decided to buy some. Ma bad.,0,0.527,0.997,NEGATIVE
,,This reminds me of when I held CSCO in the late 90’s ……Just remember to take profits along the way. Always pay yourself.,0,0.503,0.993,POSITIVE
,,“It’s the only hardware game in town for the internet”,1,0.506,0.593,POSITIVE
,,Remember Bay Networks? Remember Lucent? My butt still hurts from that raping.,2,0.51,1.0,NEGATIVE
,,Nortel Alcatel 3com ascend,3,0.501,0.998,POSITIVE
,,3Com.. I had a 3Com ISDN modem in the late 90's with a whopping 128Kbps connection while peasants were still using 33.6K or 56K dial up bullshit.King of the Nerds.,4,0.504,0.551,NEGATIVE
,,Ascend now sells weed in NJHow the mighty have fallen.https://ascend-stores.com/new-jersey/?gad_source=1&gclid=EAIaIQobChMIypCr4sHshgMVyDcIBR078QozEAAYASAAEgK4T_D_BwE,4,0.527,0.959,NEGATIVE
,,lol networking vs weed,5,0.513,0.539,POSITIVE
,,Whatever puts the kids through school,6,0.497,0.998,POSITIVE
,,Even intel produced network switches.,3,0.542,0.997,POSITIVE
,,My mom talked my dad out of $5k worth of apple in 1989 because she „never heard of it.“ and made him buy Cisco instead.,1,0.526,0.999,NEGATIVE
,,Or just use stoplosses to protect yourself and you dont have to decrease your position.  But this is not financial advice im pretty stupid.,1,0.521,1.0,NEGATIVE
,,Trailing stop losses my beloved ,2,0.491,0.979,POSITIVE
,,I would guess its the other way around? Adding to profits and applying risk management… Taking profits and adding to losers is a behavior based on fear.,1,0.513,0.999,NEGATIVE
,,I think he means you can take small profits and reinvest in the same stock. Aka buy the dips and sell a bit when it shoots up,2,0.551,0.971,NEGATIVE
,,This - and also buy what’s next 3 years down the road as AI starts filling its britches. Probably AWS or MSFT azure. Or something that doesn’t even exist right now.,3,0.549,0.89,POSITIVE
,,I put all my money into things that don’t exist yet,4,0.502,0.997,NEGATIVE
,,"People are being stupid and thinking they will sell when right and the exits are getting smaller and smaller, when it drops 20% before you have a chance and the next 20% you will be too afraid to sell.This is going sub $90 before next earnings. It will go to a bazillion one day.....just not today.",1,0.535,1.0,NEGATIVE
,,This guy fucks,1,0.5,0.977,NEGATIVE
,,It gained a similar amount earlier in the week. Volatile stock is volatile!,0,0.574,0.999,NEGATIVE
,,Funny thing is it isn’t even really volatile. It’s a 3% correction after basically rocketing up since May and analysts are still bullish on $150 to $160.I think a lot of the new investors here are quite young and are literally expecting to see only green candles every day.,1,0.524,1.0,NEGATIVE
,,"Yeah, it’s all relative. Compared to index funds it’s volatile, compared to GME it’s stable.Tomorrow is going to be fucking wild with the triple expirations. Something like 1/3 of Nvidia options expire tomorrow. Could be an absolute blood bath, let’s hope not.",2,0.51,0.999,NEGATIVE
,,"To put things into perspective, QQQ was about 7 times less volatile today and SPY was about 14 times less volatile",3,0.518,0.712,NEGATIVE
,,Yep I expected people to exit on Tuesday because of Juneteenth.....nope.....they are playing it right up to the wire today and tomorrow.People aren't tracking what the options expirations mean or why apple fell this week with the rebalancing.,3,0.509,1.0,NEGATIVE
,,This feels like a dumb question but how does one check the options and when they’re expiring for a certain stock?,4,0.547,0.999,NEGATIVE
,,barchart.com you can see the open interest for each strike price,5,0.524,0.902,POSITIVE
,,Volatile? It has gone up like 3% everyday for months! How is that volatile?,1,0.522,1.0,NEGATIVE
,,Statistically one of the top 3 known worst days to trade is 20Jun.,0,0.524,1.0,NEGATIVE
,,"If so, I'd consider today's performance as exceptional!",1,0.546,0.85,POSITIVE
,,I think other 2 in month o September,1,0.541,0.998,NEGATIVE
,,I think other 2 in month o September,2,0.541,0.998,NEGATIVE
,,And it will gain 500 billion tomorrow,0,0.537,0.982,POSITIVE
,,You think NVDA will pop 16% tomorrow...?,1,0.504,0.995,NEGATIVE
,,Sorry I meant go up 46% tomorrow. Greatest stock in the history of humankind and will go up forever 😄,2,0.54,0.999,POSITIVE
,,Intel will have its day... Just you wait (for a while).,0,0.547,0.548,NEGATIVE
,,"Dude, I've been waiting..",1,0.503,0.978,NEGATIVE
,,Me too :(,2,0.5,0.992,NEGATIVE
,,"Fabs break even in 2027, it's a play for the patient investor.",1,0.507,0.996,NEGATIVE
,,What was once a competitor has now become an unattainable target,0,0.515,0.982,NEGATIVE
,,Lol I felt it as soon as I bought an option call this morning.,0,0.514,0.998,POSITIVE
,,that is not a dip sir...,0,0.505,0.951,NEGATIVE
,,"That doesn't mean anything, it can't go up all the time, a short pullback is normal",0,0.509,1.0,NEGATIVE
,,"And it was only down 4%. Had a pretty big run up this week so it’s not crazy at all. Could be up 6% tomorrow, it’s a volatile stock.",0,0.56,1.0,NEGATIVE
,,Healthy stocks don't typically shoot up 3 percent then lose 6 percent intraday on no news after going on a bender for months. Enjoy the bubble while it lasts.,0,0.558,0.86,POSITIVE
,,So up 20% tomorrow?,1,0.495,0.864,NEGATIVE
,,Sorry guys I bought at $140,0,0.508,1.0,NEGATIVE
,,Meh - rookie numbers…,0,0.5,1.0,NEGATIVE
,,My bad I finally decided to hop on and bought a share.,0,0.533,0.533,POSITIVE
,,Intel need to up their game. Wtf happened to them,0,0.519,0.998,NEGATIVE
,,And it was just about nothing compared to how much Nvidia has gone up in the month/year …,0,0.611,1.0,NEGATIVE
,,It's all a fake scam. All of it,0,0.5,1.0,NEGATIVE
,,"Yup, it only exists because only one company TSMC can make these chips.As soon as foreign governments and the market catch up, its feasting time.U.S. government is investing heavily into fabs, expect a market shift in a few years. I wonder if we can invest in it?",1,0.566,0.997,NEGATIVE
,,"Fabs are not easy to make... And US is asking TSMC to invest in US.And they are also investing in Japan too.China despite heavy investments, can't compete with TSMC.Intel is an absolute dumpster fire.And Samsung has a long way to go. Just look at Samsung phones with Qualcomm TSMC chips and Samsung phones with Samsung chips... They are night and day.Only reason to not go all in on semiconductor is geopolitical... Though if that happens, nothing in the stock market would be safe.",2,0.536,1.0,NEGATIVE
,,I’m long NVDA and have no idea what a fab is. Does that mean we’re at the top?,2,0.527,0.988,POSITIVE
,,Sounds like the perfect opportunity to buy the dip,0,0.539,0.998,POSITIVE
,,Theres a lot more left to lose while intel has a lot to gain...,0,0.521,0.806,NEGATIVE
,,This is beautiful,0,0.5,0.992,POSITIVE
,,When you casually shift through intels market cap twice in 1 day.,0,0.541,0.996,NEGATIVE
,,Nvidia first 100 trillion value company cuz... Predictive text lol,0,0.619,0.969,POSITIVE
,,Nvidia should just acquire Intel.,0,0.603,1.0,NEGATIVE
,,and this is useful indormation how,0,0.5,0.992,POSITIVE
,,ONE Intel went of business overnight! big news,1,0.593,0.979,POSITIVE
,,thanks for the explanation,2,0.51,0.796,POSITIVE
,,I just bought a shit fuck load today… 3 shares,0,0.507,0.926,NEGATIVE
,,nice,0,0.5,0.968,POSITIVE
,,Damn,0,0.5,0.734,NEGATIVE
,,I’m sure they deserved it. ,0,0.5,0.989,POSITIVE
,,More like 2 intel,0,0.548,0.999,NEGATIVE
,,Rolls Royce is a better option in the last year it’s up 61% at 6 dollars. Rolls Royce has the potential to hit $20 dollars,0,0.569,1.0,NEGATIVE
,,praying for a drop so i can buy,0,0.552,0.992,NEGATIVE
,,NVDA is way oversold at a RSI of over 81.Seemed like an indicator of a sell-off.,0,0.509,1.0,NEGATIVE
,,"I’m new to stocks, but wouldn’t algorithmic trading play a role in this volatility ?",0,0.566,0.998,NEGATIVE
,,People pay way too much attention to market cap.,0,0.536,0.998,NEGATIVE
,,https://amppo.co/syn/#/?usercode=100264,0,0.51,0.868,POSITIVE
,,Good thing I finally decided to buy some yesterday!,0,0.552,1.0,POSITIVE
,,Is that stock site legit?,0,0.642,0.765,NEGATIVE
,,"Are we seeing profit-taking by NVDA insiders, causing this two-day decline?",0,0.535,1.0,NEGATIVE
,,Or bear traps. No buddy knows,1,0.499,0.98,NEGATIVE
,,I love your little circle with an x!,0,0.5,0.999,POSITIVE
,,Should i by intc then?,0,0.505,0.981,NEGATIVE
,,"After the split, and after the dip; I can now afford to buy a long term call option.",0,0.558,0.578,NEGATIVE
