date of comment,main comment,comment,depth,PTR Sentiment,Flair Sentiment,Flair Outlook
,,"It like all financial articles are made up to covers for big institutional moves. No no, it was probably household investors spending trillions.",0,0.517,0.985,NEGATIVE
,,"I mean this is the most logical explanation.Dave in accounting decided to rebalance his retirement portfolio to be all in on nvidia.Also so did every other Dave, Janet, Sue, Samantha, Byron, Lee, and Belinda.All at the exact same time. It’s really the only logical explanation.",1,0.522,0.78,NEGATIVE
,,I just became a virgin again for the first time ever- thanks to Elon Musk.,0,0.525,0.999,POSITIVE
,,"Technically speaking, a female Wolverine would always have her hymen break for sex making her partners believe she's always a virgin.",1,0.507,0.954,NEGATIVE
,,X-23 got some explaining to do,2,0.5,0.613,NEGATIVE
,,Also Wolverine cannot be circumcised since his foreskin will alway grow back,3,0.537,0.981,NEGATIVE
,,Somewhere a rabbi is going to be very pissed,4,0.509,0.998,NEGATIVE
,,Good thread. Solid redditing in here.,5,0.522,0.996,POSITIVE
,,"Au contrare. He can, indeed, be circumcised. Over and over again. More than any man living.",4,0.501,0.884,POSITIVE
,,Elon Musk is also responsible for all the fresh baked bread in the world and all the pretty music ever written.,0,0.533,1.0,POSITIVE
,,Elon Musk is also responsible for all the fresh baked bread in the world and all the pretty music ever written.,1,0.533,1.0,POSITIVE
,,Elon Mozart.,2,0.502,0.996,POSITIVE
,,Elon Muffin,2,0.502,0.985,POSITIVE
,,Elon Muffintop,3,0.502,0.971,NEGATIVE
,,Elon Muskethead,4,0.502,0.968,POSITIVE
,,Invented internet and porn,2,0.505,0.981,NEGATIVE
,,Muskucks can't get enough of trying to give him credit for everything.,1,0.505,0.731,POSITIVE
,,"some cybertruck bozo sliced his hand on the sheet metal and at the end of his comment, he thanked elon.when did psychopaths become mainstreamed. at least here, our degeneracy is for laughs",2,0.511,0.893,NEGATIVE
,,And you anti-musks can't read. Musk announced xAI plans to build a supercomputer with a ton of Nvidia h100 chips. So yes today's movement was a direct result of Musk yapping.,2,0.525,1.0,NEGATIVE
,,"""Musk""""Announced""""Plan""lolNuff said",3,0.673,0.84,NEGATIVE
,,"why is his son, xAI, building supercomputers?",3,0.509,0.973,POSITIVE
,,"Still waiting on that new Tesla roadster to hit production, but sure let’s throw another pie in the sky plan in the air to grift more cash from fools.",3,0.529,0.994,NEGATIVE
,,I wouldn't trust anything that comes out of Elon's mouth. Lots of stuff never happens.,4,0.503,1.0,NEGATIVE
,,"So Elon can't get TSLA above 200 but he can get NVDA above 1,100?",0,0.513,0.978,NEGATIVE
,,"According to Yahoo Finance’s Alexandra Canal, yes.I bet she thinks Elon can turn water into wine too.I’ve been seeing a lot more idiotic headlines at Yahoo Finance lately. I wonder if I apply, will they hire me too.",1,0.508,0.998,NEGATIVE
,,Elon can't get TSLA above 200give the guy a break he's already pumped it many times over it's value. One can only pump a stock so many times without delivering.,1,0.539,1.0,NEGATIVE
,,All in due time. If those Nvidia shovels were worthless nobody would be buying them.,1,0.531,0.992,POSITIVE
,,Concerning...Looking into it...,1,0.505,0.981,POSITIVE
,,Funding secured,2,0.512,0.997,POSITIVE
,,Tesla went through a stock split,1,0.611,0.998,NEGATIVE
,,So did Nvidia; the last one was in 2021.,2,0.618,0.993,NEGATIVE
,,"So did AAPL, AMZN, GOOG and so on.",2,0.502,0.983,NEGATIVE
,,"Yea, the last one was 20-1. What’s your confusion?",3,0.536,0.998,NEGATIVE
,,"Yea, the last one was 20-1. What’s your confusion?",4,0.536,0.998,NEGATIVE
,,Stock price means nothing. Talk about market cap.,1,0.604,1.0,NEGATIVE
,,I think they have a pill for that.,1,0.508,0.834,NEGATIVE
,,How long until companies spending tons of money on AI hardware have to show a clear path to revenue ,0,0.56,0.987,NEGATIVE
,,The stock market is forward-looking. Past results won't matter much,1,0.604,0.839,POSITIVE
,,The stock market is forward-looking. Past results won't matter much,2,0.604,0.839,POSITIVE
,,The pace at which AI is hovering up energy and critical minerals while accomplishing close to nothing is disturbing.,1,0.528,0.706,POSITIVE
,,Why I'm bull on Uranium.,2,0.648,0.933,NEGATIVE
,,"Ah yes, yahoo finance. This statement must be true then.People are definitely buying NVDA because of what Musk is doing, not because of the stock split or earnings 💀😂",0,0.542,0.543,POSITIVE
,,This belongs on r/wallstreetbets,0,0.505,0.548,POSITIVE
,,Nah they aren't even that regarded,1,0.501,1.0,NEGATIVE
,,How is it not a huge problem that the CEO of an alleged AI and Robotics company has a separate AI startup?,0,0.641,0.895,NEGATIVE
,,"I wouldn’t call Tesla an AI and Robotics company. They’re a car manufacturer and solar company that utilizes AI, and are trying to make robots.",1,0.63,0.943,NEGATIVE
,,They’re a battery company disguised as a car company pretending to be an AI company.,2,0.776,0.997,NEGATIVE
,,"They’re just a dude, disguised as a dude, pretending to be another dude ",3,0.501,0.998,NEGATIVE
,,Doesnt tesla have one of the best margins in the industry?,3,0.543,0.974,NEGATIVE
,,Doesnt tesla have one of the best margins in the industry?,4,0.543,0.974,NEGATIVE
,,I wouldn’t either but it’s CEO did on it’s last earnings call.,2,0.559,0.981,NEGATIVE
,,The CEO told Wall Street repeatedly over the course of YEARS that Tesla is an AI and robotics company. If he is redirecting all of that to his new private x.ai company then there will be more shareholder lawsuits.,2,0.642,0.993,NEGATIVE
,,"Nvidia (NVDA) stock traded above $1,100 for the first time ever on Tuesday, a move that allowed shares to surpasses their previous record closing high. Shares finished the day above $1,140.The milestone moment comes after Elon Musk’s artificial intelligence startup xAI said Sunday that it raised $6 billion in a Series B funding round, sending Nvidia stock up as much as 8% the following trading day.According to the Information, Musk plans to use Nvidia chips for a new ""supercomputer"" that will be used to power xAI's chatbot named Grok.",0,0.563,0.51,NEGATIVE
,,Elon should name his chatbot gronX and let Gronk be in the commercials.,1,0.504,0.842,POSITIVE
,,He’s gonna need a new name soon.,2,0.568,0.999,POSITIVE
,,That name would be pretty hilarious to Australians.,2,0.508,0.825,POSITIVE
,,Really? Is it an insult down under?,3,0.502,0.997,NEGATIVE
,,Yup: https://www.urbandictionary.com/define.php?term=gronk,4,0.516,0.908,POSITIVE
,,Pay Gronk to be in the commercials,2,0.497,0.847,POSITIVE
,,surprised the chatbot wasn’t named x,1,0.503,0.746,POSITIVE
,,Or maybe it's because of the stock split. This pump happens every post earnings. Elon is but an ant here,0,0.566,0.994,NEGATIVE
,,Lol. Lmfao even.,0,0.502,0.988,POSITIVE
,,Read this in Snagglepuss's voice. ,1,0.512,0.994,POSITIVE
,,Elon musk sucked my dick one time and wasn't even in the same room,0,0.519,1.0,NEGATIVE
,,I just cured my arthritis thanks to Elon Musk!,0,0.507,0.999,POSITIVE
,,So 3 trillion it is not much longer,0,0.508,0.999,NEGATIVE
,,Elon is such a great CEO he takes companies he doesn’t work for to all time highs.,0,0.543,0.99,POSITIVE
,,It's got nothing to do with the moron Musk.,0,0.501,0.997,NEGATIVE
,,Pretty sure he was trying to pump his company so he can get his 25% shares.,0,0.61,1.0,NEGATIVE
,,Tesla is losing ground in China and the price war and tariff suggestion he sparked is now becoming a problem. Chinese EV companies are innovating at an accelerated rate. The AI hype is something Elon can capitalize now.Lots of Tesla owners that bought their EV only to see their resale value nosedive and Chinese consumers that are starting to back their local companies isn't good news for Tesla.,0,0.524,1.0,NEGATIVE
,,Nope.,0,0.5,0.972,NEGATIVE
,,He pumped the wrong stonk,0,0.495,0.983,NEGATIVE
,,Seems a lot of big names in tech are dropping NVIDIA's name lately; which is boosting its stock price.I wonder if they get an NVDIA discount for mentioning the name..,0,0.547,0.973,NEGATIVE
,,"Well, at least he made one stock go up, he hasn't been doing it for TSLA this year...",0,0.642,0.999,NEGATIVE
,,Will Nvidia give him his 50 billion payday do you think?!,0,0.552,1.0,NEGATIVE
,,"Well that makes a lot of sense. One company says it has raised 6 Billion to spend, let's be generous and say they will spend 100% of it on chips and their staff will work for free or future stock. They have $6B, so that causes the company that they will buy the chips from to increase in value by $200B. Are they going to spend the same money 33 times? The world has gone mad.",0,0.592,0.999,NEGATIVE
,,Elon Musk is the last person to celebrate the market cap of the other company passing his own.,0,0.623,0.906,NEGATIVE
,,Bubble,0,0.5,0.929,POSITIVE
,,Thanks Roaring 20s,0,0.512,0.992,POSITIVE
,,This always happens after I sell. I can never win,0,0.515,0.988,NEGATIVE
,,A bit much to give him all the credit no?,0,0.505,0.995,NEGATIVE
,,Yahoo Finance really needs to stop sucking Elon’s dick.,0,0.504,0.99,NEGATIVE
,,2.8 TRILLION MARKET CAP and only 80 billion revenue / 50 billion EBITA?This is a massive black hole melt up bubble with no lessons learned in 2000 and 2008,0,0.533,0.999,NEGATIVE
,,Wow they’ve found a way to shoehorn ‘Elon Musk’ into Nvidia headlines now.Gotta get them clicks!!,0,0.519,0.999,POSITIVE
,,Fuck Elon,0,0.497,0.922,NEGATIVE
,,Bullshit.The split announcement has it mooning. It has nothing to do with that imbecile.,0,0.499,1.0,NEGATIVE
,,https://www.datacenterdynamics.com/en/news/elon-musk-wants-100000-h100-gpus-for-an-xai-supercomputer/,0,0.512,0.979,POSITIVE
,,"Nothing to do with Elon. NVDA 69% margin, incredible growth, and projected more growth, stock split, near monopoly on chips on AI, expanding partnership on ALL sectors. The list goes on. It will beat MSFT on market cap.",0,0.568,0.853,POSITIVE
,,Thanks to federal reserve***,0,0.51,0.993,POSITIVE
,,SMFL. 😂🚀🚀🚀🚀🚀,0,0.5,0.799,NEGATIVE
,,O ya Elon is to thank🤣🤣🤣 what a clown ass article,0,0.504,0.915,NEGATIVE
