date of comment,main comment,comment,depth,PTR Sentiment,Flair Outlook,Flair Sentiment
,,"If this gets even higher, good for the ones already in but for someone trying to get in now it looks mighty dangerous.",0,0.521,NEGATIVE,0.981
,,Up up and up no away,0,0.495,NEGATIVE,0.982
,,And I still dont know how to play the earnings.,0,0.563,NEGATIVE,0.989
,,You stay far away unless you’re protecting your own position with options,1,0.512,NEGATIVE,0.927
,,My positons are Options 😅,2,0.505,NEGATIVE,0.515
,,I’m sorry for your loss,3,0.503,POSITIVE,0.706
,,That do you mean? I have 300% realized wins lmao,4,0.51,POSITIVE,0.987
,,"And I’ve won at roulette several times, doesn’t mean it’s a good idea. Holding options through earnings is a gamble regardless of whether or not you are right because of theta and iv, has nothing to do with how great you are at trading and everything to do with math",5,0.528,NEGATIVE,0.999
,,"Call options on the momentum up to earnings, sell before actual earnings call.",1,0.566,NEGATIVE,0.981
,,You don't.,1,0.5,NEGATIVE,0.871
,,Give me SMH or give me death,0,0.502,NEGATIVE,1.0
,,It's trading at like 40 x sales.,0,0.634,NEGATIVE,0.984
,,They hit $800 in 2021,1,0.5,NEGATIVE,0.945
,,This can’t be right. This must be a bubble right?,0,0.507,NEGATIVE,0.95
,,FWD PE is 35 not that highly valued,0,0.506,NEGATIVE,1.0
,,Tell that to Cisco in 1999,1,0.5,POSITIVE,0.999
,,Lol comparing a state of the art AÍ company with a networking switch company lol,2,0.654,POSITIVE,0.995
,,"People are leaning way too far into the idea that Nvidia has and will maintain a monopoly on AI chips and infra. That's a dangerous assumption to make, the customers of Nvidia buying up all these GPUs, alongside AMD and Intel (who are not slouches) are not going to lie down and do nothing for the next decade.This will probably end in tears for a lot of people.https://www.hpcwire.com/2024/02/06/nvidias-dominance-in-ai-chips-challenged-by-big-tech-companies/",0,0.55,NEGATIVE,1.0
,,love this one ....like chatgpt or intel before ..google already started to hit the market!,1,0.552,POSITIVE,0.994
,,Exactly why AMD will easily double within the next two years. Same for intel. Same for TSM.,1,0.592,NEGATIVE,0.989
