date of comment,main comment,comment,depth,PTR Sentiment,Flair Outlook,Flair Sentiment
,,"Institutions hedging, profit takers are taking profit. What else is new? Of course short interest is going to be high. NVDA is now riding with the top 5 NYSE market caps. After less than a year of being in the 1 trillion cap range.",0,0.575,NEGATIVE,0.968
,,I bet you almost all assets going up by a lot has their SI rising.,1,0.51,NEGATIVE,0.669
,,What’s SI?,0,0.5,NEGATIVE,0.984
,,"Short interest. ""Short interest is the number of shares that have been sold short and remain outstanding. Traders typically sell a security short if they anticipate that price will decline by borrowing shares of stock"" - Investopedia",1,0.525,NEGATIVE,0.999
,,I hate when people do that! That messes it up for long share holders like me!,2,0.54,NEGATIVE,0.999
,,Or it gives you a buying opportunity 🙂,3,0.515,POSITIVE,0.994
,,This is the way,4,0.53,POSITIVE,0.997
,,Being honest in 5 years we might be in the depths of a recession by the way it’s going.,2,0.521,POSITIVE,0.796
,,"5 years is too long, I think we will be in big trouble at the end of this year or latest next year.",3,0.67,NEGATIVE,1.0
,,Is this prediction based on an extensive study and deep understanding of macroeconomics or is it based on the way you feel when you continue to see record highs every week?,4,0.537,NEGATIVE,0.779
,,"I don’t have a phd or postdoc in economics and finance so my word have zero credit: however the source I read and people podcast I listened to have their own credits. I just point out a few things: struggling in commercial real estate, hundred of thousands home owner losing their equity due to recent home price stagnant and dropping. Labor cuts due to transition of automation, uncontrolled national debt and interest rate together with bad loans. We just need a small trigger for the chain reaction happening.",5,0.503,NEGATIVE,0.995
,,"In all fairness the people with the educational background you mentioned still can’t predict when an economic downturn will happen.I’m a firm believer in confirmation bias, if you believe it’s the end of the world you will see negativity everywhere. Most of what you mentioned seems to be marginal in my optimistic opinion!Commercial RE- known issue due to remote work and isolated to office space. Multi-family, industrial, and even retail are doing well.Residential RE- Still low supply and a lowering interest rate will help prop-up already inflated prices. Definitely more concerning than commercial.Automation taking jobs???- isolated to tech compounded with remote outsourcing. The job market as a whole is tight. Which isn’t great either. Maybe software engineers need to learn how to frame houses! lolDebt- what’s new??? Probably the most concerning part. I learned a long time ago I’m not smart enough to understand how the government’s budget works. Money printer go brrrrrrrrr.A market pull back is inevitable but attempting to predict the time seems futile.",6,0.52,NEGATIVE,0.999
,,"I thought it was Sizzle Index, you know the one from TOS that it reports on the options data? 🫣",2,0.52,NEGATIVE,1.0
,,"Nice and slow, no problem. I'll look again on my profit 5 years from now. 🎉",0,0.534,POSITIVE,0.992
,,Haha myself as well the split treated me great personally,1,0.523,POSITIVE,0.926
,,,1,,,
,,You 2 should go to wsb,2,0.505,NEGATIVE,0.996
,,Sorry I’m old what does wan mean,3,0.503,NEGATIVE,0.691
,,wan was supposed to be wsb,4,0.502,NEGATIVE,0.974
,,Its a subreddit for gamblers wallstreetbet,5,0.5,POSITIVE,0.686
,,I say are you a comedian?,6,0.487,POSITIVE,0.841
,,This is a gamble. I personally wouldn’t go all in on any stock or stocks unless you’re fine losing half or more. If you’re asking for advice on a subreddit then there’s a good chance you don’t know how to properly value a company.,2,0.559,NEGATIVE,0.919
,,I don't know how. How do you properly value a company?,3,0.721,NEGATIVE,0.871
,,"Keep AVGO, but TSLA… No idea how to digest this stock. On every bad news it goes up, next ER will show bad or mediocre result (As always) so probably it will go… Higher? Maybe to $300? … Or drop 1–2 days later without any news, back to $144? Really, I have no clue at all. 🙃😂Nvidia. Yes, I'm bias because NVDA is my anchor, probably for life or at least another decade.If I were you, I would look carefully next week and try to timing the correct move, as you said, $16k taxes are no joke.",2,0.544,NEGATIVE,1.0
,,"1.6 days to cover, 1.3% of float... not sure what conclusions we are trying to draw here......NVDA - NVIDIA Corporation Stock - Share Price, Short Interest, Short Squeeze, Borrow Rates (NasdaqGS) (fintel.io)",0,0.548,NEGATIVE,0.997
,,Id like to see you take a short position,0,0.512,NEGATIVE,0.939
,,This is exactly how they got $1200 from me on 2 contracts calls . It went up and I bought then lost it all completely cause one of the ceos sold a lot of shares.. lessons learned,0,0.51,NEGATIVE,0.994
,,,0,,,
,,I don't know but someone is selling!,1,0.528,NEGATIVE,0.959
,,On fucking Nvidia?Bro spend less time on r/shortsqueeze lol,1,0.528,NEGATIVE,1.0
,,"at 1.3% float shortedafter running up 2T in market cap this yearyeah buddy go ahead and put your life savings of $2k into it, it's about to double",1,0.532,NEGATIVE,0.996
