date of comment,main comment,comment,depth,PTR Sentiment,Flair Outlook,Flair Sentiment
,,I give a 95% chance (up from 80) that Motley Fool are chatting out their arse.,0,0.502,NEGATIVE,0.951
,,Motley is trash and this should be deleted,0,0.5,NEGATIVE,1.0
,,Cancel culture means no one else gets to find out.. Scammers love cancel culture.,1,0.509,NEGATIVE,0.972
,,Just FYI Motley Fool is also simultaneously saying NVDA will go to $150. Playing both sides so they always come out on top.,0,0.526,NEGATIVE,0.97
,,And then brag about the correct prediction months from now.,1,0.532,NEGATIVE,0.877
,,"Exactly, you’ll see an article saying “if you had invested $10,000” in this stock, you’d have made $50 million”. But, oddly, they don’t follow their own advice and make $50 million…",2,0.527,NEGATIVE,0.918
,,"Editor in chief: Ok, someone write me a piece making a case for it to go higher. And someone write me a piece making a case for it to go lower. Go!Writers in room: You got it boss!",1,0.503,POSITIVE,0.927
,,"Well, First Of All, With God, All Things Are Possible, So Jot That Down",1,0.532,POSITIVE,0.969
,,As they always do,1,0.5,POSITIVE,0.989
,,"To be fair, the title says ""1 Wall Street Analyst Thinks So."" Anyone taking the word of any analyst as fact, especially ONE analyst, is a moron. But yeah, point taken.",1,0.52,NEGATIVE,1.0
,,So you're telling me to buy?,0,0.573,POSITIVE,0.72
,,If Pelosi is buying then I’m buying,1,0.508,POSITIVE,0.998
,,Falling up 📈,0,0.495,NEGATIVE,0.971
,,"The fool saying this? Buy time bby, we going to the moon",0,0.548,NEGATIVE,1.0
,,"Translation, ""we're accumulating right now, mums the word""",0,0.505,NEGATIVE,0.995
,,Didn’t Nancy just load up on NVDA?Follow the congress money.,0,0.506,NEGATIVE,1.0
,,Doesn’t Pelosi usually lose money?,1,0.505,NEGATIVE,0.949
,,You dropped this: /s,2,0.44,NEGATIVE,1.0
,,Says expert. Moving on.,0,0.538,POSITIVE,0.958
,,You can't lose if you both praise the stock and downgrade the stock in different articles. Win-win situation.,0,0.588,NEGATIVE,0.944
,,Someone wants the price low while they accumulate.,0,0.52,NEGATIVE,0.982
,,"On another group, a woman came in asking for advice. Her husband had sold her single stock (an ETF) that she had been DCA'ing for retirement for years and he was using the money to buy stocks purely on Motley Fools advice. Her portfolio was down 40% and she was taking it back from the husbands control.Motley Fool is the term for a Court Jester. ..why people are acting on advice from a company called Court Jester is beyond me..",0,0.553,NEGATIVE,1.0
,,"Anybody who calls Nvidia a bubble hasn't read their earnings. Bubbles are hype, Nvidia is hard cold cash profits.People who expect AI to be profitable ..when its not even completed its learning are idiots.""Nevertheless, history is crystal clear that a big pullback is in order once the euphoria surrounding a next-big-thing trend fades.""The internet was the ""next-big-thing"" and how much money does and has that made since it was ""the next-big-thing""? ..as the article they write comes to us via the internet.I'm old enough to be an adult before the internet and back then people who didn't see its potential spoke in the same terms and mindset as these people who don't understand the potential of AI. ..and look how wrong those people were.",0,0.538,NEGATIVE,0.995
,,"All analysts are juste scouting something like Cramer does! Just like their projected stock prices, wrong all the time and if a stock is longer time above their price target they just raise their target 😂😂😂",0,0.557,NEGATIVE,0.681
,,Even quoting motley fool should result in a ban lol.,0,0.494,NEGATIVE,0.996
,,"I tried one year of motley fool 5 years ago, and most of their recommendations ended up to be shit. And yes, I held for 5 years.",0,0.568,NEGATIVE,0.998
,,Lol. So stock market is done? It’s going to 0?,0,0.619,NEGATIVE,0.999
,,Worse! It's going to the negative territory. You will have to add more money for it to stay above zero.,1,0.509,NEGATIVE,1.0
,,Where's their article that says the exact opposite too?,0,0.529,NEGATIVE,0.999
