date of comment,main comment,comment,depth,PTR Sentiment,Flair Sentiment,Flair Outlook
,,GPT-REEEE,0,0.5,0.999,NEGATIVE
,,If you want a real answer it's cause vix is dropping at warp speed,0,0.505,0.995,NEGATIVE
,,If you want a real answer it's cause vix is dropping at warp speed,1,0.505,0.995,NEGATIVE
,,That was best ride of this day. Bought shorts at vix on 34 and sold today at 22 😃,2,0.538,0.999,POSITIVE
,,Stop copying my trades bruh,1,0.499,0.965,NEGATIVE
,,My calls are up. Did you try shutting your brokerage app down and turning it on again?,1,0.507,0.998,NEGATIVE
,,Yesterday I was waiting in line for a bowl of porridge and now look at us ,0,0.543,0.997,POSITIVE
,,now we’re feasting on ramen noodles like kings!,1,0.499,0.998,POSITIVE
,,This 5 pack of mi goreng gonna last me a week ,2,0.543,0.815,POSITIVE
,,This free ice from my ice maker tastes even better when the market is green.,3,0.549,1.0,POSITIVE
,,Drinking whiskey on the rocks with ice made of frozen bear tears!,4,0.503,0.894,NEGATIVE
,,"Still poor! We started at the bottom, and we’re STILL HERE!",1,0.517,1.0,NEGATIVE
,,I’m here for a good time not a long time,2,0.575,0.997,POSITIVE
,,"Wow, did we just get through the next Great Depression in less than 18 hours?",0,0.522,0.995,NEGATIVE
,,New generation just doesn't have that high of an attention span to have a decade of depression.,1,0.559,0.966,NEGATIVE
,,decade? a weekend of depression was too much already,2,0.51,0.999,NEGATIVE
,,"And to show you we're serious, we put Cyber Monday right after Black Friday.",3,0.509,0.988,NEGATIVE
,,Millennials and Zoomers ruining recessions and depressions. What will they ruin next?,2,0.516,0.986,NEGATIVE
,,"According to my parents, their marriage",3,0.53,0.985,POSITIVE
,,Pretty sure that was because your mom was blowing another man.But easier to blame the kids.,4,0.503,0.999,NEGATIVE
,,"Can confirm, I was other man",5,0.502,0.856,NEGATIVE
,,Ayo... 🤨📸,6,0.5,0.993,POSITIVE
,,Attention span inflation,2,0.507,0.998,NEGATIVE
,,We're memeing our way through the end of civilization!,1,0.521,0.982,POSITIVE
,,"black monday, followed by double zero roulette tuesday. all hail bullgang",1,0.508,0.999,NEGATIVE
,,FD Biden be cooking fast this time,1,0.515,1.0,POSITIVE
,,"Yup, and all that happened was; I finally cut my losses and sold Disney shares… the horror.",1,0.492,1.0,NEGATIVE
,,"I dropped Disney when Bob Chapek came into power. An accountant as a CEO has never once in the history of any company except accounting firms ever made a company more successful. Every single time it's lead to mass layoffs, selling off portions of the company, etc. and a complete loss of focus on what actually makes the company profitable. Then something drastic happens and either the accountant hands the reigns to another accountant who falls with the burning ship, or they hand it off to someone who actually knows what the fuck the company makes and at the bare minimum keeps the company going, even if in a smaller way.",2,0.58,1.0,NEGATIVE
,,"Remember most people buy high sell low. If you just hold you'll outrun all of them without doing a thing. Sun Tzu says ""to win without fighting is the highest form of strategy, so don't be a paper handed btch"".Edit: man my SunTzu quote is popular. I have more wisdoms if anybody wants to pay for a consultation. DM me.",0,0.519,0.998,NEGATIVE
,,"Sun Tzu says ""to win without fighting is the highest form of strategy, so don't be a paper handed btch"".I was there when he said that",1,0.585,0.746,NEGATIVE
,,"I was pretty sure this quote was BS but the end changed my mind, that sure sounds like good ol’ Sonny boy",1,0.51,0.528,NEGATIVE
,,His friends call him Tzu doggy dog ,2,0.504,0.931,NEGATIVE
,,Did Bruce Lee steal “The art of fighting without fighting” line in Enter the Dragon from Sun Tzu?,1,0.514,0.996,NEGATIVE
,,Lmao this is so me right now and proud of it,1,0.513,0.994,POSITIVE
,,LMFAO this is so accurate,1,0.5,1.0,POSITIVE
,,Me with my AMD position yesterday,1,0.703,0.991,POSITIVE
,,they told me to try appreciating the small wins,1,0.505,0.846,NEGATIVE
,,A single wobble bounce?Or is the dead cat bouncing off a stair on the way down the staircase?,0,0.504,0.999,NEGATIVE
,,A single wobble bounce?Or is the dead cat bouncing off a stair on the way down the staircase?,1,0.504,0.999,NEGATIVE
,,Willing to bet tomorrow is red,2,0.496,0.992,POSITIVE
,,I put my money on it,3,0.512,0.996,NEGATIVE
,,Ok then positions?,3,0.5,0.983,NEGATIVE
,,Staircase carnage.,2,0.5,0.998,NEGATIVE
,,Dead cat bounce.Get ready for the real show.,1,0.51,0.999,POSITIVE
,,"No dude these cheap calls are absolutely going to print, don't you see how expensive puts are rn?! Bro stonks only go up bro $NVDA 🚀🚀🚀🚀🚀🤡",2,0.503,0.987,NEGATIVE
,,Tim Apple punching air Rn,0,0.508,0.944,NEGATIVE
,,You're thinking of Cook Apple,1,0.509,0.763,NEGATIVE
,,Let him Tim,2,0.505,0.644,NEGATIVE
,,Nana stock still in red,0,0.61,0.999,NEGATIVE
,,It's at 2012 prices now. Nana doesn't mind waiting for it to bounce back.,1,0.498,0.993,NEGATIVE
,,Man the amount people freaking out over this makes me think most people shouldn’t be investing 😂,0,0.501,0.999,NEGATIVE
,,We gotta have something to talk about,1,0.5,0.929,POSITIVE
,,"We typically profit from those individuals who act irrationally in the market. They tend to buy when prices are high and sell when prices are low. Therefore, we need them to make money.",1,0.544,0.701,POSITIVE
,,"Nobody here is investing, they are gambling.",1,0.51,0.993,NEGATIVE
,,My puts are fucked,0,0.485,0.989,NEGATIVE
,,Lol intel,0,0.55,0.998,POSITIVE
,,Nana spared everything with the exception of Intel. ,1,0.522,0.986,NEGATIVE
,,"Intel is going to be memed out of existence, aren't they?",2,0.527,0.839,NEGATIVE
,,They deserve it.,3,0.495,0.987,POSITIVE
,,"This sub is just proof how easily the public is manipulated.We had a giant run the whole year, then down 5% and everyone thought the sky was falling.",0,0.546,0.8,NEGATIVE
,,"Half the comments on this thread are ""you guys are fucking dumb, this is a dead cat bounce and we're going lower tomorrow. bull trap"" and the other half are ""you guys are fucking dumb, that drop was a bear trap and the rest of the year until november we're moving up again. it was just a correction""so which is it lol",1,0.509,1.0,NEGATIVE
,,Sir this is a casino,2,0.502,0.854,POSITIVE
,,"I'd say the latter, but even if we go down more, it doesn't really matter. I'm not retiring in the next 6 months.",2,0.558,0.547,NEGATIVE
,,Sir half of us are trying to retire tomorrow with 0dte 🥴,3,0.495,1.0,NEGATIVE
,,"I bought back in, so definitely going down.",2,0.52,0.999,NEGATIVE
,,5% is a lot in one day,1,0.538,0.859,NEGATIVE
,,"Ikr, just hold boys, even if there was an actual reason for concern like COVID, just hold, the world will still be here in 10+ years.",1,0.517,0.999,POSITIVE
,,Just hold ❌Buy the dip ✅,2,0.506,0.685,NEGATIVE
,,The quickest Kamala recession recovery in history,0,0.512,0.846,POSITIVE
,,Didn't you hear? This is just the start of the Kamala Harris presidency's negative effect on the economy. I saw on LinkedIn that's why this genius sold all his stocks during the crash. https://imgur.com/a/1EDvmidHe truly belongs here with us,1,0.512,1.0,NEGATIVE
,,Kamalmao,1,0.5,0.815,POSITIVE
,,Wait til tomorrow. We will see the cat-,0,0.499,0.945,POSITIVE
,,I predict that tomorrow the cat will either be alive or dead but until then it's in a super position of being both alive and dead.,1,0.509,0.557,POSITIVE
,,Schrödinger’s bets,2,0.5,0.504,POSITIVE
,,Why is AMD down?,0,0.975,0.998,POSITIVE
,,Something something AI,1,0.592,0.899,NEGATIVE
,,Lol. Yesterday was a sea of red and AMD was green. Today everything is green and AMD is red.,1,0.608,1.0,POSITIVE
,,Anyone who was all in AMD and sold yesterday is probably a time-traveler.,2,0.591,0.969,NEGATIVE
,,Cause sometimes the market is random like that.,2,0.547,0.965,NEGATIVE
,,"AMD always goes down. And on the rare day it goes up, don't worry, it will go back down tomorrow. No problemo.",1,0.55,0.753,NEGATIVE
,,"Thank you Joe Biden, you've done it again.",0,0.504,0.995,POSITIVE
,,I thought Kamala hit the sell off button?,1,0.508,0.981,NEGATIVE
,,"Ha! As we all know, only the president of the united states has control over the magic lines.",2,0.517,0.657,NEGATIVE
,,This recession is joever,1,0.512,0.987,NEGATIVE
,,"Wow all this green makes me feel really optimistic about the future, I should buy back in hard - I’m sure nothing could go wrong tomorrow",0,0.52,0.999,POSITIVE
,,"Just wait for tomorrow guys, I bought calls.",0,0.508,0.998,NEGATIVE
,,"15% drop, 2% gain, just the way I like it",0,0.506,0.942,POSITIVE
,,Yesterday = global depressionToday = economic recovery,0,0.54,0.504,NEGATIVE
,,The simulation is running out of resources they are speedrunning the ending the World War will finish in half a day,0,0.504,0.999,NEGATIVE
,,You’re welcome guys,0,0.508,0.991,POSITIVE
,,"i'm guessing you either sold stocks, or got some good puts. Thanks dude, you saved us all",1,0.563,0.938,NEGATIVE
,,Thanks u/xxx420blaze420xxx,1,0.497,0.998,POSITIVE
,,Okay now I’m actually panicking - these are the kind of posts before a real crash,0,0.508,0.996,NEGATIVE
,,We are so back.,1,0.515,0.958,POSITIVE
