date of comment,main comment,comment,depth,PTR Sentiment,Flair Outlook,Flair Sentiment
,nan,GPT-REEEE,0,0.5,NEGATIVE,0.999
,nan,Every time I see wsb hating AMD from now on I'm gonna buy a share,0,0.64,NEGATIVE,0.997
,nan,"this legit is the way it has been for the past like 5 years, when good news comes out, its not good enough, and it tanks, and when bad news comes out, it just mean they have room to grow!, like idk how the stock works anymore.",1,0.541,NEGATIVE,0.985
,nan,"yeh, AMD's 40% cagr over 5 years must be killing you. Lmk when you open your gofundme so I can support you through this difficult time.",2,0.558,NEGATIVE,0.905
,nan,All you have to know is that Jim Cramer inverse positions moon. Unfortunately he endorsed NVDA today which is why it dropped like 3%. Even he can't keep the best stock down more than a blip.,2,0.543,NEGATIVE,1.0
,nan,I wish he would go away.,3,0.508,NEGATIVE,0.804
,nan,"Inverse wsb, not regarded.",1,0.502,NEGATIVE,1.0
,nan,"Google found a parallel universe where WSB is profitable, their entire strategy is to inverse this universes WSB. We live in the bad time line",2,0.523,NEGATIVE,1.0
,nan,You joke. But there was a sweet spot right before covid where all plays here made money,3,0.508,NEGATIVE,0.949
,nan,All the plays everywhere made money.,4,0.515,NEGATIVE,0.794
,nan,For someone!,5,0.5,POSITIVE,0.984
,nan,For some of the time.,6,0.585,NEGATIVE,0.861
,nan,"Everything I did made money, and I’m a fucking moron",5,0.51,NEGATIVE,0.928
,nan,"You realise the reason why was the market was frothy, right?",4,0.552,NEGATIVE,0.855
,nan,This is the Bad Place! ,3,0.495,NEGATIVE,1.0
,nan,Could you imagine the memes?,3,0.512,POSITIVE,0.773
,nan,Did you just figure? I've been buying dick over balls INTC since grandma dropped 700K,2,0.501,NEGATIVE,0.717
,nan,I’m all in on quantum computing stocks… short term options,3,0.514,POSITIVE,0.83
,nan,That and Jaguar stock,4,0.708,POSITIVE,0.748
,nan,You mean MARK,5,0.505,POSITIVE,0.983
,nan,Show how many shares you bought later,1,0.511,POSITIVE,0.919
,nan,Gonna have to go by posts not comments or I'll be full port by next week (I am poor),2,0.532,NEGATIVE,0.998
,nan,and that shareholder's name? lisa su,2,0.509,POSITIVE,0.805
,nan,"Well, everybody on WSB says it's undervalued",1,0.549,NEGATIVE,0.929
,nan,You got that kind of money???,1,0.513,NEGATIVE,0.998
,nan,I figure I can keep it up until at least Monday,2,0.515,NEGATIVE,0.992
,nan,"I purchased AMD shares on 9/13/2016 - I'm up 2105%With that said - I added AMD to another account on 10/30/2024 and I'm down -16%AMD has some very serious swings. Last dump Low was in 10/2022. If the charts show the trend, we're near bottom. New Year should see better times.",0,0.662,NEGATIVE,1.0
,nan,"I loaded up in March of this year, seeing AMD as the obvious competitor to Nvidia and future of the chip market.I'm down like 30%, what an absolute turd of a stock, easily the worst in my portfolio after MRNA.",1,0.624,NEGATIVE,1.0
,nan,The real competitor to NVDA has been Broadcom (AVGO) with their custom chips. Bought my first shares in AVGO on 4/2020 - Up 896%They are filling the gaps of NVDA's supply shortage. They just reported earnings and projections from current supply demand. Shares shot up 24% Friday.,2,0.536,POSITIVE,0.825
,nan,What positions have you added in the last two years to hold long and what are your thoughts on SERV,3,0.548,POSITIVE,0.996
,nan,"In the past two years...Bought MSTR 1/23/2024 and been adding since - a Bitcoin trade. Up 806%Added to my existing TSLA holdings 10/18/2024 - Up 97%META 11/22/2022 - up 461%NVDA 10/27/2022 - up 912%I've been lightening my holdings in AMZN and GOOG. Own too much of both2025 might be the year I lighten up on MSFT for the first time in years. Billions poured into OpenAI has been of negligible financial benefit to MSFT beyond the Ai PRI've had some real bad picks. Big losses.Sold out of OKLO on 12/13/2024 to a huge lossCan never seem to buy ADBE (Adobe) bought in at the wrong time to big lossesOther BIG losses this year CEG, DELL, CRM, EU, GCT. OXY. PANW, SMR, UEC - Timing is everything. Others would swear up and down with names. They didn't work for me.I looked up SERV and I'm an absolute normy when it comes to robotics with interactions in city scapes - pedestrians, cars, traffic lights etc. . The operating numbers for SERV appear to show operational money bleed. Analysts are either ""all in"" or ""avoid""",4,0.533,NEGATIVE,1.0
,nan,I sincerely hope MSTR isn’t a long term play.,5,0.535,NEGATIVE,0.96
,nan,She’s managed to not pull an Intel and be profitable ea quarter - that’s why,0,0.535,NEGATIVE,0.995
,nan,"Being profitable is the death of a company. You want potential to be profitable, not profitability. And a car whose doors open upwards",1,0.575,NEGATIVE,1.0
,nan,This guy knows all about ROI,2,0.498,POSITIVE,1.0
,nan,"Fucks, this guy fucks is the line",3,0.534,NEGATIVE,0.856
,nan,This guy fucks ROI,4,0.498,NEGATIVE,0.897
,nan,"... I was doing a ""Radio On Internet""/""Return on Investment"" joke, while using the ""this guy..."" format.  Ya know, because Russ Hanniman.  Trying to be a little original instead of reusing the same hack line, but thanks for... whatever you're doing tho.  ",4,0.517,NEGATIVE,1.0
,nan,And a car whose doors open upwards,2,0.506,NEGATIVE,0.929
,nan,She saw there was no future in the direction they were going and that there is gold in them there AI hills. She has done a massive amount of work in transitioning AMD to be a possible future direct competitor and with that is about as much potential as you can think of.,2,0.548,POSITIVE,0.608
,nan,"Next two years will be important. They closed the massive Xilinx acquisition in early 2022, that was their long-term AI play. If they started working on something new with Xilinx, then we should be seeing it in the next 1-2 years given typical design cycle times.",3,0.565,POSITIVE,0.999
,nan,"AMD also doesn't run fabs though so a bit of an unfair comparison as that is where most of INTC cash is going.With that, AMD hasn't had the whole ""two generations of our high end desktop processors are unstable - sorry no backsides"" happen to them this year so they definitely beat the Intel design team at their jobs.",1,0.57,POSITIVE,0.837
,nan,AMD also doesn't run fabs though so a bit of an unfair comparison as that is where most of INTC cash is going.if anything thats even more impressive. means they're paying someone elses margins to run a fab.In simple terms: the renter in the shack next door (AMD) is saving more money than the gentry landlord (Intel).,2,0.543,POSITIVE,0.702
,nan,Fabs are very very expensive to run and build. And you always need to be at the cutting edge to print money. It’s hard enough designing good chips. Leave the manufacturing to somebody else.,3,0.512,NEGATIVE,1.0
,nan,"And stay cousin to Jensen, never saying a bad word despite all the comparisons that journalists make to her face.Lisa is great 👍",1,0.504,POSITIVE,0.999
,nan,"Your first mistake was linking stock price to a company's position.Plenty of shit companies with ripping charts, as well as great companies with flat ass bullshit charts.",0,0.594,NEGATIVE,1.0
,nan,I have some UPS stock that this describes,1,0.638,POSITIVE,0.999
,nan,Sometimes keeping a sinking ship above water signals the presence of the greatest captain.,0,0.507,POSITIVE,0.996
,nan,That’s my next tramp stamp tattoo,1,0.524,POSITIVE,0.994
,nan,Great reminder to a person pegging them that they’re paying.,2,0.502,POSITIVE,0.991
,nan,What's your current one say?,2,0.532,POSITIVE,0.884
,nan,"Sometimes keeping a sinking ship above water signals the presence of the greatest captain.""Porthole ↓""",3,0.506,POSITIVE,0.955
,nan,I mean under her leadership AMD has clawed quite a bit of market share from intel on both the consumer side and data center side. AMD went from a terrible budget offer (intel had better budget cpus several times) to a genuine competitor.,1,0.575,NEGATIVE,0.933
,nan,"AMD went from something like 5% enterprise market share to somewhere around 50% under Lisa Su. Not even mentioning the desktop market, which isn’t nearly as profitable.",2,0.574,NEGATIVE,0.855
,nan,"wtf are you talking about, she took a company that was struggling to one that’s on a huge successful streak, amd was never thought to be able to even enter the data center and now they’ve got a huge share of the data center which is where the profit is.",1,0.58,POSITIVE,0.945
,nan,That's what I tell my financial advisor when I'm barely breaking even on my investments in the largest bull run in the history of the stock market.,1,0.597,POSITIVE,0.535
,nan,Advanced Money Destroyer. She’s great at her job.,1,0.52,POSITIVE,0.994
,nan,"One time my dad died and my mom gave 10 grand to his friend/stock broker friend and said ""invest it in his name"" and then he put it all in AMD because my dad loved AMD. But that was 20 years ago and the stock promptly took a huge dump. My mom held it for 10 years anyway, and then sold it right before it started going up again.",2,0.591,NEGATIVE,1.0
,nan,I see you come from a lineage of regarded traders,3,0.502,POSITIVE,0.998
,nan,i mean would be hard for it to happen a second time,3,0.533,NEGATIVE,0.932
,nan,"Stock price doesn't necessarily reflect how good a company is doing. They're definitely correlated, but a stock price is also reliant on how much people think it's worth, so that muddies it",0,0.612,NEGATIVE,0.807
,nan,Honestly AMD is positioned very well and has huge sales overtaking Intel. They got other segments also...People pissing on AMD got no foresight,1,0.619,NEGATIVE,0.567
,nan,"My parents had my foresight removed when I was a baby, nothing I could do about it.",2,0.506,NEGATIVE,0.999
,nan,This doesn't explain your username,3,0.5,NEGATIVE,0.999
,nan,Cum makes a great spackle in a pinch.,4,0.51,POSITIVE,0.965
,nan,"That was your forskin, dummy. What op means is your fortnite",3,0.498,POSITIVE,0.791
,nan,"Everyone’s got fortnite, dummy. What op meant is your fork’s knife",4,0.499,NEGATIVE,0.533
,nan,"Not only no foresight, but also current sight lol. They are idiots. Like 7 years ago if you mentioned amd in the data center you’d get laughed out of the room. Now they’ve have dethroned intel there.",2,0.556,NEGATIVE,0.999
,nan,This! Example: TSLA the stock has nothing to do with Tesla the company,1,0.697,NEGATIVE,0.999
,nan,AMD is a wicked bitch. She has smited me many times.,0,0.586,POSITIVE,0.863
,nan,I mean she’s competing with nvda,0,0.502,NEGATIVE,0.894
,nan,"Imagine being Lisa Su and going home for the holidays as the CEO of AMD, one of the most successful chip companies ever, but still not being good enough for your parents because your cousin at the other end of the table is the CEO of NVIDIA",1,0.565,NEGATIVE,1.0
,nan,"POV: You make hammers, nails, screws, etc. Your cousin Jimmy makes pickaxes. You're both good at what you do, and everyone admires both your handiwork, but let's be honest, hammers have way more general use value for the average consumer.Except then some dip-ass in California says he found gold in them thar hills, and now every regard at Home Depot is throwing their hammers away for Jimmy's Deluxe Pickaxes thinking they're going to be the lucky one, and somehow this is now your fault every Thanksgiving.",2,0.513,NEGATIVE,0.969
,nan,Sounds like Asian parents lol,2,0.503,POSITIVE,0.664
,nan,i'm not an expert but i think she might have asian parents,3,0.577,NEGATIVE,0.987
,nan,"They literally are cousins, or cousins once removed or something like that. They are related though.",3,0.509,POSITIVE,0.895
,nan,"excuse me, is she really cousins with jensen huang? omfg i kinda feel bad for her 😭😂😂",2,0.503,NEGATIVE,1.0
,nan,Second cousins once removed afaik. Lisa’s great grandmother is Jensen’s grandma.,3,0.512,POSITIVE,0.995
,nan,Competing against her cousin Jensen,1,0.502,POSITIVE,0.997
,nan,Seems like CEO gene runs in the family,2,0.521,POSITIVE,0.989
,nan,nvidia is like that one cousin that your parent always compare you with.you earn 100k/year ? your mom said that your cousin earn 500k/year,1,0.639,POSITIVE,0.999
,nan,the funny part is that the CEO of Nvidia and AMD are actually second cousins (might be wrong on the exact labeling) Their grandparents are siblings,2,0.564,POSITIVE,0.977
,nan,"Why not? She pulled AMD out of $2 a share and its trading at $130. She took back significant market share from Intel in both server and pc markets. While the GPU's aren't as powerful as Nvidia they are a good value buy. She is running a well founded company now.Now as for the stock price. Remember AMD has issues with being dependent on political climates. Remember they manufacture in Taiwan and with the threat of China along with tariffs people are hesitant to stay in. Stock is not 100% sales and revenue.What should we look for, for future pricing?Relations with China and Taiwan and other regional political instabilityTariffs and their long term effects2a. included in this is shifting production from Taiwan to Arizona's TSMC plantBTC and other coin values and people setting up mining rigs again.Market saturation (server) People may not be upgrading servers anytime soon, looing back to tariffs, market sales may slow down due to increase pricing.Sales due to gaming market - Look this year kind of sucked for AAA titles we were about 50/50 so a person's desire to upgrade systems to play new games was a miss (Personal Opinion)A bunch of us sold at around 200 cause you know, if you dont sell you dont make money.",0,0.575,NEGATIVE,1.0
,nan,I bought under $7 🥲,1,0.515,NEGATIVE,0.993
,nan,Stonks go up. AMD is going to moon,0,0.605,POSITIVE,0.772
,nan,Ya'll don't remember AMD prior to Lisa Su LOL,0,0.566,NEGATIVE,0.695
,nan,Zoom out,0,0.5,POSITIVE,0.866
,nan,she needs to wear black leather jackets like her distant cousin jensen huang..they give you more creative power,0,0.503,POSITIVE,0.962
,nan,know your worth queen,0,0.545,POSITIVE,0.975
,nan,When amd has the slightest positive news it is going to skyrocket 🤣.,0,0.602,NEGATIVE,1.0
,nan,"Fuck yea I’m buying AMD stock, y’all don’t want a bargain price?",0,0.588,NEGATIVE,0.987
,nan,Lets go,1,0.502,NEGATIVE,0.998
,nan,Not to be that crazy leftist but the leadership qualities that make someone a “good boss” and the leadership qualities that makes stock price go up are pretty much diametrically opposed. The stock traded sideways this year but I’d bet she’s way better to work for than any of the other big tech CEOs.,0,0.56,NEGATIVE,0.602
,nan,That's bullish. Buying calls on Monday.,0,0.514,NEGATIVE,0.986
,nan,Right???Also suggest CEO and Dead CEO of the Year categories.,0,0.64,NEGATIVE,1.0
,nan,AMD keep buying and dont stop buying,0,0.585,POSITIVE,0.998
,nan,19 minute read? No thanks,0,0.508,NEGATIVE,0.999
,nan,Be interesting if WSB as a community picked its CEO of the Year - every year. Is TIME even a thing anymore?,0,0.623,POSITIVE,0.87
,nan,"You should show the whole 5y chart since she took over, not just the last year. AMD is worth way more now than it did in 2016.Oh fyi, shares in 2016 were under 3 dollars. I made 35k off stock in 8 years. That doesn’t happen often.",0,0.583,NEGATIVE,0.903
,nan,AMD used to be expensive but its valuation is now pretty compelling. It trades around 26x 2025 earnings now with 25% projected annual earnings growth.,0,0.591,POSITIVE,0.97
