date of comment,main comment,comment,depth,PTR Sentiment,Flair Outlook,Flair Sentiment
,nan,GPT-REEEE,0,0.5,NEGATIVE,0.999
,nan,How about now?,0,0.5,POSITIVE,0.762
,nan,Lolololol took the words out of my mouth,1,0.499,NEGATIVE,0.647
,nan,How about now?,2,0.5,POSITIVE,0.762
,nan,"I sold my 80 shares of AMD months and months ago and haven’t looked back since. I don’t care if they go to $400 next year, I hopped off that train lol.",3,0.589,NEGATIVE,0.993
,nan,"Well, your still here talking about it.",4,0.548,NEGATIVE,0.904
,nan,"What does that have to do with anything? I can talk about my Saabs I used to own 12 years ago that doesn’t mean I’m gonna go buy one out of someone’s barn, buddy ole pal.",5,0.523,POSITIVE,0.875
,nan,Did not age well!,2,0.56,NEGATIVE,1.0
,nan,"I no longer hold it and I don’t trade options. AMD’s daily activity, while I want the company to succeed because I like them, is moot to me.I only come here for entertainment lol 🙃",3,0.546,NEGATIVE,0.999
,nan,"Good thing that I got leaps, not weeklies. Moves like today would decimate weeklies.",3,0.523,NEGATIVE,0.981
,nan,nothing is oversold until it stops selling off and has reversed lol,0,0.503,POSITIVE,0.975
,nan,How about now?,1,0.5,POSITIVE,0.762
,nan,"no it hasn't reversed yet, you won't know when it will until it already has",2,0.538,NEGATIVE,0.658
,nan,How about now?,3,0.5,POSITIVE,0.762
,nan,Now?,4,0.5,NEGATIVE,0.529
,nan,NOW,5,0.5,POSITIVE,0.832
,nan,How now brown cow,4,0.5,NEGATIVE,0.965
,nan,Prices are never too high to begin buying and never too low to begin selling. And all a man needs to make money is to appraise general conditions,1,0.508,POSITIVE,0.999
,nan,AMD 150C 3/21/25 is the play,0,0.665,POSITIVE,0.946
,nan,I don’t like seeing the same thought I had. Makes me believe I’m going down hard,1,0.508,NEGATIVE,0.812
,nan,Fuck literally same I’ve got these exact calls,2,0.501,NEGATIVE,0.999
,nan,We gonna be rich 🤑,3,0.502,POSITIVE,0.936
,nan,do...do I have to buy these to be cool?,3,0.6,POSITIVE,0.505
,nan,How does 165 3/21/25 look?,1,0.525,NEGATIVE,1.0
,nan,"Yeah, a bit optimistic, I'd say. But 150 is definitely feasible.",2,0.501,POSITIVE,0.835
,nan,Too far OTM imo.,2,0.502,NEGATIVE,1.0
,nan,I'm 5/16/25 at $165. So far so good,2,0.672,POSITIVE,0.996
,nan,Fuck you im in.,1,0.497,POSITIVE,0.998
,nan,Fuck it I’m in,1,0.495,POSITIVE,0.807
,nan,Is my AMD 200C Feb 2025 cooked LOL,0,0.596,POSITIVE,0.997
,nan,February??? Lmao,1,0.525,NEGATIVE,0.999
,nan,Yup my 220s are cooked as well,1,0.53,POSITIVE,1.0
,nan,Bruh those were cooked before you even bought em,1,0.507,NEGATIVE,1.0
,nan,YOU SHOULD JUST BUY A call for next ear thatll be a fraction of price and then go from there,0,0.552,NEGATIVE,0.999
,nan,Always inverse WSB,0,0.502,POSITIVE,0.992
,nan,I’m not buying shit. Chips had their year. It’s over,0,0.609,NEGATIVE,0.996
,nan,"cramer says buy, the stock news say buy, wsb says buy... you know what that means,",0,0.615,NEGATIVE,0.513
,nan,Wsb says buy? Wsb hates amd. It says sell,1,0.619,NEGATIVE,1.0
,nan,"There have only been front page bullish posts on it, wdym",2,0.506,NEGATIVE,0.998
,nan,"WSB was making memes about Advanced money destroyer, and same goes for r/stocks.",1,0.536,NEGATIVE,0.999
,nan,If Cramer says buy they going bankrupt next week 💀,1,0.579,NEGATIVE,0.999
,nan,I picked up 5 $100 leaps about 10 minutes ago. Ill just sit on them. Just need a pop anytime over the next 13 months.,0,0.526,POSITIVE,0.736
,nan,Also calls here $150 for May/June’25,0,0.581,POSITIVE,0.648
,nan,Or your could just buy Nvidia 🤷🏼‍♂️,0,0.601,NEGATIVE,0.987
,nan,No.,1,0.5,NEGATIVE,0.994
,nan,Buy both,1,0.7,POSITIVE,0.976
,nan,Bought $115 AMD calls for November break even at $140 after selling $130 calls for next Friday,0,0.58,NEGATIVE,0.997
,nan,AMD and NVDA are both oversold at this point. Regard analysts think AVGO is going to take up marketshare when Nvidia has repeatedly said its sold the fuck out for 2025.There's enough chips and money printing for everyone. Didn't think I'd be able to re-enter Nvidia at 130 again so today was a blessing.,0,0.567,NEGATIVE,0.606
,nan,"I'm waiting to see a flip in the trend, but I plan on also getting in on AMD once the reversal happens. I think it has more room to fall. We will see though",0,0.573,POSITIVE,0.854
,nan,Definitely getting close to the bottom.I am liking the forward P/E and prospects.CPU market is solid for them now.GPU is growing.They don't have to be #1. Just like when it was Intel vs AMD.,0,0.556,POSITIVE,0.861
,nan,"AMD stock is in a downtrend, don't buy it.",0,0.773,NEGATIVE,1.0
,nan,You will be disappointed,0,0.5,NEGATIVE,0.994
,nan,idk if the rising tide going to lift that boat.,0,0.506,NEGATIVE,0.994
,nan,175 is so far otm though...,0,0.502,NEGATIVE,0.788
,nan,Have fun with that,0,0.5,POSITIVE,0.999
,nan,"Sold my calls this morning, might buy back in early January. It’ll just keep dropping the rest the year.",0,0.573,NEGATIVE,1.0
,nan,So for the next 2 weeks...,1,0.565,NEGATIVE,0.997
,nan,Wait for it to dip below 100,0,0.502,NEGATIVE,0.998
,nan,"1 min RSI hit 5 today. Absolutely absurd, I just bought more. Love the play ",0,0.523,POSITIVE,0.974
,nan,"I mean if you want to grab a falling knife, there's a high chance you're gona get cut. But emo kids love cutting their wrists and they're free to do whatever they want cause AMERICA!That money couldve been in a stock that has better potential to run in the near future.",0,0.525,NEGATIVE,0.985
,nan,"So how come people at screaming now Tesla is overvalued because it has a PE of 100, and AMD oversold with PE of 100 too.",0,0.548,NEGATIVE,0.971
,nan,"Zoom out bro. This is going into the 80's like big hair and lead fuel.Technically I think $96, but 80's is even better.People aren't going to take profit on Nvidia just to buy AMD right now",0,0.562,POSITIVE,0.76
,nan,Advanced Money Destroyer,0,0.542,POSITIVE,0.699
,nan,"-600 for me, you know what they say... Only gamble with what you can afford to lose.",1,0.507,POSITIVE,0.907
,nan,For what its worth the 1 year trend line shows next resistance angular line to be 115ish before it moves the other direction,0,0.59,NEGATIVE,0.997
,nan,AMD $100 EOY,0,0.738,POSITIVE,0.84
,nan,"Ah, so the main difference between zen5 epyc and haswell xeon is marketing, huh?",1,0.507,POSITIVE,0.698
,nan,Advanced Marketing Devices,2,0.568,POSITIVE,0.998
,nan,But AMD is making a lot of money YOY,1,0.611,NEGATIVE,0.642
,nan,This ain’t for you dawg,1,0.5,NEGATIVE,0.996
,nan,no way you are a real person,1,0.523,NEGATIVE,0.999
,nan,"Forward PE mid 20's.. can you name a tech stock with better EPS growth estimates, and similar or lower forward PE?",1,0.561,NEGATIVE,0.998
,nan,Jan 2027 leaps regard,1,0.497,POSITIVE,0.996
,nan,which is why I'm buying leaps,1,0.648,POSITIVE,0.999
,nan,I bet on the wrong horse too…,0,0.494,NEGATIVE,0.981
,nan,"Looks like a great time to buy according to bollinger band. I got em weeklies lmao, will prolly roll the gains into future contracts",0,0.527,POSITIVE,0.999
,nan,I mean if I'm looking at your little lineyroos it's literally not oversold yet,0,0.552,POSITIVE,0.951
,nan,I bought more intel and amd,0,0.702,NEGATIVE,0.589
,nan,i added shares to the long term today but I wouldn’t buy leaps until we see sub $90s - $110,0,0.552,NEGATIVE,0.998
,nan,"Long an underperformer while the entire market is overdue for a significant pullback, bold move Cotton",0,0.55,POSITIVE,0.88
,nan,Cycle is too long,0,0.562,NEGATIVE,0.999
,nan,I don’t feel so good about my 02/21 130c now lol,0,0.517,NEGATIVE,0.962
,nan,Or your 6 months early,0,0.565,NEGATIVE,0.983
,nan,Glad I got 2027 calls then.,1,0.508,POSITIVE,0.994
,nan,"LEAPs? Man gtfo of here, you're too smart",0,0.504,POSITIVE,0.964
,nan,3000 is a lot,0,0.505,NEGATIVE,0.598
