date of comment,main comment,comment,depth,PTR Sentiment,Flair Sentiment,Flair Outlook
,,GPT-REEEE,0,0.5,0.999,NEGATIVE
,,This is bullish for NVDA sales in Singapore lololol,0,0.606,0.999,NEGATIVE
,,... and Singapore (re)sales to China under the table.,1,0.621,0.98,NEGATIVE
,,"""allegedly""",2,0.495,0.996,NEGATIVE
,,🤫💸,3,0.5,0.761,NEGATIVE
,,"Yes, that’s the joke.",2,0.5,0.908,NEGATIVE
,,"They will define what they cannot do, but they will inovate a way around the law, like they always do. Also they are exported from Taiwan who's gonna know?",0,0.53,0.929,POSITIVE
,,You don't see Huawei using 2nm.,1,0.505,1.0,NEGATIVE
,,Now those countries will buy a crazy amount of chips. Calls on NVDA,0,0.544,0.969,NEGATIVE
,,"Hah, like they were really getting any after the US tech behemoth's orders anyways",0,0.53,0.997,NEGATIVE
,,They working hard to set a double top ey,0,0.537,0.61,NEGATIVE
,,Hey buddy we are trying to get to 10 trillion back off,0,0.508,0.998,NEGATIVE
,,"Always calls, if they don’t sell to China more stock for TSLA and Oracle",0,0.569,0.831,POSITIVE
,,When your product is so good the US wants to cap your exports.,0,0.538,0.998,NEGATIVE
,,"From what I understand, they are not capping the amount of chips they can sell, but the number of people in foreign countries who are approved by the US government to buy these chips. It essentially would create a sort of monopoly for the few people that get these export licenses.Honestly to me, it sounds like Government corruption. I wouldn't doubt if Biden has a few friends who will get the export licenses and kick 10% back to the big guy.",0,0.516,1.0,NEGATIVE
,,,1,,,
,,"Never go full regard, Putinzombie ...",2,0.505,1.0,NEGATIVE
,,You are too regarded for even this subreddit,2,0.502,0.817,NEGATIVE
,,GTFO out of business. Pray we don’t become the EU that needs to gimp corporations to pay for their social welfare.,0,0.531,0.999,NEGATIVE
