date of comment,main comment,comment,depth,PTR Sentiment,Flair Outlook,Flair Sentiment
,nan,GPT-REEEE,0,0.5,NEGATIVE,0.999
,nan,Bought my first calls today,0,0.566,NEGATIVE,0.576
,nan,Good idea,1,0.548,POSITIVE,0.993
,nan,Where did the regards go wrong,2,0.497,NEGATIVE,0.942
,nan,That's why they are all coming here,3,0.5,NEGATIVE,0.925
,nan,If you bought them at the end of the day you got fire sale pricing 🔥,1,0.52,NEGATIVE,0.994
,nan,Was before the crash. It was even green for some time,2,0.526,NEGATIVE,0.934
,nan,I bought spy calls at 3:59pm and down almost 5%,2,0.517,NEGATIVE,1.0
,nan,"its going straight down, better buy calls",1,0.564,NEGATIVE,0.999
,nan,but is it the last time?,1,0.6,POSITIVE,0.751
,nan,"me too, about a half hour before the dip",1,0.457,POSITIVE,0.789
,nan,"I was going to buy my first calls today, but I know that when I buy stock, it goes down. So I changed my mind and decided to buy calls in paper trading first. Market delivers at instant.",1,0.591,POSITIVE,0.978
,nan,Second time’s a charm!,1,0.525,POSITIVE,1.0
,nan,Me too! Intel calls bc im regarded!,1,0.525,POSITIVE,0.993
,nan,Bought INTC at $19.26. Placed the order a week ago and just waited to see what would happen.,2,0.548,NEGATIVE,0.85
,nan,The J Pow that Stole Christmas,0,0.499,POSITIVE,0.999
,nan,"But he did cut the rate tho. Next meeting, Trrump will be in office by then, so it should be another cut.",1,0.507,NEGATIVE,0.625
,nan,Took me 3 years to break even and one hour to go to where i was 3 years ago,0,0.528,NEGATIVE,1.0
,nan,"That mither fukers wrekt, hope ur port looks better that steam fried chicken shit. ",1,0.507,NEGATIVE,1.0
,nan,Are you a intel bagholder,1,0.55,NEGATIVE,0.992
,nan,I'm saving this meme for next year,0,0.735,POSITIVE,0.996
,nan,!RemindMe 10 months,1,0.562,POSITIVE,0.977
,nan,I will be messaging you in 10 months on 2025-10-19 00:44:08 UTC to remind you of this linkCLICK THIS LINK to send a PM to also be reminded and to reduce spam.Parent commenter can delete this message to hide from others.Info Custom Your Reminders Feedback,2,0.515,NEGATIVE,0.958
,nan,Wonder if he can top his magnum opus,1,0.52,POSITIVE,0.956
,nan,this fucking guy makes me wanna go long $ROPE,0,0.524,POSITIVE,0.959
,nan,You guys are acting like this isn’t a fire sale.Edit: this is not financial advice /s,0,0.512,NEGATIVE,0.999
,nan,Too busy buying the tip to buy the dip,1,0.544,NEGATIVE,0.998
,nan,You guys are buying the tip. I was told to do something completely different. I’m never going to Wendy’s again,2,0.506,NEGATIVE,1.0
,nan,We’re all going to Wendy’s if this continues,3,0.511,NEGATIVE,0.985
,nan,Took your tip put it in dip. Thats how we got here. ,4,0.499,POSITIVE,0.954
,nan,"Zoom out the chart, SPY is still very close to ATH this isn’t a fire sale barely a discount",1,0.501,NEGATIVE,0.998
,nan,Is this the rich person equivalent of people rushing to buy a 500$ TV on 5% discount.,2,0.522,NEGATIVE,0.999
,nan,I don't like my stuff on sale... its fucking mine and I will hold it until its worthless goddammit.,1,0.506,NEGATIVE,0.994
,nan,"HOOD started dipping, I kept buying the dip and ran out of cash",1,0.512,NEGATIVE,0.997
,nan,"Ran out of cash today, gotta get bent over to get more for tomorrow. Everyone have a safe night. ",2,0.521,POSITIVE,0.818
,nan,It is but 90% of web was in 0dtes so they can't buy,1,0.567,NEGATIVE,1.0
,nan,"PUT YOUR HANDS UP DatBeigeBoy!!! POLICE ARE ENROUTE! PREPARE TO BE BOOKED FOR PROVIDING ILLEGAL FINANCIAL ADVICE!I am a bot, and this action was performed automatically. Please contact the moderators of this subreddit if you have any questions or concerns.",1,0.507,POSITIVE,0.827
,nan,"I'm behind Wendys, you know where, by the dumpster, $20 will do...",0,0.599,POSITIVE,0.953
,nan,<image>,1,0.5,POSITIVE,0.985
,nan,"He makes $250,000 a year",0,0.827,POSITIVE,0.995
,nan,He has a portfolio that I BET looks different than ours today....,1,0.542,NEGATIVE,0.933
,nan,"Nah, since 2022 Fed Officials can't buy single stocks, sector funds, crypto, commodities, derivatives (futures or options), shorts, or buy on margin. It's congress members that still get to have all that fun...",2,0.53,NEGATIVE,0.979
,nan,Since 2022? You mean that year that just happened?,3,0.662,NEGATIVE,0.864
,nan,"Yeah, due of course to some super sketchy looking trades that occurred just before the pandemic in 2020.",4,0.497,NEGATIVE,0.995
,nan,Surely someone will investigate that,2,0.498,POSITIVE,0.929
,nan,Won’t be Nancy,3,0.5,POSITIVE,0.731
,nan,She'll investigate what he bought that she didn't to see if he made more than her.,4,0.509,NEGATIVE,0.982
,nan,$250k but he’s fucking us for millions,1,0.52,NEGATIVE,0.981
,nan,If your getting fucked for millions what'd the problem. Bend over. ,2,0.505,NEGATIVE,1.0
,nan,That's... not... a lot...,1,0.505,NEGATIVE,0.999
,nan,"Brother, I live in southwest Virginia, you're basically Bill Gates around here if you're making 250k a year",2,0.556,POSITIVE,0.998
,nan,He was seeing too much green and not enough red going into Christmas,0,0.511,NEGATIVE,0.993
,nan,what happed there? looked okay 8 hours ago,0,0.512,NEGATIVE,1.0
,nan,The Fed did exactly what they said they would do lol,1,0.659,POSITIVE,0.985
,nan,"Not only that, but they did exactly as they should do and are signaling what they should be signaling.",2,0.497,POSITIVE,0.999
,nan,Note to self for next time: Sell everything and go all cash an hour before a Fed meeting.,0,0.526,NEGATIVE,0.999
,nan,"I did that. Although my thesis was wrong. Saw poly market betting on rate pause, so to me that felt bearish.",1,0.523,NEGATIVE,0.999
,nan,I tried to buy my first puts this morning. I was shaking when I hit the button to execute the trade. Notice popped up that I don’t have permission to trade options and had to take an online exam. Spent the next hour pasting exam questions in ChatGPT. I’d be rich if I wan’t so fucking stupid.,0,0.517,NEGATIVE,1.0
,nan,Down $30k today. Thanks Jay 🤬,0,0.534,NEGATIVE,0.746
,nan,Options?,1,0.515,NEGATIVE,0.959
,nan,"Nah, just investments. So unrealized losses.",2,0.5,NEGATIVE,0.999
,nan,"As long as I don't look at my phone, it's all unrealized.",3,0.551,NEGATIVE,1.0
,nan,Gann day nothing else matters.,0,0.507,NEGATIVE,0.602
,nan,The colors of Christmas are green and red. Not green and green. Duh,0,0.506,NEGATIVE,0.994
,nan,Buy the dip. Shrek dick inbound.,0,0.542,POSITIVE,0.918
,nan,"Why after rate cut, everything are red?!",0,0.491,NEGATIVE,0.999
,nan,"It wasn’t even really his fault, he’s doing his job. It’s bigger forces operating here. It’s a message. The market should have pumped HARD on this news",0,0.529,POSITIVE,0.786
,nan,"SPY still up over 24% this year. One red day and this sub cry’s uncle, bunch of over leveraged gambling addicts",1,0.559,NEGATIVE,0.876
,nan,Na fuck him I need somewhere to direct my depression,1,0.497,NEGATIVE,0.999
,nan,Market expected 75-100bps cut in 2025 and we most likely getting only 50. Not hard to understand that treasury yields would rally and stock market would fall,1,0.566,NEGATIVE,0.997
,nan,Have they rallied though?,2,0.5,NEGATIVE,0.596
,nan,10 yr went from 4.39 to 4.52 in a couple hours which is a pretty big move yes,3,0.519,POSITIVE,0.973
,nan,Was a genuine question. Thx,4,0.502,POSITIVE,0.985
,nan,No problem at all,5,0.495,POSITIVE,0.998
,nan,Its more the fact that the fed revised their expected rate cuts for 2025,1,0.512,NEGATIVE,0.997
,nan,Was priced in 2 on Monday at a minimum. ,2,0.502,NEGATIVE,0.995
,nan,I agree. This news should have pumped.,1,0.528,NEGATIVE,0.669
,nan,"how could you cover up the funniest part of that image, that only UNH is up today",0,0.536,POSITIVE,0.583
,nan,LMAO one of the best,0,0.558,POSITIVE,0.998
,nan,They should put this one on the fridge. ,0,0.522,POSITIVE,0.792
,nan,Wonder if shares his knowledge,0,0.505,NEGATIVE,0.577
,nan,He's creating discounts for everybody!,0,0.505,POSITIVE,0.98
,nan,"Powell's wife: ""Honey, I liquidated the index funds in our retirement account before Halloween. Should we get back in?""",0,0.502,NEGATIVE,0.997
,nan,God Damnit!!!! I was going to buy puts on Friday since it's pay day here at wendys! Mother fuck cock shit ass fuck. Why do I always get ass fucked man. I never get a win.,0,0.516,NEGATIVE,0.995
,nan,"Jerome Powell: 'I don’t do soft landings, I do crash landings.",0,0.5,NEGATIVE,0.679
,nan,Guy jumped off house with dick out and landed right up my ass. I hate these crash landings. ,1,0.506,NEGATIVE,0.973
,nan,All red and that motherfucker UNH is up!!! wtf!!!,0,0.5,NEGATIVE,0.987
,nan,Maybe just don’t make bad investments/shit asset allocations?,0,0.505,NEGATIVE,0.905
,nan,The Fed's decision and announcement that stubborn core inflation would delay further cuts came as no surprise to any paying attention to the indicators.What did come as a surprise is that the market didn't already have all this priced in. Interest rate sensitive sectors like home builders have been falling for months because there was little prospect of mortgage rate relief.,0,0.515,NEGATIVE,0.995
,nan,Fuck this guy this was payback for him having it easy with gramps in there the last 4 years now orange gonna fire his ass so he bigly mad,0,0.513,POSITIVE,0.628
,nan,F this guy,0,0.51,POSITIVE,0.975
,nan,"I’m guessing it’s institutional investors selling off cause they’re not getting a bigger rate cut, as usual, it’s greedy corporate America f***ing over, the average Joe",0,0.509,NEGATIVE,0.999
,nan,"Tax harvesting at relative top, by quant and institutions to fund Christmas, into January rally probably. ",1,0.515,NEGATIVE,0.991
,nan,He’s such a dick,0,0.5,POSITIVE,0.998
,nan,"I don’t care, TSLA is still going strong, been carrying my portfolio since the election.",0,0.531,POSITIVE,0.969
