date,text,PTR Sentiment,Flair Sentiment,Flair Score,Repost,Hastags
2024-11-20T16:30:01.000Z,"Mark your calendars for #CES2025, taking place January 6-10. Join us in Las Vegas for our CEO Jensen Huang’s opening keynote, insightful speaker panels, and immersive demos showcasing the latest tech innovations.Register for CES: https://nvda.ws/3ZeG55i@CES",0.5127,POSITIVE,0.9915,0,['#CES2025']
2024-11-21T20:48:23.000Z,"Discover how @ENERGY's AI initiatives are transforming science, industry, and government. In the latest NVIDIA AI Podcast, the U.S. Department of Energy's chief AI officer, Helena Fu, discusses the department's groundbreaking efforts. #AIpodcast",0.5498,POSITIVE,0.9834,0,['#AIpodcast']
2024-11-21T20:06:23.000Z,"Registration is now open for #GTC25.  Join us March 17–20 in San Jose, CA to get hands-on experience with the latest technologies driving real-world change through #AI.   https://nvda.ws/3OiVX0b",0.527,POSITIVE,0.9871,0,"['#GTC25', '#AI']"
2024-11-20T14:08:34.000Z," This just in: 384 systems on the #Top500 list run on NVIDIA's #acceleratedcomputing platform, with 85% of the new accelerated systems using NVIDIA Hopper to enable breakthroughs in sustainable computing. @top500supercomp #SC24  https://nvda.ws/3CLHeIB",0.5448,POSITIVE,0.9975,0,"['#Top500', '#acceleratedcomputing', '#SC24']"
2024-11-15T17:33:43.000Z,"NVIDIA is named the No. 1 best company to work for in America, according to @Forbes. Discover why it’s like no place you’ve ever worked. #NVIDIAlife",0.575,POSITIVE,0.9551,0,['#NVIDIAlife']
2024-11-14T05:30:02.000Z, Just announced: Indonesia tech leaders team with NVIDIA and partners on sovereign #AI. This includes the launch of the Sahabat-AI #LLM collection and AI services for Indonesia's industries and over 277 million Bahasa speakers. Learn more: https://nvda.ws/3UPxaEZ,0.5752,POSITIVE,0.9718,0,"['#AI', '#LLM']"
2024-11-14T00:24:09.000Z,"Join us at #MSIgnite next week, Nov 19-22: https://nvda.ws/3Z4OaJIDon't miss the opportunity to meet NVIDIA AI experts, experience hands-on demos in the NVIDIA booth, and attend a broad range of insightful sessions to explore how to accelerate your work with @Microsoft.",0.5388,POSITIVE,0.9514,0,['#MSIgnite']
2024-10-24T17:00:36.000Z,New episode of NVIDIA #DRIVELabs features collaboration between #NVIDIAResearch and @Stanford on real-time anomaly detection and reactive planning with #LLMs. Winner of @RoboticsSciSys Outstanding Paper Award. #AI #automomousdriving #robotics https://nvda.ws/4hktF2F,0.5402,POSITIVE,0.9988,0,"['#DRIVELabs', '#NVIDIAResearch', '#LLMs', '#AI', '#automomousdriving', '#robotics']"
2024-11-13T02:31:54.000Z,"Japan’s #cloud leaders are teaming with NVIDIA to build new AI infrastructure to supply compute resources for its industries.Discover how NVIDIA #acceleratedcomputing, networking, and software solutions will transform Japan's industries.  https://nvda.ws/3Z1JRPq#AISummit",0.562,POSITIVE,0.9906,0,"['#cloud', '#acceleratedcomputing', '#AISummit']"
2024-11-13T18:38:52.000Z,"At #AIsummit, our founder and CEO Jensen Huang and SoftBank Chairman and CEO Masayoshi Son shared a sweeping vision for Japan’s role in the AI revolution. Learn how the country is poised to create both digital and physical #AI. @sbnews9434",0.5358,POSITIVE,0.9949,0,"['#AIsummit', '#AI']"
2024-11-13T02:35:02.000Z," We are collaborating with @sbnews9434 to build the AI grid for Japan. https://nvda.ws/48OC9vgUsing our tech for AI factories, 5G AI-RAN networks, and creating an AI marketplace, Softbank is accelerating their journey to becoming a global AI powerhouse. #AISummit",0.5607,POSITIVE,0.9899,0,['#AISummit']
2024-11-12T14:00:16.000Z,"Exciting Update! Jensen Huang, CEO of NVIDIA, is a 2025 Edison Achievement Award Honoree!A true tech visionary, he’s transforming industries with innovation. Join us in celebrating his impact on the future of technology!#EdisonAwards #Innovation #JensenHuang #AI #NVIDIA",0.5448,POSITIVE,0.9986,0,"['#EdisonAwards', '#Innovation', '#JensenHuang', '#AI', '#NVIDIA']"
2024-11-04T21:42:24.000Z,The new NVIDIA AI Blueprint simplifies building interactive visual #AIagents for video search and summarization.  https://nvda.ws/3UAPKApThese agents can understand activity within large volumes of videos using #generativeAI. #SCEWC2024,0.5377,POSITIVE,0.9987,0,"['#AIagents', '#generativeAI', '#SCEWC2024']"
2024-11-01T17:30:20.000Z,"Education is a lifelong endeavor for Gary Yau, a senior quality assurance engineer at NVIDIA. Discover how he’s advanced his skills and career with the help of our continuing education benefits. #NVIDIAlife",0.5182,POSITIVE,0.999,0,['#NVIDIAlife']
2024-10-24T06:40:30.000Z,"Just announced at NVIDIA #AISummit in India Industrial powerhouses including @OlaElectric, @RIL_Updates, @TCS, and @tech_mahindra are utilizing #NVIDIAOmniverse to accelerate factory planning & operations with #DigitalTwins and #GenerativeAI. https://nvda.ws/4e4H4sW",0.528,POSITIVE,0.9862,0,"['#AISummit', '#NVIDIAOmniverse', '#DigitalTwins', '#GenerativeAI']"
2024-10-24T06:20:31.000Z,"Announced at #AISummit India:Leading cloud infrastructure providers and server manufacturers are boosting accelerated data center capacity with thousands of #NVIDIAHopper GPUs, with deployments expected to double by year’s end.Read more: https://nvda.ws/4eTj5yg",0.5267,POSITIVE,0.9627,0,"['#AISummit', '#NVIDIAHopper']"
2024-10-23T12:00:00.000Z,"Our CEO Jensen Huang joined the King of Denmark to launch the Gefion AI supercomputer, powered by an #NVIDIADGX SuperPOD, which will accelerate innovation for quantum computing, energy, biology, and more in Denmark. #SovereignAI @novonordiskfondRead more",0.525,POSITIVE,0.9917,0,"['#NVIDIADGX', '#SovereignAI']"
2024-10-22T17:33:32.000Z,"At the #AIsummit in Washington, D.C., policymakers, civil servants, and industry leaders experienced the transformative impact of #AI firsthand.Access session replays, now available to watch on demand: https://nvda.ws/4hsL0a3Watch the event recap: https://nvda.ws/3UlzlzB",0.5193,POSITIVE,0.9951,0,"['#AIsummit', '#AI']"
2024-10-22T00:18:28.000Z,"Don’t miss this visionary conversation with our CEO Jensen Huang and @Gartner_inc’s Daryl Plummer on #AI, leadership, and innovating the future. https://nvda.ws/3A63ex8 #GartnerSYM",0.5225,POSITIVE,0.9803,0,"['#AI', '#GartnerSYM']"
2024-10-21T18:40:09.000Z,"At #HLTH2024, we're thrilled to announce our partnership with @Microsoft, providing AI startups from the #NVIDIAInception and @msft4startups programs with access to essential tools and resources to solve complex healthcare challenges. https://nvda.ws/4hg2xlC",0.5208,POSITIVE,0.9891,0,"['#HLTH2024', '#NVIDIAInception']"
2024-10-18T16:49:14.000Z,Ruixuan Li is leading the way in developing GPU architecture. Explore her journey as she works on defining next-generation #AI technology. #NVIDIAlife,0.5528,POSITIVE,0.9991,0,"['#AI', '#NVIDIAlife']"
2024-10-17T16:21:57.000Z," Did you know that 85% of ocean litter is plastic? Clearbot, powered by #NVIDIAJetson, is tackling this issue head-on by autonomously cleaning waterways with energy-efficient #AI, removing trash before it reaches the oceans.Learn more ",0.5252,POSITIVE,0.626,0,"['#NVIDIAJetson', '#AI']"
2024-10-09T10:25:35.000Z,"""We're at the beginning of a new industrial revolution""Rene Haas is joined by @NVIDIA CEO Jensen Huang on the 1st episode of Tech Unheard.  Listen in as Jensen introduces the AI factory, where intelligence is now manufactured at large volumes: https://newsroom.arm.com/podcasts/tech-unheard-episode-one-jensen-huang?utm_source=twitter&utm_medium=social-organic&utm_content=podcast&utm_campaign=mk29_exec-comms_na…",0.5292,POSITIVE,0.9164,0,[]
2024-10-11T14:00:27.000Z,"Happy #GeForceDay! On October 11, 1999, the GeForce 256 launched as the world's 1st GPU & changed PC gaming graphics forever.What was your favorite PC game of that era? Learn more about the history of the GeForce 256: https://nvda.ws/3BCb81I",0.5131,POSITIVE,0.9975,0,['#GeForceDay']
2024-10-10T17:51:01.000Z,"#WorldMentalHealthDay  Half of the world's population will face a mental health disorder, yet there are only 13 mental health workers per 100,000 people globally, with up to 40x disparity between countries.   https://blogs.nvidia.com/blog/ai-mental-health-therapyside/… See how @Therapyside, a Madrid startup,",0.5183,NEGATIVE,0.6669,0,['#WorldMentalHealthDay']
2024-10-08T16:00:02.000Z, Just announced: @DeloitteUS adopts NVIDIA NIM Agent Blueprint for container security to help enterprises build safe AI using open-source software.  Read now: https://nvda.ws/4gYy0J0,0.5363,NEGATIVE,0.555,0,[]
2024-10-08T15:29:51.000Z, Live from AI Summit: We are collaborating with top U.S. tech leaders to revolutionize the world’s industries with custom #AI solutions.  https://nvda.ws/4dHVoHARead now to discover the transformative power of NVIDIA AI in shaping the future.,0.5546,POSITIVE,0.9947,0,['#AI']
2024-10-09T16:19:27.000Z,"Boost your application performance and ROI with our ongoing optimizations of leading #LLMs, designed to deliver high throughput and low latency for real-time demands. Learn more: https://nvda.ws/3Nkeb18",0.5227,POSITIVE,0.985,0,['#LLMs']
2024-10-08T21:03:31.000Z,"Today at #AIsummit, VP of Enterprise Platforms Bob Pette highlighted how our accelerated computing platform is critical to the next wave of industrial, cybersecurity, scientific and healthcare transformations. https://nvda.ws/47UR1b7 #AI",0.5285,POSITIVE,0.9862,0,"['#AIsummit', '#AI']"
2024-10-08T17:47:29.000Z,"#NVIDIABlackwell has arrived. @OpenAI , we’re excited to see what you can do with one of the first engineering builds of the #NVIDIADGX B200 system.Learn more about DGX B200 here: https://nvda.ws/3BBLJoM",0.5158,POSITIVE,0.9908,0,"['#NVIDIABlackwell', '#NVIDIADGX']"
2024-10-08T15:33:47.000Z,"Our long-standing partnership with NVIDIA and deep innovation continues to lead the industry, powering the most sophisticated AI workloads.",0.5588,POSITIVE,0.9993,0,[]
2024-10-07T16:56:51.000Z,"Tune in to the #CES2025 opening keynote by our CEO Jensen Huang live in Las Vegas on Monday, January 6, at 6:30 p.m. PT. https://nvda.ws/3XX7uXr",0.5347,POSITIVE,0.9911,0,['#CES2025']
2024-09-27T16:27:47.000Z,Discover how NVIDIA executive assistant Jaime Miller is redefining the perception of administrative roles and driving IT innovation. #NVIDIAlife,0.5135,POSITIVE,0.9935,0,['#NVIDIAlife']
2024-09-17T20:09:36.000Z,"A key part of #sovereignAI is a nation’s ability to produce AI with its own workforce — along with its own infrastructure, data and business networks.   https://blogs.nvidia.com/blog/tunisia-ai-innovation-hub/… In a collaboration between Tunisia and NVIDIA, a new AI innovation hub launched today in the",0.572,POSITIVE,0.9964,0,['#sovereignAI']
2024-09-25T16:38:28.000Z,"The @sangerinstitute is using NVIDIA GPUs and Parabricks to accelerate cancer research, saving up to $1M and 1,000 MWh annually. #sustainablecomputing #AIforGood",0.5154,POSITIVE,0.9985,0,"['#sustainablecomputing', '#AIforGood']"
2024-09-24T23:26:46.000Z,"We’ve joined the U.S. government in the launch of the Partnership for Global Inclusivity on AI, providing Deep Learning Institute training, GPU credits and hardware and software grants to help make the benefits of safe and trustworthy AI accessible to all.",0.5394,POSITIVE,0.9929,0,[]
2024-09-23T17:16:51.000Z,"Federated Learning is a technique for developing more accurate, generalizable #AI models trained on data across diverse data sources without mitigating data security or privacy.  https://blogs.nvidia.com/blog/ai-federated-learning-cancer-detection/…Learn how top U.S. medical centers and research institutes are evaluating",0.5291,POSITIVE,0.7225,0,['#AI']
2024-09-20T15:53:01.000Z,"By the end of January, all NVIDIA operations will run on renewable energy. Join us at #NYClimateWeek 2024 as we harness AI for sustainability and celebrate energy efficiency gains. Let's build a greener future.  https://nvda.ws/4d9rOuf #ClimateAction",0.5415,POSITIVE,0.8649,0,"['#NYClimateWeek', '#ClimateAction']"
2024-09-21T01:00:35.000Z,"We would like to correct the previous statement of ""By the end of January, all NVIDIA operations will run on renewable energy."" What we meant is: ""By the end of January, all the electricity that powers NVIDIA’s global operations will come from renewable sources.""",0.5428,NEGATIVE,0.9578,0,[]
2024-09-20T19:10:25.000Z,"We are collaborating with @TMobile to advance the future of telecom: https://nvda.ws/3zn0LhsAt T-Mobile’s Capital Markets Day, our CEO Jensen Huang joined T-Mobile CEO Mike Sievert to discuss how AI-RAN will optimize network performance, energy efficiency, and provide new",0.5561,POSITIVE,0.9192,0,[]
2024-09-20T05:24:51.000Z,"We are excited to announce our collaboration with @NVIDIA to drive next-generation climate solutions through the Earth-2 platform. Together, we’re advancing AI-powered weather forecasting with cutting-edge accuracy, supported by our new Climate Tech Lab in Abu Dhabi.",0.5484,POSITIVE,0.9995,0,[]
2024-09-19T20:02:19.000Z,"Don't miss the #AIsummit special address from NVIDIA's Bob Pette. You’ll learn how our accelerated computing platform is delivering breakthrough performance in the next wave of #AI, sensor processing, digital twins, cybersecurity, autonomous systems, sustainable computing, and",0.5307,POSITIVE,0.9996,0,"['#AIsummit', '#AI']"
2024-09-18T21:15:37.000Z,Watch our CEO Jensen Huang and @salesforce CEO Marc Benioff on stage at Dreamforce for a fascinating #AI discussion on building the future with AI Agents and more: https://nvda.ws/3zkd1iK,0.5429,POSITIVE,0.9885,0,['#AI']
2024-09-18T15:37:00.000Z,"We're collaborating with @TMobile to transform telecommunications networks into AI computing infrastructure. AI-RAN—powered by NVIDIA AI Aerial—will revolutionize the telecommunications industry, paving the way to AI-powered networks. Watch the full video: https://nvda.ws/4d7WDzz",0.555,POSITIVE,0.9951,0,[]
2024-08-27T13:54:27.000Z,"Announcing the generative virtual screening for drug discovery NIM Agent Blueprint, a paradigm shift to the #drugdiscovery process to help researchers identify and develop drug candidates faster and with fewer steps. #NIM #GenerativeAI https://nvda.ws/3X3Cbdb",0.5063,POSITIVE,0.989,0,"['#drugdiscovery', '#NIM', '#GenerativeAI']"
2024-08-08T23:41:46.000Z,"Silicon Valley startup, @Figure_robot, unveils their next-gen industrial humanoid robot Figure 02, built using Isaac Sim for #syntheticdata and #generativeAI model training.  https://nvda.ws/3ywjfLX#NVIDIAInception",0.5108,POSITIVE,0.9587,0,"['#syntheticdata', '#generativeAI', '#NVIDIAInception']"
2024-09-05T21:52:49.000Z,"Honored to announce that our CEO Jensen Huang will receive the Charles F. Jenkins Lifetime Achievement Award during the 76th Engineering, Science & Technology #Emmy Awards. Jensen is being recognized for contributing significant advancements to television technology and",0.536,POSITIVE,0.9989,0,['#Emmy']
2024-09-04T16:51:02.000Z,"GeForce RTX GPUs power best-in-class AI PCs for advanced AI in gaming, content creation and more.Get a sneak peek ahead of @ifa_berlin kicking off in this week's #AIDecoded blog.",0.5459,POSITIVE,0.9996,0,['#AIDecoded']
2024-09-02T19:19:48.000Z,"Exciting to see Colossus, the world’s largest GPU #supercomputer, come online in record time. Colossus is powered by @nvidia's #acceleratedcomputing platform, delivering breakthrough performance with exceptional gains in #energyefficiency.Congratulations to the entire team!",0.5242,POSITIVE,0.9997,0,"['#supercomputer', '#acceleratedcomputing', '#energyefficiency']"
2024-09-03T16:36:34.000Z,"At #OCW24, we are teaming up with Oracle to accelerate AI and data processing. https://nvda.ws/4gbLEYDVisit the Data & AI Pavilion and watch our sessions to learn how our accelerated computing platform is enabling organizations to build, customize, and deploy #generativeAI.",0.5323,POSITIVE,0.9871,0,"['#OCW24', '#generativeAI']"
2024-08-30T16:09:59.000Z,"After a decade in software engineering, MBA intern Margaret Zhang sought new ways to apply her technical skills. Read more about her work this summer as a product management intern on NVIDIA’s enterprise platform team. #NVIDIAlife https://nvda.ws/4e5qWIc",0.5336,POSITIVE,0.8498,0,['#NVIDIAlife']
2024-08-28T16:43:01.000Z, CoreWeave is the first to bring@NVIDIA's H200 Tensor Core GPUs to market! Dive into our latest blog to learn how we’re pushing AI performance boundaries and powering the future of Generative AI. https://hubs.la/Q02MTstw0 #AI #NVIDIA #TechInnovation,0.5571,POSITIVE,0.8747,0,"['#AI', '#NVIDIA', '#TechInnovation']"
2024-08-28T15:12:06.000Z," We’re proud to be first to market with @NVIDIA’s H200 GPU, paired with our Mission Control platform to supercharge AI development. Experience unmatched reliability and performance with CoreWeave.  https://hubs.la/Q02MVSG40 #AI #TechInnovation #CoreWeave",0.5438,POSITIVE,0.9988,0,"['#AI', '#TechInnovation', '#CoreWeave']"
2024-08-28T15:06:14.000Z,"In the latest round of #MLPerf industry benchmarks, the first submission of NVIDIA Blackwell delivered up to 4X more performance on #Llama 2 70B, while the NVIDIA H200 Tensor Core GPU continued to deliver outstanding results across every data center test.",0.5323,POSITIVE,0.999,0,"['#MLPerf', '#Llama']"
2024-08-27T15:02:30.000Z,"Announcing NVIDIA NIM Agent Blueprints, reference applications for every enterprise to make their own #AI. They equip developers with apps for building generative AI use cases such as digital humans, PDF data extraction, and virtual screening. https://nvda.ws/3X2RenB",0.5328,POSITIVE,0.9889,0,['#AI']
2024-08-27T15:06:21.000Z,@Accenture @DeloitteUS @SoftServeInc @wwt_inc @ciscoDC @DellTech @HPE @LenovoDC,0.5078,POSITIVE,0.9726,0,[]
2024-08-26T16:32:14.000Z,"From 400x faster simulations to 140x energy savings, see how NVIDIA’s CUDA GPU-accelerated computing is paving the way for sustainable computing.Read more: https://nvda.ws/3WTGqYI #CUDA #AI #SustainableComputing",0.521,POSITIVE,0.9908,0,"['#CUDA', '#AI', '#SustainableComputing']"
2024-08-23T15:31:12.000Z,"At #HotChips2024, @nvidia will showcase innovations across #datacenter computing and design that deliver unprecedented performance, #energyefficiency, and optimization. Read the latest blog to learn more and register now. https://nvda.ws/3AunnfZ",0.5189,POSITIVE,0.9561,0,"['#HotChips2024', '#datacenter', '#energyefficiency']"
2024-08-08T15:00:01.000Z,"Why wait for the weekend? Thursdays are meant for snack breaks and side quests! This #GFNThursday celebrates 2,000 games in the cloud and brings @SquareEnix's Visions of Mana demo, a @TESOnline reward and more.Blog  https://nvda.ws/3SHIrWK",0.5027,POSITIVE,0.983,0,['#GFNThursday']
2024-07-31T17:28:03.000Z,  #NVIDIAResearch used real-time #generativeAI to create an immersive desert world showcasing NVIDIA Edify and the @NVIDIAOmniverse platform.  https://nvda.ws/3Wr4pOO  Presented at #SIGGRAPH2024 Real-Time Live.,0.5278,POSITIVE,0.998,0,"['#NVIDIAResearch', '#generativeAI', '#SIGGRAPH2024']"
2024-08-01T16:00:01.000Z,"NOW AVAILABLE: Experience stunning realism in your designs, AI-accelerated workflows, and expansive workspaces with the #NVIDIARTX A400 – all in a compact design.",0.5296,POSITIVE,0.9996,0,['#NVIDIARTX']
2024-08-12T17:00:01.000Z," Calling all researchers: #NVIDIAAcademicGrant Program is now accepting proposals on Generative AI & LLMs, and Simulation & Modeling. Submit by September 30  https://nvda.ws/4fHPQiO for a chance to advance your research with computing resources.  ",0.5207,POSITIVE,0.9588,0,['#NVIDIAAcademicGrant']
2024-08-12T16:54:35.000Z,NVIDIA intern David Martin’s mission is to improve tech accessibility for the deaf and hard-of-hearing community. Explore his journey championing AI for good. #NVIDIAlife,0.5381,POSITIVE,0.9943,0,['#NVIDIAlife']
2024-08-09T21:30:01.000Z,The State of California announced a first-of-its-kind #AI education initiative w/ NVIDIA. This partnership equips students and professionals with cutting-edge AI skills through certifications & resources. Ready to shape the future? Learn more  https://nvda.ws/3M1LRjk ,0.5386,POSITIVE,0.9891,0,['#AI']
2024-08-08T20:50:49.000Z,"We had an incredible week at #SIGGRAPH2024. See how SIGGRAPH is leading conversations on computer graphics, simulation and #AI as it expands beyond media and entertainment — into huge industries like robotics, autonomous vehicles and scientific discovery.",0.5267,POSITIVE,0.9988,0,"['#SIGGRAPH2024', '#AI']"
2024-07-31T19:35:40.000Z,"As part of its 10-Year Anniversary Summit last week, @Zoox hosted NVIDIA CEO and Founder Jensen Huang for a fireside chat with Zoox CEO @aicha2evans and Co-Founder and CTO Jesse Levinson. Congrats to Zoox on the big milestone! Read more:",0.5534,POSITIVE,0.9445,0,[]
2024-08-02T19:00:00.000Z,Learn how NVIDIA #NetworkingforAI solutions are designed with advanced innovations to ensure top AI performance. Explore the technologies driving the future of AI. Watch now:,0.5715,POSITIVE,0.9941,0,['#NetworkingforAI']
2024-07-26T17:31:25.000Z,NVIDIA offers a variety of programs and resources to equip the next generation of #AI professionals with the skills to excel in a career in AI. Gain insights on how to use NVIDIA's technologies and resources to accelerate your professional development.,0.5574,POSITIVE,0.9959,0,['#AI']
2024-08-02T17:30:01.000Z,"In this @WSJ article, discover how today's #generativeAI workloads are driving new demands on enterprise technology platforms. #DataCenter #NVIDIADGX",0.5564,POSITIVE,0.9524,0,"['#generativeAI', '#DataCenter', '#NVIDIADGX']"
2024-07-29T21:31:18.000Z,"Announcing the new NVIDIA Humanoid Robot Developer Program at #SIGGRAPH2024. Discover how generative AI enhances robotics using Isaac Lab, Isaac Sim, OSMO robot cloud compute orchestration services and more. https://nvda.ws/3WHt9DB",0.5459,POSITIVE,0.9872,0,['#SIGGRAPH2024']
2024-07-29T21:00:00.000Z,"With new #OpenUSD NIMs, more industries can now develop applications for visualizing industrial design and engineering projects, as well as simulate environments to build the next wave of physical #AI and robots.#SIGGRAPH2024 #GenerativeAI https://nvda.ws/4c6QC5L",0.5479,POSITIVE,0.9897,0,"['#OpenUSD', '#AI', '#SIGGRAPH2024', '#GenerativeAI']"
2024-07-29T23:40:08.000Z,"Jensen Huang discusses the future of #AI-amplified human productivity, the energy efficiency of accelerated #computing, and the intersection of graphics and AI with @WIRED’s Lauren Goode. Catch up on all the news from #SIGGRAPH2024.",0.5402,POSITIVE,0.7896,0,"['#AI', '#computing', '#SIGGRAPH2024']"
2024-07-29T21:46:16.000Z,"Live from #SIGGRAPH2024: Our CEO Jensen Huang and @Meta CEO Mark Zuckerberg chat on #AI and the next computing platforms. Watch the livestream to discover #generativeAI and virtual world breakthroughs, and how research is driving AI advancements.",0.5412,POSITIVE,0.9805,0,"['#SIGGRAPH2024', '#AI', '#generativeAI']"
2024-07-29T21:02:35.000Z,"Watch now: Our CEO Jensen Huang chats with @WIREDSenior Writer Lauren Goode to explore accelerated computing, #generativeAI, and the research that’s fueling the next wave of innovation. #SIGGRAPH2024",0.5148,POSITIVE,0.9959,0,"['#generativeAI', '#SIGGRAPH2024']"
2024-07-29T16:59:41.000Z,"Our tech is boosting #energyefficiency across industries, cutting down #datacenter energy use. Innovations like liquid-cooled AI superclusters are setting new standards in eco-friendly tech. Learn more from @SeekingAlpha: https://nvda.ws/3WrvHEv",0.5378,POSITIVE,0.8438,0,"['#energyefficiency', '#datacenter']"
2024-07-26T16:40:22.000Z,"Land an internship at NVIDIA: Linh Nguyen, who leads our campus recruiting teams, shares inside tips about how to stand out from the crowd. #NVIDIAlife",0.5137,POSITIVE,0.9952,0,['#NVIDIAlife']
2024-07-25T20:15:19.000Z,"We are honored to share that our CEO, Jensen Huang, has been named a top 35 #HPC legend by @HPCWire for his visionary leadership and groundbreaking advancements in accelerated computing. https://nvda.ws/4fgsbFP",0.5218,POSITIVE,0.9874,0,['#HPC']
2024-07-25T17:30:01.000Z,"In this @WSJ article, discover how @nvidia technologies are leading the charge to make #AI more energy efficient. Read more about the future of sustainable computing now. #DataCenter #AcceleratedComputing",0.5441,POSITIVE,0.7312,0,"['#AI', '#DataCenter', '#AcceleratedComputing']"
2024-07-25T17:14:19.000Z,"Join us at #SIGGRAPH2024 for two keynote presentations from our CEO and Founder Jensen Huang on Monday, July 29 at 2:30pm MT.Don't miss #OpenUSD day, #GenerativeAI day, research panels, our Startup Innovation Zone, training labs, and more: https://nvda.ws/3RLddgP  @Meta @WIRED",0.5158,POSITIVE,0.951,0,"['#SIGGRAPH2024', '#OpenUSD', '#GenerativeAI']"
2024-07-24T16:48:59.000Z,Accelerated computing and #AI are delivering #energyefficiency while reducing costs for many industries. Explore how NVIDIA technologies are tackling power demands from data centers and why accelerated computing is sustainable computing on our blog: https://nvda.ws/3Wwjujc,0.5233,POSITIVE,0.9898,0,"['#AI', '#energyefficiency']"
2024-07-15T17:28:05.000Z,We’re excited to announce that our CEO Jensen Huang will be joined by @Meta CEO Mark Zuckerberg to discuss how research enables AI breakthroughs at #SIGGRAPH2024. Attend the discussion to learn about the intersection of #generativeAI and virtual worlds. https://nvda.ws/3W3nOoI,0.5207,POSITIVE,0.9046,0,"['#SIGGRAPH2024', '#generativeAI']"
2024-07-12T13:07:36.000Z," #SIGGRAPH2024 preview  https://nvda.ws/3Llwlyh #NVIDIAResearch will showcase advancements in #generativeAI and #simulation, showing how simulation research enhances AI models and how #AI models are advancing simulation technology.",0.5368,POSITIVE,0.9825,0,"['#SIGGRAPH2024', '#NVIDIAResearch', '#generativeAI', '#simulation', '#AI']"
