date,text,PTR Sentiment,Flair Sentiment,Flair Score,Repost,Hastags
2024-02-13T00:21:40.000Z,Get insights from our CEO Jensen Huang and the UAE Minister of State for Artificial Intelligence on the latest breakthroughs in #AI. #WGS24,0.5407,POSITIVE,0.9964,0,"['#AI', '#WGS24']"
2024-02-09T22:37:13.000Z,"The #GTC24 session catalog is open: Browse 600+ sessions to see what's in store—from the latest in #generativeAI, accelerated computing, and beyond.Plus, get an additional 20% off your conference pass when you register with code GTCSAVE20. https://nvda.ws/41NrmxZ",0.5078,POSITIVE,0.8749,0,"['#GTC24', '#generativeAI']"
2024-01-25T16:45:00.000Z,"Powered by NVIDIA Picasso, #GenerativeAI by @GettyImages is a commercially safe service for creative endeavors that shares revenue with contributors.Learn more about us: https://nvda.ws/41Msba3 #NVIDIAstory",0.5288,POSITIVE,0.7741,0,"['#GenerativeAI', '#NVIDIAstory']"
2024-01-25T18:00:53.000Z,.@GettyCreativity,0.5,NEGATIVE,0.9224,0,[]
2024-01-24T17:10:40.000Z, RTX Video HDR is now available! GeForce RTX GPU users can upscale SD video to HDR leveraging the power of AI. Learn more #AIonRTX  https://nvda.ws/3UcDgzp,0.516,POSITIVE,0.9936,0,['#AIonRTX']
2024-01-24T16:43:55.000Z,"Partnering with @NSF and the NAIRR pilot, we’re bringing together academia, industry, non-profit and government sectors to harness the power of #AI. With NVIDIA AI software and supercomputing, we help lead the way to build a generation of innovation.",0.5506,POSITIVE,0.9994,0,['#AI']
2024-01-16T21:41:30.000Z,"From shopping advisors for personalized product recommendations to marketing content creation to code generation, learn how #generativeAI is redefining the retail industry. #DataCenter",0.5194,POSITIVE,0.9573,0,"['#generativeAI', '#DataCenter']"
2024-01-08T19:41:46.000Z,"The #GTC24 session catalog is now open  Browse 600+ sessions to see what's in store—from the latest in #generativeAI, accelerated computing, and beyond. Plus, get an additional 20% off your conference pass when you register with code GTCSAVE20. https://nvda.ws/41NrmxZ",0.5078,POSITIVE,0.9701,0,"['#GTC24', '#generativeAI']"
2024-01-19T18:14:22.000Z,"New video: NVIDIA DRIVE partners discuss the latest #AI innovations for automated and autonomous driving, the importance of in-vehicle compute, and the role of simulation in developing safe #autonomousvehicles. #CES2024 Watch the video: https://nvda.ws/3Hn911c",0.5361,POSITIVE,0.9995,0,"['#AI', '#autonomousvehicles', '#CES2024']"
2024-01-18T16:51:06.000Z,"Thank you @twominutepapers for sharing how #NVIDIAResearch is changing the landscape of gaming, video conferencing, and #robotics.What a time to be alive!",0.5117,POSITIVE,0.9852,0,"['#NVIDIAResearch', '#robotics']"
2024-01-08T18:16:13.000Z,"At #CES2024, NVIDIA #automotive partners Mercedes-Benz, Polestar, Kodiak, Pebble and more to showcase #AI-infused vehicles.",0.5338,POSITIVE,0.9986,0,"['#CES2024', '#automotive', '#AI']"
2024-01-08T17:58:07.000Z,"Unleash the power of #generativeAI and robotics. At #CES2024, our ecosystem partners are bringing together cutting-edge technologies to transform industries and create smarter robots with NVIDIA Isaac platform. Learn more: https://nvda.ws/3NTrxC2@nvidiaomniverse #NVIDIARobotics",0.5143,POSITIVE,0.9981,0,"['#generativeAI', '#CES2024', '#NVIDIARobotics']"
2024-01-12T21:57:25.000Z,"“This year, every industry will become a technology industry,” NVIDIA founder and CEO Jensen Huang said in a fireside chat with @RecursionPharma, as he discussed the groundbreaking innovations that are reshaping the #healthcare landscape during #JPM2024.",0.5877,POSITIVE,0.9969,0,"['#healthcare', '#JPM2024']"
2024-01-11T16:00:02.000Z,Here comes the #CES2024 Announcement 𝑩𝒍𝒊𝒛𝒛𝒂𝒓𝒅. New year new... Games Membership Options  Cloud Gaming Tech Read the full #GFNThursday blog https://nvda.ws/4aMXWEd,0.5748,NEGATIVE,0.768,0,"['#CES2024', '#GFNThursday']"
2024-01-08T16:55:00.000Z,"The global automotive-configurator ecosystem is using @NVIDIAOmniverse and #OpenUSD to craft state-of-the-art 3D experiences, showcasing life-like graphics and high-end, immersive experiences with advanced lighting and textures.#CES2024",0.5179,POSITIVE,0.9997,0,"['#OpenUSD', '#CES2024']"
2024-01-08T15:45:00.000Z,"We're live from Vegas: Join us for the NVIDIA special address at #CES2024. Discover our latest generative AI, creating, gaming, and robotics innovations.",0.5368,POSITIVE,0.9982,0,['#CES2024']
2024-01-05T17:00:02.000Z,"Don't miss our livestreamed special address at #CES2024 on Monday, Jan. 8 at 8 a.m. PT. Tune in to discover the latest NVIDIA innovations for generative AI, creating, gaming, and robotics. https://nvda.ws/46n6gqO",0.5409,POSITIVE,0.9733,0,['#CES2024']
2024-01-04T16:00:09.000Z,"January 8, 2024.8AM PT.: http://twitch.tv/nvidia",0.5329,NEGATIVE,0.9962,0,[]
2024-01-04T17:19:30.000Z,"Thanks to our employees, customers and partners for a spectacular year.",0.6233,POSITIVE,0.9985,0,[]
2024-01-02T16:00:27.000Z,"This week #InTheNVIDIAStudio we're diving into the futuristic 3D art of @Blendeered. Using his GeForce RTX 4090 GPU, #NVIDIACanvas, & Blender, Blendeered is able to take a step into the future with his newest render  https://nvda.ws/47kSh5n",0.5132,POSITIVE,0.991,0,"['#InTheNVIDIAStudio', '#NVIDIACanvas']"
2023-12-20T18:23:30.000Z,"It's a wrap! This year, many of our #NVIDIAInception members and developer community have created incredible robots that could greatly impact the world and contribute to the future of #robotics. Take a look at some of the cool robots from 2023. https://blogs.nvidia.com/blog/robot-roundup-jetson/?ncid=so-twit-112172…",0.5363,POSITIVE,0.9974,0,"['#NVIDIAInception', '#robotics']"
2023-12-04T18:12:00.000Z,Winter has returned and so has our #WinterArtChallenge! Share your winter-themed art (like this incredible one created on an RTX GPU by @rafianimates) using the hashtag for a chance to be featured on our social channels! We can't wait to see what you create! ,0.5165,POSITIVE,0.9984,0,['#WinterArtChallenge']
2023-12-20T23:42:43.000Z,"For sweater or worse, we're a tight-knit team. #NVIDIANs showing off this year's NVIDIA holiday sweater. #NVIDIAlife",0.5631,POSITIVE,0.9997,0,"['#NVIDIANs', '#NVIDIAlife']"
2023-12-08T23:00:29.000Z,#GenerativeAI started the year as a blip on the radar but ended with a splash. Hear from our experts on what to expect in the year ahead.,0.6137,POSITIVE,0.9993,0,['#GenerativeAI']
2023-12-06T20:00:00.000Z,"What makes GPUs game-changers for AI? Discover how NVIDIA revolutionized #machinelearning with parallel processing, supercomputing and a broad software stack. https://nvda.ws/4ab12S0 #AI #genAI",0.5426,POSITIVE,0.9995,0,"['#machinelearning', '#AI', '#genAI']"
2023-12-06T17:34:38.000Z,"Take your creativity further with AI and faster with #AIonRTX. With new AI tools, enhancements, and more, you'll be able to go from imagination to reality quicker than ever before. Learn more: https://nvda.ws/3TgAVmH",0.55,POSITIVE,0.9905,0,['#AIonRTX']
2023-12-05T19:47:14.000Z,Teenage dream: Aspiring computer science major Luca Lofranco experiences #NVIDIAlife with a @MakeAWish visit. https://nvda.ws/480Cvxa,0.5038,POSITIVE,0.8697,0,['#NVIDIAlife']
2023-12-04T18:01:58.000Z,We’re honored to be among the top adoption-friendly workplaces on the @DTFA list. We offer employees unlimited financial aid to cover the cost of an adoption and up to 20 weeks of paid parental leave to those welcoming an adopted child into their home. https://nvda.ws/3uSONcw,0.5119,POSITIVE,0.977,0,[]
2023-12-01T17:00:00.000Z,“We’re at the beginning of a brand-new generation of computing.” See our CEO and founder Jensen Huang speak on the future of #AI with @NYTimes' @andrewrsorkin at the annual #DealBookSummit.,0.5534,POSITIVE,0.9946,0,"['#AI', '#DealBookSummit']"
2023-11-30T21:07:07.000Z,Crucible Moments by @Sequoia takes a deep dive into our company's groundbreaking evolution. Tune in to learn about our pivotal role in the tech revolution and the future of #AI. #CrucibleMoments,0.565,POSITIVE,0.9992,0,"['#AI', '#CrucibleMoments']"
2023-11-29T02:30:54.000Z,"Great to have Jensen Huang from @nvidia on stage today, as we announced our expanded collaboration to deliver GPU-based solutions. @awscloud will be the first provider to bring NVIDIA GH200 Grace Hopper Superchips with new multi-node NVLink technology to the cloud. Plus, our",0.5652,POSITIVE,0.9981,0,[]
2023-11-28T22:46:02.000Z,"At #AWSreInvent, @AWSCloud CEO Adam Selipsky and our CEO Jensen Huang spotlight the pivotal role of #generativeAI in cloud transformation, highlighting their companies’ growing partnership.",0.5211,POSITIVE,0.9992,0,"['#AWSreInvent', '#generativeAI']"
2023-11-28T18:30:00.000Z,"Just announced  NVIDIA NeMo Retriever, a #generativeAI microservice that lets enterprises connect custom large language models to enterprise data to deliver highly accurate responses for #AI applications. #AWSreInvent",0.5339,POSITIVE,0.9374,0,"['#generativeAI', '#AI', '#AWSreInvent']"
2023-11-28T17:35:34.000Z,We are honored NVIDIA Picasso has been named one of @FastCompany’s  Next Big Things in Tech in #AI and data.  #FCTechAwardsLearn more: https://nvda.ws/47v261m,0.55,POSITIVE,0.9969,0,"['#AI', '#FCTechAwardsLearn']"
2023-11-17T10:05:26.000Z,Discover how NVIDIA and @Scaleway are collaborating to turbocharge large language model and #generativeAI development for European startups.,0.5258,POSITIVE,0.9931,0,['#generativeAI']
2023-11-15T21:00:01.000Z,"Discover the power of retrieval-augmented generation (RAG), a technique for enhancing the accuracy and reliability of #generativeAI models. Check out the blog.",0.5054,POSITIVE,0.995,0,['#generativeAI']
2023-11-15T22:00:11.000Z,Learn more on how NVIDIA Grace Hopper will power JUPITER and propel #AI for #scientific discovery.  #SC23 @fzj_jsc @Evidenlive  https://nvda.ws/3ufCas3,0.5261,POSITIVE,0.9834,0,"['#AI', '#scientific', '#SC23']"
2023-11-15T17:06:18.000Z,"At #MSIgnite, NVIDIA announced @NVIDIAOmniverse Cloud Services on @Azure to enable automakers worldwide to unify digitalization across their business and provide a fast track to design, build and operate cars.",0.5531,POSITIVE,0.9729,0,['#MSIgnite']
2023-11-15T18:00:01.000Z,Big news from #MSIgnite TensorRT-LLM for @Windows will soon be compatible with @OpenAI's Chat API. This means devs can run AI models locally on PC w/RTX - including the release of new DirectML enhancements to Llama 2.  #AIonRTX Read more  https://nvda.ws/3FXcQJU,0.5317,POSITIVE,0.8579,0,"['#MSIgnite', '#AIonRTX']"
2023-11-15T19:00:00.000Z,".@Amdocs to build custom #LLMs to allow communications service providers to efficiently deploy #generativeAI use cases across their businesses, from customer experiences to network operations and provisioning, using NVIDIA AI foundry service on @Azure. https://nvda.ws/3MOqSBh",0.5452,POSITIVE,0.995,0,"['#LLMs', '#generativeAI']"
2023-11-13T15:14:05.000Z,"The @BASF #quantumcomputing team are demonstrating how a quantum algorithm can see what no traditional simulation can, by running their first 60 qubit simulations on NVIDIA’s Eos H100 Supercomputer. #SC23",0.5044,POSITIVE,0.9994,0,"['#quantumcomputing', '#SC23']"
2023-11-15T12:08:25.000Z,"This Friday, don't miss NVIDIA founder and CEO Jensen Huang speak live with @GroupeIliad Deputy CEO, Aude Durand at @Scaleway's #ai-PULSE conference in Paris.Watch on November 17, 10:30 a.m. CET > https://nvda.ws/3MNZVh5",0.5457,POSITIVE,0.6098,0,['#ai']
2023-11-15T16:24:47.000Z,"See how organizations like @SAP, @Amdocs, and @GettyImages are using the just-announced NVIDIA generative AI foundry service to build custom #LLMs. https://nvda.ws/3QW961A #MSIgnite",0.5379,NEGATIVE,0.9365,0,"['#LLMs', '#MSIgnite']"
2023-11-13T14:57:54.000Z,NVIDIA GH200-powered centers represent 200 exaflops of #AI performance that are driving scientific innovation and enabling scientists and researchers to tackle some of the world’s most challenging problems. #SC23,0.5261,POSITIVE,0.9999,0,"['#AI', '#SC23']"
2023-10-31T20:29:27.000Z,Scientists from WARPLab and MIT are developing an autonomous underwater vehicle powered by an #NVIDIAJetson Orin NX to study the human impact on coral reefs. Stay tuned for updates as they explore using #NVIDIAIsaacSim powered by Omniverse. https://nvda.ws/47dAY6t #NVIDIARobotics,0.5055,POSITIVE,0.9191,0,"['#NVIDIAJetson', '#NVIDIAIsaacSim', '#NVIDIARobotics']"
2023-11-03T17:28:31.000Z,"The @UF opened a new #AI and #datascience hub, the Malachowsky Hall for Data Science & Information Technology. It's home to the HiPerGator AI supercomputer and is designed to bring together people from academia and industry, research and government.",0.5592,POSITIVE,0.9826,0,"['#AI', '#datascience']"
2023-11-01T18:00:00.000Z,"Experience performance boosts 2x or more using Stable Diffusion with #AIonRTX. Learn how NVIDIA GPUs and TensorRT speed up AI workflows, with insights from @PugetSystems:",0.5332,POSITIVE,0.9937,0,['#AIonRTX']
2023-11-01T17:46:37.000Z,".@BristolUni and @HPE have invested in creating Isambard-AI, the UK’s most powerful #supercomputer, using thousands of NVIDIA GH200 Grace Hopper Superchips to deliver 21 exaflops of #AI performance. Learn more now.",0.5417,POSITIVE,0.9992,0,"['#supercomputer', '#AI']"
2023-11-01T16:42:13.000Z,"Recursion is working with us to streamline drug discovery. Combining @RecursionPharma’s computational expertise with our tech, the collaboration hopes to make better predictions and increase a drug’s probability of success with patients. https://nvda.ws/48HLCnz #NVIDIAstory",0.5308,POSITIVE,0.9976,0,['#NVIDIAstory']
2023-10-31T15:00:29.000Z,"This week #InTheNVIDIAStudio we've got some treats for you. DLSS 3.5 w/ Ray Reconstruction has been added to @NVIDIAOmniverse, the November Studio Driver drops tomorrow and NVIDIA Creative Director Sabour Amirazodi shares his spooky house.  https://nvda.ws/4987pVI",0.5157,POSITIVE,0.7747,0,['#InTheNVIDIAStudio']
2023-10-30T23:34:38.000Z,".@RAPIDSai, the open-source software to accelerate data science, has just been recognized as a Top #OpenSource Software by @InfoWorld. Read about it here: https://nvda.ws/479CHK4 #RAPIDSAI",0.5253,POSITIVE,0.984,0,"['#OpenSource', '#RAPIDSAI']"
2023-10-30T17:59:44.000Z,NVIDIAN Christof Henkel clinched the top spot in an American Sign Language recognition challenge on @Kaggle with an #AI model that detects fingerspelled characters and translates them into text. #NVIDIAlife https://blogs.nvidia.com/blog/2023/10/23/nvidia-life-kaggle-ai-contest-sign-language-recognition/?ncid=so-twit-477997…,0.5303,POSITIVE,0.9888,0,"['#AI', '#NVIDIAlife']"
2023-10-27T17:39:15.000Z,"Thanks to the nonprofit @HelpMeSee, #GPU-powered surgical-simulation devices are helping to train doctors in lower-income countries to treat cataract blindness, the world’s leading cause of blindness. https://blogs.nvidia.com/blog/2023/10/20/helpmesee-nonprofit-training-simulator-for-cataract-surgery/…",0.5136,POSITIVE,0.9839,0,['#GPU']
2023-10-26T18:01:13.000Z,Watch the #HPTheMoment episode featuring our CEO Jensen Huang as he shares his career journey and perspective on the rapid growth of NVIDIA.,0.5386,POSITIVE,0.9919,0,['#HPTheMoment']
2023-10-23T16:00:11.000Z,"Experience the conference for the era of AI. Connect with visionaries, experts, and peers in San Jose, CA and virtually to explore the technologies that are transforming every industry. Register for GTC now. #GTC24 https://nvda.ws/3tC84yl",0.5185,POSITIVE,0.9896,0,['#GTC24']
2023-10-16T17:13:47.000Z,Hosts of @AcquiredFM wrapped up their series on NVIDIA by sitting down with our CEO Jensen Huang for a special interview covering our company’s journey that only he could share. This is one not to miss. #NVIDIAstory,0.5316,POSITIVE,0.9986,0,['#NVIDIAstory']
2023-10-10T16:00:19.000Z,"This week #InTheNVIDIA we're 𝙢𝙖𝙭𝙞𝙢𝙞𝙯𝙞𝙣𝙜 creativity at #AdobeMAX! Discover how RTX GPUs accelerate new AI-powered features in @creativecloud apps, @Substance3D, and Adobe Firefly. Plus check out @SouthernShotty's AI-accelerated 3D art  https://nvda.ws/3FaAceE",0.5375,POSITIVE,0.9857,0,"['#InTheNVIDIA', '#AdobeMAX']"
2023-10-06T16:45:38.000Z,Learn how @nvidia partners with leading cloud service providers to give enterprises the #AI platform they need to build #generativeAI using #NVIDIADGX Cloud with NVIDIA AI Enterprise. @Forbes Read more here: https://nvda.ws/3LRobOP,0.5517,POSITIVE,0.8953,0,"['#AI', '#generativeAI', '#NVIDIADGX']"
2023-09-28T20:32:15.000Z,"Invenio Imaging is developing technology that enables surgeons to evaluate tissue biopsies in the operating room, providing three minutes AI-accelerated insights that would otherwise take weeks to obtain from a #pathology lab. https://nvda.ws/3PxKQAV #AI",0.5386,POSITIVE,0.9972,0,"['#pathology', '#AI']"
2023-09-25T15:00:01.000Z,"NVIDIA and @Infosys are expanding their strategic collaboration to help enterprises drive productivity gains with #generativeAI applications and solutions. They are co-developing AI-powered solutions in areas like 5G, cybersecurity, and energy transition. https://nvda.ws/48sjQv5",0.5416,POSITIVE,0.9919,0,['#generativeAI']
2023-09-18T20:37:59.000Z,Experience cutting-edge graphics and #AI performance with the most powerful single-slot GPU for professionals. The latest #NVIDIARTX 4000 GPU is now available for purchase through our partners.,0.5335,POSITIVE,0.9998,0,"['#AI', '#NVIDIARTX']"
2023-09-19T19:03:52.000Z,"Check out HALP (Hardware-Aware Latency Pruning), our method designed to adapt convolutional neural networks (#CNNs) and #transformer-based architectures for real-time performance to maximize NVIDIA compute utilization.",0.525,POSITIVE,0.9977,0,"['#CNNs', '#transformer']"
2023-09-20T16:56:32.000Z,"To help meet the needs of modern #generativeAI applications, @OracleCloud Infrastructure announced the general availability of NVIDIA H100 Tensor Core GPUs on OCI Compute, with NVIDIA L40S GPUs coming soon. Learn more now. #OCW23 #DataCenter https://nvda.ws/3PLXDku",0.5212,POSITIVE,0.9858,0,"['#generativeAI', '#OCW23', '#DataCenter']"
2023-10-02T16:31:05.000Z,"Our Chief Scientist, Bill Dally, describes a tectonic shift in how computer performance gets delivered in a post-Moore’s law era. https://nvda.ws/3tbwHSh",0.5068,POSITIVE,0.9346,0,[]
2023-09-29T17:05:19.000Z,Congratulations Bryan Catanzaro on being named one of Fast Company’s AI-20 for your role in shaping the world of #generativeAI. We greatly appreciate your work here at NVIDIA and for the industry. Learn more: https://nvda.ws/3t4oeQP,0.533,POSITIVE,0.9436,0,['#generativeAI']
2023-09-28T16:22:42.000Z,"Discover the #AIonRTX advantage. From enhanced creativity and ultra-efficient productivity to blisteringly fast gaming, the ultimate in AI power on Windows PCs is on NVIDIA RTX and GeForce RTX: https://nvda.ws/3LEPCLL",0.5238,POSITIVE,0.9984,0,['#AIonRTX']
2023-09-18T19:00:01.000Z,Two more days before Speech AI Day! Take advantage of this chance to stay up-to-date on the latest trends and techniques in speech AI! Register today> https://nvda.ws/3Zkyl07,0.5424,POSITIVE,0.9609,0,[]
2023-09-16T16:00:02.000Z,Learn how to advance your #AI capabilities with the NVIDIA AI platform on #OCI. See what NVIDIA is doing at #OCW23 on September 19-21. Read here > https://nvda.ws/48bcxI9,0.5612,POSITIVE,0.9873,0,"['#AI', '#OCI', '#OCW23']"
2023-09-15T15:45:00.000Z,"Hear the conversation with our senior director of AI research, Anima Anandkumar, on generative #AI providing opportunities to get ahead of the curve on challenges like drug development and extreme weather in the latest episode of the AI Podcast.",0.5448,POSITIVE,0.9966,0,['#AI']
2023-09-13T21:00:01.000Z,"Stop by our AI Pavilion at #OCW23 to check out our demos featuring hardware show & tell, #NVIDIADGX Cloud on OCI, Llama 2 in NVIDIA AI Playground, Stable Diffusion ControlNet & partner demos from Convai, @Gemelo_AI, @heavy_ai, and Inworld from Sept 18-21. https://nvda.ws/44OD8rI",0.5405,POSITIVE,0.7652,0,"['#OCW23', '#NVIDIADGX']"
2023-09-07T19:33:58.000Z,"Whether transcribing clinical notes in #healthcare facilities, or enabling food kiosk #avatars in restaurants, #speechAI is the perfect tool to help businesses meet customer expectations. https://nvda.ws/3sLyaPa #MedicalImaging #NLP",0.5102,POSITIVE,0.999,0,"['#healthcare', '#avatars', '#speechAI', '#MedicalImaging', '#NLP']"
2023-09-12T23:43:48.000Z,"NVIDIA is committed to safe and trustworthy AI, which is why we joined leaders from the @WhiteHouse, Congress, and tech industry today in Washington D.C. to discuss #AI standards and best practices. https://nvda.ws/3PAOgUz",0.5492,POSITIVE,0.8834,0,['#AI']
2023-09-11T16:00:01.000Z,"In its debut on the #MLPerf industry benchmarks, results of NVIDIA GH200 Grace Hopper Superchip, H100 and L4 Tensor Core GPUs, and Jetson AGX Orin system-on-a-chip showed leadership performance running AI in production from the cloud to the network’s edge. https://nvda.ws/45Ku3kS",0.5256,POSITIVE,0.9999,0,['#MLPerf']
2023-09-08T18:37:01.000Z,Just announced - NVIDIA TensorRT-LLM supercharges large language model #inference on NVIDIA H100 Tensor Core GPUs. #LLM,0.5337,POSITIVE,0.9997,0,"['#inference', '#LLM']"
2023-09-08T16:05:44.000Z,.@AcquiredFM just released their latest installment of the #NVIDIAstory. Tune in to discover our company's journey to powering generative AI technologies and our role in ushering in the #AI era.,0.5779,POSITIVE,0.9825,0,"['#NVIDIAstory', '#AI']"
2023-09-07T17:29:13.000Z,"We’re delighted to share that our CEO, Jensen Huang, has once again been recognized as one of the world’s most influential people by @TIME. Learn how his extraordinary vision has helped enable the #AI revolution. #TIME100AI",0.5403,POSITIVE,0.9865,0,"['#AI', '#TIME100AI']"
2023-09-05T20:43:52.000Z,"Learn how #NVIDIAInception member Viaduct uses NVIDIA A100 Tensor Core GPUs and the NVIDIA TSPP framework for training, tuning, and deploying time-series models to detect vehicle failure patterns, track issues, and deploy predictions. #AI #DataCenter",0.529,POSITIVE,0.9934,0,"['#NVIDIAInception', '#AI', '#DataCenter']"
2023-09-05T15:52:18.000Z,"Our CEO met with Indian Prime Minister @narendramodi, underscoring the growing partnership between our company and the global technology superpower. At this meeting, applications of AI and leveraging the nation’s talented youth were discussed. https://blogs.nvidia.com/blog/2023/09/04/modi-huang-india/?ncid=so-twit-338861…",0.5602,POSITIVE,0.9357,0,[]
2023-08-28T19:00:00.000Z,"NVIDIA announced the latest version of its enterprise software platform, NVIDIA AI Enterprise 4.0. The update gives businesses the tools needed to adopt gen #AI, offering the security and API stability required for reliable production deployments.",0.5537,POSITIVE,0.9969,0,['#AI']
2023-09-04T16:44:50.000Z,"Our CEO met with Indian Prime Minister Narendra Modi, underscoring the growing partnership between our company and the global technology superpower. At this second meeting between Modi and Huang, applications of AI and leveraging the nation’s talented youth were discussed.",0.5694,POSITIVE,0.9987,0,[]
2023-08-23T16:16:08.000Z,We announced that the world’s leading system manufacturers will deliver NVIDIA AI-ready servers to help companies customize and deploy #GenerativeAI applications using their proprietary business data. https://nvda.ws/45kUtcU #VMwareExplore @VMware @NVIDIAAI,0.5504,POSITIVE,0.9737,0,"['#GenerativeAI', '#VMwareExplore']"
2023-08-22T17:00:01.000Z,"Today at @VMwareExplore NVIDIA and @VMware announced VMware Private AI Foundation with NVIDIA, a turnkey solution enabling enterprises to customize LLMs and run inference workloads in their own data centers, readying them for the era of #GenAI. https://nvda.ws/3QNC83A",0.5375,POSITIVE,0.974,0,['#GenAI']
2023-08-22T01:10:03.000Z,"Don't miss NVIDIA founder and CEO Jensen Huang speak with @VMware CEO Raghu Raghuram live at the #VMwareExplore General Session Keynote on August 22, 9am PDT in Las Vegas. Save the date. https://nvda.ws/3sa1nmE",0.5169,NEGATIVE,0.9989,0,['#VMwareExplore']
2023-08-18T17:29:56.000Z,.@nvidia and @googlecloud are making it easier for enterprises to accelerate time to solution with #generativeAI. Join us at #GoogleCloudNext 2023 on August 29-31 and come by Booth #1407 to learn about the NVIDIA #AI platform on Google Cloud. Register now: https://nvda.ws/3YHRPvb,0.5404,POSITIVE,0.8188,0,"['#generativeAI', '#GoogleCloudNext', '#1407', '#AI']"
2023-08-18T16:51:25.000Z,"Our interns around the globe are wrapping up their summer internships, taking on real-world assignments to develop their careers, while having some fun along the way. #NVIDIAlife",0.5178,POSITIVE,0.9929,0,['#NVIDIAlife']
2023-08-16T18:00:13.000Z,"Whether animating a single #3D character or generating a group of them for industrial digitalization, creators & developers can boost their workflows with the latest #OpenUSD and livesync update to the @reallusion  iClone Omniverse Connector.Read more: https://nvda.ws/45tI0mF",0.5152,POSITIVE,0.9386,0,"['#3D', '#OpenUSD']"
2023-08-15T21:00:00.000Z,"Watch this video to learn about NVIDIA AI Foundations - a set of #AIfoundries that enable training, customization, and deployment of #genAI models: NeMo is for custom #LLMs, BioNeMo is for drug discovery, and Picasso is for image, video, & 3D applications.",0.5256,POSITIVE,0.9996,0,"['#AIfoundries', '#genAI', '#LLMs']"
2023-07-31T19:58:16.000Z,"AI is transforming the way we access clean energy. Learn how #AI and #NVIDIAJetson are helping to optimize solar and wind farms, simulate climate and weather, and advance carbon capture and power fusion breakthroughs. https://nvda.ws/47ellg8",0.5259,POSITIVE,0.9972,0,"['#AI', '#NVIDIAJetson']"
