date,text,PTR Sentiment,Flair Sentiment,Flair Score,Repost,Hastags
2023-03-17T16:00:03.000Z,"GTC starts next week. From computer vision and conversational #AI to autonomous machines and healthcare, learn from the best in the industry. Watch our CEO Jensen Huang's keynote to discover the latest trends shaping the future of AI. https://nvda.ws/3IAmLaT #GTC23",0.5417,POSITIVE,0.9922,0,"['#AI', '#GTC23']"
2023-03-16T22:33:47.000Z,"Generative AI can unlock enormous potential for companies, teams, and individuals, with creative tools like ChatGPT and more. Discover how #AI is paving the way for the future at #GTC23: https://nvda.ws/40wm5Jp",0.5361,POSITIVE,0.9977,0,"['#AI', '#GTC23']"
2023-03-16T20:08:08.000Z,"The latest version of our #AI-powered Deep Learning Super Sampling (DLSS) technology is now supported in an assortment of blockbuster games and franchises, and being integrated into @UnrealEngine. https://nvda.ws/3FuROCw #GDC2023",0.5261,POSITIVE,0.9933,0,"['#AI', '#GDC2023']"
2023-03-16T17:27:26.000Z,Dozens of sessions at @NVIDIAGTC feature NVIDIA and industry luminaries focused on #AI business strategy for leaders. https://nvda.ws/3TjfCyY #GTC23,0.5547,POSITIVE,0.9742,0,"['#AI', '#GTC23']"
2023-03-15T23:14:21.000Z,"At @NVIDIAGTC, AI powered by our technology can help tackle such challenges in #climatescience and increase the accuracy of weather prediction. #GTC23",0.5719,POSITIVE,0.9969,0,"['#climatescience', '#GTC23']"
2023-03-15T19:42:56.000Z,An accurate representation of our emotions while watching a preview of the #GTC23 keynote. Register free so you don't miss the exciting news coming on March 21st at 8am PT.,0.505,POSITIVE,0.9429,0,['#GTC23']
2023-02-23T22:06:10.000Z,"To better understand the climate impacts on the environment, researchers from @NorthwesternU and @argonne are helping collect information using #NVIDIA Jetson-driven edge computing Waggle devices. Learn more: https://nvda.ws/41ewOcm",0.516,POSITIVE,0.8848,0,['#NVIDIA']
2023-03-01T19:00:01.000Z,"Learn how the next-generation workstations powered by @Intel and #NVIDIARTX are bringing unprecedented performance, features, and efficiency for creative and technical professionals.",0.5303,POSITIVE,0.9991,0,['#NVIDIARTX']
2023-03-02T01:50:50.000Z,"Clear your calendar for our CEO Jensen Huang’s @NVIDIAGTC keynote on March 21, 8am PT. He’ll share the latest #AI technologies affecting every industry–and our everyday lives. #GTC23 https://nvda.ws/3Z0OKFO",0.529,POSITIVE,0.9275,0,"['#AI', '#GTC23']"
2023-03-01T16:50:00.000Z,RTX Video Super Resolution is now available for @NVIDIAGeForce RTX 40 and 30 series #GPUs. Use the power of #AI & RTX Tensor Cores to improve the quality of video watched in a Chrome or Edge browser.,0.525,POSITIVE,0.9999,0,"['#GPUs', '#AI']"
2023-02-28T10:00:02.000Z,Our experts from @NVIDIA are excited to speak this week at the world’s largest and most influential event for the connectivity industry. #MWC23 https://nvda.ws/3Y4chFr,0.5328,POSITIVE,0.9984,0,['#MWC23']
2023-02-28T17:00:04.000Z,"Congrats to our Chief Scientist, Bill Dally, for being inducted into the Silicon Valley Engineering Council's Hall of Fame. https://nvda.ws/3IZ3BuX @SVECorg",0.5097,POSITIVE,0.9345,0,[]
2023-02-27T17:44:57.000Z,"NVIDIA unveils a new AI-on-5G solution that enables telcos to deliver immersive graphics, metaverse applications and computer vision from one GPU-accelerated system. https://nvda.ws/41vNNa9",0.5541,POSITIVE,0.9993,0,[]
2023-02-27T17:00:03.000Z,"Be there when it happens. Clear your calendar for NVIDIA CEO Jensen Huang’s keynote, where he’ll share the latest #AI technologies affecting every industry–and our everyday lives. #GTC23 https://nvda.ws/3Z0OKFO",0.54,POSITIVE,0.9409,0,"['#AI', '#GTC23']"
2023-02-23T16:00:03.000Z,Mercedes-Benz is shaping the future with its software-defined vehicles which are powered end-to-end by NVIDIA #AI and #Omniverse #automotive https://nvda.ws/3klf3rc,0.5403,POSITIVE,0.9915,0,"['#AI', '#Omniverse', '#automotive']"
2023-01-19T17:35:45.000Z,#NVIDIAInception member @SoftRoboticsInc harnesses the NVIDIA Isaac Sim robotics platform to develop models for every one of its #robotics gripping applications to improve safety and increase production when handling foods on fast-moving conveyor belts. https://nvda.ws/3ZOc4rd,0.5328,POSITIVE,0.9973,0,"['#NVIDIAInception', '#robotics']"
2023-02-16T19:41:43.000Z,#AI and the #metaverse are shaping the #automotive industry. Learn more at #GTC23,0.5493,POSITIVE,0.9994,0,"['#AI', '#metaverse', '#automotive', '#GTC23']"
2023-02-21T23:00:01.000Z,"GTC is making headlines! Join us March 20-23 for a news-packed keynote from founder and CEO Jensen Huang and sessions covering the latest advancements in #generativeAI, the #metaverse, robotics, cloud computing, and more. Register for free today. #GTC23 https://nvda.ws/3lUBxzO",0.5172,POSITIVE,0.9576,0,"['#generativeAI', '#metaverse', '#GTC23']"
2023-02-07T21:00:00.000Z,"#NVIDIADGX SuperPOD and NVIDIA Clara enable @VinBrainAI to deploy its healthcare AI model to more than 100 hospitals in Vietnam, Myanmar, New Zealand, and the U.S. The #AI models can detect abnormalities quicker and accelerate time to diagnosis. https://nvda.ws/3JSVNvB",0.5446,POSITIVE,0.9945,0,"['#NVIDIADGX', '#AI']"
2023-02-07T17:06:57.000Z,"#NVIDIAInception member @OrbitalSidekick creates technology to spot gas pipeline leaks with satellites to collect hyperspectral imagery from space, using the #NVIDIAJetson edge AI platform to process and analyze data in real time.",0.5363,POSITIVE,0.9988,0,"['#NVIDIAInception', '#NVIDIAJetson']"
2023-02-06T18:31:56.000Z,"See how universities around the world are tapping into NVIDIA GPU-accelerated #supercomputers to better equip educators, researchers and students with the tools they need to transform the future of higher education. https://nvda.ws/3XVtAsp",0.524,POSITIVE,0.9815,0,['#supercomputers']
2023-02-02T15:35:01.000Z,"Financial services firms depend on low-latency for complex algorithmic trading models. Learn how the NVIDIA A100 Tensor Core #GPU, running on @Supermicro_SMCI servers, delivers top throughput, latency, and efficiency in the STAC-ML inference benchmark. https://nvda.ws/3X1naGN",0.5271,POSITIVE,0.9081,0,['#GPU']
2023-01-26T21:33:39.000Z,"Large language models recognize, summarize, translate, predict and generate text and other content. Check out this explainer blog to learn how LLMs work and what they are used for: https://nvda.ws/3RdNhZJ",0.5062,POSITIVE,0.745,0,[]
2023-02-01T20:37:39.000Z,"Including a number of sophisticated technologies, NVIDIA DLSS 3 is available now in Cyberpunk 2077. #RTXOn",0.5289,POSITIVE,0.999,0,['#RTXOn']
2023-01-31T15:57:30.000Z,NVIDIA DLSS 3 is AVAILABLE NOW in Cyberpunk 2077 delivering maximum performance! #RTXOn  https://nvidia.com/en-us/geforce/news/cyberpunk-2077-dlss-3-update-out-now…,0.5329,POSITIVE,0.997,0,['#RTXOn']
2023-01-31T18:30:02.000Z,"“If we’re going to create a 3D internet, then you have to have the people who are participating in it creating content as well…#AI can help us.” Read more on what NVIDIA VP Rev Lebaredian said about @NVIDIAOmniverse & the #metaverse in @TIME: https://nvda.ws/3JvSmuQ",0.5534,POSITIVE,0.8203,0,"['#AI', '#metaverse']"
2023-01-31T16:48:33.000Z,"A VFX artist applies NVIDIA Broadcast in certain movie scenes and ""breaks the fourth wall"" for an unsettling effect.",0.5204,NEGATIVE,0.7219,0,[]
2023-01-11T21:00:00.000Z,Lights! Cameras! Atoms?! Learn more about how this pioneering researcher illuminates molecular forces with a world-class instrument using #AI and high performance computing at the edge. #QuantumComputing #HPC https://nvda.ws/3CAktoo,0.521,POSITIVE,0.9993,0,"['#AI', '#QuantumComputing', '#HPC']"
2023-01-18T18:43:39.000Z,"Check out the latest #DRIVEDispatch from the NVIDIA team, where we use ultrasonic sensors for height detection, radar for free-space detection, and more: https://nvda.ws/3IXx5tu",0.5175,POSITIVE,0.9413,0,['#DRIVEDispatch']
2023-01-12T16:45:00.000Z,"To boost AI research, we helped create MineDojo. It uses the almost infinite number of open-ended tasks and actions in Minecraft to train #AI agents. And for the gamers who love that world, @Minecraft with RTX lights it up like never before. https://nvda.ws/3xTkalW #NVIDIAstory",0.5226,POSITIVE,0.9972,0,"['#AI', '#NVIDIAstory']"
2023-01-11T19:05:17.000Z,"Thanks to our employees, NVIDIA is again one of the Best U.S. Workplaces, according to @Glassdoor. Learn more about us: https://nvda.ws/3CGh72V #GlassdoorBPTW #NVIDIAlife",0.5262,POSITIVE,0.9762,0,"['#GlassdoorBPTW', '#NVIDIAlife']"
2023-01-10T18:05:00.000Z,"Supercharge speed, efficiency and savings for enterprise #AI with 4th Gen Intel Xeon Scalable systems accelerated with NVIDIA Hopper. Learn more. https://nvda.ws/3VVncPP",0.5407,POSITIVE,0.9965,0,['#AI']
2023-01-10T17:00:01.000Z,"We’re honored to be recognized in the top 10 of the #JUST100, and as a leader in our industry in the latest Rankings of #AmericasMostJUST Companies by @JUSTCapital and @CNBC. https://nvda.ws/3ZlgMwq",0.5203,POSITIVE,0.983,0,"['#JUST100', '#AmericasMostJUST']"
2023-01-09T18:18:35.000Z,"Join Jensen Huang and Michael Dell for a fireside chat at the @DellServers PowerEdge .Next event as they discuss #AI breakthroughs that will help organizations realize smarter, faster outcomes. Register now: https://nvda.ws/3ZyWLmi",0.5192,NEGATIVE,0.5908,0,['#AI']
2023-01-06T17:25:10.000Z,"With big reveals and debuts from the NVIDIA DRIVE ecosystem—including @HonHai_Foxconn, @PolestarCars, @volvocars and more—#AI transportation reaches a tipping point at #CES2023",0.5353,POSITIVE,0.9981,0,"['#AI', '#CES2023']"
2023-01-03T18:07:58.000Z,"At #CES2023, we announced a major update to #NVIDIA Isaac Sim, a #robotics simulation tool now accessible from the cloud built on @nvidiaomniverse.  Learn more in our announcement blog. https://nvda.ws/3GzgbzY",0.5152,POSITIVE,0.5923,0,"['#CES2023', '#NVIDIA', '#robotics']"
2023-01-04T17:32:34.000Z,"This week at #CES2023, we're celebrating Isaac Sim ecosystem partners who're using NVIDIA Isaac Sim for their #robotics simulation needs.",0.525,POSITIVE,0.9971,0,"['#CES2023', '#robotics']"
2023-01-04T17:56:45.000Z,"The future of transportation will be safer, more efficient, and now...more entertaining, with @NVIDIAGFN streaming to the car: https://nvda.ws/3CjOpEY#CES2023",0.5096,POSITIVE,0.9367,0,['#CES2023']
2023-01-03T19:00:02.000Z,"Riding in a car has never been more entertaining... Announced today at #CES2023, GeForce NOW will be coming to @HMGNewsroom, @BYDCompany, & @PolestarCars cars! Learn more  https://nvda.ws/3IlFR4u",0.5114,POSITIVE,0.9986,0,['#CES2023']
2023-01-03T16:46:54.000Z,"Keep boredom at bay, with NVIDIA GeForce NOW streaming to the car. @HMGNewsroom, @BYDCompany and @PolestarCars will be the first to offer cloud gaming in their vehicles: https://nvda.ws/3WIPfDg #CES2023 @NVIDIAGFN",0.5162,POSITIVE,0.9892,0,['#CES2023']
2023-01-03T21:00:50.000Z,Introducing GeForce RTX 40 Series Laptops for Creators. Learn about the new #NVIDIAStudio laptops announced at #CES2023: https://nvda.ws/3Q9gcOe,0.5303,POSITIVE,0.9876,0,"['#NVIDIAStudio', '#CES2023']"
2022-12-27T16:00:24.000Z,Tune in January 3rd at 8AM PT for GeForce Beyond at CES 2023.Learn more  https://nvidia.com/en-us/geforce/special-event/…,0.5214,POSITIVE,0.7256,0,[]
2022-12-31T22:49:23.000Z,"The ""State of AI Report 2022"" covers how our company continues its leadership in the #AI hardware industry.",0.6445,POSITIVE,0.9764,0,['#AI']
2022-12-31T03:51:45.000Z,15 AI experts predict digital twins and generative AI are set to advance enterprise goals and consumer needs even as the world enters a third year of planning uncertainty. https://nvda.ws/3G9GhrA,0.5612,POSITIVE,0.9859,0,[]
2022-12-30T17:50:42.000Z,"Our AI Podcast has attracted more than 3.6M listens to date from folks who want to hear the latest in machine learning. Check out the top 5 episodes of 2022 on topics like game development, autonomous vehicles and more.",0.5212,POSITIVE,0.9966,0,[]
2022-12-29T20:06:39.000Z,"Don't miss our virtual Special Address at #CES2023 on Tuesday, Jan. 3, at 8 a.m. PT (UTC-8) for a first look at what’s coming in gaming, creative, automotive and robotics. https://nvda.ws/3i5PVnb",0.5264,POSITIVE,0.6177,0,['#CES2023']
2022-12-21T18:00:00.000Z,Human-machine collaboration. Cybersecurity. Digital Twins.Learn about the #edgeAI trends for 2023.,0.5106,POSITIVE,0.9964,0,['#edgeAI']
2022-12-27T17:49:27.000Z,"Our most popular videos of 2022 put spotlights on photorealistically animated data centers, digital twins for climate science, AI for healthcare and more.",0.5279,POSITIVE,0.9993,0,[]
2022-12-26T19:20:45.000Z,"Learn how startups in the retail industry - and particularly in quick-service restaurants - are using NVIDIA AI and robotics technology to make it easier to order food in drive-thrus, find beverages on store shelves and have meals delivered.",0.556,POSITIVE,0.9637,0,[]
2022-12-22T18:32:34.000Z,"In celebration of the holiday season, our CEO’s #AI avatar, Toy Jensen, sings in his musical debut. A performance created with @NVIDIAOmniverse Avatar Cloud Engine (ACE) technology. Learn more at https://nvda.ws/3FRqJss. Happy Holidays!",0.524,POSITIVE,0.9915,0,['#AI']
2022-12-20T19:19:09.000Z,"Discover the latest innovations made possible by accelerated computing and artificial intelligence. Join us for the virtual NVIDIA Special Address at CES, taking place Jan 3 at 8 a.m. PT. https://nvda.ws/3FHzCVG",0.5348,POSITIVE,0.9981,0,[]
2022-12-08T18:29:34.000Z,See how the #metaverse and cloud technologies will supercharge #autonomousvehicle development in 2023:,0.5143,POSITIVE,0.9436,0,"['#metaverse', '#autonomousvehicle']"
2022-11-14T19:12:45.000Z,"We're excited to share our #NVIDIAInception member @skycatch's use of Isaac Sim and Jetson. Learn more about their journey to make sites more safe, efficient, and sustainable.",0.5232,POSITIVE,0.9949,0,['#NVIDIAInception']
2022-12-01T16:33:15.000Z,".@MonarchTractor, an #NVIDIAInception member harnesses the power of the NVIDIA Jetson #edgeai #robotics platform to deliver smart tractors that support sustainable farming and safely navigate fields using only cameras in areas without GPS signals. https://nvda.ws/3OTO40T",0.5172,POSITIVE,0.9979,0,"['#NVIDIAInception', '#edgeai', '#robotics']"
2022-11-29T16:10:29.000Z,"This week #InTheNVIDIAStudio we're diving into the incredible artistic & life journey of @hsinchien. Huang is a 3D artist, virtual reality expert, storyteller and educator who leverages NVIDIA RTX GPUs & @AdskMaya + @unity + @Substance3D.Blog  https://nvda.ws/3gI7IjR",0.5129,POSITIVE,0.999,0,['#InTheNVIDIAStudio']
2022-10-13T20:27:07.000Z,"Vision AI software from NVIDIA #Metropolis member Searidge Technologies is helping the aviation industry to enhance air-traffic control, improve airline efficiency, and bolster airplane safety at airports worldwide. Learn more >",0.5377,POSITIVE,0.9991,0,['#Metropolis']
2022-11-28T18:28:01.000Z,"Next week, join us at Gartner #IT IOCS to learn how @nvidia is transforming enterprises with industry-leading #AI platforms built on #NVIDIADGX systems and enterprise-class software. Learn more: https://nvda.ws/3XHNDdS",0.5498,POSITIVE,0.9614,0,"['#IT', '#AI', '#NVIDIADGX']"
2022-11-30T16:43:54.000Z,"NVIDIA founder & CEO, Jensen Huang, spoke with @VentureBeat about how generative #AI will be transformational in the development of the #metaverse. Read the interview.",0.5454,NEGATIVE,0.6125,0,"['#AI', '#metaverse']"
2022-11-29T17:18:06.000Z,Learn how @SiemensSoftware #SynthAI uses #NVIDIAOmniverse Replicator to generate physically accurate #3D #syntheticdata using #AWS to power industrial workflows. https://nvda.ws/3gFxtkR#MachineVision #IndustrialMetaverse,0.5034,POSITIVE,0.9996,0,"['#SynthAI', '#NVIDIAOmniverse', '#3D', '#syntheticdata', '#AWS', '#MachineVision', '#IndustrialMetaverse']"
2022-11-17T21:00:02.000Z,Read how @NOAA has selected @LockheedMartin and NVIDIA to build a system to accelerate complex visualizations of the latest #climate data from hours to minutes with @NVIDIAOmniverse. #SC22,0.5244,POSITIVE,0.6984,0,"['#climate', '#SC22']"
2022-11-28T22:26:14.000Z,"Watch #RSNA22 Special Address with Director of Business Development in Healthcare, David Niewolny. He explores the state of #AI in #medicalimaging and shares how NVIDIA is helping medical centers around the world build AI-powered imaging ecosystems.",0.5558,POSITIVE,0.9994,0,"['#RSNA22', '#AI', '#medicalimaging']"
2022-11-25T22:39:59.000Z,Tune in to our special address at #RSNA22 and discover the latest AI innovations for #medicalimaging and how NVIDIA is helping medical centers around the world build AI-powered imaging ecosystems.,0.548,POSITIVE,0.998,0,"['#RSNA22', '#medicalimaging']"
2022-11-21T17:55:20.000Z,be ready ,0.52,POSITIVE,0.987,0,[]
2022-11-22T16:00:44.000Z,"This week we're thankful for the creators who have joined us #InTheNVIDIAStudio! We're showcasing a few of these artists including @pablander, @karenxcheng, & @WATCHHOLLIE, along with highlighting the creative power of the GeForce RTX 4080 GPU.Blog: https://nvda.ws/3Ve958r",0.5138,POSITIVE,0.995,0,['#InTheNVIDIAStudio']
2022-11-14T16:11:12.000Z,"With @NVIDIAOmniverse, data center architects and operators can build a full-fidelity, real-time interactive #DigitalTwin of their data centers, connecting the infrastructure, simulation, layout, network stack, and monitoring tools they use today. #SC22",0.5306,POSITIVE,0.9997,0,"['#DigitalTwin', '#SC22']"
2022-11-14T15:37:19.000Z,.@NVIDIAOmniverse now connects to leading scientific computing visualization software and supports new batch rendering workloads on systems powered by NVIDIA A100 and H100 Tensor Core GPUs. #SC22,0.5455,POSITIVE,0.9985,0,['#SC22']
2022-11-14T15:16:16.000Z,"Announcing broad adoption of NVIDIA H100 Tensor Core GPUs and Quantum-2 InfiniBand, including new offerings on @Azure and 50+ new partner systems for accelerating scientific discovery. #SC22",0.5574,POSITIVE,0.9987,0,['#SC22']
2022-11-14T15:08:20.000Z,The NVIDIA #SC22 Special Address has started! Tune in to hear an in-depth overview of our latest innovations.,0.5223,POSITIVE,0.9992,0,['#SC22']
2022-11-10T19:36:58.000Z,We’re honored @TIME recognized NVIDIA #InstantNeRF as one of the  Best Inventions of 2022. Learn more: https://nvda.ws/3UOdSNQThank you to our NeRF community for exploring this new technology to create 3D scenes instantly from 2D photos. Share your favorite #InstantNeRF.,0.5475,POSITIVE,0.9787,0,"['#InstantNeRF', '#InstantNeRF']"
2022-11-09T15:12:07.000Z,"It's a new age for safety, with the all new Volvo EX90 powered by NVIDIA DRIVE Orin: https://nvda.ws/3UmShw5",0.5707,POSITIVE,0.9931,0,[]
2022-11-09T19:10:02.000Z,"Just announced at #BigCompute22, @NVIDIA teams with @RescaleInc to bring the full stack of NVIDIA AI software to every major #cloud service provider. NVIDIA #AI will bring new capabilities to Rescale’s #HPC-as-a-service offering. Learn more: https://nvda.ws/3UFVg2l",0.5783,POSITIVE,0.989,0,"['#BigCompute22', '#cloud', '#AI', '#HPC']"
2022-11-08T15:40:34.000Z,"A new beta release of #NVIDIAOmniverse is here! This launch includes major updates to core reference applications and tools for developers, creators, and novices looking to build #metaverse applications: https://nvda.ws/3fLM3GZ",0.5326,POSITIVE,0.938,0,"['#NVIDIAOmniverse', '#metaverse']"
2022-11-08T16:45:00.000Z,"Our GPUs interpret data from the @NASAWebb Space Telescope so that all of humanity can see outer space as never before. And to help researchers explore the vast chemical space of drug discovery, we built the #AI-powered BioNeMo cloud service. https://nvda.ws/3xTkalW #NVIDIAstory",0.5217,POSITIVE,0.996,0,"['#AI', '#NVIDIAstory']"
2022-11-04T20:00:01.000Z,"Green computing aims to maximize energy efficiency and minimize environmental impact in the ways computer chips, systems and software are designed and used. Learn about the history of green computing and why it's here to stay. #IT #AI https://nvda.ws/3fxRJUM",0.5287,POSITIVE,0.9612,0,"['#IT', '#AI']"
2022-11-04T18:01:48.000Z,We’re excited to share that our hardware and software will make real-time generation of modern art possible with @RefikAnadol and his upcoming #AIArt exhibit at the @MuseumModernArt.,0.5318,POSITIVE,0.9985,0,['#AIArt']
2022-10-26T18:00:22.000Z,"Whalecome to this week's #InTheNVIDIAStudio blog featuring the amazing 3D artist, @southernshotty! Read more about the process & inspiration behind his beautiful works in @BlenderNation & @Substance3D https://nvda.ws/3D65l1n",0.5102,NEGATIVE,0.5008,0,['#InTheNVIDIAStudio']
2022-10-24T21:58:42.000Z,".@sensennet, an #NVIDIAMetropolis partner, uses NVIDIA Jetson #edgeAI platform to improve safety and operational efficiency for the trucking industry in Australia. Learn more. https://nvda.ws/3Sxq3Nd#computervision",0.5279,POSITIVE,0.9952,0,"['#NVIDIAMetropolis', '#edgeAI', '#computervision']"
2022-10-24T16:55:35.000Z,Watch the Oracle #CloudWorld fireside chat with our CEO Jensen Huang and @Oracle’s CEO Safra Catz to learn how the combination of Oracle’s powerful infrastructure with NVIDIA’s expertise in #AI will serve enterprises across industries.,0.5288,POSITIVE,0.9943,0,"['#CloudWorld', '#AI']"
2022-10-20T20:00:02.000Z,"Five days left - submit your session, poster, and training lab proposals for #GTC22 by Oct. 24. Share your latest breakthroughs  with our global community at our next event. https://nvda.ws/3EPBEnI",0.5243,POSITIVE,0.9815,0,['#GTC22']
2022-10-20T16:00:00.000Z,"At Oracle #CloudWorld, our CEO Jensen Huang and @Oracle's CEO Safra Catz discussed their companies’ expanding collaboration to speed up adoption of enterprise #AI.",0.5338,POSITIVE,0.9842,0,"['#CloudWorld', '#AI']"
2022-10-18T18:47:04.000Z,"Announced today, @Meta's next-generation AI platform, Grand Teton, uses NVIDIA H100 GPUs to train and run challenging AI models that are rapidly growing in their size and capabilities, requiring greater compute.",0.5496,POSITIVE,0.9993,0,[]
2022-10-18T16:16:28.000Z,"Today at #CloudWorld, we announced a multi-year partnership with @Oracle to help customers solve business challenges with #AI. This collaboration aims to bring our end-to-end accelerated computing stack to the Oracle Cloud Infrastructure (OCI). https://nvda.ws/3eA6Ixf",0.5669,POSITIVE,0.9924,0,"['#CloudWorld', '#AI']"
2022-10-10T17:30:01.000Z,"Interested to know why GPUs are important to #AI? Join us in the next NVIDIA Emerging Chapters Education Series and learn why they are an essential part of modern artificial intelligence infrastructure Oct 20, 2022 at 3PM GMT.Register now > https://nvda.ws/3EDQqO6",0.5361,POSITIVE,0.9716,0,['#AI']
2022-10-13T16:29:50.000Z,The @PolestarCars #Polestar3 is setting a new standard for premium SUVs with the power of NVIDIA DRIVE: https://nvda.ws/3CviGQv,0.5432,POSITIVE,0.9587,0,['#Polestar3']
2022-10-15T15:55:00.000Z,"A gift from our founder and CEO, Jensen Huang, and his spouse Lori will transform @OregonState University's engineering school and boost #AI, climate, and robotics research.",0.5288,POSITIVE,0.9971,0,['#AI']
2022-10-14T15:42:00.000Z,"Creatives are taking, and breaking, the latest #AI tools. And in the process, learning how they can make their work better.",0.5391,POSITIVE,0.993,0,['#AI']
2022-09-30T17:09:00.000Z,"Meet the latest additions to the #DRIVEIX ecosystem, announced at #GTC22",0.5179,POSITIVE,0.998,0,"['#DRIVEIX', '#GTC22']"
2022-09-26T17:00:00.000Z,"Watch how the new #NVIDIARTX 6000 Ada generation GPU delivers real-time rendering, graphics, and AI, helping designers and engineers drive cutting-edge simulation-based workflows to build and validate more sophisticated designs. @ANSYS",0.541,POSITIVE,0.9989,0,['#NVIDIARTX']
2022-10-05T15:00:02.000Z,Join Marc Hamilton (VP of Solutions Architecture and Engineering at @nvidia) for his @TEDx talk on October 12th to learn about the computing power needed to build sustainable #AI factories and digital twins that will power the metaverse. Register now!,0.534,NEGATIVE,0.5512,0,['#AI']
2022-10-05T15:30:01.000Z,NVIDIA Morpheus enables organizations to detect threats faster with #AI-based #cybersecurity. Watch how it works in this video.,0.55,POSITIVE,0.9993,0,"['#AI', '#cybersecurity']"
2022-09-28T17:03:08.000Z,"This #GTC22, we provided a glimpse into the future of in-vehicle infotainment. Check it out: https://nvda.ws/3xZfNGm",0.5059,POSITIVE,0.9994,0,['#GTC22']
2022-09-22T20:00:00.000Z,Watch how #NVIDIAClara Holoscan with #Omniverse gives surgeons the ability to practice patient-specific procedures that can improve #surgical efficiency and reduce patient time in the operating room.,0.5213,POSITIVE,0.9046,0,"['#NVIDIAClara', '#Omniverse', '#surgical']"
2022-09-29T22:05:27.000Z,"Are you making a difference in the world of #AI, the #metaverse, data science, and more? Share your latest breakthroughs with our community and expand your network. Submit your proposal for a March 2023 GTC session or poster by Oct. 24. https://nvda.ws/3SHtaCH",0.5379,POSITIVE,0.9805,0,"['#AI', '#metaverse']"
2022-09-29T16:05:45.000Z,"The perfect demo doesn’t exi—See how 30+ NVIDIA artists across time zones created the fully playable, simulated demo using nearly a dozen content-creation apps, all in just three months. https://nvda.ws/3rijhQd",0.5189,POSITIVE,0.9954,0,[]
2022-09-22T16:00:05.000Z,"Learn about NVIDIA Maxine's new cloud-native architecture, and how its breakthrough #AI features enhance audio, video, and augmented reality effects in #realtime. https://nvda.ws/3S14TrB#AugmentedReality #GTC22",0.5385,POSITIVE,0.9904,0,"['#AI', '#realtime', '#AugmentedReality', '#GTC22']"
2022-09-21T22:00:01.000Z,"Watch how @NVIDIAOmniverse Avatar Cloud Engine makes it easy for developers to build and deploy intelligent, interactive virtual assistants and digital humans like Violet to life. #GTC22",0.5095,POSITIVE,0.9998,0,['#GTC22']
