date of comment,main comment,comment,depth,PTR Sentiment,Flair Outlook,Flair Sentiment
,,I dont notice anything wrong. Just money flowing to r/thetagang as it should.,0,0.5,NEGATIVE,0.972
,,I cannot tell you how much I have made off thetagang. I lost a lot in buying options and have made it back 5x in selling them,1,0.509,NEGATIVE,1.0
,,You have made money with Theta gang not off theta gang ;),2,0.508,NEGATIVE,0.964
,,Thetagang is the way be a WSB liquidity provider ,2,0.528,NEGATIVE,0.979
,,Technically won't the liquidity flow into my pocket if I sell those options?,3,0.536,NEGATIVE,0.742
,,Theta gang always wins,1,0.502,POSITIVE,0.966
,,mmm not always but enough,2,0.502,POSITIVE,0.979
,,you suck at options,0,0.508,NEGATIVE,0.998
,,,1,,,
,,"Yes. Because almost always at one point you are up on ur options and you just don’t sell and wait. And then even after being down 20,30,50!,70!!,90!! % you still hold them and expect something to be different.",2,0.514,NEGATIVE,0.953
,,Exit strategy is lacking. Unless it is 'all or nothing'.,3,0.517,NEGATIVE,1.0
,,To the moon!,3,0.51,POSITIVE,0.999
,,Yes the facts are 60 to 65 percent of options make money and that’s prolly increased to 70 percent so yea you are the bottom 30 percent . If it makes you feel better you are the bottom 40 percent,2,0.588,NEGATIVE,0.995
,,LOL are you blaming the market right now ? Snap out of it,2,0.551,NEGATIVE,0.545
,,"You know you can sell options, right? You don’t have to hold them until expiration…",0,0.521,POSITIVE,0.835
,,I’ve taken profits many times - it’s still a funnel that eventually leads to $0,1,0.506,NEGATIVE,0.997
,,"What? I’m up almost 60% this year trading nothing but options. Buy today, sell tomorrow after it appreciates, if it goes down, hold one more day, buy at the lowest possible price to lower your average, and then sell the next day when it exceeds your new average cost.Rinse and repeat.I should mention I also never wager much (never more than 10-15% of my balance), and I never get close to the expiration date of the option. Always 90-120 days away from the expiration date.",2,0.549,POSITIVE,0.553
,,How long do you buy your contracts for one week or two weeks?,3,0.592,NEGATIVE,0.993
,,"I’m not sure I understand the question.I’ll give you an example, right now, I bought two AAPL $270 1/17/2025 expiration calls for $234/contract. I’ll sit on those until they’re worth more than $234/option. (Right now, it’s looking like a bad buy, because they’re worth $206 per right now, but you can’t win them all. The goal is just to be more green than red, and I’ve been more green than red this year.)This whole year has been pretty bullish, so I’m probably just riding the trend of the general stock market.But the goal is to capitalize big time on the up years, and try to avoid the down years as much as possible.",4,0.556,NEGATIVE,1.0
,,Thank you so much,5,0.51,POSITIVE,0.826
,,Wait i just read the other part why do you have it for 90-120 days if you are selling it in 2 days of purchasing,3,0.514,NEGATIVE,0.994
,,"Trying to avoid theta decay.The closer you get to the expiration date, the more like gambling this whole deal becomes. Might as well go to Vegas and plop the money down on a roulette table if you’re doing 0-7 DTEs.If the expiration date is far out, there’s still a lot that can happen between now and the expiration date. And since the trend of the stock is, on average, up, I’m going to have a better chance of upward movement rather than downward.",4,0.519,NEGATIVE,1.0
,,One more question do you buy during quarterlys,5,0.569,NEGATIVE,0.809
,,This triggers a wash sale tho right,3,0.51,NEGATIVE,0.943
,,Yeah I’m currently riding that roller coaster,2,0.502,POSITIVE,1.0
,,Greed will get anyone.,1,0.51,NEGATIVE,0.994
,,That you are partially regarded.,0,0.505,NEGATIVE,0.599
,,You buy otm options. They are lotto tickets.    You have tesla 50 put and 250 calls... what are you hoping happens here? What's the plan?I get that your betting on a crash but why not just buy shares in a vol index?,0,0.528,POSITIVE,0.912
,,This has to be a joke 😂140 DIS call - It hasn't been at this level for yearsMultiple 50 Tesla puts - again hasn't happened in five years. 250 Tesla calls??!?!?The 450 spy puts expiring in two weeks... I mean a twenty percent drop would require a bomb to hit the u.s. or multiple bank failures.You really should stop trading options you have no idea what you are doing. Maybe these calls are an attempt on a hedge that doesn't make sense?,0,0.516,NEGATIVE,1.0
,,You're retarded buying way otm short term puts on spy and tesla expecting to make money,0,0.515,NEGATIVE,0.998
,,Did you just throw darts at a board and buy whatever came up? SPY 450P in two weeks?!?! TSLA 50P?!?! AAPL 200P... With the iPhone event coming up in a few days?!?!,0,0.524,NEGATIVE,1.0
,,I only see one option,0,0.532,NEGATIVE,1.0
,,There’s 3 pictures,1,0.5,POSITIVE,0.911
,,Oops,2,0.5,NEGATIVE,0.651
,,You should have said the one option is for you to quit buying options,3,0.647,NEGATIVE,0.996
,,Yeah they’re all 2024 expirations; what do you expect,0,0.505,POSITIVE,0.936
,,You’re able to research this many names and buy that many different options ? Many of these are total moon shots. I don’t even know where to begin…Well let’s begin here… just stay long on good companies. Oh and sell your asts before it drops under 10,0,0.526,NEGATIVE,1.0
,,Why would ASTS drop under 10? So far it does just fine,1,0.499,POSITIVE,0.937
,,"Be careful, options with stocks are very risky because a stock falls more than 10% in a single day, which is rare with indices, so when you trade options with stocks, you have to get out quickly, starting from 15% profit, that’s already good.",0,0.553,NEGATIVE,0.991
,,"It’s not just 15% profit but from 15% I secure the profit, my best profit from stock options is when I sell a put",1,0.615,POSITIVE,0.826
,,"It’s not just 15% profit but from 15% I secure the profit, my best profit from stock options is when I sell a put",2,0.615,POSITIVE,0.826
,,"I mean when the price goes up to 15% I start to put a stop loss in case the premium falls, and sell put is sweetie",3,0.506,NEGATIVE,0.906
,,"I mean when the price goes up to 15% I start to put a stop loss in case the premium falls, and sell put is sweetie",4,0.506,NEGATIVE,0.906
,,"This is one of the craziest portfolios I've ever seen, bro will buy anything. Constantly throwing $1000 hoping for monumental world shaking movements in the underlying is crazy",0,0.524,NEGATIVE,0.647
,,Hats the strategy on the options buy & hold wait for it to melt away to nothing and then not know what happened???,0,0.535,NEGATIVE,0.999
,,You're still in ASTS?,0,0.513,POSITIVE,0.803
,,Of course,1,0.51,POSITIVE,0.977
,,Hi fellow Spacemob 🤝,2,0.5,POSITIVE,0.995
,,All I see is you buy stock and hold it forever and don’t sell… it also seems you do the same with your options not the most profitable way but indeed a way… I also see you are able to pick a winning stock but you are unable to pick winning options,0,0.573,POSITIVE,0.56
,,HIMS needs Viagra,0,0.508,NEGATIVE,0.542
,,Hims back to 12 soon,1,0.51,NEGATIVE,0.963
,,Can you let us know what you're doing before so we could do the opposite? 🤔,0,0.529,NEGATIVE,0.809
,,You shouldn’t trade options,0,0.518,NEGATIVE,0.989
,,Hims calls were ….. bad calls?,0,0.506,NEGATIVE,0.999
,,That you are bad with options.,0,0.502,NEGATIVE,0.999
,,"SPY 450 Put, i found the gay bear",0,0.504,NEGATIVE,0.998
,,Who knew trading or holding decaying and hyper leveraged derivatives like securities would turn out this way. Amazing! Lol 🤦‍♂️,0,0.51,POSITIVE,0.999
,,You aren’t good with options . You should try selling options,0,0.523,NEGATIVE,1.0
,,I notice someone who has no idea what they are doing lol,0,0.5,NEGATIVE,0.972
,,You win more and you also lose more?,0,0.593,POSITIVE,0.769
,,That you need a new options trading strategy,0,0.607,NEGATIVE,0.9
