date,headline,PTR Sentiment,Flair Outlook,Flair Score
11/23/2024,Thoughts on this allocation? (AI Theme),0.5713,NEGATIVE,0.9224
11/22/2024,"My top 8 performers. DCA'd randomly since Oct 25, 2023",0.5207,POSITIVE,0.9997
10/24/2024,TSMC’s Arizona Chip Production Yields Surpass Taiwan’s in Win for US Push,0.5275,POSITIVE,0.9962
10/18/2024,These are the stocks on my watchlist (10/18),0.5625,POSITIVE,0.9868
10/17/2024,These are the stocks on my watchlist (10/17),0.5625,POSITIVE,0.9583
09/14/2024,NVIDIA CEO Outlines Plan to Shift From TSMC and Seize $1 Trillion Non-AI Market,0.5736,NEGATIVE,0.969
09/09/2024,Apple Unveils iPhone 16 Pro: A New Chapter in Mobile Technology,0.6106,POSITIVE,0.978
08/27/2024,Is The Market Aware of the Risks Behind Nvidia's Upcoming Earnings?,0.5921,NEGATIVE,0.9847
08/14/2024,The Chips Act's Biggest Beneficiary may be...Intel!,0.5325,NEGATIVE,0.5095
08/09/2024,TSMC Sales Surge 45% In July On Strong AI Demand,0.6479,POSITIVE,0.9947
08/02/2024,Understand this about INTC...,0.5,POSITIVE,0.9796
07/25/2024,Best Youtube channels/Books to learn?,0.522,POSITIVE,0.9984
07/18/2024,"TSMC Q2 Earning Beat Estimate, Let's see the financial highlights",0.515,POSITIVE,0.9944
07/18/2024,These are the stocks on my watchlist (7/18),0.5625,POSITIVE,0.9838
07/10/2024,"TSMC Records Best June Sales Ever Amidst AI Boom, with Nvidia, Micron, and AI Chips Poised to Benefit Again",0.5957,POSITIVE,0.9967
07/08/2024,INTC is having a great day,0.52,POSITIVE,0.9886
06/17/2024,These are the stocks on my watchlist (6/17),0.5625,POSITIVE,0.9787
06/09/2024,Rocket 1: Nvidia's Ascendancy in SMH ETF Widens the Gap Against The Pack,0.5231,POSITIVE,0.9409
06/07/2024,50 Most Valuable Companies Worldwide,0.5467,POSITIVE,0.9997
06/02/2024,Nvidia's Market Cap Now Exceeds the Total Value of All Semiconductor Companies in the SMH ETF by 100+ Billion,0.5691,POSITIVE,0.9948
05/25/2024,Nvidia Goes Solo: Too Big to Mingle in the SMH Chip Club,0.5394,NEGATIVE,0.9925
05/10/2024,TDG vs Major Exchanges for Buy & Hold,0.5475,POSITIVE,0.706
03/09/2024,TSMC thoughts,0.5075,POSITIVE,0.9908
07/18/2023,Which investment operating strategy are you?,0.5967,NEGATIVE,0.7738
07/17/2023,Investment plan for about 85 000$ USD over the coming year,0.654,POSITIVE,0.9916
06/08/2023,A.I stocks yesterday. Are we nearing the end of this hype?,0.546,NEGATIVE,0.9984
05/20/2023,"Intel Stock Evaluation + AMD Benchmark: Price Target Rage, deep analysis",0.619,POSITIVE,0.9984
05/16/2023,Warren Buffett’s New Positions,0.5988,POSITIVE,0.9925
04/30/2023,Nvidia market cap is more than 5 other chip makers combined,0.59,POSITIVE,0.9522
04/29/2023,Best Stocks for Long-Term Investment Discussion (2023),0.5883,POSITIVE,0.9997
04/17/2023,Earning sessions are coming! Most anticipated earnings for this coming week,0.5521,POSITIVE,0.999
03/23/2023,"Daily U.S. Stock Market News Flash (Thursday, March 23)",0.5887,NEGATIVE,0.9457
03/21/2023,"Taiwan chip export plunges, China still lags amid U.S. restriction",0.514,NEGATIVE,0.9993
03/17/2023,"Daily U.S. Stock Market News Flash (Friday, March 17)",0.5919,NEGATIVE,0.9306
02/24/2023,Today's Stock Market Analysis,0.715,POSITIVE,0.9022
02/20/2023,"Al Gore’s Firm Sells Alibaba Stock, TSMC, and Shopify",0.5588,NEGATIVE,0.7974
02/15/2023,Buffett’s Quick $3.7 Billion Sale of TSMC Stock Spooks Investors,0.5713,NEGATIVE,0.7237
01/17/2023,"Daily U.S. Stock Market News Update (Tuesday, January 17)",0.5988,NEGATIVE,0.9732
01/13/2023,"Stock Market Today (as of Jan 13th, 2023)",0.66,POSITIVE,0.7961
01/07/2023,"Most Anticipated Earnings Releases for the week beginning January 9th, 2023",0.5686,POSITIVE,0.9678
01/07/2023,Next weeks economic events and potential earnings,0.565,POSITIVE,0.9687
12/29/2022,"TSMC starts mass production of 3 nanometer chips in Taiwan, said demand is very strong. Is it true?",0.5941,POSITIVE,0.9837
12/07/2022,TSMC to build its first US-based chip manufacturing plant in Arizona,0.5606,POSITIVE,0.9871
12/07/2022,TSMC triples Arizona chip investment to $40bn,0.5233,NEGATIVE,0.9675
12/07/2022,TSMC ups its Arizona chipmaking investment to $40 billion ahead of Biden's visit,0.5217,POSITIVE,0.9087
12/01/2022,TSMC Plans to Make More Advanced Chips in US at Urging of Apple,0.5381,POSITIVE,0.5427
11/21/2022,Everyone piling into TSMC b/c of Buffett? Buffett’s $5 Billion TSMC Purchase Adds to Wave of Bullish Calls,0.5129,NEGATIVE,0.978
11/15/2022,"Berkshire Hathaway buys $5 bn in TSMC stock, causing it to jump ~8% on the news. Are semiconductors a good value at the moment?",0.5546,NEGATIVE,0.9908
10/25/2022,"China will certainly invade Taiwan before 2030, what will happen to TSCM ?",0.5133,NEGATIVE,0.9995
10/25/2022,"Market Weekly Recap: Streaming, Chips, Airline Stocks Led the Gain, Tesla Earnings Alarmed the Tech",0.5635,NEGATIVE,0.9546
10/23/2022,U.S. China Semiconductor Restrictions Hit Chinese Startup and NVIDIA competitor Biren Technology,0.5468,NEGATIVE,0.9964
10/11/2022,"The escalating US-China tech race wipes out $240 Billion from chipmakers - TSMC drops 8.3% and Samsung and Tokyo Electron also declined; Selloff extended to currency markets, with the South Korean won sliding as much as 1.8% vs USD.",0.536,NEGATIVE,0.9978
10/08/2022,Next weeks economic events and earnings. Will be fun to see how they move the markets,0.5572,POSITIVE,0.9962
10/08/2022,"Most Anticipated Earnings Releases for the week beginning October 10th, 2022",0.5643,POSITIVE,0.9652
08/29/2022,Largest public companies in 2000 vs 2022,0.5675,POSITIVE,0.9926
03/22/2022,SiliconMotion of the Ocean - Mega Memory Upside Round 2 ($SIMO),0.5014,NEGATIVE,0.7438
12/22/2021,Japan Has a Potential Role in TSMC’s Risk Diversification,0.51,POSITIVE,0.9867
12/07/2021,Forget iPhone: TSMC Is Already After Metaverse,0.505,NEGATIVE,0.9139
12/01/2021,"TSMC’s 3nm Enters Pilot Production, but Advanced Packaging Faces Challenges",0.5178,NEGATIVE,0.8683
11/11/2021,"TSMC-From Phones to Cars and Fridges, This Taiwan Firm Powers the World. But Success Brings Problems",0.5136,NEGATIVE,0.5608
10/31/2021,Do you believe in the Metaverse? ($FB) ($MVRS),0.5012,NEGATIVE,0.9998
10/29/2021,$TSM - Taiwan Semiconductor Manufacturing | The critical Jenga Block of Semiconductor Manufacturing,0.5261,POSITIVE,0.9896
10/21/2021,Japan Considers a Semiconductor Fund to Support TSMC and Chip Industry Revival,0.53,POSITIVE,0.9713
10/06/2021,Largest Economic Collapse in History?,0.5312,NEGATIVE,0.9971
10/04/2021,INTEL vs AMD vs NVIDIA - Looking for a Chip Stock.. which one should I buy?,0.6585,NEGATIVE,0.9917
09/02/2021,IS TSM A STRONG BUY?,0.6133,POSITIVE,0.956
08/26/2021,TSMC raises chip prices by as much as 20% amid high demand,0.5225,POSITIVE,0.7589
08/13/2021,Which broker can I use in Europe to invest in an ETF composed of several IC and AI companies?,0.566,POSITIVE,0.7616
08/05/2021,"What is next for the Semi-Conductor Industry: TSMC, INTEL, QUALCOMM, Micron Technologies",0.5322,POSITIVE,0.9992
07/12/2021,[DD] QUalcomm (QCOM),0.5,NEGATIVE,0.6569
05/04/2021,Why You Should Short the Intel Fab Play,0.525,NEGATIVE,0.9992
04/26/2021,What's Happening in the Markets: Week of 4/26/2021,0.59,POSITIVE,0.8307
03/29/2021,TSMC raising fab prices,0.4962,POSITIVE,0.9602
03/29/2021,INTC DD,0.515,NEGATIVE,0.7257
03/02/2021,Samsung Electronics' EUV preparation is less than TSMC's?,0.4942,NEGATIVE,0.9965
02/07/2021,Future of Semiconductor market?,0.6083,NEGATIVE,0.7699
12/16/2020,With TSMC and Samsung seemingly at capacity and raising prices who else would you invest in that could gain market share in the silicon fab market?,0.5588,NEGATIVE,0.9964
09/24/2020,Long term shares,0.5767,POSITIVE,0.9982
08/10/2020,Deep dive into the technological aspect of Intel's problems,0.5158,NEGATIVE,0.8752
08/05/2020,Take advantage of the overreaction!,0.5117,NEGATIVE,0.9006
05/24/2020,"US adds 33 Chinese Companies, Institutions to Economic Blacklist",0.5364,NEGATIVE,0.9587
02/18/2020,"Feb. 18, 2020, Asia business news",0.6125,POSITIVE,0.7697
04/18/2019,"Today's Pre-Market News [Thursday, April 18th, 2019]",0.585,NEGATIVE,0.5113
12/4/2024,I Want to Hear Your Thoughts on the Qualities Intel’s Next CEO Should Have and Why,0.5386,POSITIVE,0.9959
