Date Posted,Source,Headline,Preview,Link,PTR Headline Sentiment,Flair Headline Outlook,Flair Headline Score,PTR Preview Sentiment,Flair Preview Outlook,Flair Preview Score
09/18/2024,The New York Times,"France’s Budget Problems ‘Very Serious,’ Prime Minister Says",https://www.lemonde.fr/en/economy/article/2024/10/10/france-s-great-consumption-slump_6728864_19.html,"France's debt load has ballooned to €3 trillion, or more than 110 percent of gross domestic product, the highest in Europe after Greece's and...",0.514,NEGATIVE,0.929,0.503,NEGATIVE,0.902
08/26/2024,Al Jazeera,Macron rejects left-wing government amid France’s political deadlock,https://www.npr.org/2024/09/05/nx-s1-5101536/france-prime-minister-michel-barnier,"Macron rejects left-wing government amid France's political deadlock. After his party's defeat in the July elections, Macron must decide who to...",0.501,NEGATIVE,0.657,0.502,POSITIVE,0.946
06/12/2024,Campus France,Checklist. Prepare your arrival in France,https://www.nytimes.com/2024/10/25/business/france-moodys-negative-outlook.html,"Here you will find everything you need to do and plan on, step by step, to properly prepare for your arrival in France.",0.499,POSITIVE,0.88,0.531,NEGATIVE,0.959
10/23/2024,Le Monde.fr,"Osama bin Laden's son banned from returning to France, says minister",https://www.euractiv.com/section/energy-environment/news/frances-edf-faces-uphill-battle-as-europes-demand-for-nuclear-reactors-grows/,Interior Minister Bruno Retailleau said Omar bin Laden was ordered to leave over posts on social media 'advocating terrorism.,0.512,NEGATIVE,0.995,0.514,NEGATIVE,0.579
03/12/2024,Olympics,Stade de France | Paris 2024,https://www.lemonde.fr/en/les-decodeurs/article/2024/09/06/michel-barnier-is-france-s-new-prime-minister-what-happens-next_6725033_8.html,"The Stade de France, the country's largest stadium, will transform into the Olympic Stadium after three decades of hosting France's biggest sports events.",0.499,POSITIVE,0.998,0.532,POSITIVE,0.86
08/25/2024,Reuters,Telegram messaging app CEO Durov arrested in France,https://www.npr.org/2024/10/23/nx-s1-5162340/rape-france-wife-pelicot,"Durov, who has dual French and United Arab Emirates citizenship, was arrested as part of a preliminary police investigation into allegedly...",0.519,NEGATIVE,0.992,0.499,NEGATIVE,0.997
11/6/2024,ESPN,Kylian Mbappé omitted from France squad amid poor form,https://kpmg.com/xx/en.html,"Kylian Mbappé has not been included in France's squad for their Nations League fixtures against Israel and Italy, Didier Deschamps confirmed...",0.5,NEGATIVE,0.948,0.507,POSITIVE,0.653
10/23/2024,The New York Times,France’s Government Survives a No-Confidence Vote,https://www.reuters.com/world/europe/france-shifts-left-risk-policy-paralysis-looms-2024-07-08/,France's Government Survives a No-Confidence Vote · A no-confidence vote against the government of Prime Minister Michel Barnier of France was...,0.509,POSITIVE,0.845,0.517,POSITIVE,0.639
03/15/2024,The Guardian,France’s lower house votes to limit ‘excesses’ of fast fashion with environmental surcharge,https://www.nytimes.com/2024/09/18/business/france-debt-deficit-prime-minister-macron.html,"Thursday's vote makes France the first country in the world “legislating to limit the excesses of ultra fast fashion”, said Christophe Bechu,...",0.484,POSITIVE,0.925,0.53,NEGATIVE,0.521
09/24/2024,CNN,"The left won France’s election, but its new government will be at the mercy of the far right",https://www.aljazeera.com/news/2024/8/26/macron-meets-marine-le-pen-amid-france-prime-minister-talks,Macron has revealed his cabinet – led by Prime Minister Michel Barnier marking a shift to the right and leaving left-leaning politicians out in the cold.,0.566,NEGATIVE,0.952,0.51,POSITIVE,0.955
09/16/2024,Reuters,France picks Sejourne as nominee for EU Commission after Breton clash,https://www.campusfrance.org/en/organise-arrival-France,"France picked Foreign Minister Stephane Sejourne as its new candidate for the next European Commission as the incumbent, Thierry Breton,...",0.501,NEGATIVE,0.666,0.499,POSITIVE,0.992
03/12/2024,Olympics,Stade de France | Paris 2024,https://www.lemonde.fr/en/politics/article/2024/10/08/osama-bin-laden-s-son-ordered-to-leave-france-says-minister_6728613_5.html,"The Stade de France, the country's largest stadium, will transform into the Olympic Stadium after three decades of hosting France's biggest sports events.",0.499,POSITIVE,0.998,0.508,NEGATIVE,0.98
07/18/2024,POLITICO.eu,Macron wins shock vote to keep coalition hopes alive,https://olympics.com/en/paris-2024/venues/stade-de-france,Pro-Macron and center-right lawmakers successfully pulled their votes together to stop the left from grabbing control of the National Assembly.,0.506,POSITIVE,0.99,0.504,POSITIVE,0.928
08/25/2024,Reuters,Telegram messaging app CEO Durov arrested in France,https://www.reuters.com/world/europe/telegram-messaging-app-ceo-pavel-durov-arrested-france-tf1-tv-says-2024-08-24/,"Durov, who has dual French and United Arab Emirates citizenship, was arrested as part of a preliminary police investigation into allegedly...",0.519,NEGATIVE,0.992,0.529,NEGATIVE,0.994
11/6/2024,ESPN,Kylian Mbappé omitted from France squad amid poor form,https://www.espn.com/soccer/story/_/id/42246914/kylian-mbappe-omitted-france-squad-amid-poor-form,"Kylian Mbappé has not been included in France's squad for their Nations League fixtures against Israel and Italy, Didier Deschamps confirmed...",0.5,NEGATIVE,0.948,0.504,NEGATIVE,0.978
10/23/2024,The New York Times,France’s Government Survives a No-Confidence Vote,https://www.nytimes.com/2024/10/08/world/europe/michel-barnier-france-no-confidence-vote.html,France's Government Survives a No-Confidence Vote · A no-confidence vote against the government of Prime Minister Michel Barnier of France was...,0.509,POSITIVE,0.845,0.52,POSITIVE,0.805
03/15/2024,The Guardian,France’s lower house votes to limit ‘excesses’ of fast fashion with environmental surcharge,https://www.theguardian.com/world/2024/mar/15/france-fast-fashion-law-environmental-surcharge-lower-house-votes,"Thursday's vote makes France the first country in the world “legislating to limit the excesses of ultra fast fashion”, said Christophe Bechu,...",0.484,POSITIVE,0.925,0.5,POSITIVE,0.675
09/24/2024,CNN,"The left won France’s election, but its new government will be at the mercy of the far right",https://www.cnn.com/2024/09/24/europe/france-new-government-right-analysis-intl/index.html,Macron has revealed his cabinet – led by Prime Minister Michel Barnier marking a shift to the right and leaving left-leaning politicians out in the cold.,0.566,NEGATIVE,0.952,0.547,POSITIVE,0.822
06/09/2024,Al Jazeera,"Far right surges in EU vote, topping polls in Germany, France, Austria",https://www.reuters.com/world/europe/frances-breton-says-he-steps-down-eu-commissioner-2024-09-16/,"Far right surges in EU vote, topping polls in Germany, France, Austria. French President Emmanuel Macron calls snap election after National...",0.508,POSITIVE,0.987,0.53,NEGATIVE,0.919
09/16/2024,Reuters,France picks Sejourne as nominee for EU Commission after Breton clash,https://olympics.com/en/paris-2024/venues/stade-de-france,"France picked Foreign Minister Stephane Sejourne as its new candidate for the next European Commission as the incumbent, Thierry Breton,...",0.501,NEGATIVE,0.666,0.504,POSITIVE,0.928
02/09/2024,Campus France,France Excellence Europa scholarships: call for applications 2024,https://www.politico.eu/article/emmanuel-macron-france-shock-vote-coalition-centrist-thursday-president-elections-2024-nfp/,"The ""France Excellence Europa"" scholarship program allows students from 26 European Union countries to obtain scholarships to study at the Master's level in a...",0.503,POSITIVE,0.989,0.505,NEGATIVE,0.602
11/25/2024,Financial Times,France drops buy-EU demand for Brussels defence fund,"France has dropped its opposition to non-EU companies accessing EU-funded financial incentives for Europe's defence industry, as Brussels...",https://www.ft.com/content/f556667f-c2c2-4111-8dda-bc5b6ed9ce10,0.5650000000000001,NEGATIVE,0.9972,0.5318750000000001,NEGATIVE,0.5194
11/22/2024,BBC,France 37-23 Argentina: Les Bleus overcome Pumas in autumn finale,France avenge their summer defeat by Argentina with a comfortable victory in Paris to maintain their winning run in the Autumn Nations...,https://www.telegraph.co.uk/world-news/2024/11/25/russia-ukraine-war-uk-france-troops-peskov-starmer-macron/,0.5,POSITIVE,0.9905,0.500625,POSITIVE,0.9854
11/23/2024,Business Insider,"I've traveled my whole life, but at 75, a trip to an adult women's camp in France changed my life","Victoria Goyet, 76, attended Camp Château in southwest France. The experience left her with a life-changing realization.",https://www.lbc.co.uk/news/russia-ukraine-uk-france-troops-war/,0.6475000000000002,POSITIVE,0.8354,0.5027272727272728,POSITIVE,0.9983
11/25/2024,Munster Rugby | Home,Ireland U20s To Face England & France At Virgin Media Park,Munster Rugby - Ireland U20s To Face England & France At Virgin Media Park.,https://www.politico.eu/article/west-red-lines-help-ukraine-france-jean-noel-barrot-russia-missile/,0.5033333333333333,POSITIVE,0.9703,0.49875,POSITIVE,0.9953
11/22/2024,tntsports.co.uk,Autumn Nations Series highlights: France complete perfect campaign with convincing win over Argentina - Rugby video,Watch highlights as France claimed a convincing 37-23 win over Argentina at the Stade de France to complete a perfect Autumn Nations Series...,https://www.thetimes.com/world/russia-ukraine-war/article/france-ukraine-long-range-scalp-missiles-russia-zl6tz335s,0.5333333333333333,POSITIVE,0.9997,0.5107692307692309,POSITIVE,0.9992
11/25/2024,Jewish Insider,Netanyahu rejects France’s part in potential Lebanon cease-fire unless it recants ICC arrest threat,Biden called Macron to reach compromise; Lebanon has required France to play a central role in monitoring the possible cease-fire with...,https://www.bbc.co.uk/sport/rugby-union/articles/c170y179e1do,0.495,NEGATIVE,0.9952,0.5030769230769231,POSITIVE,0.6958
11/25/2024,The Jewish Chronicle,Almost 1 in 5 young French people think Jews leaving France would be a good thing,The study also shows a growing divide between different age groups in France.,https://www.france24.com/en/france/20241123-hundreds-of-organisations-to-protest-violence-against-women-across-france,0.5,NEGATIVE,0.9078,0.5095454545454546,POSITIVE,0.9859
11/22/2024,Ministère de l'Europe et des Affaires étrangères,"Ukraine has a right to defend itself against Russian aggression, says (...) - France in the UK","Paris, 20 November 2024. Q. – What's your reaction, France's reaction to the immediate development, i.e. the firing of Storm Shadow missiles...",https://www.reuters.com/world/europe/france-promises-help-chemical-submission-victims-amid-mass-rape-trial-2024-11-25/,0.509375,POSITIVE,0.5044,0.5275000000000001,POSITIVE,0.9715
11/25/2024,Publishing Perspectives,From Frankfurt to France: Rising Rights Sales for ‘Marceau Miller’,"'The Novel of Marceau Miller,' written by a pseudonymous author, is to be released in January by a happily surprised publisher in Paris.",https://news.sky.com/story/thousands-protest-against-sexual-violence-in-france-as-gisele-pelicot-trial-continues-13259096,0.495,POSITIVE,0.9975,0.5692857142857143,POSITIVE,0.995
11/25/2024,Ski Club Of Great Britain,Win A Stay With Ski France!,"Competition, Member Exclusive. Win A Stay With Ski France! Date01 Dec 24. Time11:59 pm. LocationOnline Competition. Log in or join to access tickets.",https://www.aljazeera.com/news/2024/11/23/thousands-protest-against-sexual-violence-in-france,0.505,POSITIVE,0.9982,0.51,POSITIVE,0.978
11/21/2024,ING Think,France’s economic outlook darkens,France's latest business climate data provides further evidence of the worsening economic outlook in France.,https://www.google.com/search?q=France&sca_esv=a67a64356a29d00d&biw=929&bih=865&tbm=nws&story=GkQIpQEaIAoTc3RvcnlfbGFiZWxfcGFydGlhbBIJbWFzcyByYXBlGh0KE3N0b3J5X2xhYmVsX3BhcnRpYWwSBkZyYW5jZTIwCia14ZKi9NiInxXU4oP397TF9sQBhvfNyLnVlI5Dv_rNi_zx3fPrARD77-zdDBgFcgIQAg&fcs=ACgqzeePUrC96PyALeFels7L9IF64EAbyw&sa=X&ved=2ahUKEwjIydmhivmJAxVyXEEAHTgRL24Q7IUHegQIIRAF,0.505,NEGATIVE,0.9976,0.5062500000000001,NEGATIVE,0.816
11/25/2024,France ONU,Libya: France will continue to provide its support for the essential work of the ICC,"Mr. President,. I thank Prosecutor Karim Khan for the presentation of his 28th report to the Security Council in implementation of...",https://www.euronews.com/my-europe/2024/11/25/frances-far-right-threatens-to-bring-down-the-government-over-draft-budget,0.4975,POSITIVE,0.9799,0.5231250000000001,POSITIVE,0.9523
11/25/2024,Daily Express,UK and France 'in talks' to deploy troops to Ukraine over fears of US removing support,"Britain and France are in talks to send troops to Ukraine to deter Vladimir Putin, it has emerged. London and Paris want to create a “core...",https://www.telegraph.co.uk/news/2024/11/25/le-pen-in-her-power-to-crash-frances-fifth-republic-barnier/,0.4925,NEGATIVE,0.8283,0.5205,POSITIVE,0.7843
11/23/2024,The Home of Rugby League,France Wheelchair defeat England in Fassolette-Kielty Trophy,The return of Nicolas Clausells inspired France to a revenge victory over England which regained the Fassolette-Kielty Trophy in a compelling and often...,https://www.france24.com/en/live-news/20241125-le-pen-meets-pm-as-french-government-wobbles,0.5033333333333333,NEGATIVE,0.9532,0.4992857142857143,POSITIVE,0.9998
11/25/2024,Ski Club Of Great Britain,France Ski Holidays Top Choice For Brits,France ski holidays top choice for Brits – 1000 polled. A poll of over 1000 skiers and snowboarders by top UK specialist SNO reveals France...,https://www.thetimes.com/world/europe/article/is-budget-vote-the-moment-le-pen-will-finally-fell-frances-government-thx0ll99h,0.505,POSITIVE,0.9996,0.5125000000000001,POSITIVE,0.9254
11/21/2024,The Home of Rugby League,England Wheelchair defeat Spain in France,Joe Coyd and Jack Heggie combined to devastating effect as England overcame a spirited Spain challenge in an entertaining Wheelchair Rugby...,https://www.businessinsider.com/travel-adult-womens-camp-france-2024-11,0.5033333333333333,NEGATIVE,0.8223,0.499,POSITIVE,0.991
11/25/2024,The Telegraph,Israel gives green light to Hezbollah ceasefire deal in Lebanon,Vote to be taken on US-brokered deal to end violence.,https://www.munsterrugby.ie/2024/11/25/ireland-u20s-to-face-england-france-at-virgin-media-park/,0.5,NEGATIVE,0.9446,0.51625,NEGATIVE,0.6597
11/27/2024,The Guardian,France says Netanyahu is immune from ICC warrant as Israel is not member of court,Claim comes after Paris signalled it would fulfil obligations as signatory to Rome statute after arrest warrant issued.,https://www.theguardian.com/world/2024/nov/27/france-says-netanyahu-is-immune-from-icc-warrant-as-israel-is-not-member-of-court,0.5,NEGATIVE,0.9672,0.5138888888888888,NEGATIVE,0.9049
11/27/2024,Financial Times,France may not enforce ICC arrest warrant for Benjamin Netanyahu,France has suggested it would not necessarily detain Israeli Prime Minister Benjamin Netanyahu if he entered the country despite an outstanding arrest...,https://www.ft.com/content/6a61504d-2788-41cd-913c-e4546dfc6bcf,0.5650000000000001,NEGATIVE,0.9978,0.506875,NEGATIVE,0.9773
11/27/2024,Daily Express,France economy meltdown fears as stock market plunges,French borrowing costs have surged past Greece with rising investor concerns who are now favouring US assets instead.,https://www.express.co.uk/news/world/1981640/france-economy-meltdown-fears-stock,0.4925,NEGATIVE,0.9859,0.5942857142857144,NEGATIVE,0.9619
11/27/2024,Reuters,French blue-chips lead European stocks lower on budget angst,"French stocks hit a more than three-month low on Wednesday as investors fretted about the fragile government's ability to push through its budget,...",https://www.reuters.com/markets/europe/european-shares-slip-amid-trump-tariff-woes-french-lenders-drop-2024-11-27/,0.505,NEGATIVE,0.9982,0.5055555555555556,NEGATIVE,0.9998
11/27/2024,Reuters,"Exclusive: France is weighing zero-interest loan for 6 nuclear reactors, sources say",French officials are drawing up plans to provide an interest-free loan to state-owned power utility EDF to finance a significant portion of the construction...,https://www.reuters.com/business/energy/france-is-weighing-zero-interest-loan-6-nuclear-reactors-sources-say-2024-11-27/,0.505,NEGATIVE,0.8318,0.501,NEGATIVE,0.9914
11/27/2024,The Telegraph,Wanted! Jolly people to help plug France’s Father Christmas shortage,Rude children and long hours are causing a Father Christmas shortage in France as men increasingly refuse to take on the jolly white-bearded role.,https://www.telegraph.co.uk/world-news/2024/11/27/wanted-hundreds-of-santas-to-fill-shortage-of-festive-roles/,0.5,POSITIVE,0.9937,0.4977777777777778,NEGATIVE,0.9989
11/27/2024,Reuters,"Israel-Hezbollah truce holds, Israel sets south Lebanon curfew","While the ceasefire largely held on Wednesday morning, Israel said it identified Hezbollah operatives returning to areas near the border and had opened fire...",https://www.reuters.com/world/middle-east/israel-hezbollah-ceasefire-takes-effect-2024-11-27/,0.505,NEGATIVE,0.9636,0.5083333333333333,NEGATIVE,0.9653
11/27/2024,Servier,Servier inaugurates a bioproduction plant in France to support the growth of its R&D programs,"This strategic unit will enable innovative therapies to be developed more rapidly, particularly in the field of oncology.",https://servier.com/en/newsroom/inaugurates-bioproduction-plant-france/,0.5,POSITIVE,0.9627,0.5415000000000001,POSITIVE,0.9993
11/27/2024,Reuters,Scenes from Lebanon as Israel-Hezbollah ceasefire takes effect,"A ceasefire between Israel and Lebanese armed group Hezbollah held on Wednesday after the two sides struck a deal brokered by the U.S. and France,...",https://www.reuters.com/pictures/scenes-lebanon-israel-hezbollah-ceasefire-takes-effect-2024-11-27/,0.505,NEGATIVE,0.7355,0.5042857142857142,NEGATIVE,0.8516
11/27/2024,Reuters,Air Europa's owner Globalia confirms interest from Air France-KLM,Spanish airline Air Europa's owner Globalia said on Wednesday there was an interest from Air France-KLM in potentially taking a stake in the airline.,https://www.reuters.com/markets/deals/air-europas-owner-globalia-confirms-interest-air-france-klm-2024-11-27/,0.505,NEGATIVE,0.8029,0.5061111111111111,NEGATIVE,0.9547
11/27/2024,PBS,What to know about the Israeli-Hezbollah cease-fire deal,A ceasefire deal that went into effect on Wednesday could end more than a year of cross-border fighting between Israel and Lebanon's Hezbollah militant...,https://www.pbs.org/newshour/world/what-to-know-about-the-israeli-hezbollah-cease-fire-deal,0.5,POSITIVE,0.9922,0.5208333333333334,NEGATIVE,0.7693
11/27/2024,Daily Express,Disaster for Macron as France faces 'government shutdown' over budget 'civil war',"France may be heading for ""government shutdown"", as left-wing and right-wing forces appear set to ""bring down the government"" over its controversial budget.",https://www.express.co.uk/news/world/1981498/france-budget-macron-barnier-le-pen,0.4925,NEGATIVE,0.9996,0.5044444444444445,NEGATIVE,0.9963
11/27/2024,Manchester City FC,OSC France members visit the Etihad,Six members of the Official Supporters Club in France came to Manchester to visit the Etihad Stadium and support their favourite team.,https://www.mancity.com/news/club/france-osc-members-visit-etihad-63868313,0.5116666666666667,POSITIVE,0.9836,0.501,POSITIVE,0.9963
11/27/2024,The Telegraph,France backtracks on ICC arrest warrant for Netanyahu,France appeared to have backtracked on whether it would arrest Benjamin Netanyahu if he set foot in the country. It comes amid reports that the Israeli...,https://www.telegraph.co.uk/world-news/2024/11/27/france-u-turn-netanyahu-icc-arrest-warrant/,0.5,NEGATIVE,0.9662,0.4991666666666667,NEGATIVE,0.9986
11/27/2024,Daily Express,The 10 friendliest countries for tourists in Europe - even France makes the list,"There are many factors to consider when choosing your next holiday destination - accommodation, climate and cuisine, but also how welcome you are made to...",https://www.express.co.uk/travel/articles/1981275/10-friendliest-countries-tourists-europe,0.4925,POSITIVE,0.9974,0.5225,POSITIVE,0.9975
11/27/2024,POLITICO.eu,France is approaching a moment of humiliation in financial markets as budget chaos mounts,The growing sense of crisis over France's budget is driving the country toward a moment of humiliation in financial markets: It seems only a matter of time...,https://www.politico.eu/article/france-budget-chaos-financial-markets-humiliation-michel-barnier/,0.505,NEGATIVE,0.9984,0.5227777777777778,NEGATIVE,0.9899
11/27/2024,Yahoo,"Reju, Nouvelles Fibres Textiles partner to bolster textile recycling in France","Reju, a textile materials regeneration company, and French company Nouvelles Fibres Textiles (NFT) have reached a partnership aimed at sourcing and...",https://www.yahoo.com/finance/news/reju-nouvelles-fibres-textiles-partner-125854803.html,0.5,POSITIVE,0.9965,0.5083333333333333,POSITIVE,0.8572
11/27/2024,Reuters,"Morning Bid: Holiday-bound US turns focus to inflation, France tense",A look at the day ahead in U.S. and global markets from Mike Dolan. With Wall Street about to log off for what's effectively a four-day Thanksgiving holiday...,https://www.reuters.com/markets/us/global-markets-view-usa-2024-11-27/,0.505,NEGATIVE,0.931,0.5185000000000001,NEGATIVE,0.7404
11/27/2024,The Spectator,Michel Barnier has brought France to the verge of collapse,A new Anglo-Saxon barbarism has entered the French political language: 'government shutdown.' There is excited talk of civil servants not being paid.,https://www.spectator.co.uk/article/michel-barnier-has-brought-france-to-the-verge-of-collapse/,0.5,NEGATIVE,0.9356,0.49666666666666665,NEGATIVE,0.9998
11/27/2024,Chelsea Football Club,Sonia Bompastor on playing for France: Some of the best times of my life | News | Official Site,A number of Blues are currently away representing their respective national teams. Somebody who knows what that honour feels like is our head coach Sonia...,https://www.chelseafc.com/en/news/article/sonia-bompastor-on-playing-for-france-some-of-the-best-times-of-my-life,0.5,POSITIVE,0.9906,0.5269999999999999,POSITIVE,0.7557
11/27/2024,The Home of Rugby League,Four England Wheelchair Players Nominated for the 2024 IRL Golden Boot,England Wheelchair head coach Tom Coyd has congratulated four of his players for their inclusion on International Rugby League's long list of contenders to...,https://www.rugby-league.com/article/63296/four-england-wheelchair-players-nominated-for-the-2024-irl-golden-boot,0.5033333333333333,POSITIVE,0.9908,0.50875,POSITIVE,0.9963
11/27/2024,Toyota Europe Newsroom,Toyota passes 5 million production milestone in France,"The 5 millionth vehicle has rolled off the production line at Toyota Motor Manufacturing France (TMMF) since operation began in 2001. A bespoke Yaris Cross,...",https://newsroom.toyota.eu/toyota-passes-5-million-production-milestone-in-france/,0.5216666666666666,POSITIVE,0.9975,0.5858333333333334,POSITIVE,0.9935
11/27/2024,Daily Mail,"Europe finally faces up to migrant crisis: Germany looks set to vote in anti-migrant chancellor, France blames","European governments have begun to face up to the challenges of the migrant crisis, making moves to provide a fair system that cuts casualties and protects...",https://www.dailymail.co.uk/news/article-14113665/Europe-finally-faces-migrant-crisis-Germany-looks-set-vote-anti-migrant-chancellor-France-blames-soft-UK-Channel-crossings-Ireland-faces-homeless-crisis-hard-right-Meloni-tackled-problem.html,0.49,NEGATIVE,0.8659,0.5075000000000001,POSITIVE,0.962
11/27/2024,NHK,Osaka governor in France to promote World Expo 2025,"The governor of Osaka Prefecture in western Japan is in France to promote next year's World Exposition, which will be held in Osaka.",https://www3.nhk.or.jp/nhkworld/en/news/20241127_10/,0.5,POSITIVE,0.9919,0.5191666666666667,POSITIVE,0.7741
11/27/2024,NHK,"US, France vow to make sure Israel-Lebanon ceasefire is implemented",The United States and France have pledged to make sure that the Israeli and Lebanese governments fully implement a ceasefire.,https://www3.nhk.or.jp/nhkworld/en/news/20241127_12/,0.5,NEGATIVE,0.9558,0.5116666666666667,NEGATIVE,0.8404
11/27/2024,Reuters,"Air France-KLM in talks to take a 20% stake in Air Europa, El Economista says","Franco-Dutch airline group Air France-KLM is in talks to take a 20% stake in Spanish airline Air Europa, newspaper El Economista said on Wednesday,...",https://www.reuters.com/markets/deals/air-france-klm-talks-take-20-stake-air-europa-el-economista-says-2024-11-27/,0.505,NEGATIVE,0.8834,0.515,NEGATIVE,0.9819
11/27/2024,This is Money,Why are Britons getting speeding tickets from France? 'Mystery' over fines with no agreement in place,"France is continuing to send speeding fines to UK motorists despite there being no explanation as to how French authorities are getting hold of UK data,...",https://www.thisismoney.co.uk/money/cars/article-14123463/French-fine-mystery-remains-speeding-fines-reaching-UK-motorists-theres-no-data-sharing-place-two-countries.html,0.53,NEGATIVE,0.9998,0.5322222222222223,NEGATIVE,0.9986
11/27/2024,The Telegraph,France is playing with fire: an IMF bailout is no longer unthinkable,"France is pushing its luck. The country has long enjoyed an “exorbitant privilege” within the EU, able to borrow at rock-bottom German rates because it is...",https://www.telegraph.co.uk/business/2024/11/27/france-playing-fire-imf-bailout-no-longer-unthinkable/,0.5,POSITIVE,0.5173,0.4964285714285714,NEGATIVE,0.6937
