date of comment,main comment,comment,depth,PTR Sentiment (Comment),Flair Outlook,Flair Score
,nan,Forget TSMC: PornHub VR Is Already After Metaverse,0,nan,nan,nan
,nan,Lol metaverse has always been around before the hype how much better could it get then call of duty or battlefield and so on,1,nan,nan,nan
,nan,"Forget PornHub, verse is after meta",1,nan,nan,nan
,nan,Lol,0,nan,nan,nan
,nan,I thought second life was the metaverse?,0,nan,nan,nan
,nan,But without fake TVs showing ads.,1,nan,nan,nan
,nan,Monkey see Monkey do | Good way to get your company’s stock up is to mention metaverse,0,nan,nan,nan
,nan,😂,0,nan,nan,nan
