Date Posted,Source,Headline,Preview,Link,PTR Headline Sentiment,Flair Headline Outlook,Flair Headline Score,PTR Preview Sentiment,Flair Preview Outlook,Flair Preview Score
12/1/2024,Financial Times,"Sale of UK tech gem Arm was ‘big mistake’, says Nick Train",https://www.ft.com/content/f53e37ee-7b0e-4f02-8657-8e8eb77c32dd,"Nick Train, one of the UK's best-known fund managers, has branded the sale of British chip designer Arm “a mistake” that potentially...",0.53,NEGATIVE,0.993,0.507,POSITIVE,0.936
12/3/2024,TechRadar,"Microsoft’s claim that Arm-based Copilot+ PCs are “fastest, most intelligent Windows PCs” is debunked on X – and the community’s verdict isn’t wrong",https://www.techradar.com/computing/windows/microsofts-claim-that-arm-based-copilot-pcs-are-fastest-most-intelligent-windows-pcs-is-debunked-on-x-and-the-communitys-verdict-isnt-wrong,'Be careful what you post on social media' might be a lesson Microsoft is just now learning: a swift nugget of PR that was published on X...,0.509,POSITIVE,0.947,0.51,NEGATIVE,0.991
12/3/2024,The Telegraph,US Navy will get re-arm at sea capability to give it edge in China conflict,https://www.telegraph.co.uk/us/news/2024/12/02/us-navy-to-re-arm-at-sea-amid-china-threat/,"Engineers adapting crane that can be fitted to a warship, removing need for vessels to travel thousands of miles back to base.",0.524,NEGATIVE,0.757,0.531,NEGATIVE,0.817
12/2/2024,STV News,Man died after getting arm and neck trapped in log chipper machine on farm in Aberfeldy,https://news.stv.tv/north/man-died-after-getting-arm-and-neck-trapped-in-log-chipper-machine-on-farm-in-aberfeldy,"A FAI found Andrew Sinclair died after his clothes became entangled in the machine, leading to arm and neck injuries.",0.507,NEGATIVE,0.987,0.514,NEGATIVE,0.999
12/1/2024,Yahoo Finance,Is AI Stock Arm Holdings Going to $160? 1 Wall Street Analyst Thinks So.,https://finance.yahoo.com/news/ai-stock-arm-holdings-going-123000772.html,"The artificial intelligence (AI) stock craze, although it's moderated some in recent times, is a long-tail trend that began around two years...",0.597,NEGATIVE,0.998,0.581,POSITIVE,0.865
12/2/2024,Variety,"Mubi Launching Global Publishing Arm, Sets First Book Release for 2025 (EXCLUSIVE)",https://variety.com/2024/film/global/mubi-publishing-arm-book-editions-1236225946/,"The arthouse distributor, streamer and production company will launch Mubi Editions and aims to publish two to three titles in its first...",0.535,POSITIVE,0.992,0.522,POSITIVE,0.993
12/2/2024,Bloody Elbow,UFC champion Alex Pereira humbles massive bodybuilder in intense arm wrestling contest,https://bloodyelbow.com/2024/12/01/ufc-champion-alex-pereira-humbles-massive-bodybuilder-in-intense-arm-wrestling-contest/,Alex Pereira made a bodybuilder quit during an arm wrestling bout during a recent visit to Korea. The UFC light-heavyweight champion has...,0.503,POSITIVE,0.999,0.506,POSITIVE,0.959
12/1/2024,The Motley Fool,Is Arm Holdings Stock a Buy Now?,https://www.fool.com/investing/2024/12/01/is-arm-holdings-stock-a-buy-now/,"The semiconductor space has had its fair share of big winners this year, with Arm Holdings (ARM 4.50%) among them. Its stock price is up...",0.665,POSITIVE,0.905,0.582,NEGATIVE,0.697
12/3/2024,The Hill,Immigration advocacy group launches political arm to counter Trump agenda,https://thehill.com/latino/5019440-immigration-advocacy-group-launches-political-arm/,A top immigration advocacy group announced on Tuesday a new political arm to highlight the human consequences of the incoming Trump...,0.538,POSITIVE,0.902,0.539,POSITIVE,0.581
12/3/2024,crypto.news,Nike’s NFT arm RTFKT to shut down after launching final collection,https://crypto.news/nikes-nft-arm-rtfkt-to-shut-down-after-launching-final-collection/,Nike-owned non-fungible token studio RTFKT will wind down operations sometime in January 2025 after launching one last collection.,0.508,NEGATIVE,1.0,0.512,NEGATIVE,1.0
12/3/2024,The Chiswick Calendar,Chiswick sculptor who broke her arm when she fell off her bike would like to thank the kind people who helped her,https://chiswickcalendar.co.uk/chiswick-sculptor-who-broke-her-arm-when-she-fell-off-her-bike-would-like-to-thank-the-kind-people-who-helped-her/,"Image: Gillian Brett. Guest blog by Gillian Brett. Gillian Brett, Chiswick resident and sculptor who also teaches locally, fell off her bike...",0.485,POSITIVE,0.996,0.495,POSITIVE,0.533
12/3/2024,NME,"Kacey Musgraves addresses concertgoer who grabbed her arm: “She kinda ruined it for everybody""",https://www.nme.com/news/music/kacey-musgraves-addresses-concertgoer-who-grabbed-her-arm-she-kinda-ruined-it-for-everybody-3818329,Kacey Musgraves has addressed the moment a concertgoer grabbed her arm at one of her latest shows while on tour.,0.503,NEGATIVE,0.998,0.511,NEGATIVE,0.895
12/3/2024,Insurance Times,Gallagher announces three senior hires for UK and Ireland retail arm,https://www.insurancetimes.co.uk/news/gallagher-announces-three-senior-hires-for-uk-and-ireland-retail-arm/1453881.article,"'These appointments enhance my leadership team and give us a springboard for further profitable growth,' says managing director.",0.52,POSITIVE,0.953,0.523,POSITIVE,0.578
12/3/2024,Investment Week,L&G asset management arm becomes latest to distance itself from SDR labels,https://www.investmentweek.co.uk/news/4384865/asset-management-arm-distance-sdr-labels,"L&G's asset management division has removed the word 'sustainable' from its funds, and now none of its strategies will feature it going...",0.516,NEGATIVE,0.986,0.524,POSITIVE,0.805
12/3/2024,PrimeResi,Lloyds’ private equity arm exits major estate agency group,https://primeresi.com/lloyds-private-equity-arm-exits-major-estate-agency-group/,"Lloyds Banking Group's private equity outfit, LDC, has exited its investment in UK lettings and estate agency business Lomond,...",0.544,NEGATIVE,0.993,0.537,NEGATIVE,0.975
12/3/2024,Techno-Science.net,Neuralink: a robotic arm controlled by thought 🦾,https://www.techno-science.net/en/news/neuralink-robotic-arm-controlled-by-thought-N26110.html,"A robotic arm that obeys human thoughts: this idea, worthy of science fiction, is the new ambition of Neuralink, Elon...",0.509,NEGATIVE,0.778,0.544,POSITIVE,0.868
12/3/2024,Readly | All magazines - one magazine app subscription,Can nvidia make arm chips work for gaming? - 3 Dec 2024 - Maximum PC Magazine,https://gb.readly.com/magazines/maximum-pc/2024-12-03/6747b6ba2e2fcecc9396ddb6,"THE LATEST WHISPERS claim that Nvidia will put a new SoC into production in September 2025, and that it will be aimed at 'high-end' PCs.",0.529,POSITIVE,0.958,0.507,POSITIVE,0.974
12/3/2024,Stroud News and Journal,Marston’s cuts debts and returns to profit after selling brewing arm,https://www.stroudnewsandjournal.co.uk/news/national/24767281.marstons-cuts-debts-returns-profit-selling-brewing-arm/,Boss Justin Platt said the business has entered into “an exciting new chapter” after becoming a pure pub business.,0.526,POSITIVE,0.967,0.527,POSITIVE,0.951
12/3/2024,eeNews Europe,World’s coldest ARM processor ...,https://www.eenewseurope.com/en/worlds-coldest-arm-processor/,Equal1 in Ireland has successfully tested the world's most complex and coldest Quantum controller chip using cores from ARM in the UK.,0.509,NEGATIVE,1.0,0.508,NEGATIVE,0.999
12/3/2024,PR Newswire,Intel's Real Threat: ARM? Per Liftr Insights data,https://www.prnewswire.com/news-releases/intels-real-threat-arm-per-liftr-insights-data-302320334.html,"Liftr Insights data shows the impact of ARM on Intel, especially with the introduction of Azure Cobalt and Google Axion. AUSTIN, Texas, Dec.",0.542,NEGATIVE,0.985,0.526,POSITIVE,0.539
12/3/2024,The Mirror,Prince William wraps protective arm around Kate Middleton as she makes return to spotlight,https://www.mirror.co.uk/news/royals/breaking-kate-middleton-breaks-cover-34235989,The Princess of Wales is taking part in her biggest and most significant royal event since she finished cancer treatment by joining Prince...,0.514,POSITIVE,1.0,0.517,NEGATIVE,0.951
12/3/2024,Insurance Business America,AIG finalizes sale of travel insurance arm to Zurich,https://www.insurancebusinessmag.com/au/news/travel/aig-finalizes-sale-of-travel-insurance-arm-to-zurich-516368.aspx,It retains group accident & health travel products amid divestment.,0.516,NEGATIVE,0.791,0.516,NEGATIVE,0.704
12/3/2024,AltAssets Private Equity News,Investec asset management arm hits 40% of €500m target in first close of sophomore private debt fund,https://www.altassets.net/private-equity-news/by-region/europe-by-region/western-europe-europe-by-region/united-kingdom-western-europe-europe-by-region/investec-asset-management-arm-hits-40-of-e500m-target-in-first-close-of-sophomore-private-debt-fund.html,"Investec Bank's asset management subsidiary has hit a €200m first close for its second private debt fundraise, reaching 40% of its €500m...",0.515,POSITIVE,0.512,0.541,NEGATIVE,0.867
12/2/2024,Arm Newsroom,Beyond the Newsroom: Exploring Tech Innovations from Arm in November 2024,https://newsroom.arm.com/blog/latest-tech-innovations-from-arm-november-2024,"The latest tech innovations at Arm from November 2024, including efficient AI development, system on chip architecture and sentiment...",0.524,POSITIVE,0.997,0.525,POSITIVE,0.951
12/2/2024,employeebenefits.co.uk,Arm recruits chief people officer,https://employeebenefits.co.uk/total-reward/arm-recruits-chief-people-officer/280071.article,"Semiconductor and software design firm Arm has recruited Charlotte Eaton as its new chief people officer, with immediate effect.",0.505,NEGATIVE,0.788,0.512,NEGATIVE,0.993
12/3/2024,SeeNews,JYSK's Croatian arm increases EBIT 29% in FY 2023/24,https://seenews.com/news/jysks-croatian-arm-increases-ebit-29-percent-in-fy-202324-1267508,The Croatian unit of Danish bedding and furniture retailer JYSK said on Tuesday its earnings before interest and taxes (EBIT) rose 28.6% to...,0.507,POSITIVE,0.852,0.539,POSITIVE,0.896
12/3/2024,www.tradingview.com,Blockchain for IoT Minima to Develop Ledger-Embedded Microchips With ARM,https://www.tradingview.com/news/coindesk:ae9f8a3d3094b:0-blockchain-for-iot-minima-to-develop-ledger-embedded-microchips-with-arm/,"Minima, a blockchain designed to manage transactions across the internet of things (IoT) comprising mobile phones, cars and other devices is...",0.509,POSITIVE,0.973,0.514,POSITIVE,0.859
12/3/2024,Vatican News,"Arms producers increasing profits globally amid conflicts, report says",https://www.vaticannews.va/en/world/news/2024-12/arms-producers-increasing-profits-globally-amid-conflicts.html,"A report from the Stockholm International Peace Research Institute (SIPRI) shows that in 2023 the weapons trade increased profits by 4,2 per...",0.516,NEGATIVE,0.531,0.512,NEGATIVE,0.504
12/3/2024,ESG Dive,BNP Paribas’ asset management arm to exclude new oil and gas bonds,https://www.esgdive.com/news/bnp-paribas-asset-management-arm-to-exclude-new-oil-and-gas-bonds/734326/,The updated investment strategy comes approximately a year after BNP Paribas Group began refraining from participating in bond issuance by...,0.558,POSITIVE,0.745,0.547,NEGATIVE,0.899
12/3/2024,SeeNews,JYSK's Slovenian arm grows EBIT 17% in FY 2023/24,https://seenews.com/news/jysks-slovenian-arm-grows-ebit-17-percent-in-fy-202324-1267498,The Slovenian unit of Danish bedding and furniture retailer JYSK said on Tuesday its earnings before interest and taxes (EBIT) rose 17.1% to...,0.506,POSITIVE,0.724,0.538,POSITIVE,0.884
12/3/2024,DIGITIMES Asia,"Arm aims beyond semiconductors, targeting AI hardware, software, ecosystem",https://www.digitimes.com/news/a20241203PD216/arm-hardware-software-ceo-mobile.html,"Arm CEO Rene Haas has openly expressed his aspirations for AI, envisioning that all future AI applications will run on Arm technology in...",0.557,POSITIVE,0.972,0.553,POSITIVE,0.762
11/27/2024,Department of Health,Health Minister outlines support for Children & Families arm’s-length body,https://www.health-ni.gov.uk/news/health-minister-outlines-support-children-families-arms-length-body,Health Minister Mike Nesbitt has expressed his support for the establishment of a new Children and Families arm's-length body (ALB).,0.507,POSITIVE,0.912,0.513,POSITIVE,0.669
12/2/2024,City AM,MHA: Baker Tilly UK arm posts 32 per cent revenue jump,https://www.cityam.com/mha-baker-tilly-uk-arm-posts-32-per-cent-revenue-jump/,"MHA, the UK and Irish arm of Baker Tilly International, has reported a 32 per cent jump in half-year revenue, led by audit and tax.",0.532,NEGATIVE,0.979,0.526,NEGATIVE,0.999
12/3/2024,Arm Newsroom,"Accelerating Cloud Innovation with AWS Graviton4 Processors, Powered by Arm Neoverse",https://newsroom.arm.com/blog/arm-aws-reinvent-2024,AWS re:Invent 2024 will provide more evidence for how the Arm-powered Graviton4 is meeting performance and power-efficiency needs for AI.,0.506,POSITIVE,0.999,0.513,POSITIVE,0.771
12/3/2024,Los Angeles Times,Opinion: Biden should arm Ukraine to the teeth to prepare for the best negotiated peace,https://www.latimes.com/opinion/story/2024-12-03/biden-ukraine-trump-russia-putin,"Before leaving office in January, President Biden can still do much to bolster Ukraine's security, and our own. The need for greater U.S....",0.516,NEGATIVE,0.914,0.519,NEGATIVE,0.593
12/3/2024,www.jomfruland.net,Unexpected Surge: Why Arm Stock is Breaking Records,https://www.jomfruland.net/unexpected-surge-why-arm-stock-is-breaking-records/,The financial world has been abuzz with the latest developments surrounding Arm Holdings as its stock continues an unexpected upward...,0.578,POSITIVE,0.935,0.593,POSITIVE,0.616
12/2/2024,Global Corporate Venturing,Artispong takes the reins at Thai bank Krungsri's investment arm -,https://globalventuring.com/corporate/people/palida-artispong-krungsri-finnovate/,"Palida Artispong is moving up at financial services firm Krungsri's corporate venture capital arm, promoted to acting managing director.",0.527,NEGATIVE,0.546,0.504,POSITIVE,0.729
12/3/2024,Game Rant,Game Awards 2024 Could Be The Shot in The Arm One GOTY Nominee Needed,https://gamerant.com/game-awards-2024-ff7-final-fantasy-7-rebirth-sales-spike/,"The Game Awards 2024 hasn't even aired yet, but it seems to have already given one GOTY nominee a much-needed shot in the arm.",0.516,NEGATIVE,0.988,0.552,POSITIVE,0.998
12/2/2024,The Drinks Business,Stoli Group’s US arm files for bankruptcy,https://www.thedrinksbusiness.com/2024/12/stoli-groups-us-arm-files-for-bankruptcy/,"The US subsidiary of Stoli Group, owner of Stoli vodka and Kentucky Owl Bourbon, has filed for chapter 11 bankruptcy protection,...",0.522,NEGATIVE,0.979,0.519,NEGATIVE,0.98
12/3/2024,Insurance Asia,RACQ Bank’s insurance arm sale heralds' step towards revenue stability: report,https://insuranceasia.com/news/racq-banks-insurance-arm-sale-heralds-step-towards-revenue-stability-report,Members Banking Group or RACQ Bank's decision to sell its underwriting insurance business will enhance its ability to support its banking...,0.523,POSITIVE,0.973,0.525,POSITIVE,0.725
12/3/2024,MarketBeat,"5,805 Shares in Arm Holdings plc (NASDAQ:ARM) Bought by Concentric Capital Strategies LP",https://www.marketbeat.com/instant-alerts/5805-shares-in-arm-holdings-plc-nasdaqarm-bought-by-concentric-capital-strategies-lp-2024-12-03/,"Concentric Capital Strategies LP bought a new position in shares of Arm Holdings plc (NASDAQ:ARM - Free Report) in the 3rd quarter,...",0.527,NEGATIVE,0.821,0.517,POSITIVE,0.81
12/3/2024,MSN,Weapons cache sufficient to arm small army unearthed under Danish chieftain's house,https://www.msn.com/en-us/news/world/weapons-cache-sufficient-to-arm-small-army-unearthed-under-danish-chieftain-s-house/ar-AA1vbvmV,Archaeologists in Denmark have uncovered a remarkable cache of over 100 ancient weapons buried beneath the house of an Iron Age chieftain.,0.505,POSITIVE,0.714,0.519,POSITIVE,0.935
12/2/2024,Daily Mail,Stable hand who is suing after claiming her arm was crippled in fall from 'dangerous' horse is caught playing,https://www.dailymail.co.uk/news/article-14148039/Doggy-daycare-boss-suing-racehorse-trainer-claims-arm-disabled-fall-accused-lying.html,"A former stable hand suing for £436,000 over claims her arm was crippled in a fall from a 'dangerous' horse has been accused of lying after...",0.499,NEGATIVE,0.985,0.508,NEGATIVE,0.989
12/2/2024,France 24,"Global arms sales surge in 2023, driven by wars and tensions in Asia",https://www.france24.com/en/europe/20241201-global-arms-sales-2023-ukraine-gaza-wars-asia,"Global arms sales rose 4.2% to $632 billion in 2023, driven by conflicts in Ukraine, Gaza, and Asian tensions, according to a report by the...",0.588,POSITIVE,0.982,0.561,POSITIVE,0.941
12/2/2024,The Mirror,Doggy daycare boss accused of lying about arm injury after video shows her walking husky,https://www.mirror.co.uk/news/uk-news/doggy-daycare-boss-accused-lying-34230705,"Hazel Boyd is accused of lying after she was filmed pulling a husky on a lead, despite claiming her arm had been badly injured in a fall...",0.503,NEGATIVE,0.999,0.525,NEGATIVE,0.92
11/5/2024,Morningstar,"Arm Beats Earnings, Shares Still Overvalued",https://www.morningstar.co.uk/uk/news/257013/arm-beats-earnings-shares-still-overvalued.aspx,"ARM reported solid results, once again, with fiscal second-quarter revenue of USD 844 million (£649 million), above management's guided range of USD 780...",0.547,NEGATIVE,0.771,0.537,NEGATIVE,0.98
12/3/2024,Hindustan Times,"Who is Sufiyan Muqeem, Pakistan's rare left-arm wrist-spin bowler who took 5/3 and sent Zimbabwe crashing to 57 all-out?",https://www.hindustantimes.com/cricket/who-is-sufiyan-muqeem-pakistan-rare-left-arm-wrist-spin-bowler-who-took-5-3-and-sent-zimbabwe-crashing-to-57-allout-101733232880678.html,Sufiyan Muqeem claimed a five-wicket haul for just three runs as Zimbabwe were bundled for their lowest T20I score - 57. | Crickit.,0.502,POSITIVE,0.919,0.504,POSITIVE,0.673
11/29/2024,BBC,MMA: Brendan Loughnane's extraordinary tales from a fighting life before PFL Finals,https://www.bbc.com/sport/mixed-martial-arts/articles/cly2wnp14plo,From fighting with a broken arm to competing at the last minute in pink swimming shorts - Brendan Loughnane relives moments from a...,0.503,POSITIVE,0.999,0.504,POSITIVE,0.743
11/27/2024,National Museum of the Royal Navy,Joint Tour of The Fleet Air Arm Museum & Navy Wings,https://www.nmrn.org.uk/events/joint-tour-fleet-air-arm-museum-navy-wings-1,Calling all historic aviation enthusiasts! You are invited to a special collaboration between the Fleet Air Arm Museum and Navy Wings.,0.509,POSITIVE,1.0,0.509,POSITIVE,0.966
12/2/2024,Reuters,"World's top 100 defence groups boost arms sales by 4% in 2023, think tank SIPRI says",https://www.reuters.com/business/aerospace-defense/worlds-top-100-defence-groups-boost-arms-sales-by-4-2023-think-tank-sipri-says-2024-12-01/,"The world's 100 biggest defence equipment makers increased their arms sales by 4.2% in 2023 to $632 billion, fuelled by wars and regional...",0.574,POSITIVE,0.973,0.559,POSITIVE,0.994
12/2/2024,Combat Sports UK,Alex Pereira Korea Adventure: Arm Wrestling Showdowns & Fan Encounters,https://www.combatsportsuk.co.uk/alex-pereira-korea-adventure-arm-wrestling-showdowns-fan-encounters/,"UFC champ Alex Pereira shines in Korea, dominating in a viral arm wrestle, exploring, and enjoying a break after 3 epic title defences.",0.505,POSITIVE,0.998,0.51,POSITIVE,0.952
12/3/2024,Military Africa,Bulgarian Kalandor to arm Nigeria’s T-128 ATAK helicopter,https://www.military.africa/2024/12/bulgarian-kalandor-to-arm-nigerias-t-128-atak-helicopter/,Bulgarian arms dealer Kalandor has been tasked by the Nigerian Air Force to source for Turkish weapons systems and ammunition for its new...,0.505,POSITIVE,0.998,0.508,POSITIVE,0.569
12/3/2024,The Economic Times,Phillip’s machine manufacturing arm will bring Titanium and other hi-tech materials to India,https://m.economictimes.com/tech/technology/phillips-machine-manufacturing-arm-will-bring-titanium-and-other-hi-tech-materials-to-india/articleshow/115940079.cms,"PMT is in the works to source titanium from international markets such as the US and Germany, while also exploring regional exports to make...",0.532,POSITIVE,0.998,0.561,POSITIVE,0.992
11/28/2024,Screen Rant,"I've Changed My Mind, The Thunderbolts* Director's Recent Comments About Bucky's Arm In The Dishwasher Have Me Hopeful Marvel Will Handle His Story Properly",https://screenrant.com/thunderbolts-bucky-arm-dishwasher-marvel-movie-story-director-op-ed/,Bucky Barnes pulling his metal Vibranium arm from a dishwasher was one of the few shots focused on Sebastian Stan's Marvel character in the...,0.513,POSITIVE,0.988,0.512,NEGATIVE,0.769
12/2/2024,Sharecast News,K3 Business Technology proposes sale of NexSys Solutions arm,https://www.sharecast.com/news/aim-bulletin/k3-business-technology-proposes-sale-of-nexsys-solutions-arm--18229346.html,K3 Business Technology has proposed the sale of its NexSys Solutions unit to Advent-backed software firm SYSPRO for £36.0m.,0.599,NEGATIVE,0.973,0.562,NEGATIVE,0.781
12/1/2024,Journée Mondiale,My skinny arms gained 2 inches in 30 days (here’s what I did),https://www.journee-mondiale.com/en/my-skinny-arms-gained-2-inches-in-30-days-heres-what-i-did/,"Discover the secrets to transforming skinny arms into sculpted, powerful limbs using upper body machines. Learn about the science behind arm...",0.502,NEGATIVE,1.0,0.505,NEGATIVE,1.0
12/3/2024,Nasdaq,"Notable ETF Inflow Detected - SOXL, ADI, ARM, ASX",https://www.nasdaq.com/articles/notable-etf-inflow-detected-soxl-adi-arm-asx,"Looking today at week-over-week shares outstanding changes among the universe of ETFs covered at ETF Channel, one standout is the Direxion...",0.505,POSITIVE,0.639,0.509,NEGATIVE,0.561
12/3/2024,MarketBeat,Cerity Partners LLC Boosts Stock Position in Arm Holdings plc (NASDAQ:ARM),https://www.marketbeat.com/instant-alerts/cerity-partners-llc-boosts-stock-position-in-arm-holdings-plc-nasdaqarm-2024-12-03/,"Cerity Partners LLC grew its holdings in shares of Arm Holdings plc (NASDAQ:ARM - Free Report) by 141.2% in the third quarter, according to...",0.564,POSITIVE,0.998,0.543,POSITIVE,0.986
12/3/2024,BNN Bloomberg,Omers’ Private Equity Arm Buys IT Firm Integris From Frontenac,https://www.bnnbloomberg.ca/investing/2024/12/03/omers-private-equity-arm-buys-it-firm-integris-from-frontenac/,"Omers Private Equity is buying a majority stake in Integris, a US cybersecurity and IT consulting company, from Chicago-based Frontenac...",0.516,NEGATIVE,0.953,0.513,NEGATIVE,0.858
12/3/2024,The Economic Times,CCI clears ADIA arm’s investments in GMR Infra Enterprises,https://m.economictimes.com/industry/services/property-/-cstruction/cci-clears-adia-arms-investments-in-gmr-infra-enterprises/articleshow/115943813.cms,"The Competition Commission of India (CCI) has approved three transactions, including the subscription to optionally convertible debentures...",0.505,POSITIVE,0.96,0.553,POSITIVE,0.945
11/30/2024,Daily Mail,Miracle as Texas teen farmer survives freak accident that cost him his arm,https://www.dailymail.co.uk/news/article-14142601/Texas-teen-farmer-dead-burn-tractor-lost-arm.html,"Braycin Parrish, 17, has been left with horrendous burns, without an arm and some toes after he was almost fatally electrocuted while riding...",0.514,POSITIVE,1.0,0.512,NEGATIVE,0.975
12/3/2024,Yahoo Finance,"Zacks Investment Ideas feature highlights: Nvidia, Microsoft, Meta Platforms, Taiwan Semiconductor, Super Micro Computer, Vaneck Semiconductor ETF, Arm Holdings and Advanced Micro Devices",https://finance.yahoo.com/news/zacks-investment-ideas-feature-highlights-100000862.html,"Nvidia, Microsoft, Meta Platforms, Taiwan Semiconductor, Super Micro Computer, Vaneck Semiconductor ETF, Arm Holdings and Advanced Micro...",0.537,POSITIVE,0.998,0.521,POSITIVE,0.99
12/3/2024,NPR,U.S. will send Ukraine $725 million more in arms,https://www.npr.org/2024/12/03/g-s1-36575/us-ukraine-weapons,President Joe Biden has pledged to spend all of the military assistance funds Congress approved this year for Ukraine before the end of his...,0.59,NEGATIVE,0.989,0.513,POSITIVE,0.531
12/2/2024,ZDNet,This $28 'magic arm' makes taking pictures so much easier (and it's only $20 for Cyber Monday),https://www.zdnet.com/article/this-28-magic-arm-makes-taking-pictures-so-much-easier-and-its-only-20-for-cyber-monday/,"Forget tripods -- this concoction from SmallRig is a far better camera accessory, and it's on sale for Cyber Monday.",0.511,POSITIVE,1.0,0.51,POSITIVE,0.996
11/19/2024,University of Cambridge,Arm donates £3.5 million for Cambridge PhD students to study computer architecture and semiconductor design,https://www.cam.ac.uk/news/arm-donates-ps3-5-million-for-cambridge-phd-students-to-study-computer-architecture-and,"Arm is donating £3.5 million to enable 15 PhD students over the next five years to study at CASCADE, the University's new Computer...",0.55,POSITIVE,0.988,0.541,POSITIVE,0.993
07/31/2024,Arm Newsroom,Arm Holdings plc Reports Results for the First Quarter of the Financial Year Ended 2025,https://newsroom.arm.com/news/arm-holdings-plc-reports-results-for-the-first-quarter-of-the-financial-year-ending-2025,Arm today published a letter to its shareholders which contains the company's results for its fiscal first quarter of the financial year...,0.606,NEGATIVE,0.557,0.581,POSITIVE,0.581
12/3/2024,The New York Times,"U.S. Sending $725 Million in Arms to Ukraine, Including More Land Mines",https://www.nytimes.com/2024/12/02/us/politics/ukraine-weapons-shipments.html,"The package, the largest since April, comes amid deep concerns in Ukraine that the Trump administration may cut off aid.",0.563,NEGATIVE,0.988,0.516,NEGATIVE,0.862
