Date Posted,Source,Headline,Preview,Link,PTR Headline Sentiment,Flair Headline Outlook,Flair Headline Score,PTR Preview Sentiment,Flair Preview Outlook,Flair Preview Score
11/26/2024,Business Insider,Neuralink Wants to Hook up Its Brain Implant to a Robotic Arm,https://www.businessinsider.com/neuralink-hook-up-its-brain-implant-to-a-robotic-arm-2024-11,Neuralink has successfully implanted its brain chip in two human patients — and now it wants to hook it up to a robotic arm.,0.506,NEGATIVE,0.997,0.508,POSITIVE,0.593
06/02/2024,Nottinghamshire Police,Man broke his ex’s arm as part of catalogue of abuse,https://www.nottinghamshire.police.uk/news/nottinghamshire/news/news/2024/june/man-broke-his-exs-arm-as-part-of-catalogue-of-abuse/,A “bully” who broke his ex-partner's arm and subjected her to months of emotional abuse has been jailed.,0.512,NEGATIVE,0.999,0.524,NEGATIVE,0.999
11/30/2024,University of Colorado Athletics,Shedeur Sanders Wins Johnny Unitas Golden Arm Award,https://cubuffs.com/news/2024/11/29/football-shedeur-sanders-wins-johnny-unitas-golden-arm-award,"Senior Shedeur Sanders was named the recipient of the 2024 Johnny Unitas Golden Arm Award, presented by AO Smith, given to the nation's top...",0.508,POSITIVE,1.0,0.515,POSITIVE,0.97
03/06/2024,National Museum of the Royal Navy,Conservation In Action - Behind the Scenes Tour at the Fleet Air Arm Museum,https://www.nmrn.org.uk/events/conservation-action-behind-scenes-tour-fleet-air-arm-museum-1,"Each tour will last approx. 2 hours, starting with a presentation where you will get an understanding of the thinking and decision making behind the...",0.505,POSITIVE,0.999,0.506,POSITIVE,0.991
08/01/2024,Reuters,Arm shares tumble as downbeat revenue forecast clouds potential AI upside,https://www.reuters.com/technology/arm-shares-tumble-downbeat-revenue-forecast-clouds-potential-ai-upside-2024-08-01/,"Arm Holdings shares slumped 16% in afternoon trading on Thursday, after the British chip firm's tepid revenue forecast sparked concerns it...",0.545,NEGATIVE,0.999,0.549,NEGATIVE,0.994
11/5/2024,Johns Hopkins University,"Common arm positions can substantially overestimate blood pressure readings, Johns Hopkins study finds",https://hub.jhu.edu/2024/10/09/arm-positions-overestimate-blood-pressure/,Researchers found that BP measurements obtained with arm positions frequently used in clinical practice—an arm on the lap or unsupported at the...,0.502,NEGATIVE,1.0,0.503,NEGATIVE,0.991
11/28/2024,Baltimore Ravens,Charlie Kolar Suffered Broken Arm Against Chargers,https://www.baltimoreravens.com/news/charlie-kolar-broken-arm-miss-four-weeks,"After breaking his arm in Monday night's victory over the Los Angeles Chargers, No. 3 tight end Charlie Kolar will miss time.",0.504,NEGATIVE,0.855,0.518,NEGATIVE,0.998
11/5/2024,Bloomberg.com,Arm to Scrap Qualcomm Chip Design License in Feud Escalation,https://www.bloomberg.com/news/articles/2024-10-23/arm-to-cancel-qualcomm-chip-design-license-in-escalation-of-feud,"Arm Holdings Plc is canceling a license that allowed longtime partner Qualcomm Inc. to use Arm intellectual property to design chips,...",0.519,NEGATIVE,1.0,0.52,NEGATIVE,0.999
09/11/2024,Investopedia,Arm Holdings Stock is Way Up After Being Called a 'Top Pick' Amid AI Demand,https://www.investopedia.com/arm-holdings-top-pick-morgan-stanley-ai-demand-8710396,"Arm Holdings was rated as a new ""Top Pick"" by Morgan Stanley on demand for the chip designer's artificial intelligence products.",0.591,NEGATIVE,0.999,0.54,POSITIVE,0.958
12/2/2024,The Economic Times,"Panschil Realty’s hospitality arm receives SEBI approval for a Rs 2,000 crore IPO",https://m.economictimes.com/markets/ipos/fpos/panschil-realtys-hospitality-arms-receives-sebi-approval-for-a-rs-2000-crore-ipo/articleshow/115902922.cms,"Ventive Hospitality, a Blackstone-backed company, has received SEBI approval for a Rs 2000 crore IPO. The company focuses on luxury...",0.509,POSITIVE,0.736,0.535,POSITIVE,0.971
11/26/2024,Interesting Engineering,Elon Musk’s Neuralink to trial game-changing brain-chip to control robot arm,https://interestingengineering.com/science/neuralink-bci-interface-control-robot-arm,Neuralink says that the study's launch is an important step towards restoring not just digital but also physical freedom.,0.51,POSITIVE,0.995,0.509,POSITIVE,0.998
03/13/2024,Arm Newsroom,Arm Announces New Automotive Technologies to Accelerate Development of AI-enabled Vehicles by up to Two Years,https://newsroom.arm.com/news/new-automotive-technologies-2024,Arm today announced new automotive technologies and a roadmap of compute subsystems to enable faster time to market for AI enabled vehicles.,0.579,POSITIVE,0.993,0.571,POSITIVE,0.88
07/31/2024,Reuters,Arm stock dives 11% as slow AI gains lead to tepid outlook,https://www.reuters.com/technology/arm-quarterly-revenue-beats-wall-street-forecasts-outlook-line-2024-07-31/,"Arm's conservative revenue forecast sparked a selloff in the British chip firm's stock on Wednesday, as investors worried that returns from...",0.584,NEGATIVE,1.0,0.549,POSITIVE,0.863
02/28/2024,Arm Newsroom,Accelerating Data Center Development with Arm Total Design,https://newsroom.arm.com/blog/arm-total-design-for-ai,"Arm Total Design is not only a set of ecosystem partners providing IP, services and tools – it's a new mindset that encourages collaboration,...",0.541,POSITIVE,1.0,0.55,POSITIVE,0.988
12/1/2024,Nairametrics,ARM Investment Managers Unveils Sharia-Compliant Fixed Income Fund,https://nairametrics.com/2024/12/01/arm-investment-managers-unveils-sharia-compliant-fixed-income-fund/,"ARM Investment Managers, one of the country's leading asset management firms, has announced the launch of the ARM Sharia-Compliant Fixed...",0.517,NEGATIVE,0.706,0.516,NEGATIVE,0.64
02/16/2024,Financial Times,Skyrocketing Arm share price shows need for UK reform,https://www.ft.com/content/71d04a38-0b7b-4b05-980c-226188b9457e,"Since the IPO, Arm has added $80bn in market capitalisation, meaning that public investors (who own about 10 per cent) sit on about an $8bn gain...",0.541,NEGATIVE,0.996,0.506,POSITIVE,0.94
11/28/2024,Voice of America,US dismisses Russia’s warning to South Korea about supplying arms to Ukraine,https://www.voanews.com/a/us-dismisses-russia-s-warning-to-south-korea-about-supplying-arms-to-ukraine/7879446.html,US officials stress Russia's sole responsibility for deployment of North Korean troops in its war of aggression with Ukraine.,0.512,NEGATIVE,0.997,0.52,NEGATIVE,1.0
05/29/2024,AnandTech,"Arm Unveils 2024 CPU Core Designs, Cortex X925, A725 and A520: Arm v9.2 Redefined For 3nm",https://www.anandtech.com/show/21399/arm-unveils-2024-cpu-core-designs-cortex-x925-a725-and-a520-arm-v9-2-redefined-for-3nm-,"Arm is also transitioning its latest IP and Cortex core designs, including the largest Cortex X925, the middle Cortex A725, and the refreshed and smaller...",0.509,NEGATIVE,0.527,0.509,POSITIVE,0.985
06/20/2024,BBC,NatWest to buy Sainsbury's banking arm,https://www.bbc.com/news/articles/czqqzlw0159o,NatWest to buy Sainsbury's banking arm ... NatWest is to buy the main banking business of Sainsbury's as the supermarket chain withdraws from the...,0.547,NEGATIVE,0.96,0.519,POSITIVE,0.752
10/08/2024,NPR,A misplaced arm position can skew blood pressure readings,https://www.npr.org/sections/shots-health-news/2024/10/08/nx-s1-5145785/blood-pressure-reading-arm-position-hypertension,A trial from researchers at Johns Hopkins University found that simply deviating from the guidelines for arm position can produce an...,0.516,NEGATIVE,1.0,0.513,NEGATIVE,0.923
07/09/2024,IEEE Spectrum,Windows on Arm Is Here to Stay,https://spectrum.ieee.org/windows-on-arm,"Microsoft launched a new generation of AI-focused Windows laptops, called Copilot Plus PCs, in June of 2024.",0.512,POSITIVE,0.998,0.506,POSITIVE,0.997
06/03/2024,Reuters,"Exclusive: Arm aims to capture 50% of PC market in five years, CEO says",https://www.reuters.com/technology/arm-aims-capture-50-pc-market-five-years-ceo-says-2024-06-03/,"Arm Holdings aims to gain more than 50% of the Windows PC market in five years, the chip designer's CEO said, as Microsoft and its hardware...",0.57,POSITIVE,0.998,0.569,POSITIVE,0.998
03/22/2024,Arm Newsroom,Memory Safety: How Arm Memory Tagging Extension Addresses this Industry-wide Security Challenge,https://newsroom.arm.com/blog/memory-safety-arm-memory-tagging-extension,"MTE allows developers to find memory-related bugs quickly, speeding up the application debugging and development process.",0.52,POSITIVE,0.991,0.512,POSITIVE,0.853
12/2/2024,FlaglerLive,Why Americans Arm Themselves. It’s Not Just Physical Protection.,https://flaglerlive.com/gun-ownership-purpose/,Owners are also using a gun to protect their psychological selves. Owning a gun helps them feel more in control of the world around them.,0.504,NEGATIVE,0.811,0.507,NEGATIVE,0.961
12/3/2024,TAPinto,First robotic-arm assisted spinal surgery performed at Atlantic Health System’s Morristown Medical Center,"MORRISTOWN, NJ – Atlantic Health System's Morristown Medical Center was the site of the first spine surgery globally using the Mako Spine System from...",https://www.tapinto.net/towns/cranford/sections/health-and-wellness/articles/first-robotic-arm-assisted-spinal-surgery-performed-at-atlantic-health-system-s-morristown-medical-center-5,0.5,POSITIVE,0.9788,0.5119230769230769,POSITIVE,0.7613
12/3/2024,TheGamer,Elden Ring's Arm Of Malenia Statues Are Arriving Broken,"Elden Ring fans that purchased the Arm of Malenia Replica statues are getting delivered in a broken state, more often than not.",https://www.thegamer.com/elden-ring-arm-of-malenia-statue-arriving-broken/,0.5,NEGATIVE,0.9999,0.5042857142857143,NEGATIVE,1.0
12/3/2024,Salmon Arm Observer,New Salmon Arm college campus dorms to open in January,Applications are now being accepted for student housing at Okanagan College's Salmon Arm campus. Okanagan College spokesperson Kevin Parnell said the new...,http://www.saobserver.net/local-news/new-salmon-arm-college-campus-dorms-to-open-in-january-7685316,0.51,POSITIVE,0.9663,0.5618750000000001,POSITIVE,0.8115
12/3/2024,CNBC,"As global defense spending surges, South Korean arms makers look like a clear winner","A steady increase in global expenditure, combined with growing geopolitical uncertainties has provided South Korean arms makers with larger global markets.",https://www.cnbc.com/2024/12/04/as-global-defense-spending-surges-south-korean-arms-makers-look-like-a-clear-winner-.html,0.49,POSITIVE,0.9905,0.5220833333333333,POSITIVE,0.9985
12/3/2024,The Globe and Mail,Brookfield’s credit arm buys nearly $1-billion pool of U.S. commercial real estate loans,The move represents a chance by Brookfield to acquire a pool of loans at a reduced rate and put capital to work from its US$30-billion real estate credit...,https://www.theglobeandmail.com/business/article-brookfield-valley-real-estate-loans/,0.5,POSITIVE,0.9859,0.5104166666666666,POSITIVE,0.764
12/3/2024,MarketWatch,Salesforce earnings may serve as latest shot in the arm for software stocks,Salesforce's stock rises after a revenue beat that could signal healthy spending trends in the industry.,https://www.marketwatch.com/story/salesforce-earnings-may-serve-as-latest-shot-in-the-arm-for-software-stocks-563ddc9d,0.5,POSITIVE,0.6054,0.5655555555555556,POSITIVE,0.9538
12/3/2024,AceShowbiz.com,Angelina Jolie Flaunts New Tattoo on Her Arm at Gotham Awards,"'Maleficent' actress Angelina Jolie has debuted a fresh tattoo, located on her forearm when walking down the red carpet in a sleeveless gown at the Gotham...",https://www.aceshowbiz.com/news/view/00241134.html,0.5225,POSITIVE,0.9967,0.5537500000000001,NEGATIVE,0.5238
12/3/2024,Daily Express US,Russian arms exports collapse by 92% as 'military-industrial complex has failed',The Russian economy is facing a severe crisis due to the ongoing war in Ukraine and Western sanctions. The country's arms exports have also been severely...,https://www.the-express.com/news/world-news/156451/from-global-supplier-steep-decline-russia-faces-massive-drop-arms-sales,0.525,NEGATIVE,0.9999,0.5018750000000001,NEGATIVE,0.9923
12/3/2024,SDxCentral,Liftr Insights data reveals ARM’s impact on Intel’s CPU market share,"Liftr Insights released data highlighting the growth of ARM technology and its effects on Intel's CPU market share, particularly following the introduction...",https://www.sdxcentral.com/articles/liftr-insights-data-reveals-arms-impact-on-intels-cpu-market-share/2024/12/,0.5,POSITIVE,0.9957,0.553,POSITIVE,0.9905
12/3/2024,Contractor Magazine,Shedeur Sanders Wins 2024 Johnny Unitas Golden Arm Award® Presented by A. O. Smith,"BALTIMORE, MD — Shedeur Sanders has won the 2024 Johnny Unitas Golden Arm Award, presented annually by the Johnny Unitas Golden Arm Educational Foundation,...",https://www.contractormag.com/around-the-web/article/55247188/shedeur-sanders-wins-2024-johnny-unitas-golden-arm-award-presented-by-a-o-smith,0.5025,POSITIVE,0.9993,0.5059090909090909,POSITIVE,0.9982
12/3/2024,Music Times,Chris Daughtry Says His Shocking Blacked Out Arm Tattoos Are Not Meant to 'Turn You On',The rock singer and 'American Idol' alum responded to fans' questions about his arm-encompassing new ink.,https://www.musictimes.com/articles/106749/20241203/chris-daughtry-says-his-shocking-blacked-out-arm-tattoos-are-not-meant-turn-you.htm,0.5225,NEGATIVE,0.9796,0.5194444444444445,POSITIVE,0.9891
12/3/2024,EE Times,Arm Aims to Democratize Chiplets,The Arm Total Design initiative is part of the company's broader aim to accelerate the development of custom silicon.,https://www.eetimes.com/arm-aims-to-democratize-chiplets/,0.52,NEGATIVE,0.9977,0.52125,POSITIVE,0.9978
12/3/2024,MarketBeat,ARM (NASDAQ:ARM) Shares Up 0.7% - What's Next?,Arm Holdings plc (NASDAQ:ARM - Get Free Report) shares rose 0.7% during trading on Tuesday . The company traded as high as $142.30 and last traded at...,https://www.marketbeat.com/instant-alerts/arm-nasdaqarm-shares-up-07-whats-next-2024-12-03/,0.5,NEGATIVE,0.9587,0.545,NEGATIVE,0.9997
12/3/2024,The Telegraph,China’s new trade war blow could be fatal for US’s ability to arm itself,America is scrambling to find new suppliers of key materials for weapons while Beijing rapidly expands military production.,https://www.telegraph.co.uk/us/news/2024/12/03/china-new-trade-war-could-fatal-us-arm-itself/,0.5,NEGATIVE,0.9023,0.5515000000000001,NEGATIVE,0.8782
12/3/2024,Daily Mail,Angelina Jolie debuts new bird tattoo on her arm... 6 months after she got one on her chest,"Angelina Jolie showed off a new, small bird tattoo located on her arm. It matched the bird tattoo she debuted on her chest six months ago at the Tony...",https://www.dailymail.co.uk/tvshowbiz/article-14154105/Angelina-Jolie-debuts-new-bird-tattoo-arm-6-months-got-one-chest.html,0.49,NEGATIVE,0.5033,0.5563636363636365,POSITIVE,0.7764
12/3/2024,WCBM,President of Angola Jerks Biden’s Arm to Guide Him During Arrival Ceremony (VIDEO),"Joe Biden, the alleged president, traveled to Africa this week to meet with President João Lourenço of Angola and it was a disaster. The post President of...",https://wcbm.com/national-headline/president-of-angola-jerks-bidens-arm-to-guide-him-during-arrival-ceremony-video/,0.5,POSITIVE,0.8885,0.51,NEGATIVE,0.9996
12/3/2024,MSN,Baboon looks doomed when croc traps its arm,Dramatic pictures show a baboon with its arm trapped inside the jaw of a crocodile as it struggled to escape becoming the reptile's next meal.,https://www.msn.com/en-ie/news/world/baboon-looks-doomed-when-croc-traps-its-arm/ar-AA1vcUyu,0.5,NEGATIVE,0.9988,0.5066666666666667,NEGATIVE,0.9985
12/3/2024,Daily Mail,Gimme a hand - and make it snappy! Baboon looks doomed when croc traps its arm… but there's a surprise ending,Dramatic pictures show a baboon with its arm trapped inside the jaw of a crocodile as it struggled to escape becoming the reptile's next meal.,https://www.dailymail.co.uk/news/article-14153907/Baboon-croc-traps-arm.html,0.49,POSITIVE,0.9999,0.5020833333333333,NEGATIVE,0.9985
12/3/2024,Salmon Arm Observer,"Salmon Arm skaters strike gold, silver and bronze at Okanagan competition",Young Salmon Arm figure skaters enjoyed a successful outing in Kamloops for the Okanagan Interclub Competition. Hosted by the Valleyview Skating Club at...,https://www.saobserver.net/local-sports/salmon-arm-skaters-strike-gold-silver-and-bronze-at-okanagan-competition-7683571,0.51,POSITIVE,0.9907,0.5049999999999999,POSITIVE,0.9899
12/3/2024,The Economic Times,"SECI now allows Reliance Power, arm to bid in tenders","The case pertains to Reliance NU, which participated in a tender, where it allegedly submitted a fake bank guarantee and endorsement.",https://m.economictimes.com/industry/renewables/seci-now-allows-reliance-power-arm-to-bid-in-tenders/articleshow/115945062.cms,0.525,POSITIVE,0.9684,0.5085714285714286,NEGATIVE,0.9971
12/3/2024,Buyouts,Investcorp’s GP stakes arm to ‘evangelize’ employee ownership in mid-market,"Last week, Investcorp Strategic Capital Group announced it had joined Ownership Works, making it the shared ownership organization's first GP staking...",https://www.buyoutsinsider.com/investcorps-gp-stakes-arm-to-evangelize-employee-ownership-in-mid-market/,0.5,POSITIVE,0.8672,0.5305555555555556,POSITIVE,0.6945
12/3/2024,Vatican News,Arms producers increasing profits globally amid conflicts,"A report from the Stockholm International Peace Research Institute (SIPRI) shows that in 2023 the weapons trade increased profits by 4,2 percent ...",https://www.vaticannews.va/en/world/news/2024-12/arms-producers-increasing-profits-globally-amid-conflicts.html,0.5425,NEGATIVE,0.5714,0.4992857142857142,NEGATIVE,0.6538
12/3/2024,Sports Video Group,Women’s Tennis Association’s Commercial Arm Sees 24% Revenue Increase in First Year,"WTA Ventures, the commercial arm of the WTA (Women's Tennis Association), is on track for a strong performance in the first year of its mission to fuel ...",https://www.sportsvideo.org/2024/12/03/womens-tennis-associations-commercial-arm-sees-24-revenue-increase-in-first-year/,0.6216666666666667,POSITIVE,0.6408,0.6229999999999999,POSITIVE,0.9975
12/4/2024,Castanet,Shuswap Theatre offers pay-what-you-choose tickets for their holiday staged readings of Charles Dickens' A Christmas Carol,"The Shuswap Theatre is presenting a staged reading of Charles Dickens' holiday classic A Christmas Carol, as adapted for the stage by James Hutchison.",https://www.castanet.net/news/Salmon-Arm/521047/Shuswap-Theatre-offers-pay-what-you-choose-tickets-for-their-holiday-staged-readings-of-Charles-Dickens-A-Christmas-Carol,0.5,POSITIVE,0.8241,0.49923076923076926,POSITIVE,0.9281
12/4/2024,Moneycontrol,Suraj Estate Developers shares in focus after arm buys land in Mumbai,Suraj Estate Developers Share Price | The company to develop a commercial building with an estimated RERA carpet area of 1.03 lakhs square feet with a gross...,https://www.moneycontrol.com/news/business/stocks/suraj-estate-developers-shares-in-focus-after-arm-buys-land-in-mumbai-12883495.html,0.5,POSITIVE,0.9972,0.5138888888888888,POSITIVE,0.965
12/4/2024,NT News,NT Cattle station manager avoids fine after backpacker loses arm,"A Territory cattle station manager who exposed young cowboys to serious safety violations, resulting in a British backpacker losing his arm,...",https://www.ntnews.com.au/truecrimeaustralia/police-courts-nt/vehmelha-station-manager-lindsay-elliot-avoids-fine-after-23yo-henry-dunn-loses-arm-in-accident/news-story/a77f6c603c784417426c65e9d193d82f,0.5425,NEGATIVE,0.9134,0.508888888888889,NEGATIVE,0.9916
12/4/2024,On3.com,"2025 Quarterback Superlatives: Highest upside, best senior season, strongest arm","2025 Quarterback Superlatives: Highest upside, best senior season, strongest arm. charles power hs by:Charles Power•about 2 hours•.",https://www.on3.com/news/2025-quarterback-superlatives-bryce-underwood-keelon-russell-tavien-st-clair-julian-lewis/,0.5225,POSITIVE,0.9995,0.5172222222222222,POSITIVE,0.9981
12/4/2024,Newsmax,Trump Eyeing Tech Exec to Reshape Pentagon Engineering Arm,President-elect Donald Trump is considering an executive at software giant Palantir for a pivotal role in shaping the Pentagon's research and engineering...,https://www.newsmax.com/newsfront/donald-trump-pentagon-shyam-sankar/2024/12/04/id/1190387/,0.5,NEGATIVE,0.9928,0.525625,NEGATIVE,0.5785
12/4/2024,AllSides,Trump Eying Tech Exec to Reshape Pentagon Engineering Arm,President-elect Donald Trump is considering an executive at software giant Palantir for a pivotal role in shaping the Pentagon's research and engineering...,https://www.allsides.com/news/2024-12-04-1600/business-trump-eying-tech-exec-reshape-pentagon-engineering-arm,0.5,POSITIVE,0.7595,0.525,NEGATIVE,0.5785
12/4/2024,MarketBeat,ARM (NASDAQ:ARM) Stock Price Up 1.7% - Here's Why,ARM (NASDAQ:ARM) Trading 1.7% Higher - Should You Buy?,https://www.marketbeat.com/instant-alerts/arm-nasdaqarm-stock-price-up-17-heres-why-2024-12-04/,0.5,NEGATIVE,0.7706,0.6170000000000001,NEGATIVE,0.6901
12/4/2024,The Times,The Times view on the FA: Arm Twisting,"The Football Association is right to take no formal action against Crystal Palace's Marc Guéhi, who has now twice amended his rainbow-coloured captain's...",https://www.thetimes.com/comment/the-times-view/article/the-times-view-on-the-fa-arm-twisting-f8dkrzljm,0.535,NEGATIVE,0.6907,0.5130000000000001,NEGATIVE,0.9906
12/4/2024,Skift,Booking Holdings Laid Off 60 Employees at B2B Arm as It Resets Priorities,"Booking Holdings has laid off around 60 employees at one of its business-to-business units, Rocket Travel by Agoda, part of the company's recent efforts At...",https://skift.com/2024/12/04/booking-holdings-laid-off-60-employees-at-b2b-arm-as-it-resets-priorities/,0.5,NEGATIVE,0.9859,0.49,NEGATIVE,0.6902
12/4/2024,Spectrum News,Onondaga County school buses to add stop-arm cameras in six districts,"Meanwhile, a proposal to provide Onondaga schools two electric school buses has been voted down by taxpayers.",https://spectrumlocalnews.com/nys/central-ny/education/2024/12/04/onondaga-county-school-bus-stop-arm-cameras-bus-vote,0.5425,POSITIVE,0.9791,0.5095000000000001,NEGATIVE,0.9975
12/4/2024,Castanet,Salmon Arm city council calls changes to intersection 'an accident waiting to happen',"Salmon Arm city councillors expressed worry about new changes to the intersection at Highway 97A and Highway 97B – some councillors called it, “an accident...",https://www.castanet.net/news/Salmon-Arm/520723/Salmon-Arm-city-council-calls-changes-to-intersection-an-accident-waiting-to-happen-,0.5,NEGATIVE,0.9978,0.5085,NEGATIVE,0.993
12/4/2024,Важные истории,The USA Ready to Train and Arm New AFU Soldiers If Ukraine Changes Conscription Policy — US Department of State,Volodymyr Zelensky says Ukraine has no plans to reduce mobilization age.,https://istories.media/en/news/2024/12/04/the-usa-ready-to-train-and-arm-new-afu-soldiers/,0.5,NEGATIVE,0.5384,0.5442857142857143,NEGATIVE,0.9988
12/4/2024,Chicago Tribune,Law & Order: Man gets probation for breaking woman’s arm,A Gary man got nearly four years probation Tuesday for breaking a girlfriend's arm in spring 2022.,https://www.chicagotribune.com/2024/12/04/law-order-man-gets-probation-for-breaking-womans-arm/,0.5025,NEGATIVE,0.7743,0.530625,NEGATIVE,0.9903
12/4/2024,Alton Telegraph,Alton worker airlifted after chainsaw injury to arm,A worker was airlifted to a St. Louis trauma center after he suffered serious injuries to his right arm Tuesday while cutting a tree in Alton.,https://www.thetelegraph.com/news/article/alton-chainsaw-injury-airlift-st-louis-19959055.php,0.5,NEGATIVE,0.6544,0.5041666666666668,NEGATIVE,0.9412
12/4/2024,CNX Software,BredOS Arch Linux Arm distribution runs on Rockchip RK3588 single board computers,BredOS is a Linux distribution based on Arch Linux Arm and optimized to run on Rockchip RK3588/RK3588S single board computers (SBCs) with currently.,https://www.cnx-software.com/2024/12/05/bredos-arch-linux-arm-distribution-rockchip-rk3588-single-board-computers/,0.56,POSITIVE,0.8219,0.5145454545454545,POSITIVE,0.9969
12/4/2024,Salmon Arm Observer,VIEWPOINT: Salmon Arm's OCP a plan for future growth,Council Report by Salmon Arm Mayor Alan Harrison.,https://www.saobserver.net/columns/viewpoint-salmon-arms-ocp-a-plan-for-future-growth-7685000,0.51,POSITIVE,0.9931,0.5435714285714287,POSITIVE,0.8744
12/4/2024,Ynetnews,Jewish protesters occupy Canadian Parliament building lobby to demand arms embargo on Israel,"Jewish protesters supporting Palestinians staged a demonstration inside Canada's Parliament, saying that 'Every F-35 fighter jet and Apache helicopter...",https://www.ynetnews.com/article/hji3zecqye,0.5,NEGATIVE,0.9706,0.5104545454545455,NEGATIVE,0.9987
12/4/2024,Nikkei Asia,Philippines' DMCI buys Mexican cement maker's local arm,"MANILA -- Philippine conglomerate DMCI Holdings announced it has completed its acquisition of the local subsidiary of Mexican cement major Cemex, as i.",https://asia.nikkei.com/Business/Construction/Philippines-DMCI-buys-Mexican-cement-maker-s-local-arm,0.5275000000000001,NEGATIVE,0.842,0.521875,POSITIVE,0.5373
12/4/2024,Laughing Squid,Insistent Dog Takes Daycare Worker By the Arm to Lead Him to His Sleeping Sister to Be Petted,A golden retriever named Theo took his daycare worker's arm in his mouth and led him over to his sleeping canine sister Mia to be petted.,https://laughingsquid.com/dog-leads-daycare-woker-to-sister-to-be-petted/,0.5,NEGATIVE,0.8661,0.508,NEGATIVE,0.5356
