Date Posted,Source,Headline,Preview,Link,PTR Headline Sentiment,Flair Headline Outlook,Flair Headline Score,PTR Preview Sentiment,Flair Preview Outlook,Flair Preview Score
12/10/2024,Indiatimes,Monkey’s two-legged walk after losing an arm is the motivation boost you didn’t know you needed,"A viral video of a monkey walking on two legs after losing an arm has captured the internet's heart. The resilient primate navigates stairs,...",https://www.indiatimes.com/trending/monkeys-two-legged-walk-after-losing-an-arm-is-the-motivation-boost-you-didnt-know-you-needed-647947.html,0.5,POSITIVE,0.9792,0.5145454545454546,POSITIVE,0.9322
12/10/2024,Business Standard,Datamatics arm inks pact to acquire TNQTech,"Datamatics Global Services (DGSL) said that its material subsidiary, Lumina Datamatics has signed a definitive agreement to acquire a controlling stake in...",https://www.business-standard.com/markets/capital-market-news/datamatics-arm-inks-pact-to-acquire-tnqtech-124121000114_1.html,0.6625000000000001,NEGATIVE,0.9797,0.5116666666666667,NEGATIVE,0.8263
12/10/2024,Variety,Richard Shadyac Jr. to Step Down as CEO of St. Jude Fundraising Arm ALSAC,"Richard Shadyac Jr. will step down as CEO of ALSAC, the fundraising arm of St. Jude Children's Research Hospital, in March after 15 years at the helm.",https://variety.com/2024/biz/news/richard-shadyac-jr-step-down-ceo-of-st-jude-alsac-1236244188/,0.505,NEGATIVE,0.8221,0.521,NEGATIVE,0.9148
12/10/2024,onscene.tv,Driver Killed After Losing His Arm In Major Crash,INCIDENT DATE/TIME: 12-06-24 / 10:30 pm. LOCATION: EB 60 Fwy & Phillips Ranch Rd AREA/CITY: Diamond Bar DETAILS: At approximately 10:30 pm at the Eastbound...,https://onscene.tv/driver-killed-after-losing-his-arm-in-major-crash/,0.505,NEGATIVE,0.989,0.5066666666666667,NEGATIVE,0.987
12/9/2024,CoStar,News | Dissident investors call for Macy’s to create new real estate arm,"Barington Capital, Thor Equities want retailer to weigh options for Bloomingdale's, Bluemercury chains.",https://www.costar.com/article/1882790482/dissident-investors-call-for-macys-to-create-new-real-estate-arm,0.5,NEGATIVE,0.9587,0.5640000000000001,POSITIVE,0.905
12/9/2024,Newsradio WGAN |,Repairs to safety arm on Casco Bay Bridge will lead to closure,The Casco Bay Bridge will be closed Tuesday after a driver hit and damaged a barrier on the southbound side of the bridge in Portland.,https://wgan.com/news/074470-repairs-to-safety-arm-on-casco-bay-bridge-will-lead-to-closure/,0.5,NEGATIVE,0.9076,0.510625,NEGATIVE,0.9929
12/9/2024,Alvinology,KC Global Media Asia Launches Distribution Arm to Expand Global Content Reach - Alvinology,"KC Global Media Asia has unveiled KC Global Media Distribution, a new dedicated distribution arm aimed at amplifying regional and global content reach.",https://alvinology.com/2024/12/10/kc-global-media-asia-launches-distribution-arm-to-expand-global-content-reach/,0.5,POSITIVE,0.9868,0.5433333333333333,POSITIVE,0.9969
12/9/2024,Dermatology Times,"“ARM Yourself with Knowledge"": Emmy Graber, MD, MBA, Shares Insights on Acne, Rosacea, and More","As founder and course director of the “ARM Yourself with Knowledge” meetings, Emmy Graber, MD, MBA, shared some recent highlights on acne, rosacea,...",https://www.dermatologytimes.com/view/-arm-yourself-with-knowledge-emmy-graber-md-mba-shares-insights-on-acne-rosacea-and-more,0.5175000000000001,POSITIVE,0.9938,0.5025,POSITIVE,0.9646
12/9/2024,The Kyiv Independent,"US says it's ready to train, arm new soldiers if Ukraine changes conscription policy","""We have made clear is that if (Ukraine) produces additional forces to join the fight, we and our allies will be ready to acquit those forces and train...",https://kyivindependent.com/us-says-its-ready-to-train-arm-new-soldiers-if-ukraine-changes-conscription-policy/,0.5,NEGATIVE,0.9887,0.5613636363636364,POSITIVE,0.5495
12/9/2024,Motor City Bengals,Tigers sign oft-injured arm away from division rival in first Winter Meetings move,The Detroit Tigers bolstered their rotation on Monday and signed Alex Cobb who has a long history of struggling to stay healthy.,https://motorcitybengals.com/tigers-go-bit-off-script-at-winter-meetings-one-year-deal-for-oft-injured-arm,0.51,POSITIVE,0.6648,0.5125000000000001,POSITIVE,0.9209
12/9/2024,The Fintech Times,Google Hits Back at US Regulator Over Payment Arm Supervision,"Google is suing the US consumer watchdog over its decision to supervise the tech giant's payment arm, calling it an overreach.",https://thefintechtimes.com/google-hits-back-at-us-regulator-over-payment-arm-supervision/,0.5175000000000001,NEGATIVE,0.9994,0.5181250000000001,NEGATIVE,0.9995
12/9/2024,Maps of India,KBC 2024| Which of the following is a bone of the arm?,"KBC 2024, The options of the Super Sandook question - Which of the following is a bone of the arm? A. Diameter B. Circumference C. Radius D. Hypotenuse The...",https://www.mapsofindia.com/my-india/india/kbc-2024-which-of-the-following-is-a-bone-of-the-arm,0.5325,NEGATIVE,0.9999,0.5125,NEGATIVE,0.9992
12/9/2024,The Business of Fashion,Macy’s New Activist Wants Retailer to Create Real Estate Arm,"Barington Capital Group is calling on Macy's to cut its capital expenditures, form a separate real estate group and consider strategic alternatives for the...",https://www.businessoffashion.com/news/retail/macys-new-activist-wants-retailer-to-create-real-estate-arm/,0.6550000000000001,NEGATIVE,0.6221,0.558888888888889,NEGATIVE,0.9984
12/11/2024,Daily Mail,Donald Trump nominates Kari Lake to lead U.S. federal media arm,President-elect Donald Trump has selected former Arizona Senate candidate and MAGA ally Kari Lake to lead the U.S.'s state media outlet Voice of America.,https://www.dailymail.co.uk/news/article-14184371/donald-trump-nominate-kari-lake-voice-america.html,0.49,NEGATIVE,0.7535,0.5035,POSITIVE,0.7558
12/11/2024,Korea JoongAng Daily,"Hyundai Motor, BAIC to invest $1.1 billion in Chinese arm","Hyundai Motor and BAIC Motor will invest $1.1 billion in their Beijing joint venture to enhance product offerings and technology, aiming to recover sales in...",https://koreajoongangdaily.joins.com/news/2024-12-12/business/industry/Hyundai-Motor-BAIC-to-invest-11-billion-in-Chinese-arm/2199345,0.49833333333333335,NEGATIVE,0.7453,0.5207142857142858,NEGATIVE,0.7925
12/11/2024,WealthBriefing,UBS Plans US Wealth Arm Revamp,"The Swiss banking group and wealth manager is, so the report said, trying to compete more powerfully against rivals such as Merrill Lynch and Morgan Stanley...",https://www.wealthbriefing.com/html/article.php/UBS-Plans-US-Wealth-Arm-Revamp-,0.5,NEGATIVE,0.9937,0.5283333333333333,NEGATIVE,0.8002
12/11/2024,The Economic Times,Adani Green Energy's arm commissions 250 MW solar project,"New Delhi: Adani Green Energy on Thursday said its arm has commissioned a 250 MW solar power project at Badi Sid in Jodhpur district, Rajasthan.",https://m.economictimes.com/industry/renewables/adani-green-energys-arm-commissions-250-mw-solar-project/articleshow/116243753.cms,0.525,POSITIVE,0.968,0.525,NEGATIVE,0.9042
12/11/2024,Times Now,"Supreme Court Sends Contempt Notice To Axis Bank, Reliance Infra Arm Over Rs 4,500 Crore DMRC Refund Dispute","The Supreme Court issued a contempt notice to Reliance Infrastructure's DAMEPL, Axis Bank, and their MDs for failing to return Rs 4700 crore to DMRC,...",https://www.timesnownews.com/business-economy/companies/supreme-court-sends-contempt-notice-to-axis-bank-reliance-infra-arm-over-rs-4500-crore-dmrc-refund-dispute-article-116240010,0.535,NEGATIVE,0.9936,0.5066666666666667,NEGATIVE,0.9947
12/11/2024,Leadership News,ARM Investment Managers Unveils Sharia-compliant Fixed Income Fund,"Leading asset management firms, ARM Investment Managers, has announced the launch of the ARM Sharia-Compliant Fixed Income Fund designed to provide.",https://leadership.ng/arm-investment-managers-unveils-sharia-compliant-fixed-income-fund/,0.5475000000000001,NEGATIVE,0.7061,0.5166666666666667,POSITIVE,0.9092
12/11/2024,Daily Excelsior,Adani Green Energy’s arm commissions 250 MW solar project,"NEW DELHI, Dec 12: Adani Green Energy on Thursday said its arm has commissioned a 250 MW solar power project at Badi Sid in Jodhpur district, Rajasthan.",https://www.dailyexcelsior.com/adani-green-energys-arm-commissions-250-mw-solar-project/,0.4925,POSITIVE,0.9603,0.520625,NEGATIVE,0.9549
12/11/2024,News Riveting,Adani arm commissions 250 MW solar power project at Jodhpur in Rajasthan,"Team News Riveting. Ahmedabad, December 12. Adani Green Energy Twenty Five Limited, a step-down subsidiary of Adani Green Energy Limited (“AGEL”) has...",https://newsriveting.com/adani-arm-commissions-250-mw-solar-power-project-at-jodhpur-in-rajasthan/,0.5425,POSITIVE,0.9751,0.5183333333333334,POSITIVE,0.9646
12/11/2024,LatestLY,Latest News | Adani Green Energy's Arm Commissions 250 MW Solar Project,Get latest articles and stories on Latest News at LatestLY. Adani Green Energy on Thursday said its arm has commissioned a 250 MW solar power project at...,https://www.latestly.com/agency-news/latest-news-adani-green-energys-arm-commissions-250-mw-solar-project-6485117.html,0.5,POSITIVE,0.6943,0.5305000000000001,NEGATIVE,0.8877
12/11/2024,The Economic Times,Waaree Energies shares climb 4% after arm receives LoA for 170 MW solar plant,"Waaree Energies shares rallied 4% to Rs 3,303 in Thursday's intraday trade on the BSE after the company's arm, Waaree Forever Energies, received a Letter of...",https://m.economictimes.com/markets/stocks/news/waaree-energies-shares-climb-4-after-arm-receives-loa-for-170-mw-solar-plant/articleshow/116239969.cms,0.525,POSITIVE,0.9115,0.5174999999999998,NEGATIVE,0.9969
12/11/2024,Business Standard,Reliance Power gains after arm wins 930 MW solar contracts with BESS,Reliance Power rallied 4.43% to Rs 45.99 after the company announced that its subsidiary Reliance NU Suntech won 930 MW solar energy contract with battery...,https://www.business-standard.com/markets/capital-market-news/reliance-power-gains-after-arm-wins-930-mw-solar-contracts-with-bess-124121200284_1.html,0.6625000000000001,POSITIVE,0.9969,0.5111111111111111,NEGATIVE,0.9413
12/11/2024,Business Standard,Waaree Energies up 4% after arm receives LoA for 170 MW solar plant in MP,The Solar power plant will enable the generation and transmission of clean energy via the Inter-State Transmission System (ISTS),https://www.business-standard.com/markets/news/waaree-energies-up-4-after-arm-receives-loa-for-170-mw-solar-plant-in-mp-124121200243_1.html,0.6625000000000001,POSITIVE,0.9877,0.5177777777777778,POSITIVE,0.9985
12/11/2024,The Financial Express,Reliance Power shares jump 5% as arm bags 930 MW contract from Solar Energy Corp,Reliance Power shares rallied 5% to hit the upper circuit placed at Rs 46.29 after its arm bagged a 930 MW solar energy contract from Solar Energy...,https://www.financialexpress.com/market/reliance-power-shares-jump-5-as-arm-bags-930-mw-contract-from-solar-energy-corp-3689886/,0.5475000000000001,NEGATIVE,0.6567,0.5354545454545456,NEGATIVE,0.9992
12/11/2024,Upstox,"Reliance Power's arm, NU Suntech, wins India's largest solar project; shares jump 5%","Reliance Power on Wednesday said that its arm, Reliance NU Suntech, has won the country's single largest 930 MW solar project with a 1860 MWh battery energy...",https://upstox.com/news/market-news/stocks/reliance-power-jumps-5-as-arm-reliance-nu-suntech-wins-india-s-largest-solar-project-here-are-the-details/article-134815/,0.5,POSITIVE,0.7041,0.5279166666666666,POSITIVE,0.8658
12/11/2024,Business Standard,Waaree Energies gains as arm bags LoA for 170 MW Solar Power Plant in Madhya Pradesh,"Waaree Energies rose 2.26% to Rs 3245.80 after its wholly owned subsidiary, Waaree Forever Energies has received a Letter of Award for the development of a...",https://www.business-standard.com/markets/capital-market-news/waaree-energies-gains-as-arm-bags-loa-for-170-mw-solar-power-plant-in-madhya-pradesh-124121200199_1.html,0.6625000000000001,POSITIVE,0.9987,0.51625,POSITIVE,0.8584
12/11/2024,The New Indian Express,Shriram Finance concludes sale of housing loan arm,"The transaction marks a significant milestone, with all requisite approvals from regulatory authorities and stakeholders duly secured.",https://www.newindianexpress.com/business/2024/Dec/12/shriram-finance-concludes-sale-of-housing-loan-arm,0.6466666666666668,NEGATIVE,0.8099,0.5071428571428572,POSITIVE,0.9986
12/11/2024,Free Press Journal,"Indore: Second Arm Of Khajrana, Luv Kush Flyovers To Start This December","At present, the asphalt layer is being laid and after 20 December, traffic will be started on this arm too, said officials.",https://www.freepressjournal.in/indore/indore-second-arm-of-khajrana-luv-kush-flyovers-to-start-this-december,0.5316666666666667,POSITIVE,0.9882,0.5161111111111112,POSITIVE,0.9246
12/11/2024,The Financial Express,Shriram Finance completes sale of housing finance arm,The sale will allow the company to focus on its core business segments and growth areas.,https://www.financialexpress.com/business/banking-finance-shriram-finance-completes-sale-of-housing-finance-arm-3689819/,0.5475000000000001,NEGATIVE,0.6353,0.5107142857142858,NEGATIVE,0.6981
12/11/2024,MSN,Reliance Power shares in focus after arm wins 930 MW order from SECI; key details,Reliance Power shares are up 39.38 per cent in the past six months and 83.55 per cent year-to-date. Reliance NU Suntech's successful bid for SECI's Tranche...,https://www.msn.com/en-in/money/topstories/reliance-power-shares-in-focus-after-arm-wins-930-mw-order-from-seci-key-details/ar-AA1vHF9t,0.5,POSITIVE,0.9985,0.5331818181818182,NEGATIVE,0.9977
12/11/2024,The Economic Times,Reliance Power shares jump 5% after arm wins 930 MW solar project from SECI,"Reliance NU Suntech, a subsidiary of Reliance Power, secured a 930 MW solar energy project with a 465 MW/1860 MWh battery storage system in a SECI auction.",https://m.economictimes.com/markets/stocks/news/reliance-power-shares-in-focus-after-its-arm-wins-930-mw-solar-project-with-battery-storage-from-seci/articleshow/116232972.cms,0.525,POSITIVE,0.8364,0.52,POSITIVE,0.9347
12/11/2024,Business Today,Reliance Power shares in focus after arm wins 930 MW order from SECI; key details,Reliance Power shares are up 39.38 per cent in the past six months and 83.55 per cent year-to-date. Reliance NU Suntech's successful bid for SECI's Tranche...,https://www.businesstoday.in/markets/stocks/story/reliance-power-shares-in-focus-after-arm-wins-930-mw-order-from-seci-key-details-457012-2024-12-12,0.7275000000000003,POSITIVE,0.9985,0.5331818181818182,NEGATIVE,0.9977
12/11/2024,Delaware State Police (.gov),Update – Suspects Arrested* State Police Detectives Investigating Strong-Arm Robbery in Felton,"The Delaware State Police have arrested three 17-year-old males, all of Harrington, Delaware, for felony charges following a strong-arm robbery that...",https://dsp.delaware.gov/2024/12/11/update-suspects-arrested-state-police-detectives-investigating-strong-arm-robbery-in-felton/,0.5025,NEGATIVE,0.9001,0.5168181818181818,NEGATIVE,0.9835
12/11/2024,KFYR-TV,‘Not medically necessary’: Family says insurance denied prosthetic arm for 9-year-old child,A Utah family is...,https://www.kfyrtv.com/2024/12/12/not-medically-necessary-family-says-insurance-denied-prosthetic-arm-9-year-old-child/,0.505,NEGATIVE,0.9976,0.5687499999999999,POSITIVE,0.9752
12/11/2024,mint,"Adani Group in early talks with investors, lenders to refinance $1.1 billion green energy arm loans | Company Business News",The Adani Green projects for which the $1.1 billion loans were taken—from a group of overseas banks—are mostly backed by assured cashflows from PPAs (power...,https://www.livemint.com/companies/news/adani-group-in-early-talks-with-investors-lenders-to-refinance-1-1-bn-green-energy-arm-loans-11733916763828.html,0.5,NEGATIVE,0.6249,0.6089999999999998,POSITIVE,0.9967
12/11/2024,WSAZ,Insurance denies prosthetic arm for child,A Utah family is...,https://www.wsaz.com/video/2024/12/11/insurance-denies-prosthetic-arm-child/,0.5,NEGATIVE,0.7936,0.517,POSITIVE,0.9752
12/11/2024,News18,"Jubilant Bhartia Group Acquires 40% Stake In Coca-Cola’s Bottling Arm For Rs 12,500 Cr","Coca-Cola, the global beverage leader, has sold a 40% stake in its Indian bottling arm, Hindustan Coca-Cola Beverages Pvt Ltd (HCCBL), to Jubilant Bhartia...",https://www.news18.com/business/markets/jubilant-bhartia-group-set-to-acquire-40-stake-in-coca-colas-bottling-arm-for-rs-12500-cr-9152325.html,0.5,POSITIVE,0.9831,0.5345454545454547,POSITIVE,0.782
12/11/2024,Punch Newspapers,Soldiers arrest bandits arms suppliers disguising as transporters,"Troops of Operation Safe Haven in Plateau State have raided a kidnappers' den in the Bassa Local Government Area, arresting bandits' arms suppliers...",https://punchng.com/soldiers-arrest-bandits-arms-suppliers-disguising-as-transporters/,0.5025,NEGATIVE,0.9822,0.5014285714285714,POSITIVE,0.9127
12/11/2024,Liliputing,"Lilbits: More Pixel 9a details leaked, playing PS3 games on ARM PCs, and more","Lilbits: More Pixel 9a details leaked, playing PS3 games on ARM PCs, and more.",https://liliputing.com/lilbits-more-pixel-9a-details-leaked-playing-ps3-games-on-arm-pcs-and-more/,0.5,NEGATIVE,0.9996,0.5055,NEGATIVE,0.9996
12/11/2024,SEN.com.au,Damien Fleming’s top five left-arm quicks of all time,"Former Australian paceman Damien Fleming has named his top five left-arm quicks of all time. While Fleming himself was a right-armer, his top-five list...",https://www.sen.com.au/news/2024/12/11/damien-flemings-top-five-left-arm-quicks-of-all-time,0.515,POSITIVE,0.9999,0.52625,POSITIVE,0.999
12/11/2024,Salmon Arm Observer,Council talks change to limit on Salmon Arm Recreation passes,There was interest among city councillors in extending the expiration date on Salmon Arm recreation passes. This interest was prompted by a letter about the...,https://www.saobserver.net/local-news/council-talks-change-to-limit-on-salmon-arm-recreation-passes-7700540,0.51,NEGATIVE,0.7782,0.50375,NEGATIVE,0.9165
12/11/2024,Castanet,Salmon Arm rotary clubs offering Christmas turkey dinner to Shuswap residents,The Rotary Clubs of Salmon Arm have plans to bring a traditional Christmas dinner to anyone in the Shuwap who would like to enjoy a holiday meal.,https://www.castanet.net/news/Salmon-Arm/522152/Salmon-Arm-rotary-clubs-offering-Christmas-turkey-dinner-to-Shuswap-residents,0.5,POSITIVE,0.9953,0.5085000000000001,POSITIVE,0.9594
12/11/2024,How-To Geek,"Don't Be Like Me, Buy a Monitor Arm Before It's Too Late","Keep your precious (and likely expensive) monitors secure with a monitor mount. It's worth the cost! Last week, I had an unfortunate incident—I had gotten a...",https://www.howtogeek.com/dont-be-like-me-buy-a-monitor-arm-before-its-too-late/,0.5,NEGATIVE,0.9783,0.5490000000000002,POSITIVE,0.9969
12/11/2024,The Sun,Heartpounding moment brave Ukrainian warrior takes bullet to the head & grenade to the arm but SURVIVES…& k...,THIS is the heart-pounding moment a brave Ukrainian soldier continued firing at Russian targets even after being shot by the enemies.Video shows bulle.,https://www.thesun.co.uk/news/32252824/ukraine-soldier-bullet-head-survivor/,0.495,POSITIVE,0.9946,0.5104166666666666,POSITIVE,0.6493
12/11/2024,Tom's Hardware,"Fujitsu flaunts massive 144-core Monaka Arm chip — 2nm and 5nm chiplets, 3D-stacked CPU cores over memory","Fujitsu's Monaka is a monstrous processor with four 2nm compute chiplets, 5nm SRAM, and a massive 5nm IO die. This time, without HBM memory.",https://www.tomshardware.com/pc-components/cpus/fujitsu-flaunts-144-core-monaka-cpu-2nm-and-5nm-chiplets-soic-and-cowos-packaging,0.5075000000000001,NEGATIVE,0.9909,0.5116666666666666,NEGATIVE,0.9993
12/11/2024,The Denver Post,“Strong Arm” Frank Azar wins $1.55 million in Google keyword lawsuit against Alabama law firm,A two-year fight between Colorado's “Strong Arm” attorney Frank Azar and “Alabama Hammer” Michael Slocumb ended this fall with the Alabama law firm ponying...,https://www.denverpost.com/2024/12/11/frank-azar-lawsuit-slocumb-settlement-strong-arm/,0.505,NEGATIVE,0.7171,0.5437500000000001,NEGATIVE,0.9493
12/11/2024,MSN,R-Power arm bags 930 MW solar storage project at Rs 3.53/unit,"NEW DELHI: Reliance NU Suntech Private Ltd, a subsidiary of Anil Ambani's Reliance Power, has won a 930 MW solar energy project with battery storage at a...",https://www.msn.com/en-in/money/topstories/r-power-arm-bags-930-mw-solar-storage-project-at-rs-3-53-unit/ar-AA1vGfMW,0.5,POSITIVE,0.9991,0.522,POSITIVE,0.9499
12/11/2024,News24,Private sector funds R60 million forensics shot in the arm for Hawks,The Hawks head said a new crime-fighting partnership for a digital forensics lab – funded by the private sector – was not his organisation outsourcing its...,https://www.news24.com/news24/investigations/private-sector-funds-r60-million-forensics-shot-in-the-arm-for-hawks-20241211,0.5,POSITIVE,0.6408,0.5594444444444445,NEGATIVE,0.9832
12/11/2024,The Financial Express,Reliance Power arm bags 930 MW contract from SECI,Reliance NU Suntech's bid for SECI's Tranche XVII auction was won at a tariff of Rs 3.53 ($0.0416)/kWh.,https://www.financialexpress.com/business/industry/reliance-power-arm-bags-930-mw-contract-from-seci/3689635/,0.5475000000000001,POSITIVE,0.9854,0.54,NEGATIVE,0.7034
12/11/2024,WMDT,Three teens charged in connection to Felton strong arm robbery,"FELTON, Del. – Three juveniles have been charged in connection to a strong arm robbery in Felton. Just after 3 p.m. on November 28th, troopers were called...",https://www.wmdt.com/2024/12/three-teens-charged-in-connection-to-felton-strong-arm-robbery/,0.5,NEGATIVE,0.8915,0.525625,NEGATIVE,0.5459
12/11/2024,Times of India,"Coastal Rd: Sixth arm of Haji Ali interchange new arm opens, full completion by 2025",Mumbai: The sixth arm of Mumbai Coastal Road's Haji Ali interchange towards Worli was opened to traffic on Wednesday. The two remaining arms of the...,https://timesofindia.indiatimes.com/city/mumbai/mumbai-coastal-road-new-haji-ali-interchange-arm-opens-full-completion-by-2025/articleshow/116223906.cms,0.54,POSITIVE,0.9934,0.5408333333333334,POSITIVE,0.9615
12/11/2024,dtnext,Shriram Finance concludes transfer of housing finance arm to Warburg Pincus,The sale of Shriram Finance's stake in Shriram Housing Finance is done to Warburg Pincus' affiliate - Mango Crest Investment Ltd.,https://www.dtnext.in/news/business/shriram-finance-concludes-transfer-of-housing-finance-arm-to-warburg-pincus-814846,0.5,NEGATIVE,0.9518,0.5066666666666667,NEGATIVE,0.9983
12/11/2024,TAPinto,Westfield Karate Sensei Breaks One-Arm Push-up Records to Combat Bullying,Westfield resident and anti-bullying champion John Mirrione set and broke 11 world records for one-armed push-ups on solid stone ground Wednesday.,https://www.tapinto.net/towns/westfield/sections/giving-back/articles/westfield-karate-sensei-breaks-one-arm-push-up-records-to-combat-bullying,0.5,NEGATIVE,0.9644,0.51,POSITIVE,0.9343
12/11/2024,Sunshine Coast News,Long arm of law reaches back 30 years to lay child sex charges,"An 80-year-old man has been charged over alleged child sex offences dating back up to 31 years, and police believe there could be more victims.",https://www.sunshinecoastnews.com.au/2024/12/12/long-arm-of-law-reaches-back-30-years-to-lay-child-sex-charges/,0.5283333333333333,NEGATIVE,0.7196,0.513,NEGATIVE,0.9882
12/11/2024,Times of India,R-Power arm bags 930 MW solar storage project at Rs 3.53/unit,"NEW DELHI: Reliance NU Suntech Private Ltd, a subsidiary of Anil Ambani's Reliance Power, has won a 930 MW solar energy project with battery storage a.",https://timesofindia.indiatimes.com/business/india-business/r-power-arm-bags-930-mw-solar-storage-project-at-rs-3-53/unit/articleshow/116222590.cms,0.54,POSITIVE,0.9991,0.522,POSITIVE,0.9876
12/11/2024,OC3D,"RPCS3, the PS3 Emulator, now supports Apple Silicon and other ARM chips","The RPCS3 emulator has been upgraded with arm64 support, enabling Apple Silicon compatability and Linux/Windows ARM CPU support.",https://overclock3d.net/news/software/rpcs3-the-ps3-emulator-now-supports-apple-silicon-and-other-arm-chips/,0.5,POSITIVE,0.9993,0.5162500000000001,POSITIVE,0.9996
12/11/2024,Devdiscourse,Shriram Finance Completes Sale of Housing Finance Arm,Shriram Finance has finalized the sale of its entire stake in Shriram Housing Finance to Warburg Pincus for Rs 3929 crore. The sale supports Shriram...,https://www.devdiscourse.com/article/headlines/3190827-shriram-finance-completes-sale-of-housing-finance-arm,0.5,NEGATIVE,0.6353,0.5107142857142858,POSITIVE,0.9596
12/11/2024,The Moulton Advertiser,ARM mobile laboratory now operational in Bankhead Forest,"Have you ever wondered what affects where and how hard it rains? What about the impact clouds have on radiant energy coming from the sun, or the role tiny...",https://www.moultonadvertiser.com/news/article_d96bf35e-b7dd-11ef-af43-ffb30d4bdeeb.html,0.4975,POSITIVE,0.9971,0.5541666666666667,NEGATIVE,0.9991
12/11/2024,MSN,Guardians Analysis: Luis Ortiz and a deep dive into arm angles,Meet the new Guardians starting pitcher!,https://www.msn.com/en-us/sports/mlb/guardians-analysis-luis-ortiz-and-a-deep-dive-into-arm-angles/ar-AA1vFFxh,0.5,POSITIVE,0.9872,0.510625,POSITIVE,0.9999
12/11/2024,The Jewish Press,Katz Aims at Iranian Arms Smuggling in Visit to Eastern Front,Defense Minister Israel Katz took aim at Iranian arms smuggling to the Palestinian Authority on Wednesday during his visit to Israel's eastern front.,https://www.jewishpress.com/news/middle-east/jordan/katz-aims-at-iranian-arms-smuggling-in-visit-to-eastern-front/2024/12/11/,0.535,NEGATIVE,0.8714,0.5112500000000001,NEGATIVE,0.9971
