date,text,PTR Sentiment,Flair Sentiment,Flair Score,Repost,Hastags
2021-03-01T14:15:00.000Z,Women have been calling for equality for over a century. Scotiabank is committed to dismantling the barriers faced by women. #SaidBefore #IWD2021 #ChooseToChallenge,0.5008,POSITIVE,0.6234,0,"['#SaidBefore', '#IWD2021', '#ChooseToChallenge']"
2020-12-15T17:57:08.000Z,"Looking for a holiday meal? http://Alimentarito.com is a neighbourhood grocer offering fresh pasta, prepared food & pantry goods. This year they built an online store, began offering delivery, rethought processes & more. You can order online and pick it up or get it delivered",0.5441,POSITIVE,0.6647,0,[]
2020-12-10T17:11:15.000Z,We recognize that small businesses play a big role in our communities. Visit http://Visa.ca/supportsmallbutsmallbusiness… to see what we’re doing to help.,0.5113,NEGATIVE,0.577,0,[]
2020-12-14T16:42:22.000Z,"Looking to get active? http://barrebelle.ca offers fitness classes with 9 studios across Canada They’ve also focused their efforts on http://thebellebod.com, an online subscription service that offers virtual classes so you can stay active anytime, anywhere. Check them out!",0.5193,POSITIVE,0.928,0,[]
2020-12-12T17:55:03.000Z,"http://Barreyna.com is known for shared plates & cocktails. This year they got creative by offering online order, picnic baskets & creating a market i  their restaurant. Their newest addition is http://reynaontherocks.com, where you can order unique DIY cocktail kits and more",0.5554,POSITIVE,0.9877,0,[]
2020-12-11T19:30:39.000Z,Need a gift for a foodie? Former @NFL wide receiver and proud Canadian @nateburleson recommends @cherrystbbq  We recognize that small businesses play a big role in our communities. Visit http://Visa.ca/supportsmallbutsmallbusiness… to see what we’re doing to help.,0.5078,POSITIVE,0.9909,0,[]
2020-12-10T17:11:14.000Z,"Are you looking to spark joy this holiday season? http://thehappybox.ca supports small businesses by using a collection of products to curate fun, themed boxes that can be ordered online and delivered to your door (or someone else’s!). Gift a Happy Box and make someone smile.",0.5123,POSITIVE,0.8763,0,[]
