date,post,site sentiment,PTR Sentiment,Flair Outlook,Flair Sentiment
12/19/2024,can i load the boat with this soon this is a heck of a discount 🤩?,,0.5042,POSITIVE,0.995
12/19/2024,"what happened to this, is it going below $100?",,0.5175,NEGATIVE,0.9999
12/19/2024,prepared to see 95,,0.5025,POSITIVE,0.9868
12/19/2024,"the faster to 117, the faster we can go back up.",,0.515,NEGATIVE,0.9162
12/19/2024,nice little support level at 118.21 from may last year. adding,,0.6075,POSITIVE,0.9639
12/19/2024,time for a new ceo,,0.7,POSITIVE,0.995
12/19/2024,$avgo $nvda $qqq $spy fomo fomo fomo bimbo bull liquidated,,0.503,NEGATIVE,0.9992
12/19/2024,she always does. it’s all about lisa! 💩,,0.5038,POSITIVE,0.999
12/19/2024,after 1.5 years we are almost same spot!!!,,0.5267,POSITIVE,0.9986
12/19/2024, some ceo’s know how to handle small company… but they can’t handle a 200 billion company,,0.6,NEGATIVE,0.8406
12/19/2024,and there's it is....,,0.5,POSITIVE,0.9953
12/19/2024,between $amd and $coin i dont know which one is more pathetic,,0.5992,NEGATIVE,0.9999
12/19/2024,dealers are toying with retail like orcas play with their food,,0.5164,NEGATIVE,0.982
12/19/2024,"fuk lisa, still going to fly though",,0.5125,POSITIVE,0.9268
12/19/2024,better buy the dip,,0.59,NEGATIVE,0.9961
12/19/2024,wayyyyyyyy over sold.,,0.5125,NEGATIVE,0.9996
12/19/2024,$nvda companies buy nvda. amd is for basement boys.,,0.6157,NEGATIVE,0.9989
12/19/2024,get to $117 soon,,0.52,NEGATIVE,0.9373
12/19/2024,hot garbage,,0.51,NEGATIVE,1.0
12/19/2024,can ceo of the year please help,,0.6912,POSITIVE,0.5963
12/19/2024, lol this is the best comment of the year,,0.6825,POSITIVE,0.9972
12/19/2024,new 52w low every second,,0.597,NEGATIVE,1.0
12/19/2024,lisa knew when to sell  sell,,0.5213,NEGATIVE,0.773
12/19/2024,"i'm all long but on a technical side, hundo here we come..",,0.605,POSITIVE,0.9885
12/19/2024,which one is worse? $amd v/s $intc v/s $mu ? i’m literally fckd thrice 💩💩💩,,0.545,NEGATIVE,1.0
12/19/2024,anybody have an explanation? haha let me guess “easy money”?,,0.5007,NEGATIVE,0.9937
12/19/2024,netflix to release the epic collapse of amd and lisa su (2026),,0.585,NEGATIVE,0.9681
12/19/2024,114 200 weekly ma is a magnet at this point. thatll be my next buy,,0.5493,POSITIVE,0.9447
12/19/2024,"nvidias slower, more retarded brother",,0.5,NEGATIVE,0.9995
12/19/2024,ok so up 17% year to date and not missing earnings. i love these buying opportunities. they don't come up often when a good stock is at year lows with good growth.  can't wait for the turn it'll be amazing.,,0.616,POSITIVE,0.9988
12/19/2024,max pain yes yes,,0.5012,POSITIVE,0.9968
12/19/2024,"closing at the low of day, bad sign for tomorrow. new 52wk low tomorrow.",,0.546,NEGATIVE,0.9999
12/19/2024, this blood bath won’t stop until 55$,,0.4988,NEGATIVE,0.9328
12/19/2024,boom,,0.535,POSITIVE,0.9923
12/19/2024, this is reality,,0.505,POSITIVE,0.9965
12/19/2024,told ya'll i din't believe in triple bottoms....,,0.5036,NEGATIVE,0.9916
12/19/2024,i’m averaged in at $135 but idk why i have a feeling this could start sinking into the $100 range maybe even lower if we truly have entered into a bear market even lower if we have truly entered into a recession correction. won’t be selling only buying. 5 years down the road this stock is worth more than i’m averaged in at.,,0.5223,POSITIVE,0.9962
12/19/2024,wow can't even break above 120 shit show here,,0.502,NEGATIVE,0.9937
12/19/2024,the amount of clowns on twitter and youtube the last 3 weeks saying to buy this has been unreal. i am convinced all these idiots are liars and post fake screens of their “accounts”,,0.52,NEGATIVE,1.0
12/19/2024,worst 24 hours i’ve experienced trading,,0.512,NEGATIVE,1.0
12/19/2024,"i understand that cramer should normally be inversed, but if he felt the need to dump half after this was already down 45%, something more is going on. and jim loves lisa su.",,0.499,POSITIVE,0.6923
12/19/2024,cycle from october peak is still suggesting more downside to take place toward equal legs area $102 - $93 before a larger bounce takes place #elliottwave,,0.5076,NEGATIVE,0.9928
12/19/2024, one company (amd) failure is another company opportunity (nvda),,0.7575,NEGATIVE,0.9936
12/19/2024,sell,,0.535,NEGATIVE,0.9088
12/19/2024,loading up on 115p. added some more 117p as well. pay day tomorrow,,0.5169,POSITIVE,0.9794
12/19/2024,come on 120,,0.505,POSITIVE,0.9764
12/19/2024,truly is advanced money destroyer.,,0.5337,POSITIVE,0.8989
12/19/2024,wow,,0.5,POSITIVE,0.996
12/19/2024,here is the 4h chart from 12/10 showing the stock trading to the downside after it created a bearish sequence and how we expect the continuation lower to take place #elliottwave,,0.5233,NEGATIVE,0.9999
12/19/2024,amazing how absolutely stuck this feels since around 12:30 pm.... practically barcoding back and forth for hours!,,0.5062,NEGATIVE,0.9966
12/19/2024,"i never expected the stock can be 15% off from a year ago, after so many achievements they’ve done this year: mi300x revenue of 5b+ mi325x launched mi350x on the way mi400x in development rocm significant improvements epyc turin launched ryzen 9000, especially the gaming beast 9800x3d ryzen ai 300 silo ai acquisition (with cash) zt system acquisition (mostly cash)",,0.5755,POSITIVE,0.9022
12/19/2024, 35$,,0.5,NEGATIVE,0.8474
12/19/2024,"this is an easy buy, between fed rate, cut bs, tax lost harvesting, and your average hedge fund employees dumping stocks before they go on vacation around this time for two weeks you likely won’t see these numbers again in a week or two. will be headed green and beyond in no time. load up while you can, the fundamentals of this company are too strong.",,0.5497,NEGATIVE,0.972
12/19/2024,november 2024 elliott wave calling the decline after zig zag pattern elliottwave-forecast.com/el... #elliottwave,,0.5096,NEGATIVE,0.9999
12/19/2024,my calls don't have 3 years,,0.545,NEGATIVE,0.9904
12/19/2024, even at 52 week low it is a bull trap 🤣🤣🤣,,0.5275,NEGATIVE,0.9989
12/19/2024,it’s really bad christmas for amd bulls and crypto bulls…,,0.5575,NEGATIVE,0.9999
12/19/2024,trap em,,0.5,NEGATIVE,0.9858
12/19/2024,"sold a bunch of covered calls again. should have been lower strike prices, but oh well .. can't win them all. but i love the pic 😍🤣😂",,0.5031,POSITIVE,0.8629
12/19/2024, hedge fund wolfe is heavily shorting this… i blindly follow them…,,0.5006,NEGATIVE,0.9519
12/19/2024,back to $125 in a hurry.,,0.5075,NEGATIVE,0.8439
12/19/2024,stock slided in bear market territory this week. there won't be a bottom without a convincing comeback. please save your money.,,0.5725,NEGATIVE,1.0
12/19/2024,cover shorts pce tomorrow $qqq $spy,,0.5075,NEGATIVE,0.8396
12/19/2024, by giving best ceo award to lisa they indirectly said her to step down,,0.6294,NEGATIVE,0.9744
12/19/2024,"every other stock needs an earnings miss, guidance cut to get this oversold, but not amd. this one is special.  i’d say a full year guidance cut is absolutely coming since the ceo is mia",,0.5824,POSITIVE,0.9969
12/19/2024,save me lisa su,,0.5117,POSITIVE,0.8529
12/19/2024,this is wack,,0.5,NEGATIVE,0.9994
12/19/2024,a mad donkey,,0.5,NEGATIVE,0.8119
12/19/2024,a mind derail,,0.5,NEGATIVE,0.9879
12/19/2024,"$meta open sourced llama has been a huge success with developers… didn’t realize llama 3.2 uses both gpus & cpus: instinct™ mi300x gpus, amd epyc™ cpus, amd ryzen™ ai, amd radeon™ gpus, amd rocm™ software.",,0.5848,POSITIVE,0.9966
12/19/2024,bounces here tomorrow and then back down to 100,,0.5033,POSITIVE,0.9401
12/19/2024,i still get fascinated on how markets move.. even amd it pushes down and then it pushes up,,0.575,POSITIVE,0.9974
12/19/2024,ok now triple bottom.. probably will go down much more but anyway.,,0.5057,NEGATIVE,0.9985
12/19/2024, automatic money disappear,,0.5117,NEGATIVE,0.997
12/19/2024,what???,,0.5,NEGATIVE,0.9996
12/19/2024,"feels like we should wait until under $100 to start buying.  nothing is stopping this from going lower, still overvalued by quite a bit based on revenue growth is struggling",,0.5197,NEGATIVE,0.9994
12/19/2024,who knows the options expiry for this stock,,0.6075,NEGATIVE,0.9581
12/19/2024,triple bottom? wait...i don't believe in triple bottoms any more than i believe in triple tops!,,0.5067,NEGATIVE,0.9719
12/19/2024,how do they do it that they can sell it more and more with no rebound.. it goes against the principles of buying stocks.. when is the company releasing a gpu that can compete with nvda?,,0.5868,NEGATIVE,0.995
12/19/2024,call flow coming in,,0.5233,NEGATIVE,0.6928
12/19/2024,"no chance this stock will recover this year totally  disaster fucking amd fuck this all company money destroyer, everything bears eat that fucking money",,0.6362,NEGATIVE,1.0
12/19/2024, it’s never going to see 120$ again,,0.51,NEGATIVE,0.9991
12/19/2024,😂😂😭😭😭,,0.5,NEGATIVE,0.7615
12/19/2024,it’s not power hr… it’s dumping hour….,,0.5025,NEGATIVE,0.9973
12/19/2024,all money disappeared,,0.5125,NEGATIVE,0.9957
12/19/2024,joke,,0.5,NEGATIVE,0.9868
12/19/2024,just bought $27k worth of…. 2nd position. $135 by eoy.,,0.5279,NEGATIVE,0.5796
12/19/2024,just like that $120 is gone forever.,,0.5,NEGATIVE,0.7894
12/19/2024,adding position for $130c for jan31,,0.5225,NEGATIVE,0.6081
12/19/2024,that’s lisa’s shit…. ewwwww gross,,0.499,NEGATIVE,0.9998
12/19/2024,in crisis while haase is jacking off in his office  mike haase - ir (408)749-3124 mike.haase@amd.com,,0.5473,NEGATIVE,0.9343
12/19/2024,loaded today,,0.575,NEGATIVE,0.7512
12/19/2024,$mu i love chips and cheap chips for christmas is great for me,,0.5107,POSITIVE,0.978
12/19/2024,bottom,,0.51,NEGATIVE,0.9985
12/19/2024,pathetic. oversold and no bounce at all,,0.4967,NEGATIVE,1.0
12/19/2024,ahahahahha,,0.5,NEGATIVE,0.9947
12/19/2024,extremely oversold as it falls into the bottomless pit!  i have not capitulated yet!,,0.4936,NEGATIVE,1.0
12/19/2024,close above $120,,0.45,POSITIVE,0.9931
12/19/2024,"this has gotten so bad, it looks like it could go bankrupt.  yes, i’m serious.",,0.504,NEGATIVE,1.0
12/19/2024,not surprised to see another opening dump tomorrow,,0.5042,NEGATIVE,0.9949
12/19/2024,100,,0.5,POSITIVE,0.9752
12/19/2024,ceo of the year 😂😂😂,,0.7467,POSITIVE,0.9909
12/19/2024,1000 dollars a bull on stocktwits will use this gif soon🤣🤣🤣🤣,,0.5167,NEGATIVE,0.9787
12/19/2024,yup,,0.5,POSITIVE,0.9998
12/19/2024,"remember bulls, when bears get overconfident, it is a buy !",,0.5375,POSITIVE,0.9648
12/19/2024,$nvda $mu (dead) $avgo $amat after microns guidance is awful! cracks forming and saturation of chips and semis is definitely a major one.,,0.5072,NEGATIVE,1.0
12/19/2024,$soxl amd above 123 close 🐉✅🐉😀👀,,0.6063,POSITIVE,0.5038
12/19/2024,"i’ve been hearing double bottom, triple bottom, quadruple bottom for the last week.  it’s not, this is going lower.  just keeps breaking lines.  enjoy!",,0.5156,NEGATIVE,0.7325
12/19/2024,powerhour ? 💥,,0.5,POSITIVE,0.6455
12/19/2024,"if yall had a male ceo, this would be at ath right now. sorry lisa",,0.5231,NEGATIVE,0.9946
12/19/2024,"lisa, i am not a fan.",,0.51,NEGATIVE,0.9999
12/19/2024,125 tmr,,0.5,POSITIVE,0.9906
12/19/2024,double bottom on 1min?,,0.52,NEGATIVE,1.0
12/19/2024,amdl its the golden idea for next year. don't worry bears they turned this to a wash sale for a reason. 200 end of 2025 have to be a fool not to see it. that 100 percent run last year they created the danger and everyone followed. it's not amd it's the mm shorts. then they gonna fuck ya in the long term. this will spike 20 percent during ces 2 weeks.. amdl better than a bitcoin buy now..,,0.5822,NEGATIVE,0.9273
12/19/2024,"stop being so impatient. lisa is ceo of the year for a reason, they dont randomly choose. i dont really write comments but this is actually once in a life time opportunity. get in or you can miss it. it’s your decision. but dont come back and regret it. thank me later bulls. all in-ed 200k at 135 avg price. will be adding more and more as price drops. this is a millionaire move soon. mark my words",,0.5276,POSITIVE,0.9925
12/19/2024,for once a stop loss worked in my favor and couple weeks ago in this one. smh,,0.5172,NEGATIVE,0.9859
12/19/2024,triple witching tomorrow.  just wait.  there will be blood.🩸,,0.5,NEGATIVE,0.9816
12/19/2024,my average is still $181.,,0.52,NEGATIVE,0.9778
12/19/2024,just think everyone sitting in hood gold cash is outperforming this shit,,0.5081,NEGATIVE,0.9973
12/19/2024,love how everyone is saying buy puts into quad witching tomorrow when the max pain is $130...or 8% higher than here.  wouldn't surprise me at all to get a bounce here into close tomorrow...,,0.5162,POSITIVE,0.9949
12/19/2024,not even going up with the squeeze markets.,,0.54,NEGATIVE,0.9991
12/19/2024,signs are clear. weak action. quad witching tomorrow. lower lows. we going down. puts will print imo. lfgooo!!!,,0.4896,NEGATIVE,0.9998
12/19/2024,i'm buying.  easy money.  no brainer play.,,0.5833,POSITIVE,0.9996
12/19/2024,well if you wanted to buy the dip there it is. .,,0.5813,NEGATIVE,0.6248
12/19/2024,all in. gonna fight the mr.market/ now,,0.5663,POSITIVE,0.9897
12/19/2024,"seems crazy to sell here, but at the same time it seems crazy to hold it while it dumps to double digits. hmm...",,0.5191,NEGATIVE,0.999
12/19/2024,loading here hand over fist,,0.5,POSITIVE,0.7402
12/19/2024,"when this will move, it would be really fast !",,0.5125,NEGATIVE,0.9945
12/19/2024,121 tmr,,0.5,POSITIVE,0.9839
12/19/2024,bull trap set up for tomorrow's dump,,0.507,NEGATIVE,0.9993
12/19/2024,"now that the dip buyers have been primed, it's time for accelerated money destruction",,0.5186,NEGATIVE,0.9996
12/19/2024,if we hit 120 today i am all in,,0.575,POSITIVE,0.9979
12/19/2024, i am sure a lot of bulls (i mean bagholders) might have already wrote to investor relations of amd about the stock price action,,0.5732,NEGATIVE,0.9998
12/19/2024,"yea, tax loss harvest, looks scary, but i am adding slowly in small lots of 25 shares at a time, will see",,0.5112,POSITIVE,0.9428
12/19/2024,"we post market maker levels, expected moves for the week and daily levels on 8 of the biggest stocks every morning. the orange rectangle here on $amd is the expected range for the week. as you can see it is close to testing that 117.00 area. strength down here at this level tomorrow, may signal a long. be patient. happy trading.",,0.5558,POSITIVE,0.9983
12/19/2024,who remembers how hot axcelis $acls was last year? one of those semi $smh related names that couldn't lose. it's now down 66% in 16 months back to levels first hit in late 2021. also new 52w low with micron $mu bad earnings report weighing hard.,,0.5665,NEGATIVE,1.0
12/19/2024,my puts are printing,,0.4875,POSITIVE,0.9988
12/19/2024, i am sure even lisa su is shorting this shit….,,0.505,NEGATIVE,0.9995
12/19/2024,is trending everyday for being dog shit lmao what’s the stock twits record for most days trending in row red,,0.5381,POSITIVE,0.9662
12/19/2024, yeah only bears and she made huge money on this…,,0.51,POSITIVE,0.9793
12/19/2024,big time falling wedge. the break will be glorious,,0.5233,NEGATIVE,0.9981
12/19/2024,will b back to short again tomorrow,,0.5,NEGATIVE,1.0
12/19/2024,may a bit late to grab puts but definitely not calls as this thing is insanely weak. long bullish,,0.5162,NEGATIVE,1.0
12/19/2024,$spy $qqq $iwm  was a nice morning for short calls off the lows yesterday,,0.5128,NEGATIVE,0.9889
12/19/2024, even jesus christ has no clue,,0.5012,NEGATIVE,0.9479
12/19/2024,fuck it. just grabbed some calls.,,0.5033,POSITIVE,0.7727
12/19/2024,lisa su sold over $130 million worth of stock this year. it was a good year for her.,,0.7578,POSITIVE,0.9873
12/19/2024,i'm out not coming back to this trash this stock benefits company not investors.,,0.7069,NEGATIVE,0.9869
12/19/2024,$hut when is my holiday rally? $clsk $mara . dump been too  strong,,0.5221,NEGATIVE,0.9996
12/19/2024,keep selling me your shares at 52 week lows. you can have them back at 52 week highs.,,0.5431,NEGATIVE,0.9998
12/19/2024,now journey back to the past…a boring microprocessor company,,0.625,NEGATIVE,0.9989
12/19/2024,i have a vertical spread put 120 strike exp at jan 17 25 and a put 115 same ex. i’m thinking hold.,,0.4986,NEGATIVE,0.9991
12/19/2024,$spy drill baby drill!!! fomo fomo fomo $avgo $nvda $qqq,,0.5035,NEGATIVE,0.7185
12/19/2024,price is gettingmore and more enticing!,,0.525,POSITIVE,0.9948
12/19/2024,almost a full position now. great opportunity for 2025 👍,,0.525,POSITIVE,0.9957
12/19/2024,the 1st 3 weeks of january 2025 will be a disaster,,0.5138,NEGATIVE,1.0
12/19/2024,i’ll buy at 50,,0.6,POSITIVE,0.9141
12/19/2024,seems strange vanguard seems to be selling to themselves,,0.508,NEGATIVE,0.9941
12/19/2024,this never goes up,,0.505,NEGATIVE,0.9944
12/19/2024,100 coming,,0.5,POSITIVE,0.9968
12/19/2024,"if lisa thought it was going back to $200, she wouldn't have exercised her 23 million dollars of options at $130 and $140 in november and december",,0.56,NEGATIVE,0.9948
12/19/2024,buying here this is ridiculous,,0.5075,NEGATIVE,0.9996
12/19/2024,oops just bought 100 shares by accident,,0.51,NEGATIVE,0.9958
12/19/2024, if rsi is zero the value of stock is zero,,0.601,NEGATIVE,0.9994
12/19/2024,where’s next support line? this price is so fucking delicious.. really thinking about opening a position here?  just curious if the market will bleed some more🤞😆,,0.5483,POSITIVE,0.9995
12/19/2024,awesome setup… $spy $qqq,,0.5088,POSITIVE,0.9963
12/19/2024, bye bye 119$,,0.5,POSITIVE,0.988
12/19/2024,who is keep selling at new 52 week low?,,0.618,NEGATIVE,0.9992
12/19/2024,a lot of margin sale now wtf,,0.5088,NEGATIVE,0.9859
12/19/2024,this stock is the perfect example of why big money always wins. retail panics and they don’t. institutions aren’t selling amd so who is.,,0.5786,POSITIVE,0.9945
12/19/2024,i was blocked by so many hyper bulls here last week when this was $127 for saying it was going to dip below $120.,,0.5344,NEGATIVE,0.9997
12/19/2024,on watch for the waterfall to 118.5...lol,,0.5067,POSITIVE,0.9629
12/19/2024,"ce-no of the yr.  lost half her shareholders money while cramer was telling her great job.  easiest short earlier this yr, carvana, abercrombie and all the quantum pumped up 2000% stocks on tap for shorts 2025",,0.5033,NEGATIVE,0.9995
12/19/2024, 0,,0.5,POSITIVE,0.7497
12/19/2024,1 year of dogs hit absolute pain . no position just brutal to watch,,0.5906,NEGATIVE,0.9999
12/19/2024,"25% down the last 3 months.  that is, by definition, a stock crash!  ceo of the year right here!",,0.6762,NEGATIVE,1.0
12/19/2024,what's the chance amd will surprise us with a v?,,0.615,NEGATIVE,0.6723
12/19/2024, basic principle of trading… if a stock is trading below 52 week low without reversal then there is atleast 30% downside from the current levels of 52 week low…  how come everyone is forgetting that fact and buying ignorantly,,0.5407,NEGATIVE,0.996
12/19/2024,something is changing youtube.com/@amddevcentral?...,,0.509,POSITIVE,0.9406
12/19/2024,loaded more. short term pain for a long term gain. 🙌,,0.5425,NEGATIVE,0.9989
12/19/2024,$8 down from yesterday intraday high and not a word from the loser ceo.,,0.5375,NEGATIVE,0.9994
12/19/2024,“long term investing”,,0.5317,POSITIVE,0.9689
12/19/2024,waiting till a few min before close to grab some 115 puts for tomorrow,,0.4893,POSITIVE,0.6572
12/19/2024,"i’ve gone from paypal in 2023 to sbux before laxman cramer interview, now to amd mystical sell off for no reason.  i’ve literally jumped from one frying pan to another",,0.5356,NEGATIVE,0.9873
12/19/2024,guys this stock is done go buy $nbis and thanks me ltr waiting for ya at usd100,,0.5591,NEGATIVE,0.975
12/19/2024,at this point it’s slowest falling knife.. needs structure and positive momentum 🚩,,0.5185,NEGATIVE,0.9999
12/19/2024,"because they bought a year ago, and wanted ""to enjoy the gains, later"".",,0.6029,POSITIVE,0.7221
12/19/2024,"this one took all my portfoli fuck this amd when you will stop dropping!!!!!,",,0.5743,POSITIVE,0.9924
12/19/2024,wow not a word from lisa . she doesnt give a shit about investors unlike jensen,,0.5078,NEGATIVE,0.984
12/19/2024,i’m hurting and buying $amdl,,0.5038,NEGATIVE,0.9989
12/19/2024,$smci cut the clutter..focus on $smci strength i.e. scaling the data server build up in a hyper growth ai environment for fortune 500 clients using liquid cooling technology....with latest ai chips from $nvda $intc and so on....future is bright after $smci brings compliance with it's finances in next 1-2 months.....rest all is only noise,,0.5432,NEGATIVE,0.9288
12/19/2024,btfd,,0.5,NEGATIVE,0.6089
12/19/2024,"99% of people that say load up or buy the dip, don’t buy a single share. don’t listen to the pumpers. this pos is going sub 110 by end of january.",,0.5421,NEGATIVE,0.9999
12/19/2024,"quiver's wallstreetbets top 10 strategy is up 14.34% this month, here are some of the top holdings: ( $pltr ) - 10% position ( $nvda ) - 10% position ( $smci ) - 10% position ( ) - 10% position ( $tsla ) - 10% position to see the full holdings list, and replicate the strategy, visit quiverquant.com/strategies/",,0.5354,NEGATIVE,0.69
12/19/2024,fartcoin better lol,,0.5217,NEGATIVE,0.5073
12/19/2024,give me some volume bulls! $spy $nvda $tsla,,0.5125,NEGATIVE,0.9864
12/19/2024,i guess the gap down comes tomorrow,,0.5038,NEGATIVE,0.8612
12/19/2024,paid basher?,,0.5075,NEGATIVE,0.9981
12/19/2024,major opportunity here,,0.525,POSITIVE,0.9946
12/19/2024,added leaps.,,0.495,POSITIVE,0.9987
12/19/2024,"tag teamed by vivek & jerome, the night before christmas...",,0.4992,NEGATIVE,0.5636
12/19/2024,buy the f dip?,,0.575,NEGATIVE,0.996
12/19/2024,load up,,0.51,NEGATIVE,0.7155
12/19/2024,under 100?,,0.5,NEGATIVE,0.858
12/19/2024,a mofon disaster err day,,0.51,NEGATIVE,0.9986
12/19/2024,sold it because therecare more space to fall. ill jump in anytime,,0.5,NEGATIVE,0.9998
12/19/2024,"amd is presenting a good  buying opportunity. but, rather than buy now and enjoy the gains later, people are complaining.",,0.5654,NEGATIVE,0.916
12/19/2024," yes, a stock can go down forever… remember peloton i can quote 100s of examples…",,0.5467,POSITIVE,0.7574
12/19/2024,idiot,,0.5,NEGATIVE,0.9824
12/19/2024,have the markets always been so sensitive to interest rates? i remember when oil was the big indicator for the markets.,,0.5455,NEGATIVE,0.8
12/19/2024,"lisa told us a year ago that mi300 will be great. a year later, the market has realised that amd is a generation behind, and mi350 or even mi400 will be competitive. lisa lied.",,0.611,NEGATIVE,0.9992
12/19/2024,amd ceo conducting business right now,,0.683,POSITIVE,0.9836
12/19/2024,bye lisaaa,,0.5,POSITIVE,0.97
12/19/2024,"buy it here, check back in a year 🤷‍♂️",,0.667,POSITIVE,0.9716
12/19/2024,nothing goes down forever!,,0.505,POSITIVE,0.913
12/19/2024,will likely see sub 100 in january,,0.5138,NEGATIVE,0.9781
12/19/2024,"look at this guy’s posts lol every minute, another bearish post about amd….get a life buddy 👍",,0.5071,NEGATIVE,0.9876
12/19/2024, slow melt down from 170 $ (just before er) to 119$ each day it went down over 2% steadily… and this will get rug pulled soon…  in my opinion it is not going to hit 135$ again…,,0.5093,NEGATIVE,1.0
12/19/2024,bulls on here are nothing but pumpers option players.,,0.505,NEGATIVE,0.9068
12/19/2024,95$ still no bottom yet?,,0.505,NEGATIVE,0.9799
12/19/2024,"serious question.  is the ceo not allowed to comment, ever?",,0.5233,NEGATIVE,0.9945
12/19/2024,"funds bought the dip, now its gonna pump. last support hit, shakin the sl’s and now the party’s starting",,0.5146,NEGATIVE,0.5271
12/19/2024,"of course, top trending for being the worst american stock in the earth",,0.5714,NEGATIVE,1.0
12/19/2024,if rsi goes to zero…still this won’t bounce…,,0.502,NEGATIVE,0.9973
12/19/2024,lets have a discussion about this stock.. it is trading $30 below the lowest analyst estimate and $70 below the average analyst estimate... so whats the point of having analyst coverage... and the margin is so wide.. can someone explain,,0.5286,NEGATIVE,1.0
12/19/2024,"soon, the volkssturm will come out to have their last buy order...",,0.5917,POSITIVE,0.8756
12/19/2024,chatgtp said this is still overvalued,,0.695,NEGATIVE,0.997
12/19/2024,lower lows. you know what dat means,,0.482,POSITIVE,0.5026
12/19/2024,is apparently going out of business lol,,0.58,NEGATIVE,0.839
12/19/2024," balls of steel, if you’re shorting at these levels. 😂",,0.5125,POSITIVE,0.9998
12/19/2024,lol what a pos,,0.5,NEGATIVE,0.9942
12/19/2024, china will be the super power next… us companies will get winded down and it is china who s going lead the world….,,0.5404,POSITIVE,0.5655
12/19/2024,"hourly, daily, weekly and monthly downtrend,52 week low. what’s going on with this and $lrcx",,0.519,NEGATIVE,0.9995
12/19/2024,which i think are buying opps,,0.51,NEGATIVE,0.8024
12/19/2024,"rsi under 27 ... yeahhhhh, ok ... on what news please?",,0.517,NEGATIVE,0.8087
12/19/2024,when this crowd finally folds is when to go bullish again. if you bought every dip the last 3 months you would be crushed.,,0.5275,NEGATIVE,0.6229
12/19/2024,is lisa su still ceo of the yr w her stock price cut in half ??? she should give that to someone more deserving….she sounds like a dei hire w this performance.  boeing makes bad planes and they’re not down 50% on the yr are they??? 💥💥,,0.5233,NEGATIVE,0.9999
12/19/2024,"micron's er is killing amd, too. but i think it's time to buy for long now.",,0.6144,POSITIVE,0.9993
12/19/2024,amd made itself exceptionally vulnerable to tax loss harvesting this year,,0.645,POSITIVE,0.9335
