date,post,site sentiment,PTR Sentiment,Flair Outlook,Flair Sentiment
12/20/2024,remember market is almost at all time high and this shit is 156 week low…  december 2021 166$ december 2024 118$  there will be huge correction in the 1st quarter of 2025 and then this will go down till 65$  er will be a disaster as every one know what’s going to be…  65$ is definetly coming,,0.5387,NEGATIVE,1.0
12/20/2024,if u love amd  added at 125 not adding again until 110  then 100-90,,0.59,NEGATIVE,0.7616
12/20/2024,is the bottom in ? asking for a friend,,0.505,NEGATIVE,0.9433
12/20/2024,news after news theverge.com/2024/12/18/243...,,0.5538,NEGATIVE,0.9518
12/20/2024,"congratulations to everyone that hold, we just left the bottom of the hell at 115.95, now lets start the ride to paradise",,0.502,POSITIVE,0.9996
12/20/2024,"$intc why can we tell that wall street bots are manipulating the market, deliberately using high-frequency trading algorithms to transfer shares between their own accounts and then short the stock? because if you look at institutional holdings, the numbers haven’t actually changed much. retail investors are continuously buying, but when the stock price drops, they panic and sell, causing a downward spiral. the big players take advantage of this to absorb cheap shares. institutions aren’t selling, while most retail investors are stuck buying high and selling low. that’s the current situation. nvda is worth trillions, yet intel, a company of such scale, is only valued at $80 billion? come on… what an insidious and cunning game of price manipulation.",,0.5409,NEGATIVE,0.9995
12/20/2024,watching 120.5 then 121.68 for this to get some legs and squeeze $124 isn’t out the question if market rebounds huge today,,0.5455,POSITIVE,0.7025
12/20/2024,"i love when people post this kind of things....comeback from what? last night we close at $188,88 and early was almost at $115 and the fact is now $117.5 (markets still not open, so, we could see $115 or lower anyway) but people talks about comeback :d call it a comeback when it goes to $150 again",,0.5073,NEGATIVE,0.9904
12/20/2024,waiting for you $99….,,0.5,NEGATIVE,0.8638
12/20/2024,margon stanly reduced the pt,,0.495,NEGATIVE,0.7381
12/20/2024,"hello mama, i lost it all😭😭😭",,0.4962,POSITIVE,0.9847
12/20/2024,it's going to be a market red day.  thanks elon!,,0.5583,POSITIVE,0.9998
12/20/2024,watching 👀,,0.505,POSITIVE,0.9546
12/20/2024,turn green for the week?,,0.5633,NEGATIVE,0.999
12/20/2024,and $nvda impressive comeback,,0.505,POSITIVE,0.9972
12/20/2024,te new tsla sock right here can’t go wrong owning this been down everyday for months no green day’s,,0.5431,POSITIVE,0.9813
12/20/2024,"now we have inflation behind us, let’s hope to 125 today",,0.5442,NEGATIVE,0.5947
12/20/2024,give us some fucking news amd….how are they so quiet,,0.53,NEGATIVE,0.9953
12/20/2024,$kulr $tsla good news....guess who is coming to save the market,,0.5531,POSITIVE,0.8862
12/20/2024,its recovering a bit so that it has more room to drop at open,,0.496,POSITIVE,0.9741
12/20/2024,bought yuge pre market 10x leverage,,0.5592,NEGATIVE,0.9712
12/20/2024,$spy $nvda haters gonna hate i called the r bounce!,,0.5075,NEGATIVE,0.9986
12/20/2024,added 116 this morning….,,0.495,POSITIVE,0.9621
12/20/2024,"could amd soar in 2025? with how successful nvidia has been as an investment, it's only natural to look at similar companies and see if they have upside. amd (amd -2.08%) also has a significant lineup of graphics processing units (gpus) that are being used to create artificial intelligence (ai) models. stck.pro/news/amd/96584856/",,0.6065,NEGATIVE,0.9636
12/20/2024,short i  need shares at 112,,0.4933,NEGATIVE,0.9751
12/20/2024,once again gets beat by $nvda,,0.5117,NEGATIVE,0.9799
12/20/2024,when moon?,,0.51,NEGATIVE,0.9814
12/20/2024,$spy sing my angel!!!! santa rally starts today!,,0.5271,POSITIVE,0.7549
12/20/2024,$spy,,0.52,NEGATIVE,0.997
12/20/2024,120 back. watch.,,0.5175,POSITIVE,0.5143
12/20/2024,$asml $meli $mdb $mpwr deals today. any others ?,,0.5257,POSITIVE,0.8964
12/20/2024,$130 friday next week is my target this is dueeee for a big relief bounce,,0.5519,POSITIVE,0.7258
12/20/2024,all we need is to get above 121.68 today and this can possibly squeeze biggf,,0.5267,POSITIVE,0.9988
12/20/2024,$hims $smci $intc buy the fear,,0.541,NEGATIVE,0.9849
12/20/2024,january calls at the open. i feel like gambling,,0.5142,NEGATIVE,0.9975
12/20/2024,pce numbers looked good today. market is reacting positively,,0.56,POSITIVE,0.9726
12/20/2024,oh god please save us bulls we need one green day of +6%,,0.521,NEGATIVE,0.688
12/20/2024,going green for sure today,,0.55,NEGATIVE,0.5137
12/20/2024,good inflation numbers. vix crush friday + start of santa claus rally,,0.5165,POSITIVE,0.9601
12/20/2024,is santa rally a dog shit retail concept? sure seems like it. tax selling is a greater force it seems,,0.5111,NEGATIVE,0.9625
12/20/2024,so much fear and panic. i’ll continue to buy all the way to 75. please keep selling paper hands,,0.5358,NEGATIVE,0.5076
12/20/2024,oh i’d love to see the faces of shorts when this is above 126 next week,,0.5356,POSITIVE,0.8638
12/20/2024,broke every support,,0.5183,NEGATIVE,0.9998
12/20/2024,"have seen this movie before, at the end of a calendar year…dec 29th, 2022 amazon was at 81.00, and folks were saying the same types of things as they are now, on this board. throwing fundamentals and common sense out the window. retail seems to be in a panic at this point. do your own due diligence.",,0.51,NEGATIVE,0.9974
12/20/2024,i’m a major buyer sub $100. let’s go bears. keep up the good work!,,0.5155,POSITIVE,0.975
12/20/2024, below $100,,0.5,NEGATIVE,0.9859
12/20/2024,and $intc are strong buys this morning.,,0.54,POSITIVE,0.9869
12/20/2024," amd's recent stock drop highlights the growing challenges it faces in a competitive semiconductor landscape, particularly against nvidia's advancements in ai. with analysts predicting a slowdown in demand for pc processors, can amd navigate these turbulent waters and emerge stronger? folikoinsights.com/article/...",,0.5697,NEGATIVE,0.8655
12/20/2024,what could be worse than this stock action?,,0.61,NEGATIVE,0.9992
12/20/2024,i’ll buy at 95 soon,,0.5717,POSITIVE,0.9787
12/20/2024,lisa su when shareholders needed her most,,0.515,POSITIVE,0.9261
12/20/2024,this shit will dump truck to 90. just chill j n wait,,0.5007,NEGATIVE,0.9977
12/20/2024,"earnings expectations are being reset lower lately by analysts, sentiment extremely bad, rsi below 30.  feels like a strong reversal in the making soon.  added at 116.09 this morning.",,0.5169,NEGATIVE,0.9994
12/20/2024,down pre market makes me optimistic,,0.5875,POSITIVE,0.9964
12/20/2024,time to back up the truck my fellas,,0.525,POSITIVE,0.9813
12/20/2024,start a position here adding every 10 dollars dropp long term play do you own dd,,0.536,NEGATIVE,0.9604
12/20/2024,$nvda $smh,,0.5025,NEGATIVE,0.9848
12/20/2024,$115 open a poistion and if drop to 110 buy again !,,0.545,NEGATIVE,0.8946
12/20/2024,"all these traders and their fancy charts… who don’t know about how solid of a company amd really is as far as product and penetration… is wild. they literally have helped remove intel as a monopoly on processors and have expanded much deeper into many other spaces… you don’t dethrone a king without a future outlook. i believe they will never beat out nvidia on their products, but will 100% be on the tail given the server space given how the world works now and how the world is moving. easy hold here. i would buy more but i sold long ago and bought back in around 110. hurting for now",,0.5492,POSITIVE,0.997
12/20/2024,really wants to be under $100,,0.51,NEGATIVE,0.9368
12/20/2024,this stock trades like an otc boiler room special with bankruptcy around the corner. lisa su busy stuffing her mouth at the all you can eat chinese buffet?,,0.5269,NEGATIVE,0.999
12/20/2024,when do the buffett fearful quotes start??,,0.4988,NEGATIVE,0.9755
12/20/2024,"i hate to say i told you so, but i told you so.  you’re welcome.",,0.5025,POSITIVE,0.9835
12/20/2024,it favors downside in (iii) of ((iii)) shown from 12.16.2024 update. #elliottwave #stocks,,0.5162,NEGATIVE,0.9979
12/20/2024,"today is when you buy, not sell.",,0.6283,NEGATIVE,0.9908
12/20/2024,bulls get the lube ready.,,0.5125,POSITIVE,0.9371
12/20/2024,relax!!!  it’s only down $15 in a week.,,0.5483,NEGATIVE,0.528
12/20/2024,support at 112 if it breaks that stock is in trouble. it already is in trouble but we can be looking at low 100s i doubt it would fall below that but a huge long term buying opportunity with 100 percent plus gains down the line. if the pce data comes out good we should be ok if not it's going to 100 in a few days,,0.5488,NEGATIVE,0.6205
12/20/2024,$msft $unh $oklo $amzn staying clam and will trade around my conviction list,,0.5095,NEGATIVE,0.9993
12/20/2024,what the fuck!? 116???,,0.49,NEGATIVE,0.9986
12/20/2024,o boy,,0.51,POSITIVE,0.8855
12/20/2024,"good morning traders. everyday we bring you very important price levels to consider.  *expected move by friday* = $121.50 upside, $116.00 downside. *market maker levels* support =$120.00, resistance =$150.00 *levels on daily* = $110.00 remember, stocks tend to overshoot support and resistance levels. if this happens look for price to reclaim those levels and hold /fail for information on its near term potential direction. happy trading",,0.5329,POSITIVE,0.9966
12/20/2024,lisa su🤬🤬🤬🤬🤡🤡,,0.5075,POSITIVE,0.9843
12/20/2024,"whole market is red.. fvking jp and big boys are playing game.,.. wait for all retailers exhausted then they step in.. should have keep some cash.. fck too late now.",,0.5218,NEGATIVE,0.9974
12/20/2024,amd 2025! book it.,,0.75,POSITIVE,0.9661
12/20/2024,"$nvda $soxl $smci $intc amd - $114, nvda - $123,  soxl - $21,  smci - $24, intc -$17 point of interest 🙏🏻",,0.5438,NEGATIVE,0.7505
12/20/2024,= another massive dump,,0.5033,NEGATIVE,1.0
12/20/2024,"today it is more about the market, not amd. buy opportunity.",,0.719,NEGATIVE,0.991
12/20/2024,santa slump rally beara killed it,,0.504,NEGATIVE,1.0
12/20/2024,$75,,0.5,POSITIVE,0.8296
12/20/2024,"another -2%, pt $0",,0.5075,NEGATIVE,0.5272
12/20/2024,1 hour. mark your 830 candle on the 5 or 15minute chart as support/resistance to gauge their response to retail's positioning pm.,,0.5062,POSITIVE,0.9225
12/20/2024,90 next,,0.62,POSITIVE,0.8405
12/20/2024,always buy when others become fearful. the is will turn up in january.,,0.5421,POSITIVE,0.9965
12/20/2024,this went from 155 in nov 2021 to 55 in 2022. same thing on track except 227 to 75 next year!,,0.6179,NEGATIVE,0.7823
12/20/2024,👀,,0.5,NEGATIVE,0.7615
12/20/2024,"as always, advanced money destroyer",,0.5312,POSITIVE,0.9971
12/20/2024,averaging down,,0.5,NEGATIVE,0.9874
12/20/2024,this might do well today.  us department is probing nvda dell smci on chips landing up in china. amd not on the list. 🤐🤐🤐🤐,,0.565,NEGATIVE,0.9973
12/20/2024,lisa going to announce her retirement soon,,0.512,NEGATIVE,0.8147
12/20/2024,50 coming,,0.5,POSITIVE,0.9697
12/20/2024,next fib retracement level is $92.62,,0.535,NEGATIVE,0.9972
12/20/2024,$btc.x $spy $clsk powel needs to get ceod,,0.5094,NEGATIVE,0.9979
12/20/2024,"interesting, very interesting…. $smci",,0.5033,POSITIVE,0.9956
12/20/2024,"the $116.82 gap will fill at open, $113.49 is next",,0.5375,NEGATIVE,0.9975
12/20/2024,december has been  a horrible month for amd.,,0.6475,NEGATIVE,1.0
12/20/2024,sheesh,,0.5,POSITIVE,0.9919
12/20/2024,"the guy that says he bought at the top, 200.00, i feel like you and i was in at 140.00. like someone else said, if this ship sinks i lose big time!  this is from a bull that buys panic and swing plays. i’m still pretty sure this will print but now, because the opportunity aged and the price went so low during a period of growth, perceived value is totally shot. people call amd holders losers to nvidia?!, that’s not really a true statement, they’re not competitors across all product lines. besides, the real winner is the company with the most outstanding unfilled pos at tsm.",,0.5574,NEGATIVE,1.0
12/20/2024,"it hasn't started to turn, so wait for it before you start crying bullish and hodl like a wsb retard. we're at a critical pivot/squeeze point. this is where they started flipping when they bounced off 133.7 on the way back up. this is the entry where they decided to flip from long to short and vice versa. if they go much lower, they give up their long edge until people rotate out. don't trade on margin and you'll be fine. it's the margin calls they are squeezing as the money eats up their liquidity, so they'll just move their money (your money) into something they can move and move back to amd after enough get out. watch the sector to see where they are rotating within the sector. pick the top strongest to play long and the weakest to play short. they will move the most in their respective bull/bear markets.",,0.5193,NEGATIVE,1.0
12/20/2024,seems like we are doing better than all the other shit.,,0.5175,POSITIVE,0.9978
12/20/2024,wait 1.5 hours. pce.,,0.5067,NEGATIVE,0.9998
12/20/2024,only down 2%,,0.5,NEGATIVE,0.9969
12/20/2024,this opening drop that happens everyday is about to be brutal o well still holding,,0.5178,NEGATIVE,0.872
12/20/2024,"116.18, fibonacci baby. start watching for entries, but wait for confirmation or at least scale in for all of you who don't understand if you buy at the low it won't be the low. the mms must have the lowest low and the highest high. that's how they control the price. it's a war of hft attrition and all orders go through them. 5/5 (or higher) strength volume support strength starts at 115.26 and goes all the way down to the 70s. if they keep going down, just wait for them to come back up above 116.18. wait for the pullback after higher highs and higher lows and scale in, don't just go all in or they'll dip until enough get out to cover their losses if you stay in until they reach their target. options traders - you're literally telling them don't go to my target by this date and keep my money. use your heads. options are meant to be used as hedges. otherwise, the odds are against you being profitable over time. the mms goal is to move shares up the price ladder. options don't.",,0.5207,NEGATIVE,0.9995
12/20/2024,"$aapl $amzn $nvda $tsla when someone has zero idea, but cant stop himself to write an ""answer"".  looks at yourself in mirror during all that will happen.",,0.5046,NEGATIVE,0.9773
12/20/2024,what’s going on with amd ? definitely overvalued with 26% revenue growth and a ps of 7. the undervalued stock is $pltr with 25% revenue growth and a ps of 64. and i heard pltr got a contract with the army for 600 million and that definitely means the stock should be worth an extra 30 billion in market cap. i know it’s worth that much more because a guy on youtube said so,,0.6119,NEGATIVE,0.9998
12/20/2024,$smci im officially cooked boys  two sundays account was at an ath now back to my pre summer low,,0.5162,NEGATIVE,0.9994
12/20/2024,"$spy $vix if pce comes in hot, vix to the moon and stocks gets absolutely smoked",,0.5155,NEGATIVE,0.6031
12/20/2024,"$aapl $amzn $nvda $tsla ""predicting"" a  market crash in ""1-6months"" is not a prediction it's a guess. your chart means nothing. this neanderthal logic is why people don't invest and miss out.",,0.5153,NEGATIVE,0.9985
12/20/2024,pce numbers today will be a make or break for the bull run,,0.5243,NEGATIVE,0.8881
12/20/2024,wow what a burst from 180 to 110 in 3 months,,0.5417,POSITIVE,0.6967
12/20/2024,"$nvda $intc $mu $tsm  nvidia's ai business colliding with u.s.-chinese tensions, ny times reports the united states' proposed ai chip framework would block adversaries entirely, and give others quotas based on their alignment with the u.s., threatening nvidia's (nvda) expansion, the new york times' trip mickle and paul mozur report, citing four people familiar with the proposed restrictions. the chipmaker currently expects more than $10b in foreign sales this year. other companies in the space include include advanced micro devices (amd), intel (intc), qualcomm (qcom), marvel (mrvl), texas instruments (txn), micron (mu), microchip (mchp), and tsmc (tsm).",,0.5546,NEGATIVE,0.9997
12/20/2024,"$aapl $amzn $nvda $tsla why people dont want pay attention? right, couse we have statistical success ratio on exchange 10/90. which is conform with pareto principle 20/80, but with a correction on 1 century it leads to 10/90.",,0.5014,NEGATIVE,0.9771
12/20/2024,"$aapl $amzn $nvda $tsla i donno from where we will drop, but i do know we are in wave 5. will we make like ed on lower pic, or on that pic? 1000p drop that is a huge impulse giving some direction...",,0.494,NEGATIVE,0.6659
12/20/2024,"we're here, we've made it to the price target of about $115, going to be a hard bounce higher from here! 🔥🔥🔥",,0.529,POSITIVE,0.8326
12/20/2024,eyes on next er . gotta get in before then.,,0.532,POSITIVE,0.9956
12/20/2024,youtube.com/watch?v=vjehhcm... dav ives @ 29:00,,0.5093,POSITIVE,0.9973
12/20/2024,"damn, scum of a 'santa rally'... wiping out a years worth of $$$",,0.5229,NEGATIVE,0.9997
12/20/2024,115-116 more,,0.5,POSITIVE,0.9978
12/20/2024,official sign that we're about to boooom all over shorty's face: $boom is the only ticker in my watchlist that is gaf! even mms have a weak spot for comedy! @iamwillwexler,,0.5022,NEGATIVE,0.9952
12/20/2024,definitely buying...just trying to time the low..,,0.522,POSITIVE,0.99
12/20/2024,you about to lose,,0.495,NEGATIVE,0.998
12/20/2024,in five years amdq,,0.5333,POSITIVE,0.9956
12/20/2024,better semiconductor stock: amd vs. broadcom semiconductor stocks are a great area to invest in. the industry had a strong 2024 with global sales up 19% year over year and more growth expected in 2025. stck.pro/news/amd/96577808/,,0.6846,POSITIVE,0.9986
12/20/2024,jim cramer was pumping this garbage at $150 just a few months ago too.,,0.5325,NEGATIVE,1.0
12/20/2024,well whatdya know… down again.,,0.54,POSITIVE,0.5052
12/20/2024,i’ve been calling for this slow motion h sell setup for weeks now. it just accelerated.  watched out. $soxl $mu $intc $mpwr,,0.5057,POSITIVE,0.9722
12/20/2024,thank you for  your advice professor .,,0.4983,POSITIVE,0.7584
12/20/2024,"why blame lisa, elon and fed did this!",,0.505,NEGATIVE,0.9999
12/20/2024,should go back to 8 dollars,,0.5117,NEGATIVE,0.9994
12/20/2024,this is worth maybe no more then 60 dollars,,0.5283,POSITIVE,0.9918
12/20/2024,which one of you bozos bought this at 170 not even 2 months ago and expected to continue to make money? lmao 🤡,,0.5387,NEGATIVE,0.991
12/20/2024,now that we are all homeless i think it's comical how 117 is now the new resistance,,0.582,POSITIVE,0.8512
12/20/2024,"uncharted territory for su, doubt she has witnessed such a precipitous fall.",,0.4957,NEGATIVE,0.9961
12/20/2024,wow 116... ceo of the year btw.... people still defend her??,,0.6043,NEGATIVE,0.9599
12/20/2024,turd 💩,,0.5,NEGATIVE,1.0
12/20/2024,thank you for your hard earned money and for your great donation. lisa su ceo of advanced micro devices,,0.5396,POSITIVE,0.9522
12/20/2024,buy premarket for a couple hours,,0.5588,NEGATIVE,0.9905
12/20/2024,going to $90 like i said bull clowns 🤡,,0.6333,NEGATIVE,0.9996
12/20/2024,even the bears didnt think it would go this low 🥵,,0.5075,NEGATIVE,0.9994
12/20/2024,"$amdl dear harry a. wolin, mark d. papermaster, vanguard group inc,cathy woods,buy a shytload more soon,thanks,bye",,0.5374,NEGATIVE,0.5025
12/20/2024,this fkn stock is making me sick.  i put $40k in at 137 thinking id be good. wrong!  and only to see that cu.t ceo sell $10mil worth a couple weeks ago?  its no wonder someone killed that health care ceo when they do sht like that that openly destroys peoples lives!,,0.5305,NEGATIVE,0.9999
12/20/2024,$mu this shit cannot stop falling.,,0.498,NEGATIVE,0.9992
12/20/2024,so what's the end game? we all go to 0 in every stock and then meet at the nearest homeless shelter ?,,0.5567,NEGATIVE,0.9988
12/20/2024,"good morning traders. everyday we bring you very important price levels to consider.  *expected move by friday* = $121.50 upside, $116.00 downside. *market maker levels* support =$120.00, resistance =$150.00 *levels on daily* = $110.00 remember, stocks tend to overshoot support and resistance levels. if this happens look for price to reclaim those levels and hold /fail for information on its near term potential direction. happy trading",,0.5329,POSITIVE,0.9966
12/20/2024,"where did his santa rally ides come from? it's a bs phenomenon, no better than a coinflip. like tug of war between tax loss harvesting, holiday expenses and santa rally, lol",,0.5084,NEGATIVE,0.9956
12/20/2024,sell your puts and buy calls right at the bell. mark this post.,,0.5344,POSITIVE,0.993
12/20/2024,welcome to best ceo’s massage,,0.5338,POSITIVE,0.9913
12/20/2024,all panic,,0.5,NEGATIVE,0.9996
12/20/2024,best ceo of the year.,,0.7817,POSITIVE,0.9928
12/20/2024,"fukn unreal. 😂 time ceo of the year and this , lmao. complete disconnect . comical",,0.5865,NEGATIVE,1.0
12/20/2024,free fall,,0.4725,POSITIVE,0.6398
12/20/2024,$spy $aapl $tsla $nvda everyone and everything’s fooked tomorrow. gl all,,0.5056,NEGATIVE,0.6166
12/20/2024,this gonna bag a lot of people,,0.4937,POSITIVE,0.9605
12/20/2024,$intc bad news after bad news and now market tanking we going to $15. look at $wolf on the same boat going to $6 from like $58 $nvda,,0.5354,NEGATIVE,0.9999
12/20/2024,$clsk $btc.x $mstr,,0.5012,NEGATIVE,0.9085
12/20/2024,nasdaq is up 25% ytd and look at this,,0.5217,NEGATIVE,0.9986
12/20/2024,almost time to get in...114 first buy. 102 next buy,,0.6014,POSITIVE,0.9803
12/20/2024,$nvda crashing...,,0.5025,NEGATIVE,0.9991
12/20/2024,bleed bleed,,0.5,NEGATIVE,1.0
12/20/2024,bra! make it stop! wtf 😪,,0.503,NEGATIVE,0.9988
12/20/2024,🙏,,0.5,NEGATIVE,0.7615
12/20/2024,pigs get slaughtered!,,0.5083,NEGATIVE,0.9995
12/20/2024,i'm so good catching falling knives ...,,0.6,POSITIVE,0.9966
12/20/2024,117 overnight wow.. what an insane drop lately.,,0.491,NEGATIVE,0.6797
12/20/2024,$iwm $nke $spy $qqq,,0.5138,NEGATIVE,0.9981
12/20/2024,$clsk $btc.x $spy,,0.5062,NEGATIVE,0.9953
12/20/2024,$iwm $nke $qqq $spy i made $5 billion with their alerts,,0.5207,NEGATIVE,0.9946
12/20/2024,= always manages to dump,,0.5017,POSITIVE,0.7704
12/20/2024,lol,,0.5,POSITIVE,0.7374
12/20/2024,$ba really caught the bottom🔥 june calls holding thru new year 🤞 $tsla $nvda $spy,,0.58,NEGATIVE,0.9987
12/20/2024,we are getting dangerously close...,,0.4867,POSITIVE,0.9905
12/20/2024,"yup, even the pup is in disbelief...",,0.5012,NEGATIVE,0.9849
12/20/2024,dilution he says.  lmfao.,,0.5383,NEGATIVE,0.9234
12/20/2024,$tsla puts update $nvda $spy,,0.505,NEGATIVE,0.9998
12/20/2024,$ba this will be next year,,0.7467,NEGATIVE,0.6341
12/20/2024,"look 1 year chart , after every 30% drop up 25%.",,0.621,NEGATIVE,1.0
12/20/2024,let's go $tsla . holding the other 2 contracts looking for $435 since they are free now. $nvda $spy,,0.509,NEGATIVE,0.9995
12/20/2024,damnn i’ve been lately thinking hard to never trust any of this asian ceo again… bad experience…,,0.5113,NEGATIVE,0.9993
12/20/2024,"everyone... it's the same song and dance. they pump everyone's emotions by talking about tech non-stop to get you to rush in. then they rotate out of tech and make it feel like the sky's falling. just when you give up and capitulate, they rotate right back into tech making you feel foolish.  just dca in names that make money. it'll be ok",,0.5112,NEGATIVE,0.9471
12/20/2024,hodl no panic,,0.5,NEGATIVE,0.9996
12/20/2024,fakest of fake dips! total manipulation,,0.503,NEGATIVE,0.9997
12/20/2024,"i remember trading this under $15 and $nvda under $100 before the split, and now look at them all grown up. wonder how long before they grow old and toss in the towel like $intc",,0.5196,NEGATIVE,0.9336
12/20/2024,"don't count her out! glta ces las vegas monday, january 6 (day two-media day) 11am, amd ceo lisa su keynote (livestreamed: amd.com/en/corporate/events... )",,0.5598,NEGATIVE,0.9994
12/20/2024,$60,,0.5,POSITIVE,0.5738
12/20/2024,alright no more down,,0.5,POSITIVE,0.7768
12/20/2024,this is getting ridiculous.. we need a new investor to say they are buying,,0.5579,NEGATIVE,0.9999
12/20/2024,"immensely overvalued. if they execute flawlessly, they might be able to take 0.000000000012% market share from $nvda",,0.551,NEGATIVE,0.9994
12/20/2024,there is some selling pressure right now because of the year-end tax loss harvesting. this will shoot back above $150+ early next year ✅,,0.6086,NEGATIVE,0.9926
12/20/2024,a 200 billion dollar company and everyone is shorting without fear and no sight of rebound anywhere near…  damn something is fishy…  maybe dilution is coming in…. just saying though,,0.5412,NEGATIVE,0.9809
12/20/2024,why is everyone so bearish on amd?,,0.6583,NEGATIVE,0.9997
12/20/2024,oversolf 28 rsi. this is due for a rebound.,,0.4888,NEGATIVE,0.9983
12/20/2024,"nahhhh haha nice hyperbole tho,, 200 area then some resets(couple weeks to a months) and stabalization then 250(around summer next year) but it could always be sooner",,0.5589,NEGATIVE,0.9962
12/20/2024,when all the manipulation by wall street is over we will go back to $200 in 3 days,,0.5192,NEGATIVE,0.9995
12/20/2024,$dell and $nvda ready for 200$ $smci and $intc 45$🚀🚀🚀 santa rally,,0.5062,POSITIVE,0.8042
12/20/2024,5 buck cuck tomorrow?!?!,,0.4983,POSITIVE,0.5929
12/20/2024,@billbraski1777  x.com/heatherisunsane/statu...,,0.509,NEGATIVE,0.9406
12/20/2024,@iamwillwexler you think devinder members the login credentials for the buyback program?,,0.51,NEGATIVE,0.9822
12/20/2024,this is bullshit $200,,0.5,NEGATIVE,0.9982
12/20/2024,$coin $goog $jpm $unh,,0.4988,NEGATIVE,0.9968
