date of comment,main comment,comment,depth,PTR Sentiment,Flair Outlook,Flair Sentiment
,,Because monopolies are bad for consumers as well as vendors?,0,0.528,NEGATIVE,0.998
,,Came to say this,1,0.502,POSITIVE,0.773
,,For real. Can we stop with the m and a in this country for companies over 10bln? Or at least slow them down?,1,0.578,POSITIVE,0.872
,,Well the government does its due diligence at least/s,2,0.524,POSITIVE,0.981
,,Why Visa and Mastercard Stocks Are Falling.lol! In what universe/planet are Visa and Mastercard stocks falling. In our universe and planet they are both at all times high!,0,0.522,NEGATIVE,0.822
,,Is this some ai generated garbage?,0,0.593,NEGATIVE,1.0
,,"Capital One's acquisition of Discover will allow Capital One to process card transactions on a payment network that is not controlled by Visa and MasterCard, which is a form of competitive pressure on Visa and MasterCard in the industry. Personally, I don't think it will be down for long.",0,0.535,POSITIVE,0.665
,,https://archive.is/hvuMC,0,0.5,POSITIVE,0.889
