date of comment,main comment,comment,depth,PTR Sentiment,Flair Outlook,Flair Sentiment
,,"So, Thursday’s they day huh?",0,0.513,NEGATIVE,0.857
,,"Microsoft earnings could decided the entire market. If they come in soft, we’re going down hard.",1,0.554,NEGATIVE,0.974
,,macrohard,2,0.5,POSITIVE,0.962
,,Expecting a green candles?,0,0.507,NEGATIVE,0.937
,,What website,0,0.505,POSITIVE,0.741
,,Thoughts on Southwest getting beaten down after earnings?,0,0.548,NEGATIVE,0.985
,,Very curious about the money supply. One of the reasons I started to turn a bit more bearish is how rapidly the money supply is declining. Not good for asset pricing of any kind.,0,0.537,NEGATIVE,0.999
,,Well bulls it’s been fun…but it’s all over this week,0,0.545,NEGATIVE,0.991
,,RemindMe 7 Days!,1,0.505,POSITIVE,0.919
,,"Am I blind, or do I not seeing Apple and Amazon on here?",0,0.512,NEGATIVE,0.822
,,Both will be reporting on February 2nd.,1,0.522,NEGATIVE,0.984
,,Whats everyone's thoughts pre-earnings for Tesla?,0,0.552,NEGATIVE,0.928
,,Potential earnings?,0,0.623,NEGATIVE,0.814
,,Do we think a market crash is coming next week?,0,0.588,NEGATIVE,0.994
