date of comment,main comment,comment,depth,PTR Sentiment,Flair Outlook,Flair Sentiment
,,"I feel like your money would be better spent beefing up your s&p position till it’s respectable, then mixing in more individual stocks.",0,0.525,NEGATIVE,1.0
,,how much do I need to put in s and p for it to become respectable?,1,0.508,NEGATIVE,0.987
,,It’s a proportion thing. Total number is irrelevant because some people make 30k per year and some people make $300.In my individual investment account My position is roughly 2/3 mutual funds and the like vs 1/3 individual stocks.,2,0.544,NEGATIVE,0.997
,,"I prefer KO over pepsiA bit redundant to have dow 30 etf, a concentration of mega cap, and SP 500 etf. Keep your mega cap picks and put the dow 30 into the SP 500 fund.",0,0.5,NEGATIVE,0.998
,,Just buy an etf,0,0.605,NEGATIVE,0.987
,,Disney is done and apple no longer innovates.,0,0.504,NEGATIVE,0.999
,,All are good funds. You should be fine.,0,0.528,POSITIVE,0.997
,,"Disney is only going down, failure after failure",1,0.505,NEGATIVE,1.0
,,not bad. Now get some exposure to crypto.,0,0.504,NEGATIVE,0.996
,,That's good. I'm am also invested in a few and some are on ma watchlists,0,0.628,POSITIVE,0.996
,,Numbers going up is considered to be good. Numbers going down is considered to be bad.,0,0.518,NEGATIVE,0.999
,,,0,,,
,,Wrong.,1,0.485,NEGATIVE,0.996
,,Yea u don’t know anything about anything 💀,1,0.504,NEGATIVE,0.998
,,beef your portifolio up owning 1 stock of everything will give you minimal gains but its good that you spreaded it out. Just need to put more money into your portifolio,0,0.539,NEGATIVE,0.988
,,What app is it?,0,0.5,NEGATIVE,0.998
,,Why have SPY when you can have VOO and it’s literally identical but one is cheaper?,0,0.513,POSITIVE,0.531
,,I have these shares too. Do you still hold them?,0,0.518,POSITIVE,0.998
,,I sold Tesla for Amazon due to its volatility and I sold disney and transferred the money to VANGUARD,1,0.504,NEGATIVE,0.997
,,"I also bought Tesla but I will continue to hold on to it, I know Tesla is in a slump but I believe it will rise again.",2,0.55,POSITIVE,0.998
