date of comment,main comment,comment,depth,PTR Sentiment,Flair Outlook,Flair Sentiment
,,"This is misreporting. Both Visa and Mastercard will continue to operate in Russia. Read the fine print. The impact is fucking zero. They just blocked the Russian-issued cards from being used abroad, meaning that they punish people trying to flee the country, hurting the wrong guys.",0,0.507,NEGATIVE,1.0
,,,1,,,
,,,2,,,
,,"Russian natural gas isn’t sanctioned. $500MM-700MM / day is no laughing amount especially when the majority of large energy companies in Russia is owned by Oligarchs.This is a splash in the bucket even if true, almost attune to the impact of using ##BlackLivesMatter instead of actual reform.Wake me up when EU/NATO sanctions the larger exports, even then:What’s to stop Russia from selling crude to China, and China selling its own crude back to EU? You gonna sanction China?End-game globalization - electric boogaloo",1,0.518,NEGATIVE,0.985
,,"UnionPay will move in. No vacuum will be left. In 2015 the UnionPay overtook Visa and Mastercard in a total amount of value of payment transactions made by customers and became the largest card payment processing organization (debit and credit cards combined) in the world surpassing the two. Since 2006, China UnionPay cards can be used in over 100 countries outside China.",0,0.527,POSITIVE,0.994
,,cornering a wounded animal only has 2 outcomes. it submits or goes MAD.,0,0.503,NEGATIVE,0.999
,,Submission it is then.,1,0.5,POSITIVE,0.531
,,Came here to comment this. It will probably goes mad.,1,0.508,NEGATIVE,0.984
,,Oooo. A fresh Bot! Neat,1,0.502,POSITIVE,1.0
,,Oooo. A fresh Bot! Neat,2,0.502,POSITIVE,1.0
,,"aw cute. all this economic sanctions is to make the effects of this war feel real to people in russia in hopes to increase domestic pressure. domestic pressure = cornered, either Putin responds by giving up or goes batsht cray and does something we will all regret.",2,0.522,NEGATIVE,0.955
,,humanitarian saviors in the west are doing more harm than good to the RUSSIAN PEOPLE,0,0.512,NEGATIVE,0.995
,,Well Russian people voted for Putin. They chose this.,1,0.519,POSITIVE,0.988
,,"They ""voted"" much in the same way the North Korean ""voted"" Kim Jun Un to be their supreme leader",2,0.512,NEGATIVE,0.637
,,"Well around 85% of russians were for Putins invasion in 2014Majority of russians thanks to propaganda are believing that they're right in this conflict. Look at the videos where they're using ""Z"" symbols as a support for the war.",3,0.516,NEGATIVE,1.0
,,r/defiblockchain,0,0.508,POSITIVE,0.999
,,r/defiblockchain,1,0.508,POSITIVE,0.999
,,"yeah no. you have no right to be serviced by any of these companies. none. simple as that.this might have some downsides, but the alternative is not having a free market anymore. and that's much worse",1,0.531,NEGATIVE,1.0
,,"I agree. There is no right for sure and I understand that issue. But when something becomes the ""norm"" and as prevalent as credit cards in society and cash or checks are not really a major thing anywhere (especially after Covid), it's a delicate situation. It's almost like a utility being shutdown.",2,0.504,NEGATIVE,0.999
,,,0,,,
,,"I'm torn somewhat because everyday Russians don't want war, but at the end of the day the Russian people have voted for Putin since 2000. They have allowed him and his cronies to take over the country with virtually no accountability.",1,0.529,POSITIVE,0.834
,,"I doubt that was fare elections (just like in Belarus, although Russia didn’t fake it so obviously) Edit: also Putin changes the law as he pleases E.g. earlier he was not allowed to be president for more than 2 terms - now he can, b fore it was 4 years now it’s 6",2,0.522,NEGATIVE,0.869
,,"Correct, elections are not fair in Russia but the Russian people haven't demanded accountability from their politicians, judges, police officers, or really anyone.Russians have voted in Putin because he provided stability and an improved standard of living the past couple of decades. But sadly, if we zoom out we see that the average Russian is poorer than the average Pole and Poland has nowhere the amount of natural resources/wealth Russia has.The Russian people, due to fears of turmoil/another revolution or collapse/apathy/belief that 'they're all the same no matter who we vote in', have let things slide as long as they could put food on the table, buy an iPhone, and vacation in Egypt or Thailand once a year.",3,0.523,NEGATIVE,0.976
,,Putin got rid of all the opposition so there’s really not much choice. Plus this is so naive to think that “demanding accountability” would help. just think about it - people in Russia can get up to 5 years in prison for speaking against war. This is absolute nonsense! Also I think the Belarus example from last year doesn’t help - the whole country rose up against the government and it didn’t change anything,4,0.545,NEGATIVE,1.0
,,Well either the people rise up or the world wipes Moscow off the map what is better/worse?,5,0.537,NEGATIVE,0.999
,,You’re talking like it’s so easy for common citizens of a country to take down their rich and powerful dictatorship government. What are they supposed to do.,2,0.504,NEGATIVE,0.719
,,This,3,0.5,POSITIVE,0.954
,,"Russia is just extending the exclusive market to china with these sanctions. It is only going to hurt the west. But given there are so many protests in almost every major city against Russia, the west had to do something. This time China will be the beneficiary of neutrality about what has happened to Switzerland so far.World is changing, power is shifting.Let's see how long peace lasts and how long humanity lasts.",0,0.534,POSITIVE,0.909
,,Balls so hard mfs have to fine him,0,0.502,NEGATIVE,0.997
,,"Bye bye Visa and mastercard, There is no way back. Shooting yourself in the knee now new meta🤣🤣🤣",0,0.545,NEGATIVE,1.0
,,American Express too.,0,0.508,POSITIVE,0.922
,,It’s okay it’s not like EU/US was paying $500MM/day with visa or MasterCard for gas anyways :),0,0.512,NEGATIVE,0.997
