date of comment,main comment,comment,depth,PTR Sentiment,Flair Outlook,Flair Sentiment
,nan,GPT-REEEE,0,0.5,NEGATIVE,0.999
,nan,I love it when you talk to me like this,0,0.502,POSITIVE,0.997
,nan,Ridin my 3k shares at $3.20 all the way to a defense stonk status.,0,0.507,NEGATIVE,0.675
,nan,Love it brotha!!,1,0.505,POSITIVE,0.999
,nan,Yeah revenue growth of infinity percent since they literally make ZERO is going to be sick on earnings calls.,0,0.573,NEGATIVE,0.611
,nan,6 billion dollar order book bud,1,0.561,POSITIVE,0.802
,nan,Typical wsb responses on here. All the vitriol with none of the research. Oh well. Their loss.,2,0.516,NEGATIVE,1.0
,nan,Yall still talkin bout archer? LoL,0,0.504,POSITIVE,0.644
,nan,I hope so! I got in late last time - with some long calls which hope they print soon,0,0.538,POSITIVE,0.991
,nan,"Long calls your good brotha, smart. In retrospect I kind of pigeonholed myself with the Dec 20 calls. I got them on the run up a couple weeks ago, I started going shorter expiration because they were getting expensive for long expirations. I kind of like DCA ‘d the Dec 20 contracts as the stock has retreated to get the price per share down. It’s such an exciting company i have just gotten super into it.",1,0.553,NEGATIVE,0.835
,nan,This reads like a YouTube spam comment.,0,0.5,NEGATIVE,0.998
,nan,"Ya regarded degens need to stop shilling this. It's only gonna cause it to dump, and I actually don't want that. The irony... If I wasn't already deep in, I'd short this pumping foo.",0,0.502,NEGATIVE,1.0
,nan,"AMD, SMH, NVDA will follow.",0,0.62,NEGATIVE,0.643
,nan,Price target on amd?,1,0.697,NEGATIVE,0.993
,nan,Amd bro,3,0.738,POSITIVE,0.95
,nan,Not yall… talking to OP,4,0.498,NEGATIVE,0.992
,nan,"Lmao just had 430m dilution and about to start another project with hybrid engine. Took them long enough for this engine, it gonna take until 2026 for hybrid to even actualise?",0,0.516,NEGATIVE,0.58
,nan,I’ll pass but wish you good luck I really dread seeing achr in every other comment again thow.,0,0.508,NEGATIVE,1.0
