date of comment,main comment,comment,depth,PTR Sentiment,Flair Sentiment,Flair Outlook
,,GPT-REEEE,0,0.5,0.999,NEGATIVE
,,looks more like a bear flag to me,0,0.501,1.0,NEGATIVE
,,"it has no fundamentals as a company until way south of where its trading now, fundamentals will finally win with this piece",0,0.602,0.804,POSITIVE
,,What are fundamentals? Get that garbage out of here. We are regards.,1,0.508,0.988,NEGATIVE
,,"You can count on Musk to pump it soon, it’s been a while since any Tesla news.",0,0.516,0.993,POSITIVE
,,You can count on Musk to raid the piggy bank again too,1,0.519,0.996,POSITIVE
,,He’s gotta pump to raid first.,2,0.511,0.998,POSITIVE
,,I’m all in AMD 🗿,0,0.658,0.946,POSITIVE
,,"Somewhere between 240 and 160 by 4/22.It's obv, i colored in the lines and my wife's boyfriend told me i did really good.",0,0.51,0.985,NEGATIVE
