date of comment,main comment,comment,depth,PTR Sentiment,Flair Sentiment,Flair Outlook
,,GPT-REEEE,0,0.5,0.999,NEGATIVE
,,"Investors expected a leg at this point or at the very least, a hand.",0,0.527,0.898,NEGATIVE
,,The stock market is regarded. Company does amazing kills quarter high profits stock plumets to zero. Like wtf,1,0.644,0.871,POSITIVE
,,"Yea, then there's tesla defying gravity and mooning over bad earnings",2,0.529,0.999,NEGATIVE
,,It is down 30% YTD. It's back to 2021 prices. ARM made 50% YTD.,3,0.51,1.0,NEGATIVE
,,Tesla recalls all trucks. Stock +10%,2,0.605,0.955,NEGATIVE
,,Stocks don’t require brains,3,0.53,0.992,NEGATIVE
,,Buy the rumor sell the news.,2,0.579,0.985,NEGATIVE
,,K bought a sell (put) on Boeing today after hearing more planes r fucking up and up 2% what now?,3,0.524,0.989,NEGATIVE
,,"he bought a sell, didnt you read?",5,0.517,0.999,NEGATIVE
,,I hate that I laughed at this,5,0.5,1.0,NEGATIVE
,,Have u learned nothing?,4,0.488,0.997,NEGATIVE
,,Yea im working on it. Just have this moron brain that sees thing logically,3,0.511,0.999,POSITIVE
,,wtf there was nothing logically about this since day 1.,4,0.513,1.0,NEGATIVE
,,"Pelosi buy signal. Nvidia, etc.",2,0.574,0.983,NEGATIVE
,,This is a foolproof way to trade I agree,3,0.518,0.76,POSITIVE
,,"Gimme that Pelosi link to her trades again? (she's such a witch, I love it!)",4,0.5,1.0,POSITIVE
,,"It was pumped up before it went public. It's gone up. Warren Buffett wouldn't touch it due to its 1,388.78 P/E but I'm no Warren Buffett.",2,0.535,1.0,NEGATIVE
,,So everything we've seen do this wad pumped I suppose,3,0.509,0.999,NEGATIVE
,,Maybe because it’s training at 1.3k times its earnings? AI Regards did this,2,0.566,0.999,NEGATIVE
,,This lol. Never seen a P/E that high,3,0.523,0.91,POSITIVE
,,GPT-REEEE,3,0.5,0.999,NEGATIVE
,,I lost to 10 k other degenerates,2,0.5,0.939,NEGATIVE
,,The stock market is all about future forecasts. If you don’t know that yet I don’t know what to tell you…,2,0.576,0.555,NEGATIVE
,,Wrong. The stock market is all about fraud and manipulation.,3,0.63,0.998,NEGATIVE
,,Instead they got an arm,1,0.513,0.992,NEGATIVE
,,They should have used glitter pens to make the report more fun to read.,0,0.509,1.0,NEGATIVE
,,I would love it if they actually did that next time they report earnings.,1,0.572,0.994,NEGATIVE
,,winner!,1,0.51,0.999,POSITIVE
,,Headsquarters,1,0.5,0.996,POSITIVE
,,"Has the market cap of INTC on not even a billy of revenue...I guess ""AI"" or could be the next ""it"" or could be over-inflated",0,0.566,1.0,NEGATIVE
,,I agree it is overvalued. An arm isnt worth a 500 P/E ratio but still…,1,0.516,0.998,NEGATIVE
,,I thought it would go up and I still think it’s going to recover quite a bit,2,0.513,0.929,NEGATIVE
,,So it's going to double its MC for 900m revenue? LolTrue regard,3,0.524,0.988,NEGATIVE
,,"Well Intels future outlook ain’t shit, that’s why. Folks see the potential of ARM and the shit show that is Intels future",1,0.518,0.681,POSITIVE
,,"Its not going to grow into the valuation soon, but Nvidia was willing to pay 40 billion a few years ago.",1,0.544,0.942,NEGATIVE
,,Arm ISA powers billions of devices around the entire world right now.Nvidia's Grace CPU and Grace Hopper superchip both incorporate ARM's ISA.It's more of an AI-adjacent stock than an AI stock.,1,0.581,1.0,POSITIVE
,,"like my mom always used to say ""nothing you do is ever good enough""",0,0.509,0.859,POSITIVE
,,She never said that to me.,1,0.882,0.945,NEGATIVE
,,"Smart woman, hopefully you wrote that down in your diary.",1,0.502,0.976,POSITIVE
,,He wrote that in his will,2,0.505,0.699,POSITIVE
,,$100B company with $2.5B revenue…. Sure that valuation makes sense..,0,0.599,0.517,NEGATIVE
,,Right? 0.36 per share compared to 110 share price. Have fun making back your investment in 100 years.,1,0.574,0.527,NEGATIVE
,,PE over 1000. Overvalued as fuck.,0,0.493,1.0,NEGATIVE
,,"10% float, Softbank played so many idiots.",1,0.503,1.0,NEGATIVE
,,This is why a correction should come and come soon.,0,0.506,0.979,NEGATIVE
,,Definitely agree something is brewing only the big boys are propping the market up right now,1,0.536,0.58,NEGATIVE
,,It'll be the same big boys that'll pull the rug on all of us.,2,0.523,0.991,POSITIVE
,,"Yea, now how do we time it? That’s where some good money will be made.",3,0.535,0.998,NEGATIVE
,,"Long puts. I'm doing options 30, 45, 60 days out",4,0.613,0.7,POSITIVE
,,I feel you but time goes fast and the market makers can manipulate for longer than we can float the cost.,5,0.545,0.935,NEGATIVE
,,"Then do LEAPS puts - for example I've got CVNA puts for Jan 25, those mofos won't get away with cooking their books that long.",6,0.52,0.857,NEGATIVE
,,Jeremy Irons needs to get his ass into the office tonight and get this thing going already,3,0.514,0.956,POSITIVE
,,"There are three ways to make a living in this business: be first, be smarter, or cheat.",4,0.555,0.936,NEGATIVE
,,How is anyone surprised a company with a P/E of over 1300 didn’t manage to push that higher?,0,0.601,0.905,NEGATIVE
,,They should have announced some stock buyback. Seems to do wonders these days.,0,0.586,0.955,POSITIVE
,,The fuck does that mean. Crushed earnings. Decent outlook.To the fucking sin bin you go!,0,0.523,1.0,NEGATIVE
,,thats code for Softbank dumping their shares,0,0.505,1.0,NEGATIVE
,,It’s because they didn’t announce the widely anticipated Headmaster AI 2300 chip. maybe next quarter,0,0.555,0.998,NEGATIVE
,,If you don’t talk about AI your share price will tank because investors are regarded.,0,0.573,0.701,POSITIVE
,,future P/E full regard,0,0.522,0.997,POSITIVE
,,"Its my fault. I bought a bunch of stocks a month ago and they all cratered. The options should expire in another month and everything will moon, so just wait it out. You're welcome.I'll be buying a lot of Puts soon, so you can plan on that for late June. Everything should moon about then and stay up until about Feb 2025, then crash. By then I'll be broke and unable to play anymore.",0,0.516,1.0,NEGATIVE
,,Fuck me with this guidance bullshit. Can investors be rewarded for buying into good performance today?,0,0.537,0.999,NEGATIVE
,,"No, stocks are priced in for what their value should be 20 years from now.",1,0.568,0.953,NEGATIVE
,,80% of the companies discussed on Reddit won't be around in 20 years.,2,0.567,0.972,NEGATIVE
,,"I wouldn't consider Robinhood's overall gain a ""rally"": I'm pretty sure the overall sentiment is still bullish. However, I think retailers gave a nice sell price to some high holders.",0,0.537,0.983,NEGATIVE
,,"ARM revenue increased, but profits dropped 52.2%. If that's just from increased investment, then the stock market is being stupid and prioritizing short term gains over long term again, but if it's from increased costs for example, the a drop in the stock price. No I'm not going to bother to read the full report which would presumably answer my question.",0,0.603,0.999,NEGATIVE
,,The valuation is still absurd. It's worth no more than $5 a share.AI hype is finally coming home to roost.,0,0.551,1.0,NEGATIVE
,,"I honestly don't see how anyone didn't expect this, comparing ARM to NVDA or AMD or any other American chip stock is like comparing WBA to AMZN. Also 1300 P/E guys",0,0.567,0.952,POSITIVE
,,They need to change the name of the company to ULTRA PEPE BBQ and the stock will go up,0,0.629,0.998,NEGATIVE
,,"This tells you everything you need to know about ""investors""https://twitter.com/rasmr_eth/status/1787872959648182341?t=XPaJu7vhlUWliEKiv8vIYw&s=19",0,0.512,0.516,POSITIVE
,,Tell me retail was holding too many calls without telling me retail was holding too many calls,0,0.516,0.997,NEGATIVE
,,I have seen this happen to several companies lately and I just don't understand.,0,0.533,1.0,NEGATIVE
,,You can’t crush earnings. You have to beat them by just enough.,0,0.553,0.998,POSITIVE
,,"Not enough leather jackets or mention of AI. Plus on a real note… hasn’t been that much adoption or hype in the community for arm and AI, groq is getting the hype.",0,0.536,0.835,NEGATIVE
,,Check out Navitas (NVTS) if you want to play a solid company in the tech space that hasn’t already been pumped to the moon but has growth potential.,0,0.576,0.993,POSITIVE
,,This just means the author of that article has no fucking idea why his calls were burned.,0,0.504,1.0,NEGATIVE
,,The Intel move,0,0.56,0.515,NEGATIVE
,,Isn’t the stock at like 1500 PE slight bad results ofc it was gonna go down,0,0.544,1.0,NEGATIVE
,,"To paraphrase the Intelligent Investor:“Periodically, lock in your gains.”Everyone is scared, so they sell at local highs to lock in gains and buy local lows. Hardly anyone is buying and holding and that affects the market.Fear is running rampant — nobody wants to be left holding the hot potato when it blows.",0,0.519,1.0,NEGATIVE
,,The flying saucer was priced in.,0,0.502,0.808,NEGATIVE
,,guess it's not the same people who invest in tesla and kept buying while it was 20x+ it's reasonable value,0,0.512,0.861,NEGATIVE
,,Arm need to do a low power TPU,0,0.509,0.999,NEGATIVE
,,Criminals decide the price,0,0.525,0.973,NEGATIVE
,,Basically stock prices go against expectations because that is how big money reaps all the option money,0,0.558,0.992,NEGATIVE
,,When stock rise on bad news and fall on good news it means we are at the top of the froth. There is definitely a rotation from AI growth stock to defensive and value stocks.,0,0.602,0.693,POSITIVE
