date of comment,main comment,comment,depth,PTR Sentiment,Flair Sentiment,Flair Outlook
,,GPT-REEEE,0,0.5,0.999,NEGATIVE
,,"You think ETSY's going below $70 tmrw? I have 70P but I think I want to sell at open tmrw just cause it seems like the entire market is going green. NVDA crushed, SPY 500+",0,0.522,0.998,NEGATIVE
,,"Please god, go below 70 tomorrow",1,0.5,0.994,NEGATIVE
,,Set your stop losses and lets go in this together,2,0.502,0.994,POSITIVE
,,"I managed to sell em all for 2.35 a contract, im out 💨",3,0.546,0.941,NEGATIVE
,,"ARM, good. Etsy, fucked.",0,0.524,0.703,NEGATIVE
,,You don’t think Etsy can drop more tomorrow? Basically all owned by institutions and I can see them selling large volume tomorrow. I mean the company’s fucked.,1,0.506,0.998,NEGATIVE
,,"they already sold in volume, that activist investor group elliott capital wants to keep it over 70$ cause thats where they started buying.",2,0.539,0.993,NEGATIVE
,,elliott capital bag holding in a dying company,3,0.636,0.99,NEGATIVE
,,They think they can fix her,4,0.508,0.998,NEGATIVE
,,"How so? Etsy is $70 rn, if they go down even more tomorrow, why would 64p not make anything?",1,0.506,0.999,NEGATIVE
,,"Yeah, the premium on Etsy is already low, so a big selloff could give a nice boost at open.",2,0.512,0.795,NEGATIVE
,,"if it is $70 tomorrow, what market will there be post earnings, for another 10% drop in a day? definition of IV crush",2,0.548,1.0,NEGATIVE
,,"all these are answers are wrong. we don't know will happen in the PM, lol",0,0.504,0.966,NEGATIVE
,,"If it opens the same as it is now (the end of after hours trading) I'd say with ETSY sitting at $71, those puts will be worth close to nothing and with ARM sitting at $133.10, those calls will probably be even to slightly down.",0,0.51,0.999,NEGATIVE
,,"Etsy trading at $68.89 right now, decent chance it will open under $68.",1,0.515,0.992,NEGATIVE
,,Where are you figuring this out? Options profit calculator says I’m doing a lot better than that. Lol,1,0.543,0.676,POSITIVE
,,"Honestly I'm just guessing based on past experience. With only 2 days till expiration in the money options tend to be worth pretty close to how much in the money they are. Now ARM will still have IV baked in because it's ARM but I'm not sure it will be enough to make those calls worth much more than 4.23.I hope I'm wrong.EDIT: my bad, I forgot ARM already had earnings and this wasn't a move up on earnings. Those should print in the morning",2,0.554,1.0,NEGATIVE
,,ETSY puts will be worth around $11/contract.,2,0.566,0.599,NEGATIVE
,,"Based on ...? It dropped almost 11% from close until now in premarket, and I'm watching it slowly continue sliding. It's trading under $69 as of right now.",3,0.549,1.0,NEGATIVE
,,"my bad, $2.",4,0.49,0.999,NEGATIVE
,,Not a chance unless it gets to $53 somehow,3,0.497,0.999,NEGATIVE
,,Looks like you know what youre doing. Ill see myself out,0,0.512,0.874,NEGATIVE
,,What does this have to do with IV?,0,0.505,0.956,NEGATIVE
,,Right IV won’t change much for ARM,1,0.513,1.0,NEGATIVE
,,Hopefully it goes up,2,0.505,0.989,POSITIVE
,,"Dude I don't think ETSY will pay, Your options are expiring Friday and need to get below 64p. IV crush is gonna wreck your puts tomorrow.",0,0.505,1.0,NEGATIVE
,,wouldn't he make money if ETSY opens sub $70 tomorrow regardless?,1,0.506,0.993,NEGATIVE
,,Yuh people forget something or someone still needs to want your sht for it to be worth something. This aint cookie clicker,2,0.507,1.0,NEGATIVE
,,Yuh people forget something or someone still needs to want your sht for it to be worth something. This aint cookie clicker,3,0.507,1.0,NEGATIVE
,,"Funny enough, I sold some worthless Roku puts today with an expiration date of 2/23 that were “worth” $1 a contract.I noticed I was the majority of contracts being sold so for shits and giggles I priced them at $5 a contract - sold 28/45 of them at $5There’s always the group of morons who don’t pay attention to price spread and go under the moment they are filled.",4,0.532,1.0,NEGATIVE
,,Sorry for the late reply. The answer was no. He had super short dated options all the value was in the IV. When IV faded the option got nuked. I think the 64p opened at like 4 cents.I made an update video on it.https://youtu.be/GHQwyBMSceQ?si=5mVcxaMMTI0zJge2,2,0.508,1.0,NEGATIVE
,,"Things always get crazy when the market opens. So basically, idk.",0,0.536,0.999,NEGATIVE
,,If it was smci or NVDA I would say yes arm I am not too sure but you will be fine,0,0.506,0.971,NEGATIVE
