Date Posted,Source,Headline,Preview,Link,PTR Headline Sentiment,Flair Headline Outlook,Flair Headline Score,PTR Preview Sentiment,Flair Preview Outlook,Flair Preview Score
12/9/2024,Seeking Alpha,"AMD falls as BofA downgrades amid AI, PC concerns (AMD)",AMD (AMD) was in focus on Monday as Bank of America downgraded the semiconductor company. Read for more.,https://seekingalpha.com/news/4377376-amd-falls-as-bofa-downgrades-amid-ai-pc-concerns,0.505,NEGATIVE,0.9991,0.6305555555555556,NEGATIVE,0.8693
12/9/2024,MarketBeat,"5,007 Shares in Advanced Micro Devices, Inc. (NASDAQ:AMD) Bought by SGL Investment Advisors Inc.","SGL Investment Advisors Inc. purchased a new stake in Advanced Micro Devices, Inc. (NASDAQ:AMD - Free Report) during the third quarter, according to the...",https://www.marketbeat.com/instant-alerts/5007-shares-in-advanced-micro-devices-inc-nasdaqamd-bought-by-sgl-investment-advisors-inc-2024-12-09/,0.5,NEGATIVE,0.9669,0.5862500000000002,NEGATIVE,0.9503
12/9/2024,digital terminal,Lenovo Launches ThinkPad T14s Laptop with AMD Ryzen AI Processor for Maximum Productivity,"Lenovo introduced the ThinkPad T14s Gen 6 - AMD in India, the first-ever x86 Lenovo ThinkPad to feature next-gen AI capabilities with 50 TOPS of processing...",https://digitalterminal.in/launchpad/lenovo-launches-thinkpad-t14s-laptop-with-amd-ryzen-ai-processor-for-maximum-productivity,0.52,POSITIVE,0.8954,0.5700000000000001,POSITIVE,0.9975
12/9/2024,LatestLY,"Lenovo ThinkPad T14s Gen 6 With AMD Ryzen AI Pro Processor Launched in India; Check Price, Specifications and Features","Lenovo launched the AI-powered ThinkPad T14s Gen 6 in India with advanced multitasking, extended battery life, and improved security features using the AMD...",https://www.latestly.com/technology/lenovo-thinkpad-t14s-gen-6-with-amd-ryzen-ai-pro-processor-launched-in-india-check-price-specifications-and-features-6478188.html,0.5,POSITIVE,0.9958,0.5593333333333333,POSITIVE,0.9718
12/9/2024,Times of India,Lenovo launches AI-powered ThinkPad T14s Gen 6 with AMD Ryzen AI PRO 360 processor,"LAPTOPS & PC News: Lenovo has unveiled the ThinkPad T14s Gen 6 - AMD, a business laptop boasting 50 TOPS of AI processing via the Ryzen AI 7 PRO 360...",https://timesofindia.indiatimes.com/technology/laptops-pc/lenovo-launches-ai-powered-thinkpad-t14s-gen-6-with-amd-ryzen-ai-pro-360-processor/articleshow/116140989.cms,0.54,POSITIVE,0.7492,0.5870833333333334,POSITIVE,0.9891
12/9/2024,smartphonemagazine.nl,Will AMD Stock Skyrocket? Discover the Future of Smartphone CPUs!,"In the ever-evolving world of technology, AMD has long been considered a frontrunner in the realm of computing hardware. Traditionally known for its prowess...",https://smartphonemagazine.nl/en/2024/12/09/will-amd-stock-skyrocket-discover-the-future-of-smartphone-cpus/,0.5,NEGATIVE,0.9955,0.6364285714285715,POSITIVE,0.9997
12/9/2024,CNBC,Bank of America downgrades AMD due to potential market share losses,"Advanced Micro Devices could lose market share as cloud customers increasingly prefer custom chips, Bank of America said.",https://www.cnbc.com/2024/12/09/bank-of-america-downgrades-amd-due-to-potential-market-share-losses.html,0.49,NEGATIVE,0.9966,0.6127777777777779,NEGATIVE,0.9915
12/9/2024,MarketBeat,"Advanced Micro Devices, Inc. (NASDAQ:AMD) Shares Sold by Nomura Asset Management Co. Ltd.","Nomura Asset Management Co. Ltd. lowered its position in Advanced Micro Devices, Inc. (NASDAQ:AMD - Free Report) by 0.7% during the 3rd quarter,...",https://www.marketbeat.com/instant-alerts/advanced-micro-devices-inc-nasdaqamd-shares-sold-by-nomura-asset-management-co-ltd-2024-12-09/,0.5,NEGATIVE,0.9953,0.5811538461538462,NEGATIVE,0.9992
12/9/2024,PC-Tablet India,AMD Redefines Business Productivity with Third-Gen Ryzen™ AI PRO Processors: Powering the Future of AI Computing,"AMD launches 3rd Gen Ryzen™ AI PRO 300 Series processors with enhanced Copilot+ features, XDNA™ 2 architecture, and 50 TOPS of AI power, redefining business...",https://www.pc-tablet.co.in/amd-redefines-business-productivity-with-third-gen-ryzen-ai-pro-processors-powering-the-future-of-ai-computing/51506/,0.52,POSITIVE,0.9945,0.6003571428571429,POSITIVE,0.999
12/9/2024,Research Snipers,Controversial innovation Recall now also for AMD & Intel,"It took a while, but now Microsoft has now released a preliminary version of Windows 11 for the first time, in which users of PCs with processors from Intel...",https://researchsnipers.com/controversial-innovation-recall-now-also-for-amd-intel/,0.5025,NEGATIVE,0.9733,0.6375000000000001,NEGATIVE,0.779
12/9/2024,Investing.com,AMD stock slides as BofA cuts to Neutral on 2025 downside risks to expecations,"Investing.com -- Bank of America downgraded Advanced Micro Devices (NASDAQ:AMD) to Neutral from Buy in a research note on Monday, citing downside risks to...",https://www.investing.com/news/stock-market-news/amd-stock-slides-as-bofa-cuts-to-neutral-on-2025-downside-risks-to-expecations-3760945,0.54,NEGATIVE,0.9984,0.5955555555555556,NEGATIVE,0.9973
12/9/2024,Gadgets 360,Lenovo ThinkPad T14s Gen 6 Debuts in India,"Lenovo ThinkPad T14s Gen 6 launched in India with AMD Ryzen AI 7 Pro 360 CPU, 14-inch display.",https://www.gadgets360.com/laptops/news/lenovo-thinkpad-t14s-gen-6-price-in-india-launch-specifications-features-7207977,0.5,POSITIVE,0.9783,0.5075,POSITIVE,0.9592
12/9/2024,PC Guide,AMD FSR on its way for Indiana Jones and the Great Circle is great news for handheld owners,"The first update for Indiana Jones and the Great Circle is here, and the patch notes confirm that AMD FSR support is in the works.",https://www.pcguide.com/news/amd-fsr-coming-to-indiana-jones-and-the-great-circle-is-great-news-for-handheld-owners/,0.5075000000000001,POSITIVE,0.9955,0.5590909090909091,POSITIVE,0.8878
12/9/2024,The Indian Express,Lenovo launches AMD-powered ThinkPad T14s Gen 6 with up to 50 TOPs of AI performance,"On Monday, Lenovo, at the TechDay 2024 event held in Bengaluru, unveiled the AMD ThinkPad T14s Gen 6, powered by the AMD Ryzen AI 7 Pro 360 processor in...",https://indianexpress.com/article/technology/laptops/lenovo-thinkpad-t14s-gen-6-amd-launch-features-specs-9715109/,0.5225,POSITIVE,0.98,0.5815,POSITIVE,0.9556
12/9/2024,VideoCardz.com,AMD Ryzen Master update enables EXPO memory changes without reboots,"AMD has launched a new version of Ryzen Master, listed as 2.14.1.3286. This version focuses on certain optimizations for the new Ryzen 9000 series as well...",https://videocardz.com/newz/amd-ryzen-master-update-enables-expo-memory-changes-without-reboots,0.5225,POSITIVE,0.9908,0.553,POSITIVE,0.9707
12/9/2024,India Today,"Lenovo launched ThinkPad T14s Gen 6 powered by AMD Ryzen AI Pro processors, priced at Rs 1,38,000",Lenovo ThinkPad T14s Gen 6 is the latest AI laptop by the company. It promises to deliver smooth multitasking with AMD Ryzen AI Pro 300 series chipset.,https://www.indiatoday.in/technology/news/story/lenovo-launched-thinkpad-t14s-gen-6-powered-by-amd-ryzen-ai-pro-processors-priced-at-rs-138000-2646962-2024-12-09,0.5975000000000001,NEGATIVE,0.7768,0.56,POSITIVE,0.9995
12/9/2024,Wccftech,"AMD Ryzen Master 2.14.1.3286 Now Allows Turning On EXPO Without A Restart, Adds Several New CPU & Memory Tuning Features",The latest AMD Ryzen Master software version 2.14.1.3286 will now allow users to turn on the AMD EXPO without restarting system.,https://wccftech.com/amd-ryzen-master-2-14-1-3286-now-allows-turning-on-expo-without-a-restart-adds-several-new-cpu-memory-tuning-features/,0.5,POSITIVE,0.9907,0.5646666666666668,NEGATIVE,0.9131
12/9/2024,Research Snipers,AMD Processor Prices May Soon Fall,"AMD has had great success so far with its new Zen 5 gaming processor. However, the CPU is poorly available. But that should change soon.",https://researchsnipers.com/amd-processor-prices-may-soon-fall/,0.5025,NEGATIVE,0.9995,0.5808333333333334,POSITIVE,0.9724
12/9/2024,Windows Central,Windows Recall finally opens its doors to Intel and AMD with latest preview,"Microsoft has rolled out the Windows Recall preview to more Copilot+ PCs. Now, Intel and AMD-powered Copilot+ PCs can try out Windows Recall and Click To Do...",https://www.windowscentral.com/software-apps/windows-11/windows-recall-finally-opens-its-doors-to-intel-and-amd,0.525,POSITIVE,0.988,0.5683333333333332,POSITIVE,0.9459
12/9/2024,Wccftech,Indiana Jones and the Great Circle Update Enables Path Tracing on NVIDIA RTX GPUs; AMD FSR to Be Added Later,"MachineGames has released the first update for Indiana Jones and the Great Circle, enabling path tracing for NVIDIA GeForce RTX graphics cards.",https://wccftech.com/indiana-jones-and-the-great-circle-update-enables-path-tracing-on-nvidia-rtx-gpus-amd-fsr-to-be-added-later/,0.5,POSITIVE,0.9948,0.5470000000000002,POSITIVE,0.9934
12/9/2024,Windows Report,KB5048780 makes Recall available to AMD and Intel-powered Copilot+ PCs,"KB5048780 brings Windows Recall to all Copilot+ PCs out there, including those powered by Intel and AMD processors.",https://windowsreport.com/kb5048780-makes-recall-available-to-amd-and-intel-powered-copilot-pcs/,0.5175000000000001,POSITIVE,0.9424,0.5733333333333335,POSITIVE,0.9997
12/9/2024,The Week,AMD Redefines Business Productivity with Third-Gen Ryzen™ AI PRO Processors Powering the Future of Advanced AI Computing,"MUMBAI, India, Dec. 9, 2024 /PRNewswire/ -- AMD (NASDAQ: AMD) has launched its third-generation commercial AI mobile processors, the Ryzen™",https://www.theweek.in/wire-updates/business/2024/12/09/dcm5-advanced-micro-devices-inc..html,0.6450000000000001,POSITIVE,0.9914,0.6000000000000001,POSITIVE,0.5338
12/9/2024,Devdiscourse,AMD Unveils Next-Gen Ryzen™ AI PRO 300 Series: A Game-Changer in Business Computing,"AMD has introduced the Ryzen™ AI PRO 300 Series processors, enhancing business productivity with advanced AI features. These processors offer superior...",https://www.devdiscourse.com/article/technology/3187032-amd-unveils-next-gen-ryzent-ai-pro-300-series-a-game-changer-in-business-computing,0.5,POSITIVE,0.9997,0.5987500000000001,POSITIVE,0.9977
12/9/2024,elblog.pl,VLC and AMD: The Future of Upscaling Awaits! New Horizons in Media Playback!,"In a groundbreaking development, VLC Media Player and AMD are reportedly working together to revolutionize media playback through advanced upscaling...",https://elblog.pl/2024/12/09/vlc-and-amd-the-future-of-upscaling-awaits-new-horizons-in-media-playback/,0.5,POSITIVE,0.9992,0.5988888888888889,POSITIVE,0.9954
12/9/2024,TipRanks,"‘Load Up on This Dip,’ Says Investor About AMD Stock","Advanced Micro Devices (NASDAQ:AMD) stock hasn't exactly been a Wall Street darling this year, with its shares stuck in the red for 2024.",https://www.tipranks.com/news/load-up-on-this-dip-says-investor-about-amd-stock,0.51,NEGATIVE,0.9922,0.6471428571428574,NEGATIVE,0.9995
12/9/2024,GuruFocus,"NVIDIA Faces Rising AI Chip Competition from AMD, Amazon, and St","NVIDIA (NVDA) is encountering increased competition in the AI chip market. Rivals like AMD (AMD), Amazon (AMZN), and startups such as SambaNova Systems and...",https://www.gurufocus.com/news/2626827/nvidia-faces-rising-ai-chip-competition-from-amd-amazon-and-startups,0.5,NEGATIVE,0.9015,0.6188888888888889,NEGATIVE,0.7732
12/8/2024,The Hindu BusinessLine,"India at the core of every AMD product, says Jaya Jagadish",AMD India's Jaya Jagadish discusses the company's growth in India and the evolution of local talent in semiconductor industry.,https://www.thehindubusinessline.com/info-tech/india-at-the-core-of-every-amd-product-says-jaya-jagadish/article68961710.ece,0.5,POSITIVE,0.9969,0.5937500000000001,POSITIVE,0.9976
12/10/2024,TweakTown,AMD's flagship Ryzen AI Max+ Pro 395 'Strix Halo' APU with Radeon 8060S GPU leaked,"TL;DR: AMD's upcoming Strix Halo APU, featuring the Ryzen AI Max+ 395 processor, was spotted on Geekbench. It includes 16 Zen 5 CPU cores, 32 threads,...",https://www.tweaktown.com/news/102086/amds-flagship-ryzen-ai-max-pro-395-strix-halo-apu-with-radeon-8060s-gpu-leaked/index.html,0.5,NEGATIVE,0.9994,0.5596153846153846,POSITIVE,0.8723
12/10/2024,TweakTown,"AMD is working to improve Ryzen 9800X3D stock levels, but some may have to wait until 2025","AMD says stock levels for its new Ryzen 9 9800X3D CPU will ramp up in Q1 2025, which is good because it's currently sold out everywhere.",https://www.tweaktown.com/news/102060/amd-is-working-to-improve-ryzen-9800x3d-stock-levels-but-some-may-have-wait-until-2025/index.html,0.5,NEGATIVE,0.9918,0.6238888888888889,POSITIVE,0.9614
12/10/2024,TipRanks,"‘A Strong Year Is Coming,’ Says Top Analyst About AMD Stock","Advanced Micro Devices (NASDAQ:AMD) has found itself trailing the pack this year, with its stock down 13% year-to-date. While rival chipmakers ride the AI...",https://www.tipranks.com/news/a-strong-year-is-coming-says-top-analyst-about-amd-stock,0.51,POSITIVE,0.9968,0.6849999999999999,NEGATIVE,0.9913
12/10/2024,heise online,Only one in ten desktop graphics cards still comes from AMD,"AMD and Nvidia are selling fewer graphics cards, bucking the seasonal trend. AMD is being hit particularly hard.",https://www.heise.de/en/news/Only-one-in-ten-desktop-graphics-cards-still-comes-from-AMD-10194565.html,0.5125,NEGATIVE,0.9925,0.5787500000000001,NEGATIVE,0.9994
12/10/2024,Notebookcheck,MSI Summit A16 AI Plus review: Powerful AMD Ryzen 9 convertible,"The MSI model is now one of the fastest 16-inch convertibles in the market when it comes to processor performance. However, its lack of discrete graphics...",https://www.notebookcheck.net/MSI-Summit-A16-AI-Plus-review-Powerful-AMD-Ryzen-9-convertible.927086.0.html,0.5,POSITIVE,0.9991,0.5820000000000001,NEGATIVE,0.9693
12/10/2024,MarketBeat,Advanced Micro Devices (NASDAQ:AMD) Stock Price Down 1% - Should You Sell?,Advanced Micro Devices (NASDAQ:AMD) Trading Down 1% - Here's What Happened.,https://www.marketbeat.com/instant-alerts/advanced-micro-devices-nasdaqamd-stock-price-down-1-should-you-sell-2024-12-10/,0.5,NEGATIVE,0.9941,0.6625000000000002,NEGATIVE,0.9984
12/10/2024,PC Perspective,BadRAM Breaks AMD’s SEV-SNP Trusted Execution Protection,"BadRAM Breaks AMD's SEV-SNP Trusted Execution Protection Today's bad news comes from researchers at KU Leuven, the University of Lübeck, and the University...",https://pcper.com/2024/12/badram-breaks-amds-sev-snp-trusted-execution-protection/,0.5075000000000001,NEGATIVE,0.7925,0.501875,NEGATIVE,0.9772
12/10/2024,Analytics Insight,AMD Ryzen AI PRO: A Game-Changer for Business Laptops?,"Discover how AMD Ryzen AI PRO revolutionizes business laptops with enhanced AI, robust security, and extended battery life.",https://www.analyticsinsight.net/photo/amd-ryzen-ai-pro-a-game-changer-for-business-laptops,0.5025,POSITIVE,0.8258,0.63375,POSITIVE,0.9992
12/10/2024,Tom's Hardware,AMD's Ryzen 9 9900X processor tumbles to just $332 - power up a new AM5 PC with this holiday bargain,Today's deal features the latest lineup of processors from AMD - the 9000-series and in particular the Ryzen 9 9900X. This CPU has had some hefty price...,https://www.tomshardware.com/pc-components/cpus/amds-ryzen-9-9900x-processor-tumbles-to-just-usd332-power-up-a-new-am5-pc-with-this-holiday-bargain,0.5075000000000001,NEGATIVE,0.989,0.5831818181818181,POSITIVE,0.9996
12/10/2024,HotHardware,AMD Ryzen AI Max+ Pro 395 Strix Halo Chip Breaks Cover With Radeon 8060S GPU,"The first leak of a Strix Halo processor is here, and it verifies everything we thought we knew.",https://hothardware.com/news/amd-ryzen-ai-max-leak,0.5,NEGATIVE,1.0,0.5665384615384614,POSITIVE,0.9915
12/10/2024,Latin Times,Karol G Amd Feid Share One of the Most Romantic Moments in Latin Music History,The Colombian couple stole their fans' hearts after declaring their love on stage.,https://www.latintimes.com/karol-g-amd-feid-share-one-most-romantic-moments-latin-music-history-568568,0.53,POSITIVE,0.9997,0.5740909090909092,POSITIVE,0.9973
12/10/2024,FaharasNET,AMD’s Trusted Execution Environment Exposed: BadRAM Attack Unleashes Major Security Flaws!,"On December 10, 2024, a new attack method named BadRAM has raised serious concerns about the security of AMD's trusted execution environment.",https://news.faharas.net/186881/amds-trusted-execution-environment-blown/,0.5,NEGATIVE,0.9929,0.5077272727272727,NEGATIVE,0.9997
12/10/2024,Business Wire,"Zip Brings Procurement Orchestration to the Mainstream in 2024, Delivering Transformative Results for Global Leaders like HP, AMD, and Anthropic","Zip, the world's leading procurement orchestration platform, today celebrated a transformative year that established procurement orchestration as a cr.",https://www.businesswire.com/news/home/20241210426059/en/Zip-Brings-Procurement-Orchestration-to-the-Mainstream-in-2024-Delivering-Transformative-Results-for-Global-Leaders-like-HP-AMD-and-Anthropic,0.6525000000000001,POSITIVE,0.999,0.5464285714285715,POSITIVE,0.9985
12/10/2024,PC Gamer,"Just to cap off Intel's annus horribilis, Time picks AMD's Dr Lisa Su as its CEO of the year","Topping off what has been a mostly positive year of fortunes for AMD, Time magazine has picked Dr Lisa Su as its choice of CEO of the year.",https://www.pcgamer.com/hardware/just-to-cap-off-intels-annus-horribilis-time-picks-amds-dr-lisa-su-as-its-ceo-of-the-year/,0.5075000000000001,NEGATIVE,0.9626,0.6191666666666665,POSITIVE,0.9831
12/10/2024,TipRanks,Railtown AI Partners with AMD to Boost AI Innovation,"Railtown AI Technologies Inc (TSE:RAIL) has released an update. Railtown AI Technologies Inc. has joined AMD's Independent Software Vendor Partner Program,...",https://www.tipranks.com/news/company-announcements/railtown-ai-partners-with-amd-to-boost-ai-innovation,0.51,POSITIVE,0.9928,0.6450000000000001,POSITIVE,0.7985
12/10/2024,smartphonemagazine.nl,You Won’t Believe What’s Happening with AMD Stock Now,"AMD Faces Downgrade Amidst Tough AI Competition. AMD, often benefiting from Intel's recent setbacks, received a setback of its own following a decision by...",https://smartphonemagazine.nl/en/2024/12/10/you-wont-believe-whats-happening-with-amd-stock-now/,0.5,NEGATIVE,0.9975,0.6491666666666668,NEGATIVE,0.9976
12/10/2024,Ars Technica,AMD’s trusted execution environment blown wide open by new BadRAM attack,"Attack bypasses AMD protection promising security, even when a server is compromised.",https://arstechnica.com/information-technology/2024/12/new-badram-attack-neuters-security-assurances-in-amd-epyc-processors/,0.5,NEGATIVE,0.9644,0.5445,NEGATIVE,0.7632
12/10/2024,Gizmochina,"Lenovo Introduces ThinkPad T14s Gen 6 with AMD Ryzen AI Power, 17-Hour Battery Life, & WUXGA Display","Lenovo ThinkPad T14s Gen 6 (AMD) launches in India with Ryzen AI processor, 17h battery, Wi-Fi 7, and robust ThinkShield security.",https://www.gizmochina.com/2024/12/10/lenovo-thinkpad-t14s-gen-6-amd-launched/,0.5,POSITIVE,0.9628,0.5575,POSITIVE,0.9996
12/10/2024,Wccftech,"AMD’s Lisa Su Named Time CEO Of The Year – Downplays Custom AI Chip Competition From Marvell, Broadcom",AMD CEO Lisa Su is named Time Magazine's CEO of the year of back of her transformational achievements at the company.,https://wccftech.com/amds-lisa-su-named-time-ceo-of-the-year-downplays-custom-ai-chip-competition-from-marvell-broadcom/,0.5,POSITIVE,0.558,0.5871428571428571,POSITIVE,0.9503
12/10/2024,SDxCentral,AMD appoints Tim Keating as senior vice president of Government Relations and Regulatory Affairs,"AMD has appointed Tim Keating as senior vice president of Government Relations and Regulatory Affairs, effective immediately. His experience is expected to...",https://www.sdxcentral.com/articles/amd-appoints-tim-keating-as-senior-vice-president-of-government-relations-and-regulatory-affairs/2024/12/,0.5,POSITIVE,0.6884,0.5513636363636364,POSITIVE,0.6929
12/10/2024,theafricalogistics.com,The future of AMD stock amid fierce AI chip competition,"Despite a 7.83% decline in stock value over the past week, currently trading at $130.87, AMD is poised for strong growth due to its competitive advantages...",https://theafricalogistics.com/money/the-future-of-amd-stock-amid-fierce-ai-chip-competition/,0.5225,NEGATIVE,0.9506,0.6587500000000002,POSITIVE,0.996
12/10/2024,Notebookcheck,OneXFly F1 Pro: First OLED and AMD Zen 5 gaming handheld now available with better warranty options via third-party,The OneXFly F1 Pro is currently the only gaming handheld that combines an OLED display with an AMD Zen 5 APU. The device is now available to order through...,https://www.notebookcheck.net/OneXFly-F1-Pro-First-OLED-and-AMD-Zen-5-gaming-handheld-now-available-with-better-warranty-options-via-third-party.930228.0.html,0.5,POSITIVE,0.7284,0.5478125,POSITIVE,0.9928
12/10/2024,KitGuru,AMD Ryzen Master now lets you enable EXPO and overclock memory,"AMD has released a new version of its Ryzen Master overclocking utility, which brings many improvements and features useful for Ryzen 9000 series CPUs.",https://www.kitguru.net/gaming/joao-silva/amd-ryzen-master-now-allows-users-to-enable-expo-and-overclock-memory-on-the-fly/,0.5,POSITIVE,0.9966,0.566875,POSITIVE,0.9982
12/10/2024,Tom's Hardware,Retro-style gaming monitor will hit the market for $200 — the display features a 1080p VA panel with a 180 Hz refresh rate and AMD FreeSync support,A new gaming monitor has been launched to appeal to fans of retro aesthetics.,https://www.tomshardware.com/monitors/gaming-monitors/retro-style-gaming-monitor-will-hit-the-market-for-usd200-the-display-features-a-1080p-va-panel-with-a-180-hz-refresh-rate-and-amd-freesync-support,0.5075000000000001,POSITIVE,0.9806,0.5473529411764707,POSITIVE,0.9946
12/10/2024,The Record from Recorded Future News,BadRAM: $10 security flaw in AMD could allow hackers to access cloud computing secrets,Researchers found a way to disrupt AMD server hardware using $10 worth of off-the-shelf items. The company has issued a firmware update.,https://therecord.media/amd-security-flaw-badram,0.55,NEGATIVE,0.9997,0.5540909090909092,NEGATIVE,0.9985
12/10/2024,The Register,AMD secure VM tech undone by DRAM meddling,Researchers have found that the security mechanism AMD uses to protect virtual machine memory can be bypassed with $10 of hardware – and perhaps not even...,https://www.theregister.com/2024/12/10/amd_secure_vm_tech_undone/,0.5,NEGATIVE,0.994,0.5828571428571429,NEGATIVE,0.9987
12/10/2024,TipRanks,AMD Stock May Close 2024 in the Red Due to Vicious AI Chip Competition,Semiconductor company Advanced Micro Devices (AMD) faces headwinds due to lackluster demand for its artificial intelligence (AI) chips. That's a blow to AMD...,https://www.tipranks.com/news/amd-stock-may-close-2024-in-the-red-due-to-vicious-ai-chip-competition,0.51,NEGATIVE,0.9998,0.6200000000000001,NEGATIVE,0.9993
12/10/2024,TechSpot,"Bank of America lowers AMD stock rating, citing Nvidia AI dominance and declining PC demand","AMD has spent most of this year taking advantage of Intel's struggles, but Team Red was dealt a blow yesterday when Bank of America downgraded its stock...",https://www.techspot.com/news/105901-bank-america-lowers-amd-stock-rating-citing-nvidia.html,0.5,NEGATIVE,0.9998,0.6196153846153847,NEGATIVE,0.6201
12/10/2024,Investing.com Australia,AMD CEO Lisa Su named Time's CEO of the Year By Investing.com,"Advanced Micro Devices (NASDAQ:AMD) CEO Lisa Su has been recognized as CEO of the Year by Time Magazine, highlighting her transformative leadership over the...",https://au.investing.com/news/stock-market-news/amd-ceo-lisa-su-named-times-ceo-of-the-year-93CH-3579895,0.5333333333333333,POSITIVE,0.7972,0.6539999999999999,POSITIVE,0.9961
12/10/2024,Club386,AMD BIOS update lifts fps by 7% in STALKER 2 and other games,"Hard at work improving the AM5 platform for Ryzen 9000 Series CPUs, AMD's latest AGESA microcode shows promising performance uplifts in several games,...",https://www.club386.com/amd-bios-update-boosts-stalker-2-and-other-game-frame-rates-by-up-to-7/,0.5,POSITIVE,0.7958,0.5714285714285715,POSITIVE,0.7249
12/10/2024,PC Gamer,AMD's flagship Strix Halo APU makes its Geekbench debut with a monstrous name and RTX 4060 levels of GPU compute,"It's not much to go on but at this point in time, I'll take it.",https://www.pcgamer.com/hardware/processors/amds-flagship-strix-halo-apu-makes-its-geekbench-debut-with-a-monstrous-name-and-rtx-4060-levels-of-gpu-compute/,0.5075000000000001,NEGATIVE,0.546,0.5385714285714286,POSITIVE,0.9989
12/10/2024,TechSpot,"AMD Strix Halo APU with RDNA 3.5 iGPU spotted on Geekbench, outperforms RTX 4060 mobile in Vulkan benchmark","An upcoming AMD Strix Halo APU has popped up on Geekbench, shedding some light on its key specifications. The chip in question is the Ryzen AI Max+ Pro 395,...",https://www.techspot.com/news/105900-amd-strix-halo-apu-rdna-35-igpu-spotted.html,0.5,NEGATIVE,0.8839,0.5530769230769231,NEGATIVE,0.8202
12/10/2024,ITC.ua,"First Intel Arc B580 benchmark — loses to NVIDIA RTX 4060 and AMD RX 6700 XT, but outperforms A580 by 30%","The Intel Arc B580 graphics card was tested at Geekbench using the OpenCL and Vulkan APIs. It couldn't keep up with the NVIDIA RTX 4060, but it shows.",https://itc.ua/en/news/first-intel-arc-b580-benchmark-loses-to-nvidia-rtx-4060-and-amd-rx-6700-xt-but-outperforms-a580-by-30/,0.5,POSITIVE,0.8368,0.561923076923077,NEGATIVE,0.9999
12/10/2024,The Manila Times,AMD Introduces Versal RF Series Adaptive SoCs Offering the Industry's Highest Compute in a Single-Chip Device with Integrated Direct RF-Sampling Converters,"First AMD Versal adaptive SoCs integrating high-resolution RF data converters, dedicated DSP hard IP, AI Engines, and programmable logic in a single-chip...",https://www.manilatimes.net/2024/12/10/tmt-newswire/globenewswire/amd-introduces-versal-rf-series-adaptive-socs-offering-the-industrys-highest-compute-in-a-single-chip-device-with-integrated-direct-rf-sampling-converters/2019469,0.5175000000000001,POSITIVE,0.9982,0.54,POSITIVE,0.9997
