Date Posted,Source,Headline,Preview,Link,PTR Headline Sentiment,Flair Headline Outlook,Flair Headline Score,PTR Preview Sentiment,Flair Preview Outlook,Flair Preview Score
11/22/2024,Yahoo Finance,"Advanced Micro Devices, Inc. (AMD) Powers New MiTAC Servers: Boosting AI and HPC Performance",https://finance.yahoo.com/news/advanced-micro-devices-inc-amd-160343265.html,"We recently published a list of 14 AI News Updates Wall Street Is Monitoring. In this article, we are going to take a look at where Advanced...",0.617,POSITIVE,0.999,0.586,POSITIVE,0.961
11/24/2024,VideoCardz.com,AMD offered exclusive Ryzen 7 9800X3D launch kit in China with X3D keychain and hoodie,https://videocardz.com/newz/amd-offered-exclusive-ryzen-7-9800x3d-launch-kit-in-china-with-x3d-keychain-and-hoodie,A limited number of customers were given a special gift box. Source: 沙包残念/金猪升级包. What is this? Report Ad.,0.559,NEGATIVE,0.611,0.546,NEGATIVE,0.81
11/24/2024,Forbes,AMD Ryzen 9 9950X3D Release Date Revealed But There’s Bad News,https://www.forbes.com/sites/antonyleather/2024/11/24/amd-ryzen-9-9950x3d-release-date-revealed-but-theres-bad-news/,"PC enthusiasts are eagerly awaiting the release date for AMD's Ryzen 9 9900X3D and 9950X3D - its 16 and 12-core 3D V-Cache models,...",0.572,NEGATIVE,0.998,0.546,NEGATIVE,0.999
11/22/2024,Eurogamer.net,Quick! AMD's Ryzen 5 5600 has had a big price cut for Black Friday Week,https://www.eurogamer.net/digitalfoundry-2024-quick-amds-ryzen-5-5600-has-had-a-big-price-cut-for-black-friday-week,"AMD's Ryzen 5 5600 is an excellent value AM4 processor, and it's down to a ridiculously low price from Amazon for Black Friday Week.",0.586,NEGATIVE,0.51,0.554,NEGATIVE,0.992
11/22/2024,Phoronix,AMD Linux Graphics Driver Now Allows Display Support With Modern GPUs On LoongArch,https://www.phoronix.com/news/AMDGPU-DC-LoongArch,"Following the Linux 6.13 DRM feature pull this week that brought many new open-source kernel graphics driver features, it's now time to...",0.556,POSITIVE,0.994,0.517,POSITIVE,0.924
11/22/2024,The Register,Nvidia's dominance on the Green500 faces challenges from AMD – and itself,https://www.theregister.com/2024/11/22/nvidia_green500_amd/,"SC24 Nvidia's accelerators are among the most power hungry machines in their class, yet the chips continue to dominate the Green500 ranking...",0.609,NEGATIVE,0.893,0.599,NEGATIVE,0.671
11/22/2024,Gamers Nexus,"Best CPUs of 2024 (Intel vs. AMD): Gaming, Production, Budget, & Efficiency",https://gamersnexus.net/cpus/best-cpus-2024-intel-vs-amd-gaming-production-budget-efficiency,"CPUs Best CPUs of 2024 (Intel vs. AMD): Gaming, Production, Budget, & Efficiency November 22, 2024 Last Updated: 2024-11-22 The best CPUs in...",0.597,POSITIVE,1.0,0.603,POSITIVE,0.999
11/22/2024,CRN,"Analysis: Nvidia Made A Lot More Money Than Intel, AMD Combined Last Quarter",https://www.crn.com/news/components-peripherals/2024/analysis-nvidia-made-a-lot-more-money-than-intel-amd-combined-last-quarter,"Nvidia made nearly 75 percent more revenue than Intel and AMD combined in their recently completed quarters, thanks to its continued...",0.614,NEGATIVE,0.998,0.576,NEGATIVE,0.953
11/23/2024,TweakTown,AMD thinks gamers will switch from the 7800X3D to the new 9800X3D for the 'overclocking factor',https://www.tweaktown.com/news/101821/amd-thinks-gamers-will-switch-from-the-7800x3d-to-new-9800x3d-for-overclocking-factor/index.html,"AMD says gamers will be enticed by the 'overclocking factor' of the new Ryzen 7 9800X3D, and will upgrade from their 7800X3D for that OC...",0.598,NEGATIVE,0.999,0.564,NEGATIVE,0.994
11/21/2024,PCGamesN,"Gamers will switch from AMD Ryzen 7800X3D to 9800X3D for overclocking, says AMD",https://www.pcgamesn.com/amd/9800x3d-overclocking-comments,"The 9800X3D is the first AMD gaming CPU with 3D V-Cache to fully support overclocking, which AMD believes will make PC enthusiasts want it.",0.621,NEGATIVE,0.998,0.567,NEGATIVE,0.999
11/24/2024,Yahoo Finance,"Goldman Sachs: Advanced Micro Devices, Inc. (NASDAQ:AMD) Is A Top AI Growth Investor Stock",https://finance.yahoo.com/news/goldman-sachs-advanced-micro-devices-131333819.html,We recently made a list of Goldman Sachs' Top Growth Investors: 34 Stocks With The Highest Investment For Growth.,0.642,POSITIVE,0.989,0.537,POSITIVE,0.843
11/24/2024,Notebookcheck,Minisforum EliteMini AI370 review: The mini PC sets new standards with an AMD Zen 5 Strix Point APU,https://www.notebookcheck.net/Minisforum-EliteMini-AI370-review-The-mini-PC-sets-new-standards-with-an-AMD-Zen-5-Strix-Point-APU.922379.0.html,"We have tested the Minisforum EliteMini AI370 with the AMD Ryzen AI 9 HX 370, 32 GB RAM and a 1-TB SSD. Furthermore, we have analyzed its...",0.568,POSITIVE,0.998,0.574,POSITIVE,0.955
11/24/2024,WiFi Planet,AMD Prepares Ryzen 200 Series CPUs: A Budget-Friendly Line Without AI Integration,https://wi-fiplanet.com/amd-prepares-ryzen-200-series-cpus-a-budget-friendly-line-without-ai-integration/,"AMD is reportedly gearing up to launch its Ryzen 200 series, a new lineup of processors designed to target a more budget-conscious audience.",0.585,POSITIVE,0.995,0.565,POSITIVE,0.883
11/24/2024,Wccftech,"AMD Radeon RX 7600 Drops To Just $229 In Black Friday Deal, Other RX 7000 GPUs Get Heavily Discounted As Well",https://wccftech.com/amd-radeon-rx-7600-drops-to-just-229-in-black-friday-deal-other-rx-7000-gpus-get-heavily-discounted-as-well/,"At just $279, the AMD Radeon RX 7600 XT is the only 16 GB card from the current gen for modern intensive titles, but there are plenty of...",0.556,NEGATIVE,1.0,0.548,NEGATIVE,1.0
11/24/2024,HCPLive,"LUNA, OPTIC Data Support Long-Term Benefit of Ixo-Vec for Wet AMD",https://www.hcplive.com/view/luna-optic-data-support-long-term-benefit-of-ixo-vec-for-wet-amd,"New 52-week LUNA and 4-year OPTIC data demonstrate Ixo-vec's potential to reduce injection burden, maintain vision, and achieve lifelong...",0.575,POSITIVE,1.0,0.554,POSITIVE,0.993
11/20/2024,The Register,Microsoft unveils beefy custom AMD chip to crunch HPC workloads on Azure,https://www.theregister.com/2024/11/20/microsoft_azure_custom_amd/,"Ignite One of the advantages of being a megacorp is that you can customize the silicon that underpins your infrastructure, as Microsoft is...",0.562,POSITIVE,0.697,0.573,POSITIVE,0.935
11/24/2024,MSN,AMD Ryzen Threadripper 1950X and 1920X - Intel dethroned!,https://www.msn.com/en-us/news/technology/amd-ryzen-threadripper-1950x-and-1920x-intel-dethroned/vi-AA1uFfMo,"Luke Hill, Deputy Editor In Chief of www.kitguru.net has spent the last week testing AMD's new Ryzen Threadripper 1950x and 1920x.",0.584,NEGATIVE,0.997,0.561,NEGATIVE,0.934
11/22/2024,KitGuru,AMD Krackan Point APU appears in the Geekbench database,https://www.kitguru.net/components/cpu/joao-silva/amd-krackan-point-apu-appears-in-the-geekbench-database/,"AMD's next-gen Ryzen AI 300 series APUs are on the horizon, and a fresh Geekbench leak has given us a sneak peek at the entry-level...",0.569,NEGATIVE,0.954,0.566,POSITIVE,0.659
11/24/2024,igor´sLAB,"AMD presents revolutionary ""chip stacking"" technology to optimize die utilization",https://www.igorslab.de/en/amd-unveils-revolutionary-chip-stacking-technology-to-optimize-utilization/,A new patent application from AMD suggests that the company is planning to integrate a “multi-chip stacking” method into its future...,0.587,POSITIVE,0.999,0.561,POSITIVE,0.992
11/18/2024,IBM Newsroom,IBM Expands its AI Accelerator Offerings; Announces Collaboration with AMD,https://newsroom.ibm.com/2024-11-18-ibm-expands-its-ai-accelerator-offerings-announces-collaboration-with-amd,"IBM and AMD have announced a collaboration to deploy AMD Instinct MI300X accelerators as a service on IBM Cloud. This offering, which is...",0.601,POSITIVE,0.992,0.572,POSITIVE,0.989
11/20/2024,TechRadar,Microsoft convinced AMD and Nvidia to build a CPU with extraordinary features but it will never go on sale: 4th gen 9V64H has 96 cores and uses InfiniBand technology,https://www.techradar.com/pro/microsoft-convinced-amd-and-nvidia-to-build-a-cpu-with-extraordinary-features-but-it-will-never-go-on-sale-4th-gen-9v64h-has-88-cores-and-uses-infiniband-technology,An earlier version of the article mentioned that the 9V64H had 88 cores. AMD reached out to confirm that it actually has 96 cores.,0.558,NEGATIVE,1.0,0.547,NEGATIVE,0.982
11/24/2024,sharewise,Better Artificial Intelligence Stock: Broadcom vs. AMD,https://www.sharewise.com/us/news_articles/Better_Artificial_Intelligence_Stock_Broadcom_vs_AMD_TheMotleyFool_20241124_1210,It's a good time to invest in the fast-growing artificial intelligence (AI) industry. The market for AI is expected to surpass $184 billion...,0.656,NEGATIVE,0.985,0.587,NEGATIVE,0.736
11/24/2024,VideoCardz.com,AMD Radeon RX 7800M tested: Up to 28% performance boost with OCuLink over USB4,https://videocardz.com/newz/amd-radeon-rx-7800m-tested-up-to-28-performance-boost-with-oculink-over-usb4,Up to 28% more performance with OCuLink. What is this? Report Ad. The Radeon RX 7800M is a Navi 32 graphics card that carries the name of a...,0.558,POSITIVE,0.998,0.543,POSITIVE,0.936
11/24/2024,Notebookcheck,"AMD's next-gen Threadripper 9000 series to feature 16 to 96 cores, all at 350W TDP",https://www.notebookcheck.net/AMD-s-next-gen-Threadripper-9000-series-to-feature-16-to-96-cores-all-at-350W-TDP.922902.0.html,"A new leak has revealed key details about AMD's next-generation Ryzen Threadripper 9000 series, codenamed Shimada Peak.",0.568,POSITIVE,0.999,0.576,POSITIVE,0.99
11/24/2024,VideoCardz.com,"AMD Radeon RX 7900 XTX drops to $764, Radeon RX 7800 XT now at $419",https://videocardz.com/pixel/amd-radeon-rx-7900-xtx-drops-to-764-radeon-rx-7800-xt-now-at-419,PowerColor has reduced the price of two of their products. What is this? Report Ad. You can now grab the Radeon RX 7900 XTX Hellhound for...,0.559,NEGATIVE,1.0,0.543,NEGATIVE,0.938
11/23/2024,VideoCardz.com,"AMD Ryzen 9 9950X3D and 9900X3D launching end of January, 3D V-Cache only on one CCD",https://videocardz.com/newz/amd-ryzen-9-9950x3d-and-9900x3d-launching-end-of-january-3d-v-cache-only-on-one-ccd,"The rumor comes from reliable AMD leaker. According to Hoang Anh Phu, a leaker with a good track record for AMD hardware disclosures,...",0.556,NEGATIVE,0.978,0.545,NEGATIVE,0.695
11/22/2024,VideoCardz.com,AMD quietly raises Ryzen 7 9800X3D price in Germany,https://videocardz.com/newz/amd-quietly-raises-ryzen-7-9800x3d-price-in-germany,Blink and you will miss the MSRP. What is this? Report Ad. The 9800X3D is something many gamers have already put on their Christmas gift...,0.58,POSITIVE,0.996,0.555,POSITIVE,0.989
11/24/2024,[H]ard|Forum,AMD offered exclusive Ryzen 7 9800X3D launch kit in China with X3D keychain and hoodie,https://hardforum.com/threads/amd-offered-exclusive-ryzen-7-9800x3d-launch-kit-in-china-with-x3d-keychain-and-hoodie.2038100/post-1046001800,Source: https://videocardz.com/newz/amd-offered-exclusive-ryzen-7-9800x3d-launch-kit-in-china-with-x3d-keychain-and-hoodie.,0.559,NEGATIVE,0.611,0.543,NEGATIVE,0.815
11/24/2024,ITC.ua,Amazon is flooded with fake AMD Ryzen 9800X3D — for $200 during the shortage,https://itc.ua/en/news/amazon-is-flooded-with-fake-amd-ryzen-9800x3d-for-200-during-the-shortage/,"With the advent of Black Friday this Friday, unscrupulous sellers are taking advantage of the AMD Ryzen 9800X3D shortage and offering...",0.572,NEGATIVE,0.999,0.549,NEGATIVE,0.999
11/24/2024,Insider Monkey,"Advanced Micro Devices, Inc. (AMD) Set to Expand AI Portfolio with Affordable Krackan Point Processor Leak",https://www.insidermonkey.com/blog/advanced-micro-devices-inc-amd-set-to-expand-ai-portfolio-with-affordable-krackan-point-processor-leak-1396305/,"We recently compiled a list of the 15 AI Stocks Trending on Financial Media. In this article, we are going to take a look at where Advanced...",0.59,POSITIVE,0.896,0.569,NEGATIVE,0.948
11/20/2024,ServeTheHome,This is the Microsoft Azure HBv5 and AMD MI300C,https://www.servethehome.com/this-is-the-microsoft-azure-hbv5-and-amd-mi300c-nvidia/,At SC24 we saw the custom 96 core AMD MI300C HBM3 CPU and four-socket system powering the Microsoft Azure HBv5 instances.,0.606,POSITIVE,0.998,0.575,POSITIVE,0.935
11/20/2024,TechSpot,AMD Ryzen 7 9800X3D vs. Intel Core Ultra 9 285K,https://www.techspot.com/review/2921-amd-ryzen-9800x3d-vs-intel-core-ultra-285k/,We're pitting Intel's Core Ultra 9 285K against AMD's Ryzen 7 9800X3D in a massive showdown across 45 games. Let's see how they stack up in...,0.584,POSITIVE,0.981,0.558,POSITIVE,0.997
11/24/2024,The Motley Fool,Better Artificial Intelligence Stock: Broadcom vs. AMD,https://www.fool.com/investing/2024/11/24/better-artificial-intelligence-stock-broadcom-vs-a/,Both Broadcom and AMD are seeing strong sales thanks to their respective strategies to capture customers amid the AI boom.,0.656,NEGATIVE,0.985,0.563,NEGATIVE,0.994
11/22/2024,Fudzilla,New AMD Krackan APU SKU spotted with 3+3 CPU configuration,https://www.fudzilla.com/news/pc-hardware/60125-new-amd-krackan-apu-sku-spotted-with-3-3-cpu-configuration,"Possible 6-core Ryzen AI 5 340 A leak from the Geekbench database might have confirmed the rumors regarding AMD's upcoming Krackan APU, showing a...",0.61,POSITIVE,0.994,0.569,POSITIVE,0.709
11/24/2024,Yahoo,Better Artificial Intelligence Stock: Broadcom vs. AMD,https://www.yahoo.com/finance/news/better-artificial-intelligence-stock-broadcom-111000149.html,"It's a good time to invest in the fast-growing artificial intelligence (AI) industry. Among AI tech stocks, semiconductor firms Broadcom...",0.656,NEGATIVE,0.985,0.56,NEGATIVE,0.647
11/21/2024,VideoCardz.com,"AMD Krackan Point with 3+3 Zen5(c) core config spotted, could be the upcoming Ryzen AI 5 340",https://videocardz.com/newz/amd-krackan-point-with-33-zen5c-core-config-spotted-could-be-the-upcoming-ryzen-ai-5-340,The 6-core CPU is now being evaluated by ASUS. What is this? Report Ad. It looks like one of the rumors is being confirmed through a direct...,0.57,POSITIVE,0.951,0.559,POSITIVE,0.894
11/21/2024,Yahoo Finance,"Advanced Micro Devices, Inc. (AMD) PCs Excluded from Upcoming Microsoft Windows AI Copilot Features, Limited to Snapdragon Devices",https://finance.yahoo.com/news/advanced-micro-devices-inc-amd-173829116.html,"We recently compiled a list of the 15 AI Stocks That Are Dominating Headlines. In this article, we are going to take a look at where...",0.578,NEGATIVE,0.99,0.586,POSITIVE,0.96
11/22/2024,The Next Platform,Microsoft Is First To Get HBM-Juiced AMD CPUs,https://www.nextplatform.com/2024/11/22/microsoft-is-first-to-get-hbm-juiced-amd-cpus/,"Intel was the first of the major CPU makers to add HBM stacked DRAM memory to a CPU package, with the “Sapphire Rapids” Max Series Xeon SP...",0.591,POSITIVE,0.921,0.562,POSITIVE,0.924
11/23/2024,Pokde.Net,AMD Ryzen 7 9800X3D Review – King Of The Gaming CPU Hill,https://pokde.net/review/amd-ryzen-7-9800x3d-review,"While the Ryzen 9000 series is relatively underwhelming, the Ryzen 9000X3D is not - AMD has brought some major upgrades for their new 3D...",0.569,POSITIVE,0.999,0.628,POSITIVE,0.998
11/22/2024,Medscape,Men Who Heavily Drink Carry Higher Risk for Late AMD,https://www.medscape.com/viewarticle/men-who-heavily-drink-carry-higher-risk-late-amd-2024a1000lbn,Moderate alcohol consumption was associated with a lower risk for progression to late age-related macular degeneration (AMD) in men.,0.574,NEGATIVE,0.993,0.545,NEGATIVE,0.887
11/20/2024,PC Gamer,AMD rumoured to be ditching future RDNA 5 graphics architecture in favour of 'unified' UDNA tech in a possible effort to bring AI smarts to gaming ASAP,https://www.pcgamer.com/hardware/graphics-cards/amd-rumoured-to-be-ditching-future-rdna-5-graphics-architecture-in-favour-of-unified-udna-tech-in-a-possible-effort-to-bring-ai-smarts-to-gaming-asap/,"AMD hasn't even got its next-gen RDNA 4 gaming GPUs out the door, but already there are rumours RDNA 5 has been cancelled in favour of the...",0.553,NEGATIVE,0.999,0.542,NEGATIVE,0.999
11/20/2024,PCGamesN,"AMD Radeon RX 9000 gaming GPU range to drop Navi name, says leak. A hint at big changes coming?",https://www.pcgamesn.com/amd/radeon-udna-gpu-codename,"AMD reportedly has a new codename for the chips in its Radeon RX 9000 graphics cards, with the Navi name apparently consigned to history.",0.542,NEGATIVE,0.999,0.559,POSITIVE,0.897
11/24/2024,Pokde.Net,New AMD Patent Shows Overlapping Chiplet Stacking Technology,https://pokde.net/system/pc/cpu/amd-patent-overlapping-chiplet-stacking,AMD's patent shows a different chiplet approach that stacks chiplets partially to the main chiplet to potentially reduce interconnect...,0.637,NEGATIVE,0.99,0.594,NEGATIVE,0.901
11/23/2024,Gizmodo,"The Great AMD Ryzen 7 5700X Processor Is 50% Off, Now at an All-Time Low Price",https://gizmodo.com/the-great-amd-ryzen-7-5700x-processor-is-50-off-now-at-an-all-time-low-price-2000528958,"The AMD Ryzen 7 5700X 8-Core desktop processor is currently available on Amazon for Black Friday at a record low price of $130, which is a...",0.584,NEGATIVE,0.994,0.565,POSITIVE,0.513
11/10/2024,Capacity Media,"AMD unveils Versal Gen 2 FPGAs for faster, more efficient data transfers",https://www.capacitymedia.com/article/amd-unveils-versal-gen-2-fpgas-for-faster-more-efficient-data-transfers,"The Versal Premium Gen 2 is AMD's latest Field Programmable Gate Array (FPGA)-based adaptable computing solution, enabling users to move data more rapidly and...",0.569,POSITIVE,0.999,0.548,POSITIVE,0.998
11/22/2024,Tom's Hardware,Amazon flooded with fake $199 AMD Ryzen 9 9800X3D listings — searching for AMD’s top gaming chip yields fake results,https://www.tomshardware.com/pc-components/cpus/amazon-flooded-with-fake-usd199-amd-ryzen-9-9800x3d-listings-searching-for-amds-top-gaming-chip-yields-fake-results,"A search for AMD's top gaming chips, the Ryzen 9800X3D, yields several fake listings on Amazon.",0.547,NEGATIVE,1.0,0.535,NEGATIVE,1.0
11/20/2024,Yahoo Finance,"Advanced Micro Devices, Inc. (AMD): Oppenheimer Downgrades Semiconductor Sector, Recommends Selling AMD Based on Technical Analysis",https://finance.yahoo.com/news/advanced-micro-devices-inc-amd-110821811.html,"We recently compiled a list of the 15 AI News Updates You Might Have Missed. In this article, we are going to take a look at where Advanced...",0.605,NEGATIVE,0.986,0.586,POSITIVE,0.961
11/21/2024,Digital Engineering 24/7,"AMD Powers Fast Supercomputer, El Capitan",https://www.digitalengineering247.com/article/amd-powers-fast-supercomputer-el-capitan/engineering-computing,AMD showcases its ongoing high-performance computing (HPC) capabilities at Supercomputing 2024 by powering a fast supercomputer for the...,0.578,POSITIVE,0.999,0.546,POSITIVE,0.999
11/19/2024,PCGamesN,"AMD Ryzen gaming CPUs now dominate top 10 sales, with Intel nowhere to be found",https://www.pcgamesn.com/amd/intel-amd-top-ten-amazon,"Under-performing Intel Arrow Lake CPUs, and the top frame rates from the AMD Ryzen 7 9800X3D, force Intel out of the best seller charts.",0.62,POSITIVE,0.997,0.621,POSITIVE,0.997
11/22/2024,HotHardware,Scam Alert: Beware Of Fake $199 AMD Ryzen 7 9800X3D Listings On Amazon,https://hothardware.com/news/scam-alert-beware-fake-199-amd-ryzen-7-9800x3d-listings,AMD's Ryzen 7 9800X3D with a heaping pile of 3D V-Cache to give gaming a boost is one of the best-selling CPUs on Amazon.,0.557,NEGATIVE,0.999,0.552,NEGATIVE,0.998
11/20/2024,IGN,AMD vs. Intel: Which CPUs Are Better for Gaming?,https://www.ign.com/articles/amd-vs-intel-cpu-comparison,"No matter if you plug in a CPU from Team Red or Team Blue, you're going to get awesome gaming and creative performance. However, if you just...",0.619,NEGATIVE,0.995,0.567,POSITIVE,0.731
11/22/2024,Tom's Hardware,AMD increases official Ryzen 7 9800X3D pricing to 542 Euros in Europe due to exchange rate fluctuations,https://www.tomshardware.com/pc-components/cpus/amd-increases-ryzen-7-9800x3d-official-price-to-542-euros-in-europe-due-to-exchange-rate-fluctuations-cpu-is-still-selling-well-over-that-price-regardless,"AMD might be worried about changing prices based on the exchange rate. However, these incremental updates are not affecting the chip's...",0.551,NEGATIVE,0.555,0.541,POSITIVE,0.818
11/20/2024,OMG! Ubuntu,"Blender 4.3 Brings Vulkan Backend, AMD Ray-Tracing to Linux",https://www.omgubuntu.co.uk/2024/11/blender-4-3-brings-hardware-accelerated-ray-tracing-to-linux,"Feeling creative? After you've scanned out slew of changes shipping in the new Blender 4.3 release, you'll find it hard not to!",0.561,POSITIVE,0.992,0.512,POSITIVE,0.99
11/20/2024,Yahoo Finance,Advanced Micro Devices (AMD)’s AI Accelerator Breakthrough: TensorWave’s Massive GPU Cluster Plans for 2025,https://finance.yahoo.com/news/advanced-micro-devices-amd-ai-193624964.html,"We recently published a list of 15 AI News Investors Are Paying Attention To. In this article, we are going to take a look at where Advanced...",0.583,POSITIVE,0.999,0.604,POSITIVE,0.927
11/18/2024,The Next Platform,AMD Now Has More Compute On The Top500 Than Nvidia,https://www.nextplatform.com/2024/11/18/amd-now-has-more-compute-on-the-top500-than-nvidia/,There has been a lot more churn on the November Top500 supercomputer rankings that is the talk of the SC24 conference in Atlanta this week...,0.661,POSITIVE,0.992,0.586,POSITIVE,0.725
11/22/2024,PCGamesN,Fake AMD Ryzen 9800X3D listings pollute Amazon as gaming CPU sells out,https://www.pcgamesn.com/gaming-hardware/amazon-fake-amd-9800x3d,"AMD's massively popular Ryzen 7 9800X3D has sold out and sneaky Amazon sellers are taking advantage of the situation, so don't be fooled.",0.555,NEGATIVE,1.0,0.558,NEGATIVE,0.922
11/22/2024,eTeknix,AMD Krackan Processor with 6 Zen 5 and Zen 5c Cores for Budget AI Laptops Leaked,https://www.eteknix.com/amd-krackan-processor-with-6-zen-5-and-zen-5c-cores-for-budget-ai-laptops-leaked/,"A new AMD processor in the form of an engineering model has been leaked in the Artificial Intelligence benchmark “Geekbench AI,”...",0.568,NEGATIVE,0.998,0.553,NEGATIVE,0.999
11/20/2024,Forbes,IBM Teams With AMD For Cloud AI Acceleration,https://www.forbes.com/sites/karlfreund/2024/11/19/ibm-teams-with-amd-for-cloud-ai-acceleration/,"This could be quite telling, as IBM had previously been using Nvidia for it's internal cloud AI research. The Instinct 300 from AMD has more...",0.628,POSITIVE,0.997,0.567,POSITIVE,0.983
11/23/2024,eWEEK,IBM AI Accelerator Expands With Game-Changing AMD Collaboration,https://www.eweek.com/news/ibm-ai-accelerator-expands-with-amd-collaboration/,IBM and AMD have announced a groundbreaking collaboration to deploy AMD Instinct MI300X accelerators as a service on IBM Cloud.,0.599,POSITIVE,0.999,0.584,POSITIVE,0.983
11/22/2024,XDA,"Don't buy an Intel Arrow Lake CPU, get one of these instead",https://www.xda-developers.com/dont-buy-intel-arrow-lake-cpu/,"Intel and AMD have been locked in a CPU arms race for decades, with no end in sight. In recent years, Intel has fallen behind, struggling to...",0.552,NEGATIVE,1.0,0.532,NEGATIVE,0.998
11/23/2024,Yahoo Finance,"Advanced Micro Devices, Inc. (AMD) CEO Lisa Su Advocates for Open-Source AI Ecosystem and Holistic Data Center Design in India",https://finance.yahoo.com/news/advanced-micro-devices-inc-amd-160136736.html,"We recently compiled a list of the 15 AI Stocks Making Waves on Wall Street. In this article, we are going to take a look at where Advanced...",0.583,POSITIVE,0.933,0.586,POSITIVE,0.94
11/22/2024,Tom's Hardware,"AMD crafts custom EPYC CPU with HBM3 memory for Microsoft Azure – CPU with 96 Zen 4 cores and 450GB of HBM3 may be repurposed MI300C, four chips hit 7 TB/s [Updated]",https://www.tomshardware.com/pc-components/cpus/amd-crafts-custom-epyc-cpu-for-microsoft-azure-with-hbm3-memory-cpu-with-88-zen-4-cores-and-450gb-of-hbm3-may-be-repurposed-mi300c-four-chips-hit-7-tb-s,Microsoft's new Azure HBv5 virtual machines use a custom AMD CPU that looks an awful lot like the rumored MI300C that never officially...,0.532,NEGATIVE,0.681,0.529,POSITIVE,0.715
11/18/2024,PC Gamer,"This teeny unit might look like an adorable little AMD graphics card, but it's actually a fully formed PC with surprising performance",https://www.pcgamer.com/hardware/this-teeny-unit-might-look-like-an-adorable-little-amd-graphics-card-but-its-actually-a-fully-formed-pc-with-surprising-performance/,"I've often thought about what sort of components you can cram into the smallest space, because I'm a nerd and this is the sort of thing I...",0.54,POSITIVE,1.0,0.533,POSITIVE,0.887
11/22/2024,Tom's Hardware,AMD Hawk Point Refresh 'Ryzen 200' family allegedly leaked — Set to arrive in 2025 but lacks NPU for local AI Inference,https://www.tomshardware.com/pc-components/cpus/amd-hawk-point-refresh-ryzen-200-family-allegedly-leaked-set-to-arrive-in-2025-but-lacks-npu-for-local-ai-inference,AMD is looking to refresh its Hawk Point family of APUs without an NPU under the Ryzen 200 branding.,0.553,NEGATIVE,0.999,0.54,NEGATIVE,1.0
11/18/2024,TechRadar,AMD’s Ryzen chips appear to be wiping the floor with Intel – but the best-selling CPUs right now might surprise you,https://www.techradar.com/computing/cpu/amds-ryzen-chips-appear-to-be-wiping-the-floor-with-intel-but-the-best-selling-cpus-right-now-might-surprise-you,"Intel's top-selling CPU is a lowly number 13 in Amazon rankings; Team Blue is doing better in the Newegg CPU chart, but still not well...",0.523,POSITIVE,0.649,0.518,NEGATIVE,0.931
11/22/2024,Phoronix,AMD Bus Lock Trap Support Merged For Linux 6.13,https://www.phoronix.com/news/AMD-Bus-Lock-Trap-Linux-6.13,Going back to early in the year AMD Linux engineers began preparing support for a new Bus Lock Trap feature with Zen 5 CPUs.,0.575,POSITIVE,0.662,0.56,NEGATIVE,0.835
