Date Posted,Source,Headline,Preview,Link,PTR Headline Sentiment,Flair Headline Outlook,Flair Headline Score,PTR Preview Sentiment,Flair Preview Outlook,Flair Preview Score
10/27/2024,Forbes,AMD Confirms Ryzen 9000 3D V-Cache Processors Coming November 7th,https://www.forbes.com/sites/antonyleather/2024/10/21/amd-confirms-ryzen-9000-3d-v-cache-processors-coming-november-7th/,"AMD has confirmed its Ryzen 9000X3D processor range, which features 3D V-Cache will launch on November 7th.",0.557,POSITIVE,0.579,0.538,POSITIVE,0.875
11/23/2024,MarketBeat,"Pacer Advisors Inc. Trims Holdings in Advanced Micro Devices, Inc. (NASDAQ:AMD)",https://www.marketbeat.com/instant-alerts/pacer-advisors-inc-trims-holdings-in-advanced-micro-devices-inc-nasdaqamd-2024-11-23/,"Pacer Advisors Inc. lowered its stake in shares of Advanced Micro Devices, Inc. (NASDAQ:AMD - Free Report) by 7.0% in the third quarter,...",0.585,POSITIVE,0.989,0.529,POSITIVE,0.561
10/27/2024,PCMag,AMD: Next-Gen X3D Chips Slated to Launch Nov. 7,https://www.pcmag.com/news/amd-next-gen-x3d-chips-slated-to-launch-nov-7,"On Monday, AMD announced that its ""next-generation X3D"" processors will be available starting on Nov. 7. Additional details will be provided in...",0.589,POSITIVE,0.999,0.565,NEGATIVE,0.537
11/20/2024,Notebookcheck,Intel Arrow Lake gets absolutely pummeled in Mindfactory CPU sales for ongoing week as AMD dominates chart,https://www.notebookcheck.net/Intel-Arrow-Lake-gets-absolutely-pummeled-in-Mindfactory-CPU-sales-for-ongoing-week-as-AMD-dominates-chart.921324.0.html,Intel is having a pretty hard time selling CPUs in Germany according to Mindfactory sales data for the current week.,0.588,NEGATIVE,0.999,0.589,NEGATIVE,0.998
11/20/2024,Wccftech,Microsoft Unveils NVIDIA’s “Blackwell-Based” High-End Azure AI Compute Platform; HPC-Focused Azure AMD EPYC With HBM As Well,https://wccftech.com/microsoft-nvidia-blackwell-high-end-azure-ai-platform-hpc-focused-azure-amd-epyc-hbm/,"Microsoft's Azure cloud platforms are receiving significant upgrades in the form of NVIDIA Blackwell & custom AMD EPYC ""Genoa"" chips.",0.561,POSITIVE,0.995,0.57,POSITIVE,0.943
11/17/2024,PC Guide,AMD fills Amazon’s top 10 most popular CPUs as 9800X3D tops the charts,https://www.pcguide.com/news/amd-fills-amazons-top-10-most-popular-cpus-as-9800x3d-tops-the-charts/,"With the popularity of the 9800X3D, AMD quickly got the number one slot, but even the rest of its offering fills out Amazon's top 10 CPUs.",0.564,POSITIVE,0.999,0.551,POSITIVE,0.975
10/27/2024,The Verge,OpenAI will start using AMD chips and could make its own AI hardware in 2026,https://www.theverge.com/2024/10/29/24282843/openai-custom-hardware-amd-nvidia-ai-chips,OpenAI will reportedly make a custom AI inference chip with Broadcom and TSMC but without trying to create its own network of foundries.,0.592,POSITIVE,0.523,0.591,POSITIVE,0.957
08/26/2024,The Register,AMD internal data reportedly offered for sale,https://www.theregister.com/2024/08/26/amd_internal_data_intelbroker/,"In an August 25 listing on the dark web marketplace BreachForums, criminal groups IntelBroker and EnergyWeaponUser took credit for the break-in,...",0.599,NEGATIVE,0.992,0.573,POSITIVE,0.592
10/27/2024,IT Pro,AMD Advancing AI live: All the news and updates as they happened,https://www.itpro.com/hardware/live/amd-advancing-ai-live-all-the-news-and-updates-as-they-happen,"AMD Advancing AI live: All the news and updates as they happened · October 10, 2024 at 5:28 AM · October 10, 2024 at 5:34 AM · October 10, 2024...",0.622,POSITIVE,0.824,0.57,POSITIVE,0.536
11/3/2024,Tom's Hardware,"For the first time ever, AMD outsells Intel in the datacenter space",https://www.tomshardware.com/pc-components/cpus/for-the-first-time-ever-amd-outsells-intel-in-the-datacenter-space,"AMD's datacenter business unit now outsells Intel's datacenter and AI business group, as observed by SemiAnalysis.",0.593,NEGATIVE,0.971,0.556,NEGATIVE,0.509
11/23/2024,MSN,Is AMD Stock a Buy Now?,https://www.msn.com/en-us/money/other/is-amd-stock-a-buy-now/ar-AA1uARYw,The arrival of artificial intelligence (AI) into the mainstream has supercharged shares of semiconductor giant Advanced Micro Devices (NASDAQ: AMD).,0.863,POSITIVE,0.89,0.604,NEGATIVE,0.929
10/27/2024,TechRadar,The best processor in 2024: top picks from AMD and Intel,https://www.techradar.com/news/best-processors,"Here you'll find the best processors in 2023, backed by our rigorous testing and decades of collective experience working with the best CPUs Intel and AMD have...",0.626,POSITIVE,1.0,0.534,POSITIVE,1.0
09/12/2024,PCMag,Ditching High-End Graphics Cards Could Give AMD an Edge in the GPU Wars,https://www.pcmag.com/opinions/ditching-high-end-graphics-cards-could-give-amd-an-edge-in-the-gpu-wars,AMD has tipped plans to deprioritize competing in the flagship graphics card market. That could be good thing...especially for buyers of budget cards.,0.561,NEGATIVE,1.0,0.545,NEGATIVE,1.0
10/27/2024,CRN,"AMD Says Instinct MI325X Bests Nvidia H200, Vows Huge Uplift With MI350",https://www.crn.com/news/ai/2024/amd-says-instinct-mi325x-bests-nvidia-h200-vows-huge-uplift-with-mi350,AMD said its forthcoming 256-GB Instinct MI325X GPU can outperform Nvidia's 141-GB H200 processor on AI inference workloads and vowed that the...,0.571,POSITIVE,0.998,0.569,POSITIVE,0.985
11/17/2024,Wccftech,"AMD’s Ryzen 9 5900X Is A Few Generations Old, But The Latest Motherboard Combo With The ASUS Prime B550-PLUS Gives You A Savings Of $350 On Amazon",https://wccftech.com/amazon-slashes-350-off-ryzen-9-5900x-asus-prime-b550-plus-motherboard/,"The Ryzen 9 5900X CPU and ASUS Prime B550-PLUS motherboard pairing might be a few years old, but at $350 off on Amazon, there is definitely...",0.515,POSITIVE,0.999,0.51,NEGATIVE,0.644
10/27/2024,Forbes,AMD Earnings: Shares Tumble As Semiconductor Giant Narrowly Beat Expectations On Record Data Center Revenue,https://www.forbes.com/sites/lindseychoo/2024/10/29/amd-earnings-shares-tumble-semiconductor-beat-expectations/,"Key Facts. AMD reported $0.92 earnings per share and $6.8 in revenue in the third quarter of 2024, meeting analyst consensus estimates of $0.92...",0.58,NEGATIVE,0.546,0.564,NEGATIVE,0.85
11/17/2024,TechSpot,"Intel will respond to AMD's 3D V-Cache with server-bound Clearwater Forest, not desktop CPUs",https://www.techspot.com/news/105598-intel-respond-amd-3d-v-cache-server-bound.html,Intel apparently has no plans to produce consumer desktop CPUs featuring 3D-stacked cache to compete with AMD's technology.,0.555,NEGATIVE,0.999,0.551,POSITIVE,0.795
11/17/2024,Wccftech,AMD Might Have Prepped B850E Chipset But Canceled It For The AM5 Motherboard Lineup,https://wccftech.com/amd-b850e-chipset-motherboard-cancelled-rumor/,"The EEC website registers several AMD 800 chipset motherboards, including some B850E motherboards, but they may not arrive at all.",0.552,NEGATIVE,0.96,0.556,NEGATIVE,0.999
07/05/2024,GamesRadar+,"AMD Radeon RX 7800 XT review: “4K prowess without dipping into dangerously expensive, high-end territory”",https://www.gamesradar.com/hardware/desktop-pc/amd-radeon-rx-7800-xt-review/,"For under $500, this is one of the best-value graphics cards going right now. Its 16GB of VRAM gives it a lot of room to gallop in QHD and 4K, and its...",0.545,POSITIVE,0.999,0.55,POSITIVE,0.852
11/3/2024,Windows Central,"AMD's most powerful Ryzen 7 gaming CPU ever is official, and it'll cost you more than its predecessor",https://www.windowscentral.com/hardware/cpu-gpu-components/amd-zen-5-everything-we-know-so-far,"AMD officially revealed its next-gen “Zen 5” processors (CPU) at Computex 2024 in Taipei, Taiwan. The company took a two-pronged approach to its...",0.565,POSITIVE,0.998,0.551,POSITIVE,0.868
11/10/2024,Wccftech,AMD Confirms Laying Off 4% Of Its Employees To Align Resources With “Largest Growth Opportunities”,https://wccftech.com/amd-confirms-laying-off-4-of-its-employees-to-align-resources-with-largest-growth-opportunities/,"Chip designer Advanced Micro Devices, Inc. (AMD) is purportedly laying off 4% of its workforce or 1000 workers, according to online reports.",0.573,NEGATIVE,0.873,0.567,POSITIVE,0.626
10/27/2024,Reuters,AMD sees next AI chip in mass production later this year,https://www.reuters.com/technology/artificial-intelligence/amd-likely-launch-new-ai-chips-san-francisco-data-center-event-2024-10-10/,Advanced Micro Devices said on Thursday it plans to start mass production of a new version of its artificial-intelligence chip called the...,0.681,NEGATIVE,0.708,0.595,POSITIVE,0.726
11/3/2024,PCGamesN,Two new AMD Ryzen 9000X3D gaming CPUs have just been accidentally revealed,https://www.pcgamesn.com/amd/ryzen-9000-x3d-confirmed-thermal-grizzly,"Two new AMD Ryzen 9000X3D gaming CPUs have just been accidentally revealed. Thermal Grizzly has just named two new AMD X3D gaming chips,...",0.613,NEGATIVE,0.871,0.553,POSITIVE,0.925
06/18/2024,BleepingComputer,AMD investigates breach after data for sale on hacking forum,https://www.bleepingcomputer.com/news/security/amd-investigates-breach-after-data-for-sale-on-hacking-forum/,"AMD is investigating whether it suffered a cyberattack after a threat actor put allegedly stolen data up for sale on a hacking forum,...",0.582,NEGATIVE,0.923,0.558,NEGATIVE,0.986
11/18/2024,CNBC,Shares of Nvidia and AMD go different ways — here's Jim Cramer's advice on both AI chip stocks,https://www.cnbc.com/2024/11/18/jim-cramers-advice-on-nvidia-and-amd-as-ai-chip-stocks-diverge-monday.html,Join the CNBC Investing Club to gain exclusive access to CNBC's very own Jim Cramer. Become a wiser investor with real-time access to Jim's...,0.597,NEGATIVE,0.97,0.577,NEGATIVE,0.997
11/3/2024,PC Gamer,AMD's AI GPU business has barely been going for a year but it's already as big as its entire CPU operation,https://www.pcgamer.com/hardware/graphics-cards/amds-ai-gpu-business-has-barely-been-going-for-a-year-but-its-already-as-big-as-its-entire-cpu-operation/,"AMD's AI GPU business has barely been going for a year but it's already as big as its entire CPU operation ... Server, cloud, client, laptop...",0.655,POSITIVE,0.843,0.577,NEGATIVE,0.905
11/17/2024,Wccftech,MSI Releases Official Statement On Burnt X870 Motherboard Socket & AMD Ryzen 7 9800X3D,https://wccftech.com/msi-official-statement-burnt-x870-motherboard-socket-amd-ryzen-7-9800x3d/,MSI has begun investigating the root cause of the burnt MAG X870 Tomahawk motherboard & the AMD Ryzen 7 9800X3D.,0.549,NEGATIVE,0.958,0.543,NEGATIVE,0.982
03/23/2024,Financial Times,China blocks use of Intel and AMD chips in government computers,https://www.ft.com/content/7bf0f79b-dea7-49fa-8253-f678d5acd64a,Microsoft's Windows and foreign database programs also sidelined as Beijing favours Chinese hardware and software.,0.599,NEGATIVE,0.999,0.507,POSITIVE,0.839
11/10/2024,Notebookcheck,AMD Radeon HD 6470M,https://www.notebookcheck.net/AMD-Radeon-HD-6470M.43075.0.html,The AMD Radeon HD 6470M (sometimes also still called ATI Mobility Radeon HD 6470) is a laptop graphics card for entry level to middle class...,0.62,POSITIVE,1.0,0.604,POSITIVE,0.902
11/23/2024,MarketBeat,"Advanced Micro Devices, Inc. (NASDAQ:AMD) Receives $192.79 Consensus Target Price from Brokerages",https://www.marketbeat.com/instant-alerts/advanced-micro-devices-inc-nasdaqamd-receives-consensus-recommendation-of-moderate-buy-from-analysts-2024-11-23/,"Advanced Micro Devices, Inc. (NASDAQ:AMD - Get Free Report) has been assigned a consensus recommendation of ""Moderate Buy"" from the...",0.591,NEGATIVE,0.839,0.538,POSITIVE,0.621
09/16/2024,Windows Central,"A new AMD graphics feature massively increases framerates with AI tech for smoother gameplay, but there's a catch",https://www.windowscentral.com/hardware/laptops/new-amd-graphics-feature-increases-framerates-but-theres-a-catch,"AMD's AFMF 2 technology brings AI enhancements to your integrated graphics, significantly boosting frame rates in demanding games.",0.603,POSITIVE,0.982,0.569,POSITIVE,0.796
11/27/2024,MSN,Chinese x86 eight-core Zhaoxin KX-7000 CPU lags behind AMD and Intel,Zhaoxin's KaiXian KX-7000/8 processor tested in various applications: still cannot compete against modern x86 processors from AMD and Intel.,https://www.msn.com/en-us/news/technology/chinese-x86-eight-core-zhaoxin-kx-7000-cpu-lags-behind-amd-and-intel/ar-AA1uRujJ?ocid=winp2fptaskbar&cvid=504ab2aecccc4123f22c0fc9f9ab90e6&ei=5,0.5,POSITIVE,0.5682,0.5586363636363637,POSITIVE,0.9862
11/27/2024,hardwaretimes.com,AMD Radeon RX 8900 XTX Axing due to Steep Production Costs & UDNA GPU Chiplet Supremacy,The cancellation of the Navi 4C GPU was seen as a blow to AMD's presence in the enthusiast graphics segment. The chipmaker made no official claims regarding...,https://hardwaretimes.com/amd-radeon-rx-8900-xtx-axing-due-to-steep-production-costs-udna-gpu-chiplet-supremacy/,0.5225,POSITIVE,0.8456,0.5380769230769231,NEGATIVE,0.9983
11/27/2024,Scrip,Outlook Holds Out Hope For Wet AMD Approval Despite Phase III Topline Miss,"The company said the NORSE EIGHT trial of ONS-5010 did not meet the primary endpoint of showing noninferiority to ranibizumab, but it still plans to file...",https://insights.citeline.com/scrip/r-and-d/clinical-trials/outlook-holds-out-hope-for-wet-amd-approval-despite-phase-iii-topline-miss-DK5XZ7PJDJGBNAKAM3WJGAHQCY/,0.5,POSITIVE,0.6329,0.5513636363636363,NEGATIVE,0.9991
11/27/2024,BioWorld MedTech,Phase III AMD miss leaves BLA Outlook same with bevacizumab,"Outlook Therapeutics Inc. is forging onward with plans to resubmit the BLA for ONS-5010, an ophthalmic version of Avastin (bevacizumab, Roche AG),...",https://www.bioworld.com/articles/714699-phase-iii-amd-miss-leaves-bla-outlook-same-with-bevacizumab,0.5,NEGATIVE,0.9997,0.5612500000000001,NEGATIVE,0.9686
11/27/2024,MarketBeat,Advanced Micro Devices (NASDAQ:AMD) Trading Down 3% - Here's What Happened,"Advanced Micro Devices, Inc. (NASDAQ:AMD - Get Free Report)'s share price was down 3% during trading on Wednesday . The company traded as low as $133.61 and...",https://www.marketbeat.com/instant-alerts/advanced-micro-devices-nasdaqamd-trading-down-3-heres-what-happened-2024-11-27/,0.5,NEGATIVE,0.9984,0.6171428571428572,NEGATIVE,0.9999
11/27/2024,smartphonemagazine.nl,AMD’s Stock Skyrockets! Are Smartphones the Next Battlefield?,"Advanced Micro Devices (AMD): A Stock on the Rise. In recent months, the stock price of Advanced Micro Devices, Inc. (AMD) has been experiencing a...",https://smartphonemagazine.nl/en/2024/11/27/amds-stock-skyrockets-are-smartphones-the-next-battlefield/,0.5,NEGATIVE,0.9995,0.5883333333333335,NEGATIVE,0.9845
11/27/2024,Liliputing,GPD G1 Review: Compact AMD Radeon RX 7600M XT GPU gives your PC a graphics boost,"The GPD G1 is a small, portable and self-contained external GPU. Comprised of an AMD Radeon RX 7600M XT mobile graphic card together with an inbuilt 240...",https://liliputing.com/gpd-g1-review-compact-amd-radeon-rx-7600m-xt-gpu-gives-your-pc-a-graphics-boost/,0.5,POSITIVE,0.9979,0.5421428571428571,POSITIVE,0.9986
11/27/2024,ZDNET,This AMD desktop processor is a beast - and it's 60% off for Black Friday,"If you're building a gaming rig or looking to juice up a sluggish PC, the AMD Ryzen 7 5700X delivers a 4.6 GHz Max Boost for just $130.",https://www.zdnet.com/article/this-amd-desktop-processor-is-a-beast-and-its-60-off-for-black-friday/,0.5,NEGATIVE,0.9994,0.5875,POSITIVE,0.9916
11/27/2024,Phoronix,AMD Begins Work Upstreaming More Versal 2 SoC Support For Linux,Back in April AMD announced the Versal Gen 2 Adaptive SoCs for AI-driven embedded systems.,https://www.phoronix.com/news/AMD-Versal-2-Linux-Upstreaming,0.5,POSITIVE,0.8197,0.5675000000000001,POSITIVE,0.9549
11/27/2024,PC Gamer,"With new GPUs coming from AMD, Intel, and Nvidia soon here are the four graphics cards I believe are still worth buying this Black Friday","Black Friday is normally the perfect time to grab yourself a new graphics card. There are, after all, Black Friday graphics card deals out there for...",https://www.pcgamer.com/hardware/graphics-cards/with-new-gpus-coming-from-amd-intel-and-nvidia-soon-here-are-the-four-graphics-cards-i-believe-are-still-worth-buying-this-black-friday/,0.5075000000000001,POSITIVE,0.9997,0.586875,POSITIVE,0.9703
11/27/2024,HCPLive,ONS-5010 for Wet AMD Fails to Meet Noninferiority in NORSE EIGHT Trial,"ONS-5010, an ophthalmic formulation of bevacizumab for wet age-related macular degeneration (AMD), missed the pre-specified non-inferiority endpoint in...",https://www.hcplive.com/view/ons-5010-for-wet-amd-fails-to-meet-noninferiority-in-norse-eight-trial,0.5,NEGATIVE,0.9998,0.5572222222222222,NEGATIVE,0.9996
11/27/2024,Insider Monkey,"Advanced Micro Devices, Inc. (AMD): Opens $400M R&D Center in India, Builds Supercomputers for Weather Forecasting","We recently compiled a list of the 15 AI Stocks That are Making Headlines. In this article, we are going to take a look at where Advanced Micro Devices,...",https://www.insidermonkey.com/blog/advanced-micro-devices-inc-amd-opens-400m-rd-center-in-india-builds-supercomputers-for-weather-forecasting-1398490/,0.495,POSITIVE,0.9964,0.5636666666666666,NEGATIVE,0.6919
11/27/2024,Endpoints News,Outlook’s shares crash as wet AMD drug flunks Phase 3 test,Outlook Therapeutics' ONS-5010 (bevacizumab) failed to meet its primary endpoint in a Phase 3 trial against Roche's Lucentis for wet age-related macular...,https://endpts.com/outlooks-shares-crash-as-wet-amd-drug-flunks-phase-3-test/,0.5425,NEGATIVE,0.5656,0.5572222222222223,NEGATIVE,0.9989
11/27/2024,WePC,Black Friday 5800X3D deals: save on AMD’s best AM4 CPU,"Black Friday is the perfect time to upgrade your PC, especially if you're on an older, less expensive platform.",https://www.wepc.com/news/black-friday-5800x3d-deals/,0.5,POSITIVE,0.9986,0.5183333333333332,POSITIVE,0.9997
11/27/2024,FirstWord Pharma,"After missing endpoint, Outlook ploughs ahead with resubmission plans for AMD drug",Outlook Therapeutics saw its stock plummet as much as 81% on Wednesday after announcing that its wet age-related macular degeneration (AMD) drug failed to...,https://firstwordpharma.com/story/5917040,0.5025,NEGATIVE,0.9902,0.5688888888888889,NEGATIVE,0.9999
11/27/2024,Pharmaceutical Technology,Outlook Therapeutics stock craters as the wet AMD drug fails Phase III trial,The Norse Eight trial was part of the data requested by the FDA after the agency rejected the BLA for the company's Lytenava last year.,https://www.pharmaceutical-technology.com/news/outlook-therapeutics-stock-craters-as-the-wet-amd-drug-fails-phase-iii-trial/,0.6225,NEGATIVE,0.9996,0.5845454545454546,NEGATIVE,0.972
11/27/2024,zaman.co.at,The AI Landscape: Is Nvidia Losing Its Edge to AMD?,"The race for dominance in generative artificial intelligence has taken some unexpected turns, with Nvidia's recent surge in stock price raising eyebrows.",https://zaman.co.at/en/news/the-ai-landscape-is-nvidia-losing-its-edge-to-amd/1151999/,0.525,NEGATIVE,0.9851,0.6483333333333334,NEGATIVE,0.7961
11/27/2024,TechRadar,What AMD needs to do to break Nvidia’s stranglehold on AI,How AMD can capitalize on their strong performance to challenge Nvidia.,https://www.techradar.com/pro/what-amd-needs-to-do-to-break-nvidias-stranglehold-on-ai,0.5,POSITIVE,0.7737,0.6275000000000001,POSITIVE,0.9729
11/27/2024,Seeking Alpha,Why AMD Stock Is A Gift At $138 (Technical Analysis) (NASDAQ:AMD),Advanced Micro Devices' stock is undervalued and offers profit growth potential driven by data center sales surge. Read why I maintain a Strong Buy rating...,https://seekingalpha.com/article/4740677-why-amd-stock-is-a-gift-a-138-technical-analysis,0.505,NEGATIVE,0.997,0.7142857142857145,POSITIVE,0.9801
11/27/2024,XDA,These 6 games will benefit most from the Ryzen 7 9800X3D,There's a new sheriff in town. AMD's new Ryzen 7 9800X3D turned heads on launch and was quickly branded as a knockout blow to Intel.,https://www.xda-developers.com/these-6-games-will-benefit-most-from-the-ryzen-7-9800x3d/,0.5,POSITIVE,0.9589,0.50875,POSITIVE,0.9663
11/28/2024,smartphonemagazine.nl,AMD Shakes Up Smartphone Market! Earnings Reveal Groundbreaking Innovations!,"In a bold move that has captured the attention of analysts and enthusiasts alike, Advanced Micro Devices (AMD) has reported earnings that suggest a...",https://smartphonemagazine.nl/en/2024/11/29/amd-shakes-up-smartphone-market-earnings-reveal-groundbreaking-innovations/,0.5,POSITIVE,0.9749,0.6193750000000001,POSITIVE,0.9984
11/28/2024,hardwaretimes.com,"AMD Zen 6 will Feature 12 Core CPU Chiplets Fabbed on TSMC 3nm Node, Claims Rumor","AMD introduced its chiplet-based Ryzen processors in 2017, disrupting the market by offering twice as many cores at existing price points.",https://hardwaretimes.com/amd-zen-6-will-feature-12-core-cpu-chiplets-fabbed-on-tsmc-3nm-node-claims-rumor/,0.5225,NEGATIVE,0.9992,0.5433333333333333,NEGATIVE,0.9642
11/28/2024,XDA,4 ways to improve the performance of your PC with an AMD AM4 CPU,AMD Ryzen CPUs first launched in 2016 and it was only with the launch of Ryzen 7000 in 2022 did AMD migrate to the newer AM5 socket. Although at the end of...,https://www.xda-developers.com/ways-to-improve-the-performance-of-your-amd-am4-pc/,0.5,POSITIVE,0.9912,0.5907142857142859,NEGATIVE,0.6669
11/28/2024,PassionateGeekz,"It is expected to revolutionize chip packaging! AMD harvests glass substrate patents: Intel, Samsung, etc. are all planning","2024-11-28 16:30:18 Author: Yao Liwei. It is expected to revolutionize chip packaging! AMD harvests glass substrate patents: Intel,...",https://passionategeekz.com/it-is-expected-to-revolutionize-chip-packaging-amd-harvests-glass-substrate-patents-intel-samsung-etc-are-all-planning/,0.5,POSITIVE,0.9899,0.56,POSITIVE,0.9823
11/28/2024,TechRadar,Latest HPE ProLiant Gen11 lineup features AMD EPYC 9005 processors — delivering up to 35% higher performance and significant energy savings,HPE unveiles new ProLiant Gen11 servers for powerful and sustainable scaling; New servers can deliver 35% higher performance; Designed for data-heavy...,https://www.techradar.com/pro/latest-hpe-proliant-gen11-lineup-features-amd-epyc-9005-processors-delivering-up-to-35-higher-performance,0.5,POSITIVE,0.9995,0.5593333333333333,POSITIVE,0.9993
11/28/2024,Tom's Hardware,The 16GB VRAM-equipped XFX AMD Radeon RX 7900 GRE GPU is selling at its lowest price for Black Friday,Gamers looking to upgrade their rigs now have a fantastic opportunity to grab the XFX AMD Radeon RX 7900 GRE at a discounted price at Best Buy.,https://www.tomshardware.com/pc-components/gpus/the-16gb-vram-equipped-xfx-amd-radeon-rx-7900-gre-gpu-is-selling-at-its-lowest-price-for-black-friday,0.5075000000000001,POSITIVE,0.9991,0.5453571428571429,POSITIVE,0.9996
11/28/2024,Insider Monkey,Advanced Micro Devices (AMD) Faces Competition as Chinese Chips from Zhaoxin Close the Gap in AI Race,"We recently compiled a list of the 15 AI News You Should Not Ignore. In this article, we are going to take a look at where Advanced Micro Devices, Inc.",https://www.insidermonkey.com/blog/advanced-micro-devices-amd-faces-competition-as-chinese-chips-from-zhaoxin-close-the-gap-in-ai-race-1398981/,0.495,NEGATIVE,0.9009,0.5780769230769232,POSITIVE,0.6001
11/28/2024,Notebookcheck,New Lenovo Legion Go gaming handheld officially revealed with AMD Rembrandt APU and Wi-Fi 6E connectivity,"Lenovo has officially revealed a new Legion Go gaming handheld on its support pages. According to Lenovo, the device in question is the Legion Go S,...",https://www.notebookcheck.net/New-Lenovo-Legion-Go-gaming-handheld-officially-revealed-with-AMD-Rembrandt-APU-and-Wi-Fi-6E-connectivity.925019.0.html,0.5,POSITIVE,0.9956,0.5616666666666668,NEGATIVE,0.9882
11/28/2024,XiaomiToday,"COLORFUL Introduces the COLORFIRE B650M-MEOW WIFI Motherboard, Designed for AMD Ryzen 9000 Series","Colorful has unveiled its latest product in the COLORFIRE lineup, the B650M-MEOW WIFI motherboard. This addition to the MEOW Series brings support for AMD's...",https://xiaomitoday.com/colorful-introduces-the-colorfire-b650m-meow-wifi-motherboard-designed-for-amd-ryzen-9000-series/,0.5,POSITIVE,0.9997,0.5481818181818182,POSITIVE,0.9993
11/28/2024,Smartprix,Acer TravelLite TL14-42M Laptop (AMD Ryzen 3 7330U/ 8GB/ 512GB SSD/ Win11),"7th Gen AMD Ryzen 3 7330U; 4 x 2.3 GHz (Turbo Speed upto 4.3 GHz) Cores; Quad Core, 8 Threads; 8 MB Cache; AMD Radeon Graphics Graphics...",https://www.smartprix.com/laptops/acer-travellite-tl14-42m-laptop-amd-ryzen-ppd10d0fa1f9,0.5,POSITIVE,0.9997,0.5408333333333334,POSITIVE,0.9998
11/28/2024,PC Guide,"Black Friday week strengthens AMD's claims that now is a ""great time"" to upgrade your gaming PC","We recently sat down with Martijn Boonstra, AMD's Product and Business Development Manager, to discuss the launch of the Ryzen 7 9800X3D and the 9000 series...",https://www.pcguide.com/news/black-friday-week-strengthens-amds-claims-that-now-is-a-great-time-to-upgrade-your-gaming-pc/,0.5075000000000001,POSITIVE,0.9693,0.5772727272727273,POSITIVE,0.6487
11/28/2024,elblog.pl,AMD’s AI Breakthrough: A Game Changer?,"In the evolving landscape of artificial intelligence, AMD is poised to deliver significant advancements that could reshape the industry's future.",https://elblog.pl/2024/11/28/amds-ai-breakthrough-a-game-changer/,0.5,POSITIVE,0.9136,0.5549999999999999,POSITIVE,0.999
11/28/2024,VideoCardz.com,Lenovo confirms Legion Go S gaming handheld with AMD Rembrandt APU via firmware leak,"We did some digging. Legion Go S mockup, Source: VideoCardz. What is this? Report Ad. Upon digging through older leaks, we came across a listing for the...",https://videocardz.com/newz/lenovo-confirms-legion-go-s-gaming-handheld-with-amd-rembrandt-apu-via-firmware-leak,0.5225,NEGATIVE,0.9995,0.5466666666666667,NEGATIVE,1.0
