Date Posted,Source,Headline,Preview,Link,PTR Headline Sentiment,Flair Headline Outlook,Flair Headline Score,PTR Preview Sentiment,Flair Preview Outlook,Flair Preview Score
12/2/2024,HotHardware,AMD Radeon RX 8800 XT RDNA 4 GPU Rumored For A Massive Ray Tracing Performance Uplift,"The next generation AMD GPUs may just have a great uplift in ray tracing performance, if the latest rumors prove accurate.",https://hothardware.com/news/amd-radeon-rx-8800-xt-rdna-4-gpu-rumored-for-a-massive-ray-tracing-performance,0.5,POSITIVE,0.9996,0.5458333333333333,POSITIVE,0.9648
12/2/2024,PC Gamer,"This is the cheapest RTX 4060 Cyber Monday gaming laptop deal I'd actually buy, and the good news for any creative pros is it has an absolute chonker of an AMD CPU","This should be more than enough for 1080p laptop gaming, and some heavy productivity tasks, too.",https://www.pcgamer.com/hardware/gaming-laptops/this-is-the-cheapest-rtx-4060-cyber-monday-gaming-laptop-deal-id-actually-buy-and-the-good-news-for-any-creative-pros-is-it-has-an-absolute-chonker-of-an-amd-cpu/,0.5075000000000001,NEGATIVE,0.9986,0.5544444444444445,POSITIVE,0.9976
12/2/2024,MarketBeat,"Advanced Micro Devices, Inc. (NASDAQ:AMD) Stock Holdings Lessened by Chevy Chase Trust Holdings LLC","Chevy Chase Trust Holdings LLC reduced its holdings in Advanced Micro Devices, Inc. (NASDAQ:AMD - Free Report) by 1.6% during the third quarter,...",https://www.marketbeat.com/instant-alerts/advanced-micro-devices-inc-nasdaqamd-stock-holdings-lessened-by-chevy-chase-trust-holdings-llc-2024-12-02/,0.5,NEGATIVE,0.9615,0.5932142857142857,NEGATIVE,0.9983
12/2/2024,Overclocking.com,ASUS BTF motherboards in AM5 and a full range of AMD products,"According to ASUS, CES 2025 will be chock-full of AMD components, including new CPUs, BTF motherboards in AM5 and more.",https://en.overclocking.com/asus-btf-motherboards-in-am5-and-a-full-range-of-amd-products/,0.5225,POSITIVE,0.9988,0.5768750000000001,NEGATIVE,0.9743
12/2/2024,Notebookcheck,Mouth-watering Arc B580 and Arc B570 price/perf on cards as Arc Battlemage and RDNA 4 Navi 44 GPUs to outrun RTX 4060 Ti,"Known Chinese leaker Golden Pig Upgrade has revealed the possible performance of the upcoming Intel Arc B580, Arc B570, and AMD's RDNA 4 Navi 44 GPUs.",https://www.notebookcheck.net/Mouth-watering-Arc-B580-and-Arc-B570-price-perf-on-cards-as-Arc-Battlemage-and-RDNA-4-Navi-44-GPUs-to-outrun-RTX-4060-Ti.926760.0.html,0.5,POSITIVE,0.9972,0.5041176470588236,POSITIVE,0.8513
12/2/2024,www.guru3d.com,Rumor: AMD Radeon RX 8800 XT RDNA 4 Graphics Card Set for Mass Production in December,"If the rumors are valid, AMD is progressing with its upcoming Radeon RX 8800 XT graphics card (assuming it is called that), which utilizes the RDNA 4...",https://www.guru3d.com/story/rumor-amd-radeon-rx-8800-xt-rdna-4-graphics-card-set-for-mass-production-in-december/,0.515,NEGATIVE,0.9993,0.5525000000000001,NEGATIVE,0.9849
12/2/2024,YouTube · XDA,Can AMD even compete anymore? 😬,"With its new RDNA 4-based Radeon 800 series, is AMD going to give PC builders and upgraders a reason to skip the RTX 50 line? So NVIDIA is dominating the...",https://www.youtube.com/watch?v=aL3wzFbexgg,0.5,POSITIVE,0.71,0.5980000000000001,NEGATIVE,0.9988
12/2/2024,www.guru3d.com,AMD Updates Zen 4 Processors by Disabling Loop Buffer via Microcode Patch,"Advanced Micro Devices (AMD) has introduced a microcode patch that disables the loop buffer functionality in its Zen 4 processor lineup, including Ryzen...",https://www.guru3d.com/story/amd-updates-zen-4-processors-by-disabling-loop-buffer-via-microcode-patch/,0.515,NEGATIVE,0.9946,0.554,POSITIVE,0.9882
12/2/2024,Proactive Investors,US hits China with ‘groundbreaking and sweeping’ microchip ban,"The outgoing Biden administration in the US has announced a third wave of export controls on microchip technology heading to China. These export controls,.",https://www.proactiveinvestors.co.uk/companies/news/1061885/us-hits-china-with-groundbreaking-and-sweeping-microchip-ban-1061885.html,0.5225,POSITIVE,0.9921,0.525,NEGATIVE,0.9946
12/2/2024,VideoCardz.com,"AMD Radeon RX 8800 XT rumored to rival RTX 4080 with less power, mass production starts this month",The RX 8800 series looking good in rumors. What is this? Report Ad. Two reliable leakers from the Chiphell forums have come forward with early claims about...,https://videocardz.com/newz/amd-radeon-rx-8800-xt-rumored-to-rival-rtx-4080-with-less-power-mass-production-starts-this-month,0.5225,POSITIVE,0.8682,0.5434615384615384,NEGATIVE,0.9965
12/2/2024,ArmBanks.am,US dollar jumps 3.24 points to AMD 397.88,"The average market exchange rate of the US dollar to the Armenian dram at the end of 2 December 2024 amounted to AMD 397.88, jumping by 3.24 points compared...",http://www.armbanks.am/en/2024/12/02/158614/,0.5,NEGATIVE,0.9969,0.6120000000000001,NEGATIVE,0.9997
12/2/2024,Yahoo Finance,Advanced Micro Devices (AMD) Powers Advantech’s New AI-Optimized Platforms,"We recently published a list of 15 AI News Updates That Investors Are Watching. In this article, we are going to take a look at where Advanced Micro Devices...",https://finance.yahoo.com/news/advanced-micro-devices-amd-powers-123231399.html,0.5025,POSITIVE,0.9987,0.6405000000000001,NEGATIVE,0.8258
12/2/2024,Yahoo Finance,"Why Is Advanced Micro Devices, Inc. (AMD) Among the Stocks Ray Dalio’s Bridgewater Is Crazy About?","We recently compiled a list of the Billionaire Ray Dalio's Bridgewater Is Crazy About These 15 Stocks. In this article, we are going to take a look at where...",https://finance.yahoo.com/news/why-advanced-micro-devices-inc-122751166.html,0.5025,NEGATIVE,0.9676,0.5840909090909091,NEGATIVE,0.8237
12/2/2024,Notebookcheck,Ayaneo Flip KB review - handheld console with great functionality powered by the less efficient AMD Ryzen 7 8840U,Notebookcheck tests the Ayaneo Flip KB handheld console powered by an AMD Ryzen 7 8840U with Radeon 780M iGPU.,https://www.notebookcheck.net/Ayaneo-Flip-KB-review-handheld-console-with-great-functionality-powered-by-the-less-efficient-AMD-Ryzen-7-8840U.902381.0.html,0.5,POSITIVE,0.9968,0.5439285714285715,POSITIVE,0.9858
12/2/2024,Wccftech,"AMD Radeon RX 8800 XT “RDNA 4” GPU Allegedly Offers 45% Faster RT Performance Than 7900 XTX, On-Par With RTX 4080 In Raster & Lower Power Too","AMD's top RDNA 4 GPU, the Radeon RX 8800 XT, might end up being a strongly positioned mainstream product if the latest rumors are correct.",https://wccftech.com/amd-radeon-rx-8800-xt-rdna-4-gpu-faster-rt-performance-7900-xtx-on-par-rtx-4080-raster/,0.5,NEGATIVE,0.521,0.5225000000000001,POSITIVE,0.8759
12/2/2024,Trusted Reviews,Amazon slashes 52% off AMD’s top-end CPU for Cyber Monday,The AMD Ryzen 9 7900X is a Cyber Monday must-have with a whopping 52% off its regular £599.99 RRP at Amazon.,https://www.trustedreviews.com/black-friday/amazon-slashes-52-percent-off-amd-cpu-cyber-monday-4576937,0.5,NEGATIVE,0.9992,0.520625,NEGATIVE,0.6996
12/2/2024,Phoronix,Vulkan Video Now Enabled By Default For Radeon VCN2/VCN3 Hardware On Linux,An exciting merge today for the Radeon 'RADV' Vulkan driver with next quarter's Mesa 25.0 is enabling Vulkan Video API support by default for AMD graphics...,https://www.phoronix.com/news/Vulkan-Video-VCN2-VCN3-Default,0.5,POSITIVE,0.9852,0.5033333333333334,POSITIVE,0.999
12/2/2024,openPR.com,"Intermediate AMD Market Growth: Key Drivers, Challenges,","Press release - CoherentMI - Intermediate AMD Market Growth: Key Drivers, Challenges, and Opportunities in 2024 | Roche, Regeneron Pharmaceuticals...",https://www.openpr.com/news/3766347/intermediate-amd-market-growth-key-drivers-challenges,0.5225,POSITIVE,0.985,0.6335714285714287,POSITIVE,0.9818
12/2/2024,TweakTown,"Gaming monitors, AMD CPUs, SSDs, laptops, and more discounted for Cyber Monday","TL;DR: Cyber Monday on Amazon offers significant discounts on PC gaming items, including an AMD Ryzen 7 5700X CPU at 59% off and gaming monitors up to 48%...",https://www.tweaktown.com/news/101956/gaming-monitors-amd-cpus-ssds-laptops-and-more-discounted-for-cyber-monday/index.html,0.5,NEGATIVE,0.9677,0.5588888888888889,NEGATIVE,0.7477
12/2/2024,Fudzilla.com,AMD and ASUS patch inter-core latency issues in Strix Point APUs,"New BIOS Update ASUS and AMD have announced a solution to the longstanding issue of inter-core latency in the new Strix Point APUs. A BIOS update, set...",https://www.fudzilla.com/news/60175-amd-and-asus-patch-inter-core-latency-issues-in-strix-point-apus,0.5225,NEGATIVE,0.9948,0.5525,POSITIVE,0.601
12/2/2024,Barron's,"World’s Biggest Hedge Fund Sold Nvidia, Bought Super Micro, Palantir, and AMD",The S&P 500and Nasdaq are rising as the stock market gears up for the final month of the year.,https://www.barrons.com/livecoverage/stock-market-today-120224/card/world-s-biggest-hedge-fund-sold-nvidia-bought-super-micro-palantir-and-amd-rlt52IaZz2wiRLU46ch0,0.5,NEGATIVE,0.9231,0.5745454545454547,NEGATIVE,0.8913
12/2/2024,VideoCardz.com,"AMD Ryzen AI 7 PRO 360U appears in China, Lenovo excusive Strix Point SKU","Ryzen AI 7 360U with the “PRO”. What is this? Report Ad. In October, AMD announced its new generation of Ryzen AI 300 PRO series, a special version of Strix...",https://videocardz.com/newz/amd-ryzen-ai-7-pro-360u-appears-in-china-lenovo-excusive-strix-point-sku,0.5225,NEGATIVE,0.9999,0.5700000000000001,NEGATIVE,0.9419
12/2/2024,Barron's,"World’s Biggest Hedge Fund Sold Nvidia, Bought Super Micro, Palantir, and AMD","Bridgewater Associates cut down its stake in Nvidia stock, materially increased investments in Super Micro and Palantir, and bought more AMD shares.",https://www.barrons.com/articles/nvidia-stock-super-micro-palantir-amd-a2aaf3cb,0.5,NEGATIVE,0.9231,0.5745454545454547,NEGATIVE,0.9812
12/2/2024,Times of India,COLORFUL launches cat-themed motherboard for AMD Ryzen 9000 series,"TECH NEWS : COLORFUL Technology introduces the COLORFIRE B650M-MEOW WIFI, a motherboard tailored for cat lovers and AMD enthusiasts, supporting AMD Ryzen...",https://timesofindia.indiatimes.com/technology/tech-news/colorful-launches-cat-themed-motherboard-for-amd-ryzen-9000-series/articleshow/115893053.cms,0.54,POSITIVE,0.9989,0.5637500000000001,POSITIVE,0.9992
12/1/2024,Pokde.Net,"Intel Arc B580, B570 & AMD Navi 44 Are Expected To Be Faster Than NVIDIA’s RTX 4060 Ti","Leaker Golden Pig Upgrade hints that both of Intel's upcoming GPUs - the Arc B580 and Arc B570 - along with AMD's ""Navi 44"" offering will be faster than...",https://pokde.net/system/pc/gpu/intel-b580-b570-navi-44-rtx-4060-ti,0.7300000000000002,POSITIVE,0.9678,0.560909090909091,NEGATIVE,0.9875
12/1/2024,Wccftech,"AMD’s First “B850” Motherboard Images Surface Online, Showcasing An “All-White” Design","Initial images of AMD's B850 motherboard have surfaced online, giving us a look at what to expect with the next set of ""budget"" motherboards.",https://wccftech.com/amds-first-b850-motherboard-images-surfaces-online-showcasing-an-all-white-design/,0.5,POSITIVE,0.9854,0.514090909090909,POSITIVE,0.7915
12/1/2024,YouTube · CNBC-TV18,Continue Invsts In India As It Will Be A Key Market: AMD CEO Lisa Su | Global Dialogues | CNBC TV18,"In this segment of Global Dialogues, Shereen Bhan speaks with AMD CEO Lisa Su as the firm completes 2 decades in India and their plans going ahead.",https://www.youtube.com/watch?v=6zP1WwF7NzM,0.4975,POSITIVE,0.9954,0.5857692307692308,POSITIVE,0.9984
11/30/2024,elblog.pl,The Next Leap: AMD Zen 6 Revealed! What It Means for Computing’s Future?,"As the world continues to advance at an unprecedented pace, AMD is once again at the forefront of the technological revolution with the upcoming release of...",https://elblog.pl/2024/11/30/the-next-leap-amd-zen-6-revealed-what-it-means-for-computings-future/,0.5,POSITIVE,0.9981,0.5787500000000001,POSITIVE,0.9989
12/4/2024,Can Buy or Not,AMD Ryzen 7 9800X3D review: Peak 1080p,"Can Buy -- the AMD Ryzen 7 9800X3D is an excellent CPU for gaming, but that's limited to 1080p resolution.",https://www.canbuyornot.com/reviews/amd-ryzen-7-9800x3d-review-price/,0.7000000000000002,POSITIVE,0.9998,0.5875,NEGATIVE,0.964
12/4/2024,Notebookcheck,AMD Ryzen AI 7 Pro 360 makes its review-debut in the Lenovo ThinkPad T14s Gen 6 AMD,"Strix Point is finally arriving in more devices and flavors. For example, the new Lenovo ThinkPad T14s Gen 6 with the AMD Ryzen AI 7 Pro 360.",https://www.notebookcheck.net/AMD-Ryzen-AI-7-Pro-360-makes-its-review-debut-in-the-Lenovo-ThinkPad-T14s-Gen-6-AMD.926509.0.html,0.5,POSITIVE,0.9812,0.6095833333333335,POSITIVE,0.9987
12/4/2024,TweakTown,AMD's new B850 motherboard spotted: new mid-range AM5 motherboard ready for CES 2025 reveal,"AMD's first B850 motherboard leaked with an all-white design, the new mid-range 800 series chipset will most likely debut at CES 2025 early next year.",https://www.tweaktown.com/news/101954/amds-new-b850-motherboard-spotted-mid-range-am5-ready-for-ces-2025-reveal/index.html,0.5,POSITIVE,0.986,0.596923076923077,NEGATIVE,0.9995
12/4/2024,smartphonemagazine.nl,The Rise of AI: How AMD's Stock is Poised to Skyrocket!,"In an era dominated by rapid technological advances, AMD (Advanced Micro Devices) is positioned uniquely at the forefront of the AI and smartphone...",https://smartphonemagazine.nl/en/2024/12/05/the-rise-of-ai-how-amds-stock-is-poised-to-skyrocket/,0.5,NEGATIVE,0.937,0.7100000000000003,POSITIVE,0.9999
12/4/2024,MSN,"AMD announces CES 2025 launch event on January 6, 2025 – and drops a heavy hint that new RDNA 4 GPUs will be revealed","AMD has revealed when its press event is happening at CES 2025, and dropped a heavy hint that we will indeed see RDNA 4 desktop graphics cards at the show.",https://www.msn.com/en-gb/money/technology/amd-announces-ces-2025-launch-event-on-january-6-2025-and-drops-a-heavy-hint-that-new-rdna-4-gpus-will-be-revealed/ar-AA1vg1c4,0.5,NEGATIVE,0.627,0.5746153846153846,POSITIVE,0.9054
12/4/2024,Neuroscience News,Sleep Apnea May Increase Risk of Wet Macular Degeneration,"A new study has linked moderate-to-severe obstructive sleep apnea (OSA), characterized by low oxygen levels overnight, with an increased risk of developing...",https://neurosciencenews.com/sleep-apnea-wet-amd-28180/,0.5425,NEGATIVE,0.9796,0.555,NEGATIVE,0.9853
12/4/2024,MarketBeat,Advanced Micro Devices (NASDAQ:AMD) Trading 0.1% Higher - Here's Why,Advanced Micro Devices (NASDAQ:AMD) Stock Price Up 0.1% - Still a Buy?,https://www.marketbeat.com/instant-alerts/advanced-micro-devices-nasdaqamd-trading-01-higher-heres-why-2024-12-04/,0.5,POSITIVE,0.6528,0.6314285714285716,NEGATIVE,0.941
12/4/2024,TechSpot,AMD accidentally confirms Radeon RX 8600 and 8800 GPUs are also coming,"A recent update on AMD's ROCm GitHub page contains the company's first direct mention of the Radeon RX 8800 and 8600, two graphics cards from the upcoming.",https://www.techspot.com/news/105832-amd-accidentally-confirms-radeon-rx-8600-8800-gpus.html,0.5,NEGATIVE,0.9959,0.5925000000000001,NEGATIVE,0.9958
12/4/2024,OC3D,AMD confirms Radeon RX 8600 and RX 8800 RDNA 4 GPUs in ROCm update,AMD's latest ROCm update has spilled the beans on the company's next-generation RDNA 4 GPU lineup. RX 8800 and RX 8600 confirmed!,https://overclock3d.net/news/gpu-displays/amd-confirms-radeon-rx-8600-and-rx-8800-rdna-4-gpus-in-rocm-update/,0.5,NEGATIVE,0.7818,0.5566666666666666,NEGATIVE,0.8629
12/4/2024,Gadgets Now,Compare Dell Vostro 14 3401 (D552128WIN9DE) Laptop (Core i3 10th Gen/8 GB/256 GB SSD/Windows 10) vs HP 15s-GR0007AU (21W93PA) 15.6 inch Laptop (AMD Dual Core Ryzen 3/4 GB/1 TB/Windows 10) - Dell Vostro 14 3401 (D552128WIN9DE) Lapt,Dell Vostro 14 3401 (D552128WIN9DE) Laptop (Core i3 10th Gen/8 GB/256 GB SSD/Windows 10) vs HP 15s-GR0007AU (21W93PA) 15.6 inch Laptop (AMD Dual Core Ryzen...,https://gadgetsnow.indiatimes.com/compare-laptops/dell-vostro-14-3401-d552128win9de-laptop-core-i3-10th-gen8-gb256-gb-ssdwindows-10-vs-hp-15s-gr0007au-21w93pa-156-inch-laptop-amd-dual-core-ryzen-34-gb1-tbwindows-10,0.5,NEGATIVE,0.9551,0.5206451612903226,POSITIVE,0.7706
12/4/2024,Android Headlines,Lenovo's Legion Go S to come with a new AMD Ryzen APU,"Lenovo's entry into the handheld gaming market came with the Legion Go, a powerful PC gaming handheld with some unique features, and now its next device,",https://www.androidheadlines.com/2024/12/lenovos-legion-go-s-to-come-with-a-new-amd-ryzen-apu.html,0.5025,POSITIVE,0.6747,0.6112500000000001,POSITIVE,0.9981
12/4/2024,Investing.com Australia,Clearside Biomedical's SWOT analysis: stock poised for potential breakthrough in wet AMD treatment,"Clearside Biomedical, Inc. (NASDAQ:CLSD), a clinical-stage biopharmaceutical company, is garnering attention in the ophthalmology sector for its innovative...",https://au.investing.com/news/swot-analysis/clearside-biomedicals-swot-analysis-stock-poised-for-potential-breakthrough-in-wet-amd-treatment-93CH-3571125,0.5333333333333333,NEGATIVE,0.9007,0.5918181818181819,POSITIVE,0.9997
12/4/2024,Times of India,"Chinese industry bodies to companies: Don't use chips from Nvidia, AMD and Intel; they are 'no longer saf","TECH NEWS : Four major Chinese industry groups warned domestic companies against buying U.S. chips, citing reliability and security concerns.",https://timesofindia.indiatimes.com/technology/tech-news/chinese-industry-bodies-to-companies-dont-use-chips-from-nvidia-amd-and-intel-they-are-no-longer-safe/articleshow/115983706.cms,0.54,NEGATIVE,0.9996,0.5954545454545456,NEGATIVE,0.9516
12/4/2024,eTeknix,AMD Radeon RX 8600 and RX 8800 Appear in ROCm Software,"AMD has officially confirmed that its CES 2025 keynote will take place on January 6. During the event, the company is expected to provide new details on...",https://www.eteknix.com/amd-radeon-rx-8600-and-rx-8800-appear-in-rocm-software/,0.5,POSITIVE,0.945,0.5864285714285715,NEGATIVE,0.8003
12/4/2024,Hardware Times,AMD Radeon RX 8800 XT TBP Leaks Out: Max Power of only 220W with 8-pin x2 Connectors?,"We've been hearing a fair bit about AMD's upcoming RDNA 4 graphics cards lately. According to a variety of rumors, the RX 8800 XT will be up to 30% faster...",https://hardwaretimes.com/amd-radeon-rx-8800-xt-tbp-leaks-out-max-power-of-only-220w-with-8-pin-x2-connectors/,0.525,NEGATIVE,1.0,0.5420833333333334,NEGATIVE,0.9991
12/4/2024,HotHardware,"AMD Teases Next-Gen Gaming And AI Launches At CES, What To Expect","Let's get right to the point with this one: AMD's SVP & GM of Computing & Graphics, Jack Huynh, tweeted yesterday that AMD will be holding a press event on...",https://hothardware.com/news/amd-teases-ces-2025,0.5,NEGATIVE,0.5493,0.6016666666666668,NEGATIVE,0.822
12/4/2024,eTeknix,"AMD Announces Press Conference at CES 2025, Set for January 6 at 11:00 AM PT","Manufacturers are gearing up for the highly anticipated CES 2025, where exciting new product announcements are expected to take center stage. Among them…",https://www.eteknix.com/amd-announces-press-conference-at-ces-2025-set-for-january-6-at-1100-am-pt/,0.5,NEGATIVE,0.5139,0.5806250000000001,POSITIVE,0.9869
12/4/2024,Phoronix,NVIDIA vs. AMD GPU Workstation Performance For Blender 4.3,Written by Michael Larabel in Graphics Cards on 4 December 2024 at 01:39 PM EST. Page 2 of 3. 14 Comments. Blender benchmark with settings of Blend File:...,https://www.phoronix.com/review/blender-43-nvidia-amd/2,0.5,POSITIVE,0.9995,0.6057142857142858,POSITIVE,0.8775
12/4/2024,Hardware Times,ASUS Core Tuning Update Improves Gaming Performance on AMD Ryzen 9000 CPUs,"AMD's Ryzen 7 9800X3D is easily the fastest gaming CPU on the market, delivering cutting-edge framerates with maximum efficiency.",https://hardwaretimes.com/asus-core-tuning-update-improves-gaming-performance-on-amd-ryzen-9000-cpus/,0.525,POSITIVE,0.9967,0.5634999999999999,POSITIVE,0.9998
12/4/2024,Smartprix,Acer Nitro V ANV15-41 NH.QPFSI.006 Gaming Laptop (AMD Ryzen 5 6600H/ 16GB/ 512GB SSD/ Win11/ 6GB RTX3050 Graph),"Acer Nitro V ANV15-41 NH.QPFSI.006 Gaming Laptop (AMD Ryzen 5 6600H/ 16GB/ 512GB SSD/ Win11/ 6GB RTX3050 Graph) Price in India (2024): ₹1,08999.",https://www.smartprix.com/laptops/acer-nitro-v-anv15-41-nh-qpfsi-006-gaming-ppd11jvhsp6w,0.5,POSITIVE,1.0,0.5286111111111111,POSITIVE,0.9988
12/4/2024,TheStreet,"Nvidia, AMD risks rise as U.S.-China chip war heats up","In Taiwan, they're keeping a sharp eye on the Liaoning. Liaoning is a Chinese aircraft carrier. Defense officials on the island nation in the western...",https://www.thestreet.com/investing/stocks/nvidia-amd-risks-rise-as-u-s-china-chip-war-heats-up,0.5,NEGATIVE,0.9944,0.5950000000000001,POSITIVE,0.964
12/4/2024,PC Guide,"Intel's new GPUs finally rival AMD's low pricing model, but they might always be playing catch-up","With the launch of Intel Battlemage, Team Blue is offering excellent value for money - so much so that AMD might want to start taking notice.",https://www.pcguide.com/news/intels-new-gpus-finally-rival-amds-low-pricing-model-but-they-might-always-be-playing-catch-up/,0.5075000000000001,POSITIVE,0.9338,0.5788461538461539,POSITIVE,0.9982
12/4/2024,ExtremeTech,"AMD Inadvertently Tips Radeon RX 8800, RX 8600 GPUs","AMD is having a banner year, but for all the announcements and product launches, we haven't heard much about upcoming Radeon GPUs. AMD even pushed out its...",https://www.extremetech.com/computing/amd-inadvertently-tips-radeon-rx-8800-rx-8600-gpus,0.5,NEGATIVE,0.9974,0.5700000000000001,NEGATIVE,0.9977
12/4/2024,YouTube · SweClockers,ShowCase: HP Omnibook Ultra med nya AMD Ryzen™ AI,Tillhörande artikel: https://www.sweclockers.com/artikel/40144 Bli medlem på SweClockers: https://www.sweclockers.com/konto/registrera I forumet kan du...,https://www.youtube.com/watch?v=5E5kWugPTxE,0.5,POSITIVE,0.9999,0.583888888888889,POSITIVE,0.5038
12/4/2024,Fox Business,"Amazon, AMD introduce alternatives to NVIDIA AI chips","Amazon, AMD introduce alternatives to NVIDIA AI chips. Futurum Group CEO Daniel Newman joins 'Varney & Co.' to discuss alternatives to NVIDIA A.I. chips,...",https://www.foxbusiness.com/video/6365531740112,0.6550000000000001,POSITIVE,0.9582,0.6371428571428572,POSITIVE,0.8694
12/4/2024,Tom's Hardware,Exclusive AMD partner reportedly hops on Intel's Arc bandwagon — new Onix brand is seemingly affiliated with Sapphire,Another brand with Intel Arc B-series graphics cards enters the market: Sapphire or PC Partner?,https://www.tomshardware.com/pc-components/gpus/exclusive-amd-partner-reportedly-hops-on-intels-arc-bandwagon-new-onix-brand-is-seemingly-affiliated-with-sapphire,0.5075000000000001,NEGATIVE,0.9996,0.5757142857142858,NEGATIVE,0.9873
12/4/2024,PC Guide,Intel targeting entry-level gamers could be genius move as AMD and NVIDIA battle for supremacy,Intel's newly-announced Battlemage GPU lineup could be a massive hit amongst entry-level PC builders if performance is right.,https://www.pcguide.com/news/intel-targeting-entry-level-gamers-could-be-genius-move-as-amd-and-nvidia-battle-for-supremacy/,0.5075000000000001,NEGATIVE,0.9977,0.5695833333333334,POSITIVE,0.9927
12/4/2024,ZDNET,"This AMD desktop processor is a beast, and it's still half off after Cyber Monday","If you're building a new gaming rig or beefing up your sluggish PC, the AMD Ryzen 7 5700X delivers a 4.6 GHz Max Boost for just $149, a solid Cyber Monday...",https://www.zdnet.com/article/this-amd-desktop-processor-is-a-beast-and-its-still-half-off-after-cyber-monday/,0.5,NEGATIVE,0.9977,0.5475,POSITIVE,0.9983
12/4/2024,Insider Monkey,"Advanced Micro Devices, Inc. (AMD) to Unveil Next-Generation Innovations in Gaming, AI PCs, and Commercial Sectors at CES 2025","We recently compiled a list of the 12 Trending AI Stocks on Latest News and Ratings. In this article, we are going to take a look at where Advanced Micro...",https://www.insidermonkey.com/blog/advanced-micro-devices-inc-amd-to-unveil-next-generation-innovations-in-gaming-ai-pcs-and-commercial-sectors-at-ces-2025-1402287/,0.495,POSITIVE,0.9979,0.5860000000000002,NEGATIVE,0.72
12/4/2024,Nasdaq,"URTH, KO, MRK, AMD: Large Inflows Detected at ETF","Looking today at week-over-week shares outstanding changes among the universe of ETFs covered at ETF Channel, one standout is the iShares MSCI World ETF...",https://www.nasdaq.com/articles/urth-ko-mrk-amd-large-inflows-detected-etf,0.535,NEGATIVE,0.9893,0.5637500000000001,POSITIVE,0.9878
12/4/2024,Wccftech,"AMD’s “RDNA 4” Radeon RX 8600 & Radeon RX 8800 SKUs Surfaces Online, No Mention Of Radeon RX 8900 Models Yet","AMD has confirmed the Radeon RX 8600 and the Radeon RX 8800 ""RDNA 4"" SKUs, through a new ""ROCm"" patch, mentioning the next-gen GPUs.",https://wccftech.com/amds-rdna-4-radeon-rx-8600-radeon-rx-8800-skus-surfaces-online-no-mention-of-radeon-rx-8900-models-yet/,0.5,NEGATIVE,0.5641,0.5023333333333333,NEGATIVE,0.9705
12/4/2024,Yahoo Finance,"Cathie Wood Invests $22 Million in AMD, Eyes AI Growth Potential",ARK Funds' $22 Million Bet on AMD Signals Confidence in AI Future.,https://finance.yahoo.com/news/cathie-wood-invests-22-million-150159803.html,0.5025,POSITIVE,0.5962,0.6633333333333336,NEGATIVE,0.9269
12/4/2024,Digital Trends,AMD’s upcoming RX 8800 could be a lot better than expected,"AMD's RDNA 4 is just around the corner, and we now have some more hints as to which GPUs are on the way and the kind of performance they might offer.",https://www.digitaltrends.com/computing/amd-rdna-4-announcement-specs-gpus/,0.52,NEGATIVE,0.9275,0.5285714285714286,POSITIVE,0.9593
12/4/2024,PR Newswire,"Advantech Unveils AMD Series to Boost Edge Cloud, Computing and Network Security!","PRNewswire/ -- Advantech, a leading provider of edge computing solutions, has expanded its x86 series platforms with AMD EPYC™ and Ryzen™ series processors.",https://www.prnewswire.com/news-releases/advantech-unveils-amd-series-to-boost-edge-cloud-computing-and-network-security-302322114.html,0.5025,POSITIVE,0.999,0.5625,POSITIVE,0.9983
