date of comment,main comment,comment,depth,PTR Sentiment,Flair Sentiment,Flair Outlook
,,"Everyone is cutting their guidance and we still have a rally. It all depends now on Apple, Amazon and Google. If they cut guidance too, then we might have a correction.",0,0.507,1.0,NEGATIVE
,,"Google does not give guidance, ever.",1,0.504,1.0,NEGATIVE
,,There's a first for everythingThat's the only thing telling me I'll eventually see the green,2,0.511,0.947,POSITIVE
,,We will find out by end of this week if this rally is a correction or just a bull trap.,1,0.534,0.995,NEGATIVE
,,We will find out by end of this week if this rally is a correction or just a bull trap.,2,0.534,0.995,NEGATIVE
,,Spoiler: ITS A TRAP!!!,3,0.5,0.997,NEGATIVE
,,well only like 20% of the Sp500 have reported earnings. I think by the end of this week maybe 50% and maybe 80% by end of next week.,1,0.57,1.0,NEGATIVE
,,The warning is not a great sign.,0,0.488,1.0,NEGATIVE
,,10% is a big drop!,0,0.51,0.999,NEGATIVE
,,It makes sense though. More people were buying PCs during the pandemic. That growth during that time was not sustainable.,1,0.536,0.996,NEGATIVE
,,🚀🚀🚀,0,0.5,0.761,NEGATIVE
,,$AMD beating off the back of big $INTC shows strength IMO. Will be interesting to see it play out and like others mentioned everyone is revising budgets to conservative base cases with hopes that the market comes back and they can beat. Rather underpromise over deliver than the opposite right?,1,0.536,0.979,POSITIVE
,,Revenue: $5.6 billion versus $5.5 billion expectedAdjusted EPS: $0.69 versus $0.67 expectedData Center: $1.7 billion versus $1.6 billion expectedClient: $903 million versus $995 million expectedGaming: $1.6 billion versus $1.5 billion expectedEmbedded: $1.4 billion versus $1.3 billion expectedIt's Up.,0,0.579,0.871,POSITIVE
