date of comment,main comment,comment,depth,PTR Sentiment,Flair Outlook,Flair Sentiment
,,It's my fault. I Invested in tech a few days ago and this is what inevitably follows. Sorry guys.,0,0.516,NEGATIVE,1.0
,,I f**king knew it was again. STOP DOING THAT!!!!!,1,0.504,POSITIVE,0.792
,,Honestly I think this is dead granny getting her revenge for everyone laughing at the 700k intel kid.,1,0.512,NEGATIVE,0.987
,,I bought some Amazon!Follow me for more money losing tips!,1,0.511,NEGATIVE,0.987
,,I thought it was my fault for the same reasons haha,1,0.502,NEGATIVE,1.0
,,Let me know when you sell everything so I can buy back in.,1,0.554,NEGATIVE,0.756
,,Son of a *****!,1,0.5,NEGATIVE,0.777
,,Calls on SHW,0,0.51,NEGATIVE,0.973
,,Calls on SHW,1,0.51,NEGATIVE,0.973
,,"My Mason jars are still green , I think, I better get a shovel and go check",1,0.515,NEGATIVE,1.0
,,"For us single boomers, $70,000 lost in two days is a lot. We have very few opportunities to make that money back. It’s not like companies are standing in line to hire us, which by the way I understand, but it is still defeating.",1,0.532,NEGATIVE,1.0
,,If you're close to retirement shouldn't you be preferring bonds over stocks. Stocks go up and down fast. That's why retirement target funds get rid of stocks as you get closer to retirement.I'm not a financial advisor and this isn't financial advice.,2,0.541,NEGATIVE,0.999
,,"You are absolutely correct. I got greedy and made bad decisions. Sadly, I make mistakes every day, but I do try to learn from them. Behind every successful person is a whole bunch of failures. If I could spank my own bottom, I would.",3,0.506,POSITIVE,0.58
,,Assuming you had everything in NVDA (largest % loss) and you lost 70k. Your retirement portfolio is at almost 800k.,2,0.515,NEGATIVE,0.997
,,Stones remake?,1,0.5,NEGATIVE,0.997
,,looks like everything is on sale!,0,0.512,POSITIVE,0.998
,,If I marked a Toyota Camry up to 80k and then dropped it to 40k is it a sale?,1,0.496,NEGATIVE,1.0
,,Only if it goes back up and passes 80k,2,0.506,NEGATIVE,0.999
,,How long was it selling for 80k?,2,0.548,NEGATIVE,1.0
,,Till I bought it..,3,0.512,NEGATIVE,0.938
,,"3% correction is not a bloodbath, lol.",0,0.497,POSITIVE,0.914
,,I swear some guys just love to panic. Op is one of them,1,0.512,POSITIVE,0.867
,,"Yep, but some of these folks have 0DTE on TQQQ or NVDA and thought they'd be millionaires one year out of college. It seems so easy on Youtube.",2,0.553,NEGATIVE,0.605
,,I should start a channel that features all my losing trades as a warning to other regards.,3,0.486,NEGATIVE,0.996
,,"They see red, they panic.No idea what ppl are thinking. Expecting easy money in a day or week? If so everybody would do that.It calls interesting and it's always risky.",2,0.517,NEGATIVE,0.998
,,"As I write this, S&P is down 8%, QQQ down 13%.Firmly in Dip territory, not a bloodbath.Though some WSB gambler's 0DTE may be down 99%, but that's not really a surprise, is it?",1,0.508,POSITIVE,0.95
,,I loaded up TQQQ at the end of June. Made a tasty 12% gain and then promptly lost 30%. It’s tough out there,2,0.512,NEGATIVE,1.0
,,"I tell ya what, man: I'm not half bad at finding good buying points, but I'm REALLY bad at finding good selling points.",3,0.554,NEGATIVE,1.0
,,clarification: down from recent (and all time) highs. That's how dips are generally measured.,2,0.52,POSITIVE,0.962
,,Im currently in my bomb shelter,1,0.504,NEGATIVE,0.982
,,"with the last month in account it's about 15-20% over the board, not a bloodbath but that is obviously more then a correction.",1,0.532,NEGATIVE,0.984
,,The DJIA & SPX are both within 10% of their all time highs,2,0.518,POSITIVE,0.975
,,"I don't know what Over the Board means, but it doesn't mean the major indices.SPY down 8% as I write this, and even QQQ is only down 13%",2,0.516,NEGATIVE,1.0
,,When people start selling because of this then it will become a bloodbath ,1,0.496,NEGATIVE,0.997
,,When people start selling because of this then it will become a bloodbath If*.A 3% drop in the S&P does not prove any herd mentality or impending crisis.,2,0.495,NEGATIVE,0.997
,,Good thing is there will also people buying :),2,0.56,POSITIVE,0.999
,,But all the red color. Red means it’s bad!!!,1,0.499,NEGATIVE,0.999
,,Everyone is a baby. I swear to god,1,0.502,POSITIVE,0.99
,,"I agree. The DOW did not drop 20+% eg 1987. So it's not a ""Black Monday"". However, the market is more and more being seen as overvalued. A sentiment similar to that in 1987. Safeguards are in place that may make this playout through the end of the year. What will make things worse is the political instability should Trump win in November. Markets don't like instability and a second Trump presidency could extend a bear market well into the future.",1,0.545,NEGATIVE,0.999
,,Rocket Companies is up after the initial drop. I did not expect that. $RKT,0,0.517,NEGATIVE,0.998
,,Stuff that sold off before it's green,1,0.513,NEGATIVE,1.0
,,Where do you guys go to to see these stocks?,0,0.531,POSITIVE,0.52
,,https://finviz.com/,1,0.515,NEGATIVE,0.67
,,Yall acting like this never happened before. Literally happened in 2022 and then market hit new ATH. Just relax and stop listening to the media. They are trying for you to sell so whales can get in cheap again. Same as they did in 2022.,0,0.535,NEGATIVE,1.0
,,"I’m old enough to remember Black Monday 1987, when the DJIA fell 22.6 percent.",1,0.504,NEGATIVE,0.99
,,Yeah but mondays passed and it didn’t fall that bad so,2,0.489,NEGATIVE,0.999
,,What was the catalyst for that rout again?,3,0.5,NEGATIVE,0.993
,,Welcome to the world of bots selling to bots. There’s nothing fundamentally wrong here to cause this level of selling.,0,0.515,POSITIVE,0.859
,,20T of bad japanese debt that was invested in US equities is being unwoundThat's pretty fundamentally bad for liquidity,1,0.508,NEGATIVE,1.0
,,"It’s not “bad” debt. It’s debt being called and paid by selling the shares bought with it.But I stand by my statement. This isn’t a fundamental economic issue, this is greed getting caught out. In a week, there will be bargain buying.",2,0.514,POSITIVE,0.955
,,Liquidity shortages are temporary,2,0.48,NEGATIVE,0.993
,,Ignorance is bliss,1,0.5,NEGATIVE,0.791
,,They´re all half way to zero already. EOD all will be green. Just a glitch ppl.,0,0.494,NEGATIVE,1.0
,,"Yeah - was this it? Like, I’m down a little, but before the markets opened everyone was making it sound like we were all going to be homeless and unemployed by the end of the day. (Also, sorry if this jinxes it, and we all end the day homeless and unemployed).",1,0.531,NEGATIVE,1.0
,,"that would be surprising, I think it will take a dy or two more red before bouncing back",1,0.518,NEGATIVE,0.966
,,The fed will cut rates then it will turn green,0,0.508,NEGATIVE,1.0
,,"Don’t bet on that. Most rate cuts are followed by selling in markets. Rate cut usually signals to market that an economic downturn is coming soon, or has already started",1,0.523,NEGATIVE,0.819
,,Also depends if they cut .25 or .5,2,0.568,NEGATIVE,0.996
,,Or 5.,3,0.5,POSITIVE,0.993
,,You are right you never know,2,0.527,POSITIVE,0.998
,,Nana’s Curse is real,0,0.513,NEGATIVE,0.938
,,"How has nobody mentioned that AAPL saw $50+ billion in selling from Buffet and Berkshire, and was maintaining relatively the same price last month? It was the news of the sale that caused the dip today. Nothing else has changed",0,0.53,NEGATIVE,0.986
,,so far,0,0.505,POSITIVE,0.983
,,Those are rookie numbers,0,0.5,NEGATIVE,0.504
,,Hardly a correction.,0,0.5,NEGATIVE,0.998
,,amd is green 😀,0,0.663,NEGATIVE,0.998
,,Time to panic sell and buy again at top.,0,0.578,POSITIVE,0.93
,,So far!,0,0.505,POSITIVE,0.994
,,Man what I would give to be red green colorblind and upside down right now,0,0.51,NEGATIVE,0.989
,,https://finviz.com/screener.ashx?v=711&f=ta_perf_d15o&ft=4&show_etf=truei only see green... sorry.Thanks to SQQQ and SOXS and VIX :D,0,0.507,NEGATIVE,1.0
,,Just because the clickbait articles said bloodbath doesn’t mean you need to use it!,0,0.604,NEGATIVE,0.771
,,"S&P 500 is where it was on 8 May (2024). YTD up 9,5%Wake me when it's -20% over 5 years.",0,0.531,POSITIVE,0.633
,,"OP is right, it's a bloodbath. Sell all of your shares so that OP and I can buy them cheaper.",0,0.531,NEGATIVE,1.0
,,If boomers start freaking out over the dip in their retirement accounts it could get ugly in the near future if they decide to go to cash for safety (or apparent safety I should say).,0,0.507,NEGATIVE,0.972
,,"Got a call from my boomer father whose E*trade account I manage. “I saw on the news…”Yes, I believe there will be selling. It could be epic.",1,0.511,NEGATIVE,0.555
,,LOL first time?,0,0.55,POSITIVE,0.963
,,It's an opportunity.,0,0.52,POSITIVE,0.996
,,"Agreed. I just spent the last week prior to this spending 26k in various stocks company and etfs, typical. But I'll look on the brightside as I have 5k still to invest. Going to wait it out and see just how much of a discount I can get on my vanguard s&p500 😂",1,0.551,NEGATIVE,0.873
,,It’s a bonfire,0,0.5,POSITIVE,0.992
,,"Enormous buying opportunities before the fed cuts 0.50 basis points, maybe a full one. An Nivida earnings come in beat an inflation comes in way lower.",0,0.516,NEGATIVE,0.843
,,I bought a little bit of everything today.,0,0.536,POSITIVE,0.994
,,Buy the dip and don’t sell.,0,0.56,NEGATIVE,0.999
,,ASTS still hummin.,0,0.508,NEGATIVE,0.998
,,Don’t jinx it man!…and don’t drop no Gramma money on it.,1,0.499,POSITIVE,0.907
,,"If you set it to 3 months, almost all of that is green. Not a bloodbath just yet.",0,0.527,NEGATIVE,0.998
,,You get a discount! You get a discount! You get a discount!,0,0.512,NEGATIVE,0.548
,,"It’s not. Stop your silliness, OP.",0,0.499,NEGATIVE,0.955
,,"Sofi was green today for a couple hours, so theres that lol",0,0.529,POSITIVE,0.912
,,Insert James Franco ‘First Time?’ Gif.,0,0.512,NEGATIVE,1.0
,,The only stock that I have that didn’t tank was ASTS.,0,0.604,POSITIVE,0.974
,,"A red sun rises, blood has been spilled this night",0,0.498,NEGATIVE,0.84
,,Heh. My comments about investing 100k 2 weeks ago look pretty smart,0,0.515,NEGATIVE,0.983
,,Intrusive thoughts—buy Intel.,0,0.58,NEGATIVE,0.991
,,Aaaand it has bounced back,0,0.505,NEGATIVE,0.861
,,"It is, the market will finish -1,000 or worst today (pending some sort of pumping behind the scenes) You don't have the world markets all ""crashing"" and our market magically be unphased by this. Today will be bad, but should slowly tick up (hopefully) the rest of the week.But nothing finishes in the green today and if it does it will be highly sus.It's just one of those days you just have to accept is going to suck...",0,0.544,NEGATIVE,1.0
,,"I have been doing alright in my personal trades, but I am taking it on the chin with my IRA which is all hedge funds and ""total stock market"" stuff.I personally tend to invest in stuff that is ostensibly immortal, Coca Cola will take a hit from time to time and will never explode in value, but even if soda were outlawed tomorrow they would just take out the dye and sugar and start making metal cleaner.My weirdest investment this last week was Sleep Number Bed. Which went way up on Thursday, way down on Friday, and is now completely fine today.WEIRD!",0,0.531,NEGATIVE,1.0
,,Naaaah retail can't get in their brokers - can't sell - no sell pressure - no downtrend market is fine - profit - recession cancelled,0,0.545,NEGATIVE,1.0
,,Récord highs for a year and now people screaming bloody murder,0,0.583,NEGATIVE,0.965
,,I’m drenched in blood and blood and blood,0,0.497,NEGATIVE,0.992
