date of comment,main comment,comment,depth,PTR Sentiment,Flair Sentiment,Flair Outlook
,,Ooof! That’s a punch to the berries,0,0.5,0.999,POSITIVE
,,All stocks jumped during Feds meeting and tanked right after 3PM.,0,0.526,1.0,NEGATIVE
,,I think it went up bc the worry was that it would be 100 base points; then went down after fed signal it is not pivoting and will continue to be aggressive. They been saying this for months but people just refuses to accept it,1,0.517,1.0,NEGATIVE
,,fire sale,0,0.508,0.556,NEGATIVE
,,I only see red bro!,0,0.502,0.749,POSITIVE
,,I only see red bro!,1,0.502,0.749,POSITIVE
,,1M performance is a nice mix: https://finviz.com/map.ashx?st=w4,2,0.514,0.994,POSITIVE
,,That's why it's called diversified losses T.T,2,0.5,0.981,NEGATIVE
,,Lot of that going around today.,2,0.559,0.971,NEGATIVE
,,SOXS up.,2,0.5,0.947,POSITIVE
,,pick a shade son,2,0.502,0.997,POSITIVE
,,"Yes, we are in a bear market with rising interest rates. What did everyone expect? Bunch of bullshit guesses of a pivot or a pause or any stupid wish that we could go magically higher. Too much F’king money that every one has trying to make something happen. We are going lower as rates go higher. I’ve mentioned before we need to see a 40 % down Nasdaq, a 28k Dow and at least a 3400 SPX where everyone will get scared shitless and get out and then the long term players can finally get back in. The Fed is finally taking the punch bowl away and letting the gamblers lose their money. You could see this coming a mile away. Just too many young investors never dealing that yes, you can buy the dips as long as you realize you may bloody your hand on the falling knife. I don’t know what kind of holiday season we will have but the consumer may either buy because there’s no tomorrow or save their money for the high priced groceries, doctor bills, high gas prices and losing their job. The only good news is … one day next year it may all be over and the sun will shine again. Se la vie.",0,0.526,1.0,NEGATIVE
,,"Pretty sure every one of them say that 4% gives you a 95% chance of success over 30 years not 70. And by ""went on too long"" you must mean the whole history of the stock market which has included crashes far worse than this one.What's your assumption now? That stocks will stay down and just never recover until the end of time? Remember they'd have to go perfectly sideways or somehow continuously dwindle downwards for it to be a bad idea for the monthly investor. People get tied to ATH's and think we somehow need to reach them again for anyone to break even despite the fact everyone's average buying price is way way below that.",1,0.527,1.0,NEGATIVE
,,"Pretty sure every one of them say that 4% gives you a 95% chance of success over 30 years not 70. And by ""went on too long"" you must mean the whole history of the stock market which has included crashes far worse than this one.What's your assumption now? That stocks will stay down and just never recover until the end of time? Remember they'd have to go perfectly sideways or somehow continuously dwindle downwards for it to be a bad idea for the monthly investor. People get tied to ATH's and think we somehow need to reach them again for anyone to break even despite the fact everyone's average buying price is way way below that.",2,0.527,1.0,NEGATIVE
,,C‘est la vie!,1,0.5,0.903,POSITIVE
,,I’m Spanish,2,0.5,0.6,POSITIVE
,,"Worst part, forgot to canceled that RIOT buywrite when I left my desk thinking all would be fine. Now I own 200 shares of RIOT, a built in loss, and a couple of options I’d changed my mind about. It’ll be fine, but geezus!!! Lesson relearned. 👍",0,0.504,0.999,NEGATIVE
,,"But I keep reading markets are ""priced in"" in social. Effing bastards.",0,0.525,0.99,NEGATIVE
,,"Fuk me. SOS!! Not just stocks, but just everything in price going up. Holy shit..",0,0.53,0.999,NEGATIVE
,,Way too much red,0,0.518,1.0,NEGATIVE
,,Keep on dropping so we can keep on buying!,0,0.511,0.947,POSITIVE
,,Where can i view this?,0,0.5,0.531,POSITIVE
,,"Monday is a nice day to buy, for now see discount getting higher a few days.",0,0.541,0.811,POSITIVE
,,I consider buying the Friday's dip,0,0.52,0.786,NEGATIVE
,,Today we will be green,0,0.583,0.999,POSITIVE
,,These posts are how I get my info. I don’t even open my app anymore,0,0.508,0.971,NEGATIVE
,,Hey look! Santa Clause’s color!,0,0.508,0.992,POSITIVE
,,"Everyone should consider Nexo’s listings right now, including $CVX 👍🏽",0,0.511,0.793,POSITIVE
