date of comment,main comment,comment,depth,PTR Sentiment,Flair Sentiment,Flair Outlook
,,Take a look at the dow. This was not a tech thing….,0,0.521,1.0,NEGATIVE
,,Not that bad. There's a few green boxes,0,0.502,0.991,NEGATIVE
,,Those are just logos.You’re not fooling anyone Nvidia 👀,1,0.529,0.999,NEGATIVE
,,Lol I think NVDA felt challenged by you,2,0.504,0.998,POSITIVE
,,"So, a sale day!",0,0.538,0.874,POSITIVE
,,Yessir my limit order went thru!!! Discount 🤑,1,0.534,0.849,NEGATIVE
,,Where have you been the past 2 months? People taking profits is not a new thing🤷🏻‍♂️,0,0.569,1.0,NEGATIVE
,,"dude, yesterday was not just about profits taking",1,0.51,0.742,NEGATIVE
,,It’s was a systematic dump with 0 volume and volatility.,2,0.508,1.0,NEGATIVE
,,"Weird Google was down so much it appears SCOTUS is leaning toward them in the court case.Really that is good news for all the big Internet companies. Google, Meta and Amazon.Apple and Microsoft are not so much Internet companies.",0,0.53,0.997,NEGATIVE
,,Still overrated,0,0.512,0.95,NEGATIVE
,,"Tech? Could not disagree more. Think some of these companies have barely even got started.Take Alphabet. Waymo has a huge opportunity in front of them. Moving any object from Point A to Point B, including humans, might be a trillion dollar opportunity.Waymo now has the service up in running in Phoenix, San Fran and have announced the second biggest US city, Los Angeles.",1,0.524,0.925,POSITIVE
,,Most of this is already in the stock price included (was before).,2,0.631,1.0,NEGATIVE
,,"Genuine question, How do people know things are already “priced in”?",3,0.509,0.696,NEGATIVE
,,"The general sentiment is that if you as a retail investor have heard about something, literally everyone ""in the game"" has already heard and reacted before you even had a chance to hear about said event or market moving catalyst. It's why insider trading among the retail investors is so easy to spot by regulators- it's very difficult and relatively rare for a retail investor to make significant gains without an ""illegal"" edge.",4,0.538,0.999,NEGATIVE
,,What may be the reason for Microsoft stock fall? It has invested billions in openai; the tech openai possesses has huge potential for profit.,0,0.557,0.995,NEGATIVE
,,Looks like a good day to buy,0,0.565,0.984,POSITIVE
,,just move to Japan,0,0.525,0.994,NEGATIVE
,,What triggered it though?,0,0.497,0.995,NEGATIVE
,,biden/putin,1,0.495,0.749,POSITIVE
,,The prospect of an ongoing war? I don't think that came as a surprise to most of us.,2,0.521,0.968,NEGATIVE
,,they both gave speeches about it though,3,0.503,0.703,NEGATIVE
,,Manipulation has been keeping it afloat for 6+ months,1,0.531,0.864,NEGATIVE
,,I heard it's the winter storm in US.,1,0.521,0.824,POSITIVE
,,Rookie numbers.,0,0.5,0.877,POSITIVE
,,What’s this visualization tool?,0,0.503,0.94,NEGATIVE
,,"This obviously planned ahead. Just be patient and buy the dip, so when the party starts we have something to enjoy with the chips.",0,0.528,0.999,POSITIVE
,,Since when did stocks have their logo in stock name?,0,0.614,0.892,NEGATIVE
,,I'm buying some nvidia stock for future me.,0,0.714,0.856,POSITIVE
,,Ready to take a journey through the galaxy of crypto lotteries? Seize your chance at winningMilkyWayDefi's 35th lottery round! 💰🌟Join us now! 👉 https://milkyway.exchange/lottery,0,0.507,0.998,POSITIVE
,,"I literally bought, Amazon, Google, Microsoft and Apple this morning… sorry everyone",0,0.516,0.987,NEGATIVE
