date,post headline,comments,link,PTR Sentiment,Flair Outlook,Flair Score
12/14/2024,Broadcom (AVGO) broke the $1T barrier - here's how it compares to the Mag 7,127,https://www.reddit.com/r/stocks/comments/1hdxxw6/broadcom_avgo_broke_the_1t_barrier_heres_how_it/,0.498,NEGATIVE,0.847
12/19/2024,"$850,000 Cash, Should I Buy on Today’s 1,100 point Dip? What Stock/s?",95,https://www.reddit.com/r/stocks/comments/1hhjxln/850000_cash_should_i_buy_on_todays_1100_point_dip/,0.609,NEGATIVE,0.999
12/19/2024,Intel currently represents one of the best stock opportunities for 2025,136,https://www.reddit.com/r/stocks/comments/1hhi6lc/intel_currently_represents_one_of_the_best_stock/,0.604,POSITIVE,0.999
12/18/2024,How have you utilized algorithmic investing for your trades?,32,https://www.reddit.com/r/stocks/comments/1hh36fg/how_have_you_utilized_algorithmic_investing_for/,0.508,NEGATIVE,0.995
12/18/2024,Microsoft AI strategy is in shambles,40,https://www.reddit.com/r/stocks/comments/1hh0pb2/microsoft_ai_strategy_is_in_shambles/,0.603,NEGATIVE,1.0
