date,post headline,comments,link,PTR Sentiment,Flair Outlook,Flair Score
08/04/2024,Nvidia’s New AI Chip Delayed Due to Design Flaws,44,https://www.reddit.com/r/stocks/comments/1ejiswm/nvidias_new_ai_chip_delayed_due_to_design_flaws/,0.591,NEGATIVE,0.994
08/04/2024,Average Down (MU) or Diversify?,18,https://www.reddit.com/r/stocks/comments/1ek3lh5/average_down_mu_or_diversify/,0.507,NEGATIVE,0.996
08/04/2024,NVDA SAYS AI CHIPS ON TRACK AMID FEARS,62,https://www.reddit.com/r/stocks/comments/1ek8azi/nvda_says_ai_chips_on_track_amid_fears/,0.559,NEGATIVE,0.963
08/05/2024,Why The Rumored Delay Of NVIDIA's Blackwell GPUs is Unlikely To Be A Deal Killer,29,https://www.reddit.com/r/stocks/comments/1ekb0of/why_the_rumored_delay_of_nvidias_blackwell_gpus/,0.531,NEGATIVE,0.999
08/05/2024,Holding NVIDIA?,10,https://www.reddit.com/r/stocks/comments/1eki59x/holding_nvidia/,0.593,POSITIVE,0.924
08/05/2024,"AI Stock Palantir Surges On Q2 Revenue Beat, Strong Guidance",17,https://www.reddit.com/r/stocks/comments/1ekykq4/ai_stock_palantir_surges_on_q2_revenue_beat/,0.611,POSITIVE,0.975
08/06/2024,Nvidia’s Next-Generation AI Chip Rollout Slowed by Engineering Snags,20,https://www.reddit.com/r/stocks/comments/1el4crm/nvidias_nextgeneration_ai_chip_rollout_slowed_by/,0.563,NEGATIVE,0.997
08/06/2024,Best stocks to buy right now,129,https://www.reddit.com/r/stocks/comments/1el5yyn/best_stocks_to_buy_right_now/,0.61,POSITIVE,1.0
08/07/2024,"If you had to have 100% of your portfolio in either Microsoft, Apple, or Nvidia which would you choose?",408,https://www.reddit.com/r/stocks/comments/1em3z4e/if_you_had_to_have_100_of_your_portfolio_in/,0.549,NEGATIVE,0.968
08/09/2024,TSMC sales grow 45% in July on strong AI chip demand,52,https://www.reddit.com/r/stocks/comments/1enwzdc/tsmc_sales_grow_45_in_july_on_strong_ai_chip/,0.641,POSITIVE,0.99
08/14/2024,The Consumer Recession of 2023-2024 and the Future,120,https://www.reddit.com/r/stocks/comments/1eruoyr/the_consumer_recession_of_20232024_and_the_future/,0.527,NEGATIVE,0.989
08/14/2024,GOOG - Bull Case - Custom TPU leading to successful AI products,49,https://www.reddit.com/r/stocks/comments/1es01n4/goog_bull_case_custom_tpu_leading_to_successful/,0.562,POSITIVE,0.999
08/14/2024,Intel sells stake in UK chip designer Arm amid company-wide restructuring and cost cuts,74,https://www.reddit.com/r/stocks/comments/1es69kc/intel_sells_stake_in_uk_chip_designer_arm_amid/,0.588,NEGATIVE,0.98
08/15/2024,What will be the hottest company in 2025?,199,https://www.reddit.com/r/stocks/comments/1eso7u8/what_will_be_the_hottest_company_in_2025/,0.87,POSITIVE,0.974
08/15/2024,Ex-Google CEO Eric Schmidt sees Nvidia as big AI winner: ‘You know what to do in the stock market’,175,https://www.reddit.com/r/stocks/comments/1et5yvq/exgoogle_ceo_eric_schmidt_sees_nvidia_as_big_ai/,0.581,POSITIVE,0.897
08/17/2024,What insights / trends did you see when making previous bets on long term winners?,42,https://www.reddit.com/r/stocks/comments/1euapw1/what_insights_trends_did_you_see_when_making/,0.533,POSITIVE,0.901
08/17/2024,What is this anomaly?,8,https://www.reddit.com/r/stocks/comments/1eueggt/what_is_this_anomaly/,0.5,NEGATIVE,0.997
08/19/2024,AMD to acquire server builder ZT Systems for $4.9 billion in cash and stock,67,https://www.reddit.com/r/stocks/comments/1ew1fx0/amd_to_acquire_server_builder_zt_systems_for_49/,0.623,NEGATIVE,0.93
08/19/2024,Why is QCOM so cheap?,82,https://www.reddit.com/r/stocks/comments/1ewbblz/why_is_qcom_so_cheap/,0.508,NEGATIVE,0.998
08/21/2024,Should I add more stocks on my portfolio or just keep it as it is?,28,https://www.reddit.com/r/stocks/comments/1exj5im/should_i_add_more_stocks_on_my_portfolio_or_just/,0.555,POSITIVE,0.965
08/21/2024,Alphabet share buyback & investing cash flow,27,https://www.reddit.com/r/stocks/comments/1exkgbu/alphabet_share_buyback_investing_cash_flow/,0.553,NEGATIVE,0.766
08/21/2024,Out of curiosity: why is CostCo so expensive?,131,https://www.reddit.com/r/stocks/comments/1exobov/out_of_curiosity_why_is_costco_so_expensive/,0.497,NEGATIVE,0.687
08/22/2024,Citi thinks NVIDIA can make new highs following next week’s earnings report.,88,https://www.reddit.com/r/stocks/comments/1eyl9jl/citi_thinks_nvidia_can_make_new_highs_following/,0.589,NEGATIVE,0.992
08/26/2024,"Looking at QDVO, what are your thoughts?",7,https://www.reddit.com/r/stocks/comments/1f1sm89/looking_at_qdvo_what_are_your_thoughts/,0.512,NEGATIVE,0.997
08/26/2024,Still meaningful alpha left in NVIDIA?,128,https://www.reddit.com/r/stocks/comments/1f1ywwc/still_meaningful_alpha_left_in_nvidia/,0.54,POSITIVE,0.94
08/27/2024,(8/27/24) Tuesday's Pre-Market News & Stock Movers,2,https://www.reddit.com/r/stocks/comments/1f2fibs/82724_tuesdays_premarket_news_stock_movers/,0.645,POSITIVE,0.578
08/27/2024,Intel board member quit after differences over chipmaker's revival plan,109,https://www.reddit.com/r/stocks/comments/1f2ji5j/intel_board_member_quit_after_differences_over/,0.525,NEGATIVE,0.999
08/27/2024,What could stop the NVDIA frenzy?,24,https://www.reddit.com/r/stocks/comments/1f2momw/what_could_stop_the_nvdia_frenzy/,0.509,NEGATIVE,0.977
08/28/2024,Limit Order after Hours in case NVIDIA misses earnings,84,https://www.reddit.com/r/stocks/comments/1f36zrw/limit_order_after_hours_in_case_nvidia_misses/,0.589,NEGATIVE,0.996
08/28/2024,(8/28) - Wednesday's Pre-Market News & Stock Movers,2,https://www.reddit.com/r/stocks/comments/1f38ipr/828_wednesdays_premarket_news_stock_movers/,0.643,POSITIVE,0.751
08/28/2024,Buffett's Berkshire Hathaway hits $1 trillion market value,70,https://www.reddit.com/r/stocks/comments/1f3avu0/buffetts_berkshire_hathaway_hits_1_trillion/,0.554,POSITIVE,0.995
08/28/2024,Nvidia reports 122% revenue growth on surging demand for data center chips,603,https://www.reddit.com/r/stocks/comments/1f3judv/nvidia_reports_122_revenue_growth_on_surging/,0.571,POSITIVE,0.996
08/29/2024,(8/29) - Thursday's Pre-Market News & Stock Movers,0,https://www.reddit.com/r/stocks/comments/1f40ntk/829_thursdays_premarket_news_stock_movers/,0.645,POSITIVE,0.827
08/29/2024,"As SMCI looses market share and reputation, DELL is positioned to explode in coming months",33,https://www.reddit.com/r/stocks/comments/1f47zyc/as_smci_looses_market_share_and_reputation_dell/,0.557,NEGATIVE,0.995
08/29/2024,"Apple, Nvidia in talks to join OpenAI funding round, media reports say",63,https://www.reddit.com/r/stocks/comments/1f4by79/apple_nvidia_in_talks_to_join_openai_funding/,0.516,NEGATIVE,0.953
08/29/2024,Is Intel a good investment for the next 5 - 10 years?,52,https://www.reddit.com/r/stocks/comments/1f4cbx4/is_intel_a_good_investment_for_the_next_5_10_years/,0.589,POSITIVE,0.661
08/29/2024,"Dell beats estimates as server sales soar 80%, riding AI wave",72,https://www.reddit.com/r/stocks/comments/1f4ccdg/dell_beats_estimates_as_server_sales_soar_80/,0.596,POSITIVE,0.972
08/30/2024,"Intel working with bankers to present board with strategic options, sending shares up 8%",175,https://www.reddit.com/r/stocks/comments/1f54n54/intel_working_with_bankers_to_present_board_with/,0.535,POSITIVE,0.665
09/01/2024,Intel selling off non-core divisions $INTC,94,https://www.reddit.com/r/stocks/comments/1f6r2g4/intel_selling_off_noncore_divisions_intc/,0.527,NEGATIVE,0.998
09/03/2024,Taiwan semiconductor Manufacturing Company,80,https://www.reddit.com/r/stocks/comments/1f7zbvo/taiwan_semiconductor_manufacturing_company/,0.712,POSITIVE,0.957
09/03/2024,Nvidia Gets DOJ Subpoena in Escalating Antitrust Probe,304,https://www.reddit.com/r/stocks/comments/1f8al9p/nvidia_gets_doj_subpoena_in_escalating_antitrust/,0.524,NEGATIVE,0.517
09/04/2024,Why are people opposed to antitrust probes or merger blocks?,79,https://www.reddit.com/r/stocks/comments/1f8qi4h/why_are_people_opposed_to_antitrust_probes_or/,0.493,NEGATIVE,0.874
09/04/2024,(9/4) - Wednesday's Pre-Market News & Stock Movers,3,https://www.reddit.com/r/stocks/comments/1f8ris2/94_wednesdays_premarket_news_stock_movers/,0.643,POSITIVE,0.821
09/04/2024,[Reuters Exclusive] Intel manufacturing business suffers setback as Broadcom tests disappoint,106,https://www.reddit.com/r/stocks/comments/1f8spne/reuters_exclusive_intel_manufacturing_business/,0.549,NEGATIVE,0.999
09/04/2024,Thought about structured product,3,https://www.reddit.com/r/stocks/comments/1f8xarf/thought_about_structured_product/,0.522,POSITIVE,0.998
09/04/2024,Nvidia says it didn’t receive antitrust subpoena from DOJ,147,https://www.reddit.com/r/stocks/comments/1f97d6c/nvidia_says_it_didnt_receive_antitrust_subpoena/,0.542,NEGATIVE,0.978
09/05/2024,What is the growth stock endgame?,157,https://www.reddit.com/r/stocks/comments/1f9k9m4/what_is_the_growth_stock_endgame/,0.71,NEGATIVE,0.973
09/05/2024,Volvo Cars cuts margin and revenue aims after ditching electric vehicle target,6,https://www.reddit.com/r/stocks/comments/1f9na3t/volvo_cars_cuts_margin_and_revenue_aims_after/,0.514,NEGATIVE,0.518
09/06/2024,[Bloomberg] TSMC’s Arizona Trials Put Plant Productivity on Par with Taiwan,41,https://www.reddit.com/r/stocks/comments/1fah4yl/bloomberg_tsmcs_arizona_trials_put_plant/,0.512,POSITIVE,0.992
09/06/2024,Sen. Elizabeth Warren writes a letter backing the DOJ investigation into Nvidia antitrust allegations,219,https://www.reddit.com/r/stocks/comments/1fahrhc/sen_elizabeth_warren_writes_a_letter_backing_the/,0.514,NEGATIVE,0.924
09/07/2024,Can someone explain why AI is getting so much attention from the tech community in last two years when it wasn't the case before?,248,https://www.reddit.com/r/stocks/comments/1fbk12b/can_someone_explain_why_ai_is_getting_so_much/,0.55,NEGATIVE,0.524
09/08/2024,Is Jensen Hwang simply lucky or have exceptional foresight?,148,https://www.reddit.com/r/stocks/comments/1fbowa9/is_jensen_hwang_simply_lucky_or_have_exceptional/,0.5,NEGATIVE,0.744
09/09/2024,"AI exuberance masks broad weakness in tech sector, say investors",39,https://www.reddit.com/r/stocks/comments/1fcvhdq/ai_exuberance_masks_broad_weakness_in_tech_sector/,0.543,NEGATIVE,0.696
09/10/2024,Taiwan Semiconductor's August sales surge as AI demand continues,36,https://www.reddit.com/r/stocks/comments/1fdh0ku/taiwan_semiconductors_august_sales_surge_as_ai/,0.615,POSITIVE,0.99
09/10/2024,(9/10) - Tuesday's Pre-Market News & Stock Movers,2,https://www.reddit.com/r/stocks/comments/1fdh855/910_tuesdays_premarket_news_stock_movers/,0.645,POSITIVE,0.777
09/11/2024,Summarized comments from Jensen Huang from today's GS Conference,39,https://www.reddit.com/r/stocks/comments/1fenhlm/summarized_comments_from_jensen_huang_from_todays/,0.526,NEGATIVE,0.526
09/12/2024,"Oracle trails only Nvidia among large-cap tech this year, as Ellison closes in on Bezos",17,https://www.reddit.com/r/stocks/comments/1feqk2z/oracle_trails_only_nvidia_among_largecap_tech/,0.58,POSITIVE,0.649
09/12/2024,(9/12) - Thursday's Pre-Market News & Stock Movers,1,https://www.reddit.com/r/stocks/comments/1ff1hec/912_thursdays_premarket_news_stock_movers/,0.645,POSITIVE,0.85
09/13/2024,Saudi Arabia expects to get access to Nvidia's high performance chips 'within the next year',100,https://www.reddit.com/r/stocks/comments/1fg0vya/saudi_arabia_expects_to_get_access_to_nvidias/,0.598,NEGATIVE,0.761
09/13/2024,Chatgpt says its new AI can reason like a person -- which stocks benefit from this?,53,https://www.reddit.com/r/stocks/comments/1fg2qe7/chatgpt_says_its_new_ai_can_reason_like_a_person/,0.602,NEGATIVE,0.998
09/16/2024,"Intel stock jumps on plan to turn foundry unit into subsidiary, allow outside funding",148,https://www.reddit.com/r/stocks/comments/1fierfw/intel_stock_jumps_on_plan_to_turn_foundry_unit/,0.563,NEGATIVE,0.969
09/17/2024,BlackRock and Microsoft plan $30bn fund to invest in AI infrastructure,91,https://www.reddit.com/r/stocks/comments/1fjdmpw/blackrock_and_microsoft_plan_30bn_fund_to_invest/,0.552,NEGATIVE,0.849
09/19/2024,(9/19) - Thursday's Pre-Market News & Stock Movers,4,https://www.reddit.com/r/stocks/comments/1fkjq8b/919_thursdays_premarket_news_stock_movers/,0.645,POSITIVE,0.846
09/26/2024,How would Mag-7 stocks compare against their leverages over 1 year?,9,https://www.reddit.com/r/stocks/comments/1fpnouc/how_would_mag7_stocks_compare_against_their/,0.628,NEGATIVE,0.737
09/26/2024,Investing in Costco today is actually betting against it,306,https://www.reddit.com/r/stocks/comments/1fpzm9a/investing_in_costco_today_is_actually_betting/,0.54,NEGATIVE,0.991
10/01/2024,The Crash of the stock market has arrived. Price/Earnings ratio just broke 30 for the entire S&P 500.,158,https://www.reddit.com/r/stocks/comments/1ftqqw0/the_crash_of_the_stock_market_has_arrived/,0.598,NEGATIVE,0.998
10/02/2024,Nvidia CEO Jensen Huang: “Demand for Blackwell is Insane”,142,https://www.reddit.com/r/stocks/comments/1futbrv/nvidia_ceo_jensen_huang_demand_for_blackwell_is/,0.543,NEGATIVE,0.992
10/04/2024,June 2026 - where will NVDA be?,19,https://www.reddit.com/r/stocks/comments/1fvmtmy/june_2026_where_will_nvda_be/,0.52,NEGATIVE,0.938
10/06/2024,Google’s Grip on Search Slips as TikTok and AI Startup Mount Challenge,165,https://www.reddit.com/r/stocks/comments/1fxma5a/googles_grip_on_search_slips_as_tiktok_and_ai/,0.537,NEGATIVE,0.95
10/07/2024,"Super Micro soars after company says it's shipping over 100,000 AI GPUs per quarter",35,https://www.reddit.com/r/stocks/comments/1fydgxp/super_micro_soars_after_company_says_its_shipping/,0.648,POSITIVE,0.995
10/09/2024,TSMC's revenue for September surged 39.6% YoY,26,https://www.reddit.com/r/stocks/comments/1fznfk0/tsmcs_revenue_for_september_surged_396_yoy/,0.535,NEGATIVE,0.989
10/09/2024,"Internal OpenAI projections suggest no profits until 2029, MSFT allegedly entitled to 20% of OpenAI's revenue",120,https://www.reddit.com/r/stocks/comments/1g04ua4/internal_openai_projections_suggest_no_profits/,0.508,NEGATIVE,0.996
10/09/2024,TSMC Earnings Ahead: Could this cause NVDA to reach new highs?,20,https://www.reddit.com/r/stocks/comments/1g05jy3/tsmc_earnings_ahead_could_this_cause_nvda_to/,0.583,POSITIVE,0.808
10/10/2024,AMD AI event on Oct 10: Any expectations?,10,https://www.reddit.com/r/stocks/comments/1g090wb/amd_ai_event_on_oct_10_any_expectations/,0.66,NEGATIVE,0.643
10/10/2024,AMD down 4% as they kick of AI event and unveil new chip to challenge Nvidia.,134,https://www.reddit.com/r/stocks/comments/1g0p1uj/amd_down_4_as_they_kick_of_ai_event_and_unveil/,0.656,NEGATIVE,0.899
10/10/2024,Morgan Stanley just met with Nvidia’s CEO and came away even more confident in its top pick,60,https://www.reddit.com/r/stocks/comments/1g0qgfz/morgan_stanley_just_met_with_nvidias_ceo_and_came/,0.52,POSITIVE,0.998
10/14/2024,Nvidia closes at record as AI chipmaker's market cap tops $3.4 trillion,242,https://www.reddit.com/r/stocks/comments/1g3pofm/nvidia_closes_at_record_as_ai_chipmakers_market/,0.586,NEGATIVE,0.773
10/15/2024,Semis take a hit after news on limiting exports,44,https://www.reddit.com/r/stocks/comments/1g49o6s/semis_take_a_hit_after_news_on_limiting_exports/,0.513,NEGATIVE,0.63
10/16/2024,"Global chip stocks fall on ASML’s disappointing outlook, possible U.S. export cap",10,https://www.reddit.com/r/stocks/comments/1g538dr/global_chip_stocks_fall_on_asmls_disappointing/,0.521,NEGATIVE,1.0
10/18/2024,"Large cap tech, Nvidia, and by extension US index funds are likely to crash, small cap value/international to outperform. Here's why",14,https://www.reddit.com/r/stocks/comments/1g6ahuv/large_cap_tech_nvidia_and_by_extension_us_index/,0.535,NEGATIVE,0.997
10/20/2024,"What companies that arent Mag 7, ETFs, and index funds do you feel will outperform the market in 2025.",321,https://www.reddit.com/r/stocks/comments/1g80x5z/what_companies_that_arent_mag_7_etfs_and_index/,0.546,NEGATIVE,0.825
10/20/2024,I compiled a list of all 190 stocks and funds from the September 2024 Quarterly Thread,15,https://www.reddit.com/r/stocks/comments/1g8915h/i_compiled_a_list_of_all_190_stocks_and_funds/,0.532,NEGATIVE,0.9
10/22/2024,Let’s find the next 100bagger for 2025,174,https://www.reddit.com/r/stocks/comments/1g9ari7/lets_find_the_next_100bagger_for_2025/,0.532,POSITIVE,0.939
10/24/2024,"Nvidia supplier SK Hynix posts record Q3 profit, beats forecasts",18,https://www.reddit.com/r/stocks/comments/1gara3z/nvidia_supplier_sk_hynix_posts_record_q3_profit/,0.549,POSITIVE,0.674
10/24/2024,"Tesla’s Not a Car Company, Musk’s in the Business of Selling the Future. And 5 Other Things to Know Today.",10,https://www.reddit.com/r/stocks/comments/1gb1w72/teslas_not_a_car_company_musks_in_the_business_of/,0.632,NEGATIVE,0.577
10/25/2024,Favorite 10 stocks,84,https://www.reddit.com/r/stocks/comments/1gbl5kl/favorite_10_stocks/,0.565,POSITIVE,0.999
10/25/2024,When/how do you know it's time to sell your successful stock?,137,https://www.reddit.com/r/stocks/comments/1gbnd05/whenhow_do_you_know_its_time_to_sell_your/,0.624,NEGATIVE,0.994
10/28/2024,Bloomberg’s estimates on the big four tech giants,20,https://www.reddit.com/r/stocks/comments/1ge79db/bloombergs_estimates_on_the_big_four_tech_giants/,0.542,POSITIVE,0.931
10/29/2024,Softbank’s Son Says Nvidia Is Undervalued as Super AI Looms,117,https://www.reddit.com/r/stocks/comments/1gezw7h/softbanks_son_says_nvidia_is_undervalued_as_super/,0.57,NEGATIVE,0.992
10/30/2024,Why SMCI's situation is a massive threat to Nvidia,90,https://www.reddit.com/r/stocks/comments/1gfqlq2/why_smcis_situation_is_a_massive_threat_to_nvidia/,0.529,NEGATIVE,1.0
11/01/2024,BlackRock launches ETF that expands beyond the ‘Magnificent Seven’,62,https://www.reddit.com/r/stocks/comments/1gh4zwd/blackrock_launches_etf_that_expands_beyond_the/,0.509,POSITIVE,0.998
11/01/2024,"Nvidia to join Dow Jones Industrial Average, replacing Intel",135,https://www.reddit.com/r/stocks/comments/1ghghq5/nvidia_to_join_dow_jones_industrial_average/,0.539,NEGATIVE,0.975
11/04/2024,Nvidia Overtakes Apple to Become World's Largest Company,191,https://www.reddit.com/r/stocks/comments/1gjgfct/nvidia_overtakes_apple_to_become_worlds_largest/,0.666,NEGATIVE,0.692
11/05/2024,Do I sell my stock and dump the money into ETFs like VOO and VIG?,33,https://www.reddit.com/r/stocks/comments/1gk9vg0/do_i_sell_my_stock_and_dump_the_money_into_etfs/,0.561,NEGATIVE,1.0
11/05/2024,Super Micro Computer- SMCI $26 - Avoid Till We Get Restated Financials,54,https://www.reddit.com/r/stocks/comments/1gkgqx3/super_micro_computer_smci_26_avoid_till_we_get/,0.513,NEGATIVE,1.0
11/06/2024,Will Nvidia suffer due to increased tensions with China?,159,https://www.reddit.com/r/stocks/comments/1gl3byx/will_nvidia_suffer_due_to_increased_tensions_with/,0.598,NEGATIVE,0.999
11/06/2024,Qualcomm pops on chipmaker's earnings and revenue beat,10,https://www.reddit.com/r/stocks/comments/1glceac/qualcomm_pops_on_chipmakers_earnings_and_revenue/,0.558,POSITIVE,0.93
11/08/2024,Tesla hits $1T Market Cap for the first time since 2021,468,https://www.reddit.com/r/stocks/comments/1gmkxwf/tesla_hits_1t_market_cap_for_the_first_time_since/,0.553,POSITIVE,0.96
11/10/2024,Reuters Exclusive: US ordered TSMC to halt shipments to China of chips used in AI applications,143,https://www.reddit.com/r/stocks/comments/1gnos5a/reuters_exclusive_us_ordered_tsmc_to_halt/,0.544,NEGATIVE,0.994
11/12/2024,Out of the “Big 7” any you’d recommend buying over others?,173,https://www.reddit.com/r/stocks/comments/1gpmrel/out_of_the_big_7_any_youd_recommend_buying_over/,0.503,POSITIVE,0.934
11/12/2024,Chipotle (CMG) vs NVIDIA (NVDA) growth for 2025,28,https://www.reddit.com/r/stocks/comments/1gptg02/chipotle_cmg_vs_nvidia_nvda_growth_for_2025/,0.571,POSITIVE,0.957
11/13/2024,SoundHound AI Stock Tumbles as Margins Drop,10,https://www.reddit.com/r/stocks/comments/1gqnswr/soundhound_ai_stock_tumbles_as_margins_drop/,0.607,NEGATIVE,0.998
11/13/2024,PG&E to deploy nuclear-specific AI at Diablo Canyon plant,6,https://www.reddit.com/r/stocks/comments/1gqokli/pge_to_deploy_nuclearspecific_ai_at_diablo_canyon/,0.544,POSITIVE,0.991
11/13/2024,"AMD to lay off 4% of workforce, or about 1,000 employees",148,https://www.reddit.com/r/stocks/comments/1gqonzv/amd_to_lay_off_4_of_workforce_or_about_1000/,0.564,NEGATIVE,0.999
11/15/2024,SOXX and Nvidia,40,https://www.reddit.com/r/stocks/comments/1grl78h/soxx_and_nvidia/,0.585,POSITIVE,0.812
11/15/2024,Naive question: Intel 18A--what could go wrong?,47,https://www.reddit.com/r/stocks/comments/1grrx4w/naive_question_intel_18awhat_could_go_wrong/,0.519,NEGATIVE,0.991
11/17/2024,"New Nvidia AI chips overheating in servers, the Information reports",139,https://www.reddit.com/r/stocks/comments/1gtlzww/new_nvidia_ai_chips_overheating_in_servers_the/,0.604,NEGATIVE,0.999
11/19/2024,Super Micro hires new auditor to maintain Nasdaq listing; shares pop 23%,93,https://www.reddit.com/r/stocks/comments/1gukbfk/super_micro_hires_new_auditor_to_maintain_nasdaq/,0.552,NEGATIVE,0.66
11/19/2024,"Palantir short thesis and an analysis of its current earnings power, multiples and enterprise value",45,https://www.reddit.com/r/stocks/comments/1gv6hj0/palantir_short_thesis_and_an_analysis_of_its/,0.544,POSITIVE,0.998
11/19/2024,"Qualcomm says it expects $4 billion in PC chip sales by 2029, as company gets traction beyond smartphones",27,https://www.reddit.com/r/stocks/comments/1gv9g66/qualcomm_says_it_expects_4_billion_in_pc_chip/,0.63,POSITIVE,0.993
11/20/2024,"Nvidia Earnings: Beat Across the Board, Strong Guidance",245,https://www.reddit.com/r/stocks/comments/1gvzyeh/nvidia_earnings_beat_across_the_board_strong/,0.59,POSITIVE,0.993
11/21/2024,Nvidia Options Action 11/21: Confusion,8,https://www.reddit.com/r/stocks/comments/1gwhx38/nvidia_options_action_1121_confusion/,0.545,NEGATIVE,1.0
11/22/2024,AMD: The $145 Recovery Rally is Coming Next Week,188,https://www.reddit.com/r/stocks/comments/1gxj8ob/amd_the_145_recovery_rally_is_coming_next_week/
11/26/2024,$Dell Earnings,41,https://www.reddit.com/r/stocks/comments/1h0q55v/dell_earnings/
12/04/2024,Is Nebius / Yandex a pump and dump or is it going to recover up to prewar prices?,8,https://www.reddit.com/r/stocks/comments/1h6ispk/is_nebius_yandex_a_pump_and_dump_or_is_it_going/,0.503,NEGATIVE,0.988
12/03/2024,I predict Apple will acquire Nissan in the next 18 months,38,https://www.reddit.com/r/stocks/comments/1h5wpqf/i_predict_apple_will_acquire_nissan_in_the_next/,0.554,NEGATIVE,0.94
12/02/2024,Does AVGO is rise count as a gift?,9,https://www.reddit.com/r/stocks/comments/1h4xhj3/does_avgo_is_rise_count_as_a_gift/,0.52,NEGATIVE,0.549
12/05/2024,TSMC in talks with Nvidia for AI chip production in Arizona,28,https://www.reddit.com/r/stocks/comments/1h75r9y/tsmc_in_talks_with_nvidia_for_ai_chip_production/,0.578,NEGATIVE,0.686
12/07/2024,Decades of Backtesting: Insights That Changed How I Invest,29,https://www.reddit.com/r/stocks/comments/1h8g3i5/decades_of_backtesting_insights_that_changed_how/,0.509,POSITIVE,0.994
06/14/2024,"These are the stocks on my watchlist (6/14)
 ",41,https://www.reddit.com/r/stocks/comments/1dfqojs/these_are_the_stocks_on_my_watchlist_614/,0.542,POSITIVE,0.989
12/08/2024,"If you had to start again today and could only choose five stocks to set you up for the rest of your life, what would they be?",343,https://www.reddit.com/r/stocks/comments/1h9oztr/if_you_had_to_start_again_today_and_could_only/,0.542,POSITIVE,0.63
12/09/2024,Nvidia slip as China opens investigates possible antimonopoly law violation,52,https://www.reddit.com/r/stocks/comments/1ha938m/nvidia_slip_as_china_opens_investigates_possible/,0.529,NEGATIVE,1.0
12/09/2024,Why I'm bullish on Intel (INTC),334,https://www.reddit.com/r/stocks/comments/1h9zs68/why_im_bullish_on_intel_intc/,0.638,NEGATIVE,0.999
12/12/2024,"Nvidia, Rigetti, Quantum Machines Deliver AI-Powered Quantum Computing",0,https://www.reddit.com/r/stocks/comments/1hcgxsj/nvidia_rigetti_quantum_machines_deliver_aipowered/,0.564,POSITIVE,1.0
12/11/2024,6 years investing but there are still open questions,33,https://www.reddit.com/r/stocks/comments/1hc4glu/6_years_investing_but_there_are_still_open/,0.532,POSITIVE,0.961
12/10/2024,I'm bullish on $GOOG,167,https://www.reddit.com/r/stocks/comments/1hb7n68/im_bullish_on_goog/,0.647,NEGATIVE,0.985
12/10/2024,Top 10 Non-US Stocks,47,https://www.reddit.com/r/stocks/comments/1hauqh3/top_10_nonus_stocks/,0.566,POSITIVE,0.999
12/12/2024,Missed NVIDIA Surge? Three AI potential stocks are waiting for your chance!,13,https://www.reddit.com/r/stocks/comments/1hcn6hq/missed_nvidia_surge_three_ai_potential_stocks_are/,0.572,NEGATIVE,1.0
12/12/2024,"Who is the best investment opportunity in AI, NVDA or PLTR?",113,https://www.reddit.com/r/stocks/comments/1hcms3b/who_is_the_best_investment_opportunity_in_ai_nvda/,0.578,POSITIVE,0.838
12/13/2024,Semiconductor Stocks Exposed To China With Tariffs Incoming,19,https://www.reddit.com/r/stocks/comments/1hdcpo2/semiconductor_stocks_exposed_to_china_with/,0.539,NEGATIVE,0.999
12/15/2024,Will a successful battlemage release help Intel?,39,https://www.reddit.com/r/stocks/comments/1hen8qm/will_a_successful_battlemage_release_help_intel/,0.548,NEGATIVE,0.762
12/16/2024,"Another reason to be bullish on AVGO? The second half of the arithmetic war opens, and the era of AI reasoning may be upon us",7,https://www.reddit.com/r/stocks/comments/1hfrujb/another_reason_to_be_bullish_on_avgo_the_second/,0.527,NEGATIVE,0.993
12/16/2024,Four Stages of Artificial Intelligence Development,47,https://www.reddit.com/r/stocks/comments/1hfm7xn/four_stages_of_artificial_intelligence_development/,0.546,POSITIVE,0.979
12/16/2024,Reasons to believe in MU,20,https://www.reddit.com/r/stocks/comments/1hfm0ck/reasons_to_believe_in_mu/,0.505,POSITIVE,0.994
12/16/2024,From GPU to ASIC: Broadcom to capture NVDA market share!,27,https://www.reddit.com/r/stocks/comments/1hfldj9/from_gpu_to_asic_broadcom_to_capture_nvda_market/,0.566,POSITIVE,0.999
