date,post headline,comments,link,PTR Sentiment,Flair Outlook,Flair Score
02/27/2024,Are stocks facing a decade of stagnation? (Analysis from The Economist),18,https://www.reddit.com/r/stocks/comments/1b1jw61/are_stocks_facing_a_decade_of_stagnation_analysis/,0.527,NEGATIVE,0.983
03/01/2024,"Once a Hot Stock-Market Trend Has a Name, Its Best Days Are Likely to be over",68,https://www.reddit.com/r/stocks/comments/1b3xvkb/once_a_hot_stockmarket_trend_has_a_name_its_best/,0.604,NEGATIVE,0.874
03/01/2024,Nvidia is worth more than Amazon and Google. Hunting down Apple next,703,https://www.reddit.com/r/stocks/comments/1b3yy0q/nvidia_is_worth_more_than_amazon_and_google/,0.559,POSITIVE,0.968
03/04/2024,Speculative Crap I'm Investing In So You Don't Have to,127,https://www.reddit.com/r/stocks/comments/1b6k1qh/speculative_crap_im_investing_in_so_you_dont_have/,0.616,NEGATIVE,0.954
03/05/2024,AI Madness and profitablity,78,https://www.reddit.com/r/stocks/comments/1b74mw7/ai_madness_and_profitablity/,0.588,NEGATIVE,0.945
03/05/2024,What’s the future of Apple?,121,https://www.reddit.com/r/stocks/comments/1b7d0v8/whats_the_future_of_apple/,0.523,NEGATIVE,0.842
03/05/2024,"Talk to me like I'm five - AI, and ebbs/flows in the stock market",43,https://www.reddit.com/r/stocks/comments/1b7fv6f/talk_to_me_like_im_five_ai_and_ebbsflows_in_the/,0.654,POSITIVE,0.999
03/07/2024,(3/7) Thursday's Pre-Market Stock Movers & News,0,https://www.reddit.com/r/stocks/comments/1b8uy0h/37_thursdays_premarket_stock_movers_news/,0.645,POSITIVE,0.663
03/08/2024,Thoughts on ARM/MU/TSM? Seem to be good buys at these prices now and recent news...,116,https://www.reddit.com/r/stocks/comments/1ba1ivh/thoughts_on_armmutsm_seem_to_be_good_buys_at/,0.525,POSITIVE,0.942
03/09/2024,Cannot buy ETFs in Europe/Netherlands,57,https://www.reddit.com/r/stocks/comments/1badtp9/cannot_buy_etfs_in_europenetherlands/,0.555,NEGATIVE,0.968
03/09/2024,Buy more or nah ?,40,https://www.reddit.com/r/stocks/comments/1baof8g/buy_more_or_nah/,0.6,POSITIVE,0.731
03/12/2024,(3/12) Tuesday's Stock Market News & Movers,7,https://www.reddit.com/r/stocks/comments/1bcwn0u/312_tuesdays_stock_market_news_movers/,0.662,POSITIVE,0.765
03/15/2024,GTC Conference presenters for AI stock ideas,5,https://www.reddit.com/r/stocks/comments/1bf57ti/gtc_conference_presenters_for_ai_stock_ideas/,0.615,POSITIVE,0.953
03/18/2024,Nvidia announces Blackwell AI chips that will launch later this year,255,https://www.reddit.com/r/stocks/comments/1bi129l/nvidia_announces_blackwell_ai_chips_that_will/,0.642,POSITIVE,0.98
03/18/2024,Nvidia and Johnson & Johnson to develop new AI applications for surgery,52,https://www.reddit.com/r/stocks/comments/1bi46lt/nvidia_and_johnson_johnson_to_develop_new_ai/,0.61,POSITIVE,0.994
03/19/2024,"Anyone have Astera Labs' IPO on their radar? If so, what are your thoughts?",20,https://www.reddit.com/r/stocks/comments/1bio50g/anyone_have_astera_labs_ipo_on_their_radar_if_so/,0.509,NEGATIVE,0.526
03/20/2024,"Intel awarded up to $8.5 billion in CHIPS Act grants, with billions more in loans available",92,https://www.reddit.com/r/stocks/comments/1bjd2an/intel_awarded_up_to_85_billion_in_chips_act/,0.544,NEGATIVE,0.911
03/20/2024,Shares of Micron pop 14% on earnings beat driven by AI boom,86,https://www.reddit.com/r/stocks/comments/1bjo9n3/shares_of_micron_pop_14_on_earnings_beat_driven/,0.574,NEGATIVE,0.876
03/21/2024,Amazon gets boost from 72% pop in AI company Astera Labs' IPO,13,https://www.reddit.com/r/stocks/comments/1bjwxo4/amazon_gets_boost_from_72_pop_in_ai_company/,0.616,POSITIVE,0.977
03/23/2024,"If you were to invest in the mag 7, how would you split the money?",376,https://www.reddit.com/r/stocks/comments/1blsq4o/if_you_were_to_invest_in_the_mag_7_how_would_you/,0.521,NEGATIVE,1.0
03/24/2024,How hard is it for big tech or anyone to compete with Nvidia in the next ten years?,301,https://www.reddit.com/r/stocks/comments/1bmqbrn/how_hard_is_it_for_big_tech_or_anyone_to_compete/,0.56,NEGATIVE,0.963
03/25/2024,I'm paper trading to learn. Why is this bigger call paying more?,46,https://www.reddit.com/r/stocks/comments/1bnjw8g/im_paper_trading_to_learn_why_is_this_bigger_call/,0.581,NEGATIVE,0.949
03/26/2024,What Virtual Reality & Augmented Reality stocks to hold for 20 years?,26,https://www.reddit.com/r/stocks/comments/1boaebv/what_virtual_reality_augmented_reality_stocks_to/,0.532,NEGATIVE,0.604
03/27/2024,"Amazon spends $2.75B on AI startup Anthropic, its largest venture investment",46,https://www.reddit.com/r/stocks/comments/1bp6rv9/amazon_spends_275b_on_ai_startup_anthropic_its/,0.556,NEGATIVE,0.995
03/30/2024,Amazon's $150 Billion Data Center Bet: Preparing for AI Boom and Market Domination,205,https://www.reddit.com/r/stocks/comments/1brp6gc/amazons_150_billion_data_center_bet_preparing_for/,0.574,NEGATIVE,0.864
04/03/2024,Nvidia says it expects no impact to chip supply from Taiwan earthquake,37,https://www.reddit.com/r/stocks/comments/1bv6kpn/nvidia_says_it_expects_no_impact_to_chip_supply/,0.576,NEGATIVE,0.999
04/04/2024,Dell’s stock is at a new high — and it has beaten Apple’s over a five-year span,66,https://www.reddit.com/r/stocks/comments/1bva23v/dells_stock_is_at_a_new_high_and_it_has_beaten/,0.668,POSITIVE,0.995
04/08/2024,What is TSM's bear case?,176,https://www.reddit.com/r/stocks/comments/1byv2m4/what_is_tsms_bear_case/,0.498,NEGATIVE,0.979
04/08/2024,Snowflake (SNOW) ls worth buying on declines,163,https://www.reddit.com/r/stocks/comments/1bz4fyh/snowflake_snow_ls_worth_buying_on_declines/,0.513,NEGATIVE,0.922
04/08/2024,Marvell #MRVL needs to come down a bit to be a bargain,2,https://www.reddit.com/r/stocks/comments/1bz4jjf/marvell_mrvl_needs_to_come_down_a_bit_to_be_a/,0.504,POSITIVE,0.999
04/09/2024,Intel unveils latest AI chip as Nvidia competition heats up,123,https://www.reddit.com/r/stocks/comments/1bzvurm/intel_unveils_latest_ai_chip_as_nvidia/,0.581,POSITIVE,0.998
04/14/2024,First company to hit $10T valuation?,459,https://www.reddit.com/r/stocks/comments/1c448od/first_company_to_hit_10t_valuation/,0.662,NEGATIVE,0.636
04/15/2024,Why is Intel lagging for so long? Where did they go wrong,364,https://www.reddit.com/r/stocks/comments/1c4c199/why_is_intel_lagging_for_so_long_where_did_they/,0.543,NEGATIVE,0.998
04/18/2024,TSMC beats first-quarter revenue and profit expectations on strong AI chip demand,47,https://www.reddit.com/r/stocks/comments/1c70ktj/tsmc_beats_firstquarter_revenue_and_profit/,0.595,POSITIVE,0.99
04/19/2024,Nvidia’s stock plunge leads Magnificent Seven to record weekly market-cap loss,253,https://www.reddit.com/r/stocks/comments/1c86tnn/nvidias_stock_plunge_leads_magnificent_seven_to/,0.57,NEGATIVE,1.0
04/22/2024,New York Stock Exchange tests views on round-the-clock trading,89,https://www.reddit.com/r/stocks/comments/1cabi7o/new_york_stock_exchange_tests_views_on/,0.597,POSITIVE,0.516
04/24/2024,INTC vs TSLA - Trying to understand market sentiment.,101,https://www.reddit.com/r/stocks/comments/1cc3dtf/intc_vs_tsla_trying_to_understand_market_sentiment/,0.542,NEGATIVE,0.818
04/30/2024,"Samsung Electronics' operating profit jumps 933% in first quarter, beats expectations",18,https://www.reddit.com/r/stocks/comments/1cgiui4/samsung_electronics_operating_profit_jumps_933_in/,0.561,NEGATIVE,0.541
03/23/2024,Which of these blue chips is most undervalued?,209,https://www.reddit.com/r/stocks/comments/1blw42f/which_of_these_blue_chips_is_most_undervalued/,0.505,NEGATIVE,0.889
04/30/2024,Why is INTC (Intel) so down? Did I miss some news?,149,https://www.reddit.com/r/stocks/comments/1cgpahp/why_is_intc_intel_so_down_did_i_miss_some_news/,0.546,NEGATIVE,0.995
04/30/2024,Big Tech (Google and Meta) begins to give out dividend,39,https://www.reddit.com/r/stocks/comments/1cgy1w4/big_tech_google_and_meta_begins_to_give_out/,0.526,NEGATIVE,1.0
05/02/2024,Ozempic Maker Novo Nordisk Beats Profit Forecasts Amid Weight Loss Drug Frenzy,41,https://www.reddit.com/r/stocks/comments/1cicig2/ozempic_maker_novo_nordisk_beats_profit_forecasts/,0.527,POSITIVE,0.908
05/10/2024,TSMC’s April Sales Jump 60% on Sustained Demand for AI Chips,12,https://www.reddit.com/r/stocks/comments/1cou0re/tsmcs_april_sales_jump_60_on_sustained_demand_for/,0.611,POSITIVE,0.993
05/15/2024,Dell surges 9% on optimism it has secured big AI server orders,10,https://www.reddit.com/r/stocks/comments/1cst8qv/dell_surges_9_on_optimism_it_has_secured_big_ai/,0.562,POSITIVE,0.971
05/22/2024,NVDA earnings,419,https://www.reddit.com/r/stocks/comments/1cyabrc/nvda_earnings/,0.613,POSITIVE,0.921
05/23/2024,These are the stocks on my watchlist (5/23),7,https://www.reddit.com/r/stocks/comments/1cyu5el/these_are_the_stocks_on_my_watchlist_523/,0.562,POSITIVE,0.979
05/23/2024,Nvidia CEO Jensen Huang: “Tesla is far ahead in self-driving cars”,197,https://www.reddit.com/r/stocks/comments/1cz17nk/nvidia_ceo_jensen_huang_tesla_is_far_ahead_in/,0.536,POSITIVE,0.982
05/25/2024,Is it a good idea to invest in tech companies before the computex event?,40,https://www.reddit.com/r/stocks/comments/1d0mfxs/is_it_a_good_idea_to_invest_in_tech_companies/,0.55,NEGATIVE,0.999
05/25/2024,Question about selling a naked call contract,118,https://www.reddit.com/r/stocks/comments/1d0o5bi/question_about_selling_a_naked_call_contract/,0.554,NEGATIVE,0.996
05/26/2024,"Realistically, how high can NVDA actually go at this point?",521,https://www.reddit.com/r/stocks/comments/1d181jb/realistically_how_high_can_nvda_actually_go_at/,0.513,NEGATIVE,0.998
05/28/2024,Nvidia Expansion Plays - Intel Acquisition?,81,https://www.reddit.com/r/stocks/comments/1d2otdc/nvidia_expansion_plays_intel_acquisition/,0.592,NEGATIVE,0.992
05/29/2024,is Nvidia stock a Bubble,144,https://www.reddit.com/r/stocks/comments/1d35qpe/is_nvidia_stock_a_bubble/,0.695,NEGATIVE,0.994
05/30/2024,NVIDIA split- buy before or after June 7th?,44,https://www.reddit.com/r/stocks/comments/1d473om/nvidia_split_buy_before_or_after_june_7th/,0.583,NEGATIVE,0.999
05/30/2024,Reuters - Big Tech develops AI networking standard but without chip leader Nvidia,41,https://www.reddit.com/r/stocks/comments/1d47hte/reuters_big_tech_develops_ai_networking_standard/,0.565,NEGATIVE,0.791
06/02/2024,Nvidia announces new AI chips as market competition heats up,71,https://www.reddit.com/r/stocks/comments/1d6ou8s/nvidia_announces_new_ai_chips_as_market/,0.64,POSITIVE,0.972
06/03/2024,"Reuters - ""AMD launches new AI chips to take on leader Nvidia"".",55,https://www.reddit.com/r/stocks/comments/1d6wk01/reuters_amd_launches_new_ai_chips_to_take_on/,0.652,POSITIVE,0.843
06/03/2024,After 4 years of investing into single stocks: it’s not about financial education but all about psychology and luck,234,https://www.reddit.com/r/stocks/comments/1d72mwg/after_4_years_of_investing_into_single_stocks_its/,0.539,NEGATIVE,0.578
06/04/2024,"Microsoft confirms mixed reality layoffs, will keep selling HoloLens 2",21,https://www.reddit.com/r/stocks/comments/1d7pxgm/microsoft_confirms_mixed_reality_layoffs_will/,0.508,NEGATIVE,0.999
06/04/2024,Elon Musk ordered Nvidia to ship AI chips reserved for Tesla to X and xAI,220,https://www.reddit.com/r/stocks/comments/1d7wmef/elon_musk_ordered_nvidia_to_ship_ai_chips/,0.544,NEGATIVE,0.987
06/05/2024,Nvidia briefly passes $3 trillion market cap on back of AI boom,344,https://www.reddit.com/r/stocks/comments/1d8y4gs/nvidia_briefly_passes_3_trillion_market_cap_on/,0.582,NEGATIVE,0.996
06/06/2024,"Feds set stage for antitrust probes of Nvidia, Microsoft and OpenAI",29,https://www.reddit.com/r/stocks/comments/1d9bj95/feds_set_stage_for_antitrust_probes_of_nvidia/,0.533,POSITIVE,0.936
06/06/2024,These are the stocks on my watchlist (6/6) (for real this time),20,https://www.reddit.com/r/stocks/comments/1d9hx3f/these_are_the_stocks_on_my_watchlist_66_for_real/,0.562,POSITIVE,0.975
06/06/2024,TSMC ponders boosting AI chip production prices for Nvidia: Morgan Stanley,17,https://www.reddit.com/r/stocks/comments/1d9oox0/tsmc_ponders_boosting_ai_chip_production_prices/,0.552,NEGATIVE,0.719
06/06/2024,"Rivian redesigns all-electric R1 pickup and SUV, adds Nvidia chips",48,https://www.reddit.com/r/stocks/comments/1d9q1p0/rivian_redesigns_allelectric_r1_pickup_and_suv/,0.522,POSITIVE,0.94
06/07/2024,"KKR, CrowdStrike and GoDaddy to Join S&P 500 as Index Rebalances",58,https://www.reddit.com/r/stocks/comments/1daojos/kkr_crowdstrike_and_godaddy_to_join_sp_500_as/,0.506,NEGATIVE,0.976
06/09/2024,Bear Case: Why I believe Alphabet will do everything right and still lose,245,https://www.reddit.com/r/stocks/comments/1dbvyv3/bear_case_why_i_believe_alphabet_will_do/,0.505,NEGATIVE,0.992
06/10/2024,Should Musk at least give guarantees he won't let xAI compete with Tesla?,194,https://www.reddit.com/r/stocks/comments/1dco961/should_musk_at_least_give_guarantees_he_wont_let/,0.522,NEGATIVE,0.995
06/10/2024,(Up to) 5 stocks to hold for 20 years,146,https://www.reddit.com/r/stocks/comments/1dctee8/up_to_5_stocks_to_hold_for_20_years/,0.57,POSITIVE,1.0
06/11/2024,Sudden trade republic win of 600% in the night time,1,https://www.reddit.com/r/stocks/comments/1dd2nin/sudden_trade_republic_win_of_600_in_the_night_time/,0.529,POSITIVE,0.999
06/11/2024,Who’s buying Arm holding now?,84,https://www.reddit.com/r/stocks/comments/1ddheb2/whos_buying_arm_holding_now/,0.515,POSITIVE,0.988
06/12/2024,Apple’s Stock Price Reaches All-Time High After WWDC Announcements,117,https://www.reddit.com/r/stocks/comments/1dduk1t/apples_stock_price_reaches_alltime_high_after/,0.579,NEGATIVE,0.947
06/13/2024,NVidia (NVDA) is an Active Venture Capitalist,19,https://www.reddit.com/r/stocks/comments/1deotok/nvidia_nvda_is_an_active_venture_capitalist/,0.541,POSITIVE,0.724
06/14/2024,Musk says robots could make Tesla $25 trillion company — more than half value of S&P 500,455,https://www.reddit.com/r/stocks/comments/1dfg8h3/musk_says_robots_could_make_tesla_25_trillion/,0.58,NEGATIVE,0.995
06/14/2024,Are NVIDIA employees likely to be millionaires now if they joined five or more years ago?,349,https://www.reddit.com/r/stocks/comments/1dfkwor/are_nvidia_employees_likely_to_be_millionaires/,0.53,NEGATIVE,0.561
06/14/2024,I think it's indeed impossible to beat the index,29,https://www.reddit.com/r/stocks/comments/1dfqm1n/i_think_its_indeed_impossible_to_beat_the_index/,0.513,POSITIVE,0.999
06/14/2024,These are the stocks on my watchlist (6/14)  ,41,https://www.reddit.com/r/stocks/comments/1dfqojs/these_are_the_stocks_on_my_watchlist_614/,0.562,POSITIVE,0.989
06/15/2024,Is nasdaq useless?,28,https://www.reddit.com/r/stocks/comments/1dg9u6y/is_nasdaq_useless/,0.518,NEGATIVE,1.0
06/16/2024,With the increasing power demand due to AI datacenters which stocks are most likely to capture this Nuclear energy demands?,59,https://www.reddit.com/r/stocks/comments/1dh1c2v/with_the_increasing_power_demand_due_to_ai/,0.539,NEGATIVE,0.938
06/17/2024,"Nvidia to get 20% weighting and billions in investor demand, while Apple demoted in major tech fund",136,https://www.reddit.com/r/stocks/comments/1di3gla/nvidia_to_get_20_weighting_and_billions_in/,0.538,NEGATIVE,0.999
06/17/2024,"Apple shares hit another new high as the ""Three Kings Race"" ""Who will achieve the final victory?",26,https://www.reddit.com/r/stocks/comments/1di4m80/apple_shares_hit_another_new_high_as_the_three/,0.549,NEGATIVE,0.681
06/17/2024,Intel discussion,67,https://www.reddit.com/r/stocks/comments/1dibf3k/intel_discussion/,0.555,NEGATIVE,0.526
06/18/2024,Nvidia passes Microsoft in market cap to become most valuable public company,512,https://www.reddit.com/r/stocks/comments/1divtu5/nvidia_passes_microsoft_in_market_cap_to_become/,0.638,POSITIVE,0.939
06/19/2024,Looking for advice on long term stocks,66,https://www.reddit.com/r/stocks/comments/1dj5qky/looking_for_advice_on_long_term_stocks/,0.571,NEGATIVE,0.895
06/19/2024,Most stocks hyped as winners from AI boom have fallen this year,111,https://www.reddit.com/r/stocks/comments/1djh7bs/most_stocks_hyped_as_winners_from_ai_boom_have/,0.649,NEGATIVE,1.0
06/19/2024,FSELX - Can’t decide when/if to sell/buy Nvidia? Let someone else decide for you,29,https://www.reddit.com/r/stocks/comments/1djjvcg/fselx_cant_decide_whenif_to_sellbuy_nvidia_let/,0.54,NEGATIVE,1.0
06/19/2024,NVIDIA Will Crash,264,https://www.reddit.com/r/stocks/comments/1djm92c/nvidia_will_crash/,0.585,NEGATIVE,1.0
06/20/2024,Dell and Partners Join Forces to Build AI Factory for Elon Musk's xAI,12,https://www.reddit.com/r/stocks/comments/1dk68we/dell_and_partners_join_forces_to_build_ai_factory/,0.532,POSITIVE,0.998
06/20/2024,Taking profits from individual stocks and moving to index funds,39,https://www.reddit.com/r/stocks/comments/1dk6kfv/taking_profits_from_individual_stocks_and_moving/,0.52,NEGATIVE,0.999
06/20/2024,Thoughts on Intel as long-term?,299,https://www.reddit.com/r/stocks/comments/1dkb5n3/thoughts_on_intel_as_longterm/,0.585,NEGATIVE,0.954
06/20/2024,Best long term stocks to invest in?,364,https://www.reddit.com/r/stocks/comments/1dkcx7k/best_long_term_stocks_to_invest_in/,0.597,POSITIVE,1.0
06/20/2024,"Musk Just Spilled Extra Details About the xAI Supercomputer. Super Micro, These Stocks Are Jumping. Thoughts?",9,https://www.reddit.com/r/stocks/comments/1dkddvz/musk_just_spilled_extra_details_about_the_xai/,0.52,NEGATIVE,0.997
06/21/2024,Why is there no sober analysis on NVIDIA and AI?,227,https://www.reddit.com/r/stocks/comments/1dkxm1k/why_is_there_no_sober_analysis_on_nvidia_and_ai/,0.62,NEGATIVE,0.97
06/21/2024,Nvda is a meme stock at this point,206,https://www.reddit.com/r/stocks/comments/1dl7kj1/nvda_is_a_meme_stock_at_this_point/,0.606,NEGATIVE,0.994
06/24/2024,"Nvidia slides for third straight session, loses $500B in market cap",336,https://www.reddit.com/r/stocks/comments/1dnqu9z/nvidia_slides_for_third_straight_session_loses/,0.548,NEGATIVE,1.0
06/26/2024,Amazon Hits $2 Trillion Valuation For First Time Ever,137,https://www.reddit.com/r/stocks/comments/1dp40ak/amazon_hits_2_trillion_valuation_for_first_time/,0.529,POSITIVE,0.989
06/27/2024,Dividend Growth Portfolio help,12,https://www.reddit.com/r/stocks/comments/1dpln4t/dividend_growth_portfolio_help/,0.58,POSITIVE,0.988
06/28/2024,"Hedge Funds Sell Tech Stocks ‘Aggressively,’ Goldman Says",92,https://www.reddit.com/r/stocks/comments/1dqagoq/hedge_funds_sell_tech_stocks_aggressively_goldman/,0.54,NEGATIVE,0.908
06/30/2024,Thoughts on Nintendo (NTDOY),120,https://www.reddit.com/r/stocks/comments/1ds5nyj/thoughts_on_nintendo_ntdoy/,0.507,POSITIVE,0.985
07/03/2024,Long term NVIDIA call option,128,https://www.reddit.com/r/stocks/comments/1du7ykf/long_term_nvidia_call_option/,0.585,POSITIVE,0.981
07/03/2024,What companies are currently undervalued?,854,https://www.reddit.com/r/stocks/comments/1duiq8v/what_companies_are_currently_undervalued/,0.548,NEGATIVE,0.978
07/04/2024,SoftBank stock hits its first record high in 24 years — Arm and AI helped it get there,7,https://www.reddit.com/r/stocks/comments/1dv8hml/softbank_stock_hits_its_first_record_high_in_24/,0.592,POSITIVE,0.989
07/05/2024,Broadcom - A stellar company with a terrific track record and strong presence in AI.,7,https://www.reddit.com/r/stocks/comments/1dw2am6/broadcom_a_stellar_company_with_a_terrific_track/,0.641,POSITIVE,0.998
07/06/2024,Time to get out of Nvidia?,84,https://www.reddit.com/r/stocks/comments/1dwrioj/time_to_get_out_of_nvidia/,0.593,NEGATIVE,0.985
07/08/2024,How to surpass the fear of selling?,25,https://www.reddit.com/r/stocks/comments/1dye0im/how_to_surpass_the_fear_of_selling/,0.51,NEGATIVE,0.966
07/08/2024,"Ben Thompson (Stratechery) commentary on recent EU big tech actions (Apple, Meta, NVIDIA)",6,https://www.reddit.com/r/stocks/comments/1dygrfh/ben_thompson_stratechery_commentary_on_recent_eu/,0.533,POSITIVE,0.936
07/08/2024,Future AI Growth Stock Ideas?,120,https://www.reddit.com/r/stocks/comments/1dykaip/future_ai_growth_stock_ideas/,0.687,NEGATIVE,0.761
07/09/2024,Am I crazy for having 57% of my portfolio in NVIDIA?,734,https://www.reddit.com/r/stocks/comments/1dzh3zx/am_i_crazy_for_having_57_of_my_portfolio_in_nvidia/,0.573,NEGATIVE,0.539
07/10/2024,CPI and PPI risk,11,https://www.reddit.com/r/stocks/comments/1e096h6/cpi_and_ppi_risk/,0.502,NEGATIVE,0.992
07/11/2024,Can someone explain to me Nancy Pelosi's AVGO position?,11,https://www.reddit.com/r/stocks/comments/1e0o4p6/can_someone_explain_to_me_nancy_pelosis_avgo/,0.514,POSITIVE,0.81
07/11/2024,Seeking advice when individual stock in portfolio booms,20,https://www.reddit.com/r/stocks/comments/1e0r46c/seeking_advice_when_individual_stock_in_portfolio/,0.581,POSITIVE,0.85
07/11/2024,"The 8 ""secrets"" of when to sell stocks. Do you have any other ideas?",20,https://www.reddit.com/r/stocks/comments/1e0ra38/the_8_secrets_of_when_to_sell_stocks_do_you_have/,0.539,POSITIVE,0.559
07/12/2024,Quantum Computing Stocks for long position?,113,https://www.reddit.com/r/stocks/comments/1e1k59w/quantum_computing_stocks_for_long_position/,0.567,NEGATIVE,0.996
07/12/2024,New to options,28,https://www.reddit.com/r/stocks/comments/1e1t38o/new_to_options/,0.705,POSITIVE,0.983
07/12/2024,The case for Intel from a former bear,149,https://www.reddit.com/r/stocks/comments/1e1w8a8/the_case_for_intel_from_a_former_bear/,0.523,NEGATIVE,0.934
07/13/2024,Are historical prices accurate after stock splits?,6,https://www.reddit.com/r/stocks/comments/1e2n23g/are_historical_prices_accurate_after_stock_splits/,0.579,NEGATIVE,0.848
07/18/2024,Highest drop in global chip stocks since the 2020 pandemic,85,https://www.reddit.com/r/stocks/comments/1e60w6m/highest_drop_in_global_chip_stocks_since_the_2020/,0.543,NEGATIVE,0.992
07/18/2024,TSMC second-quarter profit beats expectations as AI chip boom continues,65,https://www.reddit.com/r/stocks/comments/1e68obp/tsmc_secondquarter_profit_beats_expectations_as/,0.582,POSITIVE,0.859
07/18/2024,AMD the buy of the week?,245,https://www.reddit.com/r/stocks/comments/1e6ebif/amd_the_buy_of_the_week/,0.773,NEGATIVE,0.744
07/19/2024,"Trying to recoup my $75k losses has made me emotional, so I am sincerely asking for your help moving forward.",73,https://www.reddit.com/r/stocks/comments/1e6y2c6/trying_to_recoup_my_75k_losses_has_made_me/,0.506,POSITIVE,0.882
07/19/2024,What are (in your opinion) the best buying opportunities arising from this dip?,405,https://www.reddit.com/r/stocks/comments/1e7bk6j/what_are_in_your_opinion_the_best_buying/,0.522,NEGATIVE,0.95
07/22/2024,"Nvidia preparing version of new flagship AI chip for Chinese market, Reuters reports",39,https://www.reddit.com/r/stocks/comments/1e9eymb/nvidia_preparing_version_of_new_flagship_ai_chip/,0.604,NEGATIVE,0.745
07/25/2024,How innovative is Big Tech?,98,https://www.reddit.com/r/stocks/comments/1ebx88s/how_innovative_is_big_tech/,0.555,POSITIVE,0.895
07/26/2024,Tech stocks fall in US and Asia as AI shares decline,4,https://www.reddit.com/r/stocks/comments/1ecf6re/tech_stocks_fall_in_us_and_asia_as_ai_shares/,0.568,NEGATIVE,0.999
07/26/2024,"Short seller Andrew Left of Citron charged with fraud by prosecutors, SEC",116,https://www.reddit.com/r/stocks/comments/1ecqkzv/short_seller_andrew_left_of_citron_charged_with/,0.493,NEGATIVE,0.978
07/27/2024,Why are people so confident about upcoming NVDA August earnings?,354,https://www.reddit.com/r/stocks/comments/1edi0xz/why_are_people_so_confident_about_upcoming_nvda/,0.538,NEGATIVE,0.624
07/28/2024,What are your investment criteria for buying individual stocks?,110,https://www.reddit.com/r/stocks/comments/1ee1uqa/what_are_your_investment_criteria_for_buying/,0.546,NEGATIVE,0.908
07/28/2024,NVIDIA earnings potential,112,https://www.reddit.com/r/stocks/comments/1eed7ke/nvidia_earnings_potential/,0.638,POSITIVE,0.997
07/30/2024,"Apple says it uses no Nvidia GPUs to train its AI models, instead using Google's TPUs",178,https://www.reddit.com/r/stocks/comments/1efqut7/apple_says_it_uses_no_nvidia_gpus_to_train_its_ai/,0.552,NEGATIVE,1.0
07/30/2024,"Semiconductor, AI, and AI-adjacent companies have been getting pummeled the last few weeks. Are you buying, selling, or just waiting?",228,https://www.reddit.com/r/stocks/comments/1efv2qt/semiconductor_ai_and_aiadjacent_companies_have/,0.572,NEGATIVE,1.0
07/30/2024,AMD Delivers Upbeat Sales Forecast as It Shifts Into AI Chips,43,https://www.reddit.com/r/stocks/comments/1eg3rmw/amd_delivers_upbeat_sales_forecast_as_it_shifts/,0.663,NEGATIVE,0.588
07/30/2024,"Bloomberg: Intel to Cut Thousands of Jobs to Reduce Costs, Fund Rebound",146,https://www.reddit.com/r/stocks/comments/1eg872p/bloomberg_intel_to_cut_thousands_of_jobs_to/,0.498,NEGATIVE,0.973
07/31/2024,"Nasdaq, S&P 500 post best day since Feb after Powell signals possible rate cut in Sept",70,https://www.reddit.com/r/stocks/comments/1eh18cy/nasdaq_sp_500_post_best_day_since_feb_after/,0.515,NEGATIVE,0.885
08/01/2024,CNBC: Meta’s advertising growth is proof that hefty AI spending is already paying off,100,https://www.reddit.com/r/stocks/comments/1eh89pb/cnbc_metas_advertising_growth_is_proof_that_hefty/,0.55,NEGATIVE,0.755
08/02/2024,"US launches antitrust probe into Nvidia over sales practices, The Information reports",78,https://www.reddit.com/r/stocks/comments/1eiakkr/us_launches_antitrust_probe_into_nvidia_over/,0.584,NEGATIVE,0.993
08/02/2024,"Intel heads for worst day on Wall Street in 50 years, falls to lowest in over a decade",106,https://www.reddit.com/r/stocks/comments/1eifwxf/intel_heads_for_worst_day_on_wall_street_in_50/,0.527,NEGATIVE,1.0
08/02/2024,Nvidia antitrust probe: Which competitors to buy?,62,https://www.reddit.com/r/stocks/comments/1eigllg/nvidia_antitrust_probe_which_competitors_to_buy/,0.579,NEGATIVE,0.995
08/02/2024,You guys need to realize something about Intel...,69,https://www.reddit.com/r/stocks/comments/1einp3l/you_guys_need_to_realize_something_about_intel/,0.518,NEGATIVE,0.766
