date,post headline,comments,link,PTR Sentiment,Flair Outlook,Flair Score
10/14/2024,IonQ will experience a massive rally and has multiple catalysts on the horizon.,167,https://www.reddit.com/r/wallstreetbets/comments/1g3rx6h/ionq_will_experience_a_massive_rally_and_has/,0.509,POSITIVE,0.997
10/15/2024,US Weighs Capping Exports of AI Chips From Nvidia and AMD to Some Countries,20,https://www.reddit.com/r/wallstreetbets/comments/1g3vs2n/us_weighs_capping_exports_of_ai_chips_from_nvidia/,0.619,NEGATIVE,0.993
10/15/2024,There’s a lesson in here somewhere,13,https://www.reddit.com/r/wallstreetbets/comments/1g49ewu/theres_a_lesson_in_here_somewhere/,0.498,NEGATIVE,0.573
10/15/2024,"ASML released ER early, coupled with the NVIDIA news, OUCH. Overreaction or justifiable sell off?",288,https://www.reddit.com/r/wallstreetbets/comments/1g49v03/asml_released_er_early_coupled_with_the_nvidia/,0.529,NEGATIVE,0.998
10/15/2024,NVDA Puts +100k 🥳,245,https://www.reddit.com/r/wallstreetbets/comments/1g4abaq/nvda_puts_100k/,0.499,POSITIVE,0.977
10/15/2024,Nvidia is doing damage control for investors before Taiwan has issues.,5,https://www.reddit.com/r/wallstreetbets/comments/1g4dtvd/nvidia_is_doing_damage_control_for_investors/,0.537,NEGATIVE,0.968
10/15/2024,Bloomberg Again Reports on Semiconductors With Flimsy Information on Secret Government Contacts,12,https://www.reddit.com/r/wallstreetbets/comments/1g4ff6b/bloomberg_again_reports_on_semiconductors_with/,0.501,NEGATIVE,1.0
10/15/2024,Can NVIDIA rebound or am I cooked?,239,https://www.reddit.com/r/wallstreetbets/comments/1g4gg9t/can_nvidia_rebound_or_am_i_cooked/,0.558,NEGATIVE,0.998
10/16/2024,"Nvidia is worth 11.7% of the US GDP now. At the peak of the DotCom bubble, Cisco was worth 5.5% of the US GDP.",1.5K,https://www.reddit.com/r/wallstreetbets/comments/1g57kry/nvidia_is_worth_117_of_the_us_gdp_now_at_the_peak/,0.545,POSITIVE,0.902
10/17/2024,"ASML Is A Screaming Buy - The Information Reports on Nvidia and TSMC Having ""Tension"" But The Answer is More Equipment",14,https://www.reddit.com/r/wallstreetbets/comments/1g5fnak/asml_is_a_screaming_buy_the_information_reports/,0.552,NEGATIVE,1.0
10/17/2024,Current top stock gainers include TSMC NVIDIA Blackstone Elevance Health and more！,1,https://www.reddit.com/r/wallstreetbets/comments/1g5vif5/current_top_stock_gainers_include_tsmc_nvidia/,0.568,POSITIVE,0.998
10/18/2024,"Since people were comparing Market Cap to GDP, here are the fundamentals for Nvidia (now) vs Cisco at the top of the dot-com bubble.",55,https://www.reddit.com/r/wallstreetbets/comments/1g6fawh/since_people_were_comparing_market_cap_to_gdp/,0.54,POSITIVE,0.895
10/18/2024,Selling the Shovels for AI – What Are More Stocks Like Nvidia?,51,https://www.reddit.com/r/wallstreetbets/comments/1g6o8og/selling_the_shovels_for_ai_what_are_more_stocks/,0.595,NEGATIVE,0.991
10/19/2024,Silver Breaks $33! 🚀 Next Stop: $50? Inflation + Demand = Massive Run 🔥,44,https://www.reddit.com/r/wallstreetbets/comments/1g6xtr4/silver_breaks_33_next_stop_50_inflation_demand/,0.521,NEGATIVE,1.0
10/19/2024,Post your lowest $NVDA per share price!,15,https://www.reddit.com/r/wallstreetbets/comments/1g7d2xs/post_your_lowest_nvda_per_share_price/,0.567,NEGATIVE,0.981
10/21/2024,I wait all year for this opportunity - now I'm going to share it with you.,332,https://www.reddit.com/r/wallstreetbets/comments/1g8gajx/i_wait_all_year_for_this_opportunity_now_im_going/,0.717,POSITIVE,0.993
10/21/2024,"Nvidia can hit $5 trillion valuation with ‘generational’ AI opportunity, BofA says",127,https://www.reddit.com/r/wallstreetbets/comments/1g8j5dp/nvidia_can_hit_5_trillion_valuation_with/,0.564,POSITIVE,0.832
10/21/2024,Is Cisco the Modern Day Cisco?,56,https://www.reddit.com/r/wallstreetbets/comments/1g8rhoh/is_cisco_the_modern_day_cisco/,0.514,POSITIVE,0.904
10/22/2024,Nvidia earnings date is now official - November 20,32,https://www.reddit.com/r/wallstreetbets/comments/1g984oo/nvidia_earnings_date_is_now_official_november_20/,0.589,POSITIVE,0.957
10/22/2024,Nvidia to ship 150K-200K Blackwell GB200 AI servers in Q4 2024 & 500K-550K servers in Q1 2025,79,https://www.reddit.com/r/wallstreetbets/comments/1g98moo/nvidia_to_ship_150k200k_blackwell_gb200_ai/,0.533,POSITIVE,0.747
10/22/2024,Nvidia I trust you enough,31,https://www.reddit.com/r/wallstreetbets/comments/1g9ikmj/nvidia_i_trust_you_enough/,0.563,POSITIVE,0.99
10/22/2024,Deep Fried Value - Ultimate Grilled Value DIN,10,https://www.reddit.com/r/wallstreetbets/comments/1g9qz2n/deep_fried_value_ultimate_grilled_value_din/,0.524,POSITIVE,1.0
10/24/2024,Nvidia supplier SK Hynix posts record quarterly profit as AI boom drives demand,4,https://www.reddit.com/r/wallstreetbets/comments/1gauouf/nvidia_supplier_sk_hynix_posts_record_quarterly/,0.569,NEGATIVE,0.861
10/24/2024,What do I do now??? +1700%,49,https://www.reddit.com/r/wallstreetbets/comments/1gb60e2/what_do_i_do_now_1700/,0.5,POSITIVE,0.995
10/25/2024,Nvidia Nudges Record Highs Ahead of Big Tech Earnings,11,https://www.reddit.com/r/wallstreetbets/comments/1gbpdfz/nvidia_nudges_record_highs_ahead_of_big_tech/,0.581,POSITIVE,0.998
10/25/2024,NVIDIA Position with Inverse ETFs,16,https://www.reddit.com/r/wallstreetbets/comments/1gbunt4/nvidia_position_with_inverse_etfs/,0.566,POSITIVE,0.609
10/25/2024,Nvidia Overtakes Apple as World's Most Valuable Company,92,https://www.reddit.com/r/wallstreetbets/comments/1gby15d/nvidia_overtakes_apple_as_worlds_most_valuable/,0.675,NEGATIVE,0.519
10/25/2024,I pulled out all of my stock at 130 before buying these bad boys,12,https://www.reddit.com/r/wallstreetbets/comments/1gbz7h3/i_pulled_out_all_of_my_stock_at_130_before_buying/,0.583,NEGATIVE,0.971
10/25/2024,"Michael, We’re Bigger than US Steel",16,https://www.reddit.com/r/wallstreetbets/comments/1gbzagq/michael_were_bigger_than_us_steel/,0.536,POSITIVE,0.992
10/25/2024,"If you invested $10,000 in Apple, Nvidia, or these 8 other stocks in 1999, you'd have over $1 million now",22,https://www.reddit.com/r/wallstreetbets/comments/1gc279k/if_you_invested_10000_in_apple_nvidia_or_these_8/,0.638,NEGATIVE,0.988
10/25/2024,"NVIDIA Blackwell Ultra AI GPUs To Be Called B300, Feature 12-Hi HBM3E & TSMC CoWoS-L Tech",35,https://www.reddit.com/r/wallstreetbets/comments/1gc2aqm/nvidia_blackwell_ultra_ai_gpus_to_be_called_b300/,0.539,POSITIVE,0.812
10/25/2024,Otellini would have made grandma so proud,6,https://www.reddit.com/r/wallstreetbets/comments/1gc35mh/otellini_would_have_made_grandma_so_proud/,0.515,POSITIVE,0.991
10/25/2024,Guess we’ll see wtf happens.,16,https://www.reddit.com/r/wallstreetbets/comments/1gc3obv/guess_well_see_wtf_happens/,0.502,POSITIVE,0.633
10/25/2024,It ain’t much but it’s honest work,68,https://www.reddit.com/r/wallstreetbets/comments/1gc4t7r/it_aint_much_but_its_honest_work/,0.509,POSITIVE,0.955
10/26/2024,Nvidia overtakes Apple as world's most valuable company.,103,https://www.reddit.com/r/wallstreetbets/comments/1gcbk5x/nvidia_overtakes_apple_as_worlds_most_valuable/,0.675,NEGATIVE,0.681
10/26/2024,The absolute madness of Tesla,840,https://www.reddit.com/r/wallstreetbets/comments/1gcu0ih/the_absolute_madness_of_tesla/,0.5,POSITIVE,1.0
10/27/2024,Hold or sell?,133,https://www.reddit.com/r/wallstreetbets/comments/1gd14du/hold_or_sell/,0.528,NEGATIVE,0.981
10/28/2024,"Started trading in august, then learned about options.",177,https://www.reddit.com/r/wallstreetbets/comments/1gdrngr/started_trading_in_august_then_learned_about/,0.525,NEGATIVE,0.636
10/28/2024,"$NVDA - xAI to Double Down with 100,000 More NVIDIA GPUs, Building World’s Largest AI Supercomputer at Record Speed",254,https://www.reddit.com/r/wallstreetbets/comments/1ge8ze6/nvda_xai_to_double_down_with_100000_more_nvidia/,0.557,POSITIVE,0.996
10/28/2024,Last chance RDDT under 80,45,https://www.reddit.com/r/wallstreetbets/comments/1gec8nf/last_chance_rddt_under_80/,0.54,NEGATIVE,0.865
10/29/2024,"AMD Q3 Preview: EPS Jumps 30% YoY, Close Gap with Nvidia?",6,https://www.reddit.com/r/wallstreetbets/comments/1ger3tf/amd_q3_preview_eps_jumps_30_yoy_close_gap_with/,0.577,NEGATIVE,1.0
10/29/2024,Spy lunch money Scalping Strategy for poors,46,https://www.reddit.com/r/wallstreetbets/comments/1gf2hm0/spy_lunch_money_scalping_strategy_for_poors/,0.524,NEGATIVE,1.0
10/29/2024,Family Dinner at the Lisa Su household,5,https://www.reddit.com/r/wallstreetbets/comments/1gf6s57/family_dinner_at_the_lisa_su_household/,0.507,POSITIVE,1.0
10/29/2024,sometimes at night I cry,4,https://www.reddit.com/r/wallstreetbets/comments/1gf7vyn/sometimes_at_night_i_cry/,0.497,POSITIVE,0.615
10/30/2024,NVDA Good Vibes,47,https://www.reddit.com/r/wallstreetbets/comments/1gfbxzm/nvda_good_vibes/,0.528,POSITIVE,0.99
10/30/2024,"""Super Micro Computer, Inc. (NASDAQ:SMCI) is an unstoppable stock that could make you richer""",161,https://www.reddit.com/r/wallstreetbets/comments/1gfnkti/super_micro_computer_inc_nasdaqsmci_is_an/,0.56,POSITIVE,0.521
10/30/2024,PLTR $250M+ of Insider Selling???,59,https://www.reddit.com/r/wallstreetbets/comments/1gfw0r4/pltr_250m_of_insider_selling/,0.502,NEGATIVE,0.996
10/31/2024,Tried fucking around with nvidia options for the week,96,https://www.reddit.com/r/wallstreetbets/comments/1ggj3ud/tried_fucking_around_with_nvidia_options_for_the/,0.563,NEGATIVE,0.999
11/01/2024,The last mile: S&P at 6000,19,https://www.reddit.com/r/wallstreetbets/comments/1ggzwq5/the_last_mile_sp_at_6000/,0.545,POSITIVE,0.989
11/01/2024,Lost 23k$,23,https://www.reddit.com/r/wallstreetbets/comments/1gha88l/lost_23k/,0.492,NEGATIVE,0.996
11/01/2024,"Nvidia to join Dow Jones Industrial Average, replacing Intel",404,https://www.reddit.com/r/wallstreetbets/comments/1ghgbw9/nvidia_to_join_dow_jones_industrial_average/,0.539,NEGATIVE,0.975
11/02/2024,Dow Jones Industrial Average (DOW) Adding NVIDIA (NVDA) replacing Intel (INTC) on Novmeber 8th,32,https://www.reddit.com/r/wallstreetbets/comments/1ghlg2q/dow_jones_industrial_average_dow_adding_nvidia/,0.524,NEGATIVE,0.68
11/02/2024,Why I think TSM/INTC will outpace NVDA/AMD growth in the next decade.,251,https://www.reddit.com/r/wallstreetbets/comments/1ghyq7o/why_i_think_tsmintc_will_outpace_nvdaamd_growth/,0.593,NEGATIVE,0.934
11/03/2024,Nvidia after earnings,205,https://www.reddit.com/r/wallstreetbets/comments/1gihiuy/nvidia_after_earnings/,0.695,NEGATIVE,0.982
11/03/2024,Nvda $200 November 22 - how regarded I'm part 2,117,https://www.reddit.com/r/wallstreetbets/comments/1giz8hu/nvda_200_november_22_how_regarded_im_part_2/,0.608,POSITIVE,0.98
11/04/2024,NVIDIA’s Accounts Receivable has ballooned to an eye-popping $14 billion which represents approximately 68% of their quarterly revenue,309,https://www.reddit.com/r/wallstreetbets/comments/1gjb909/nvidias_accounts_receivable_has_ballooned_to_an/,0.519,NEGATIVE,0.919
11/04/2024,Mega Bull is about to be unleashed,503,https://www.reddit.com/r/wallstreetbets/comments/1gje2dz/mega_bull_is_about_to_be_unleashed/,0.502,POSITIVE,0.999
11/04/2024,NVIDIA Starts Diverting Orders Away From Super Micro Computer (SMCI) As A Potential Delisting And DOJ Investigation Loom Large,47,https://www.reddit.com/r/wallstreetbets/comments/1gjgsm9/nvidia_starts_diverting_orders_away_from_super/,0.526,NEGATIVE,1.0
11/04/2024,TSMC's Importance to Companies Like Apple or Nvidia and the Artificial Intelligence (AI) Revolution,8,https://www.reddit.com/r/wallstreetbets/comments/1gjhdty/tsmcs_importance_to_companies_like_apple_or/,0.569,POSITIVE,0.998
11/04/2024,"Facebook, Nvidia ask US Supreme Court to spare them from securities fraud suits",43,https://www.reddit.com/r/wallstreetbets/comments/1gjpm0t/facebook_nvidia_ask_us_supreme_court_to_spare/,0.527,NEGATIVE,1.0
11/04/2024,$3.39 trillion: AI titan Nvidia overtakes Apple as world’s most valuable company,87,https://www.reddit.com/r/wallstreetbets/comments/1gjqhnh/339_trillion_ai_titan_nvidia_overtakes_apple_as/,0.636,NEGATIVE,0.98
11/05/2024,Started taking NVidia gains after 12 years,205,https://www.reddit.com/r/wallstreetbets/comments/1gkaord/started_taking_nvidia_gains_after_12_years/,0.56,POSITIVE,0.993
11/06/2024,ARBB IOT & ASTERA LABS,7,https://www.reddit.com/r/wallstreetbets/comments/1gl0xkj/arbb_iot_astera_labs/,0.501,POSITIVE,1.0
11/06/2024,Follow-Up Post on Earnings Day: $IONQ Set for a Massive Rally with Multiple Catalysts Ahead,65,https://www.reddit.com/r/wallstreetbets/comments/1gl2dp1/followup_post_on_earnings_day_ionq_set_for_a/,0.535,POSITIVE,0.984
11/07/2024,Please stop sleeping on this company earnings tm it made me rich asf this year and 10k just today,51,https://www.reddit.com/r/wallstreetbets/comments/1gldil6/please_stop_sleeping_on_this_company_earnings_tm/,0.647,NEGATIVE,1.0
11/07/2024,"AI Giants Poised for Unprecedented Growth: Palantir and NVIDIA Set to Soar 2025, As education systems worldwide grapple with funding",14,https://www.reddit.com/r/wallstreetbets/comments/1glrdiu/ai_giants_poised_for_unprecedented_growth/,0.558,POSITIVE,0.97
11/08/2024,What should i do?,82,https://www.reddit.com/r/wallstreetbets/comments/1gmjn2a/what_should_i_do/,0.5,NEGATIVE,0.96
11/08/2024,Partnership with MCSU Health and why it matters.,5,https://www.reddit.com/r/wallstreetbets/comments/1gmkmi6/partnership_with_mcsu_health_and_why_it_matters/,0.513,POSITIVE,0.999
11/08/2024,Lost over 6k after trading options,54,https://www.reddit.com/r/wallstreetbets/comments/1gmm9lx/lost_over_6k_after_trading_options/,0.511,NEGATIVE,0.994
11/11/2024,Margin Debt,18,https://www.reddit.com/r/wallstreetbets/comments/1gondu7/margin_debt/,0.495,NEGATIVE,0.929
11/11/2024,NVDA Earnings 256.85%=173K For over a year it has allowed me to witness your greatness!🚀,6,https://www.reddit.com/r/wallstreetbets/comments/1goxpa4/nvda_earnings_25685173k_for_over_a_year_it_has/,0.606,POSITIVE,0.999
11/11/2024,IonQ - The Hyperbolic Run Just Started,48,https://www.reddit.com/r/wallstreetbets/comments/1gp6cnt/ionq_the_hyperbolic_run_just_started/,0.511,NEGATIVE,0.993
11/12/2024,My views on why NVDA beats earnings and flies to higher supports. Likley past 200.,104,https://www.reddit.com/r/wallstreetbets/comments/1gpq5d8/my_views_on_why_nvda_beats_earnings_and_flies_to/,0.539,POSITIVE,0.937
11/13/2024,NVDA: Why the stock is still massively undervalued?,25,https://www.reddit.com/r/wallstreetbets/comments/1gq40up/nvda_why_the_stock_is_still_massively_undervalued/,0.589,NEGATIVE,1.0
11/13/2024,Nvidia CEO Huang regrets not taking SoftBank’s Masayoshi Son’s offer to help buy the company,42,https://www.reddit.com/r/wallstreetbets/comments/1gq63n6/nvidia_ceo_huang_regrets_not_taking_softbanks/,0.61,NEGATIVE,0.729
11/13/2024,SoftBank plans supercomputer with Nvidia Blackwell chips.,9,https://www.reddit.com/r/wallstreetbets/comments/1gq8mo1/softbank_plans_supercomputer_with_nvidia/,0.543,POSITIVE,0.524
11/13/2024,After sitting on a bit of money i decided to buy calls because of course,46,https://www.reddit.com/r/wallstreetbets/comments/1gqf49b/after_sitting_on_a_bit_of_money_i_decided_to_buy/,0.535,POSITIVE,0.727
11/13/2024,"Jen-Hsun Huang's Dialogue with Masayoshi Son: Japan's New AI Pie, Arm's AI Ambition and NVIDIA's New East Asia Opportunity",5,https://www.reddit.com/r/wallstreetbets/comments/1gqgh1h/jenhsun_huangs_dialogue_with_masayoshi_son_japans/,0.591,POSITIVE,1.0
11/13/2024,SoundHound AI Stock Tumbles as Margins Drop,9,https://www.reddit.com/r/wallstreetbets/comments/1gqnmrh/soundhound_ai_stock_tumbles_as_margins_drop/,0.607,NEGATIVE,0.998
11/14/2024,"If you can't surpass them, become an ally! NVIDIA is leading the chip industry",39,https://www.reddit.com/r/wallstreetbets/comments/1gr60dq/if_you_cant_surpass_them_become_an_ally_nvidia_is/,0.566,POSITIVE,0.999
11/14/2024,Comparing top 500 supercomputers (filter to private company in US) to marketcap (RXRX Recursion 3 orders of magnitudes higher than all),16,https://www.reddit.com/r/wallstreetbets/comments/1gr91g9/comparing_top_500_supercomputers_filter_to/,0.586,POSITIVE,0.981
11/15/2024,Weekly Earnings Thread 11/18 - 11/22,2.6K,https://www.reddit.com/r/wallstreetbets/comments/1grybzd/weekly_earnings_thread_1118_1122/,0.582,POSITIVE,0.729
11/15/2024,"NVDA has Disclosed Ownership in New Company, Options play?",88,https://www.reddit.com/r/wallstreetbets/comments/1gs1jhy/nvda_has_disclosed_ownership_in_new_company/,0.669,NEGATIVE,0.976
11/15/2024,Can NVDA tell us what's next from its 13 September earnings report to current trends?,12,https://www.reddit.com/r/wallstreetbets/comments/1gs2d3p/can_nvda_tell_us_whats_next_from_its_13_september/,0.566,NEGATIVE,0.939
11/15/2024,"Artificial intelligence boom continues to drive Wall Street as well as the semiconductor industry, with NVIDIA set to report Q3 earnings nex",38,https://www.reddit.com/r/wallstreetbets/comments/1gs4jfs/artificial_intelligence_boom_continues_to_drive/,0.56,POSITIVE,0.779
11/16/2024,"AI Effect Elon Musk’s xAI raising up to $6 billion to purchase 100,000 Nvidia chips",185,https://www.reddit.com/r/wallstreetbets/comments/1gsyufm/ai_effect_elon_musks_xai_raising_up_to_6_billion/,0.558,POSITIVE,0.967
11/17/2024,New Nvidia AI chips face issue with overheating servers,147,https://www.reddit.com/r/wallstreetbets/comments/1gtesty/new_nvidia_ai_chips_face_issue_with_overheating/,0.606,NEGATIVE,0.992
11/18/2024,NVIDIA 3rd Quarter FY25 Financial Results 🧨,108,https://www.reddit.com/r/wallstreetbets/comments/1gtzovr/nvidia_3rd_quarter_fy25_financial_results/,0.563,NEGATIVE,0.619
11/18/2024,NVDA about to earn itself a juicy correction?,125,https://www.reddit.com/r/wallstreetbets/comments/1gu1ke7/nvda_about_to_earn_itself_a_juicy_correction/,0.501,NEGATIVE,0.995
11/18/2024,"Palantir short thesis and an analysis of its current earnings power, multiples and enterprise value",128,https://www.reddit.com/r/wallstreetbets/comments/1gu30vk/palantir_short_thesis_and_an_analysis_of_its/,0.544,POSITIVE,0.998
11/18/2024,"NVIDIA is next-gen Blackwell chips delayed again, exposed to overheating issues？",64,https://www.reddit.com/r/wallstreetbets/comments/1gu6sxq/nvidia_is_nextgen_blackwell_chips_delayed_again/,0.533,NEGATIVE,0.999
11/18/2024,Me forgetting NVDA earnings is this week and questioning why I’m losing money so fast,51,https://www.reddit.com/r/wallstreetbets/comments/1gu8hf8/me_forgetting_nvda_earnings_is_this_week_and/,0.542,NEGATIVE,0.999
11/18/2024,NVIDIA is helping Google to accelerate the quantum computing devices,14,https://www.reddit.com/r/wallstreetbets/comments/1guda3i/nvidia_is_helping_google_to_accelerate_the/,0.542,POSITIVE,0.996
11/18/2024,Did Nvidia allow MSCI to release their latest news?,4,https://www.reddit.com/r/wallstreetbets/comments/1guejro/did_nvidia_allow_msci_to_release_their_latest_news/,0.565,NEGATIVE,1.0
11/18/2024,NVDA Gains and Earnings,12,https://www.reddit.com/r/wallstreetbets/comments/1guhf17/nvda_gains_and_earnings/,0.582,POSITIVE,0.999
11/19/2024,Nvidia’s growing cash hoard points to M&A,46,https://www.reddit.com/r/wallstreetbets/comments/1gukdo9/nvidias_growing_cash_hoard_points_to_ma/,0.584,NEGATIVE,0.585
11/19/2024,Some thought from first year stock investment,10,https://www.reddit.com/r/wallstreetbets/comments/1guqtl3/some_thought_from_first_year_stock_investment/,0.735,NEGATIVE,0.979
11/19/2024,"ASML, they make the machines that make the semiconductors, orders have slowed and share price has tumbled, is it now undervalued?",123,https://www.reddit.com/r/wallstreetbets/comments/1guz8iv/asml_they_make_the_machines_that_make_the/,0.541,NEGATIVE,0.967
11/19/2024,$VRT ➡️ S&P 500: Coming Soon,73,https://www.reddit.com/r/wallstreetbets/comments/1gv6504/vrt_sp_500_coming_soon/,0.507,POSITIVE,0.965
11/19/2024,Everyone is speculating about Nvidia but who knows what direction it's headed?,58,https://www.reddit.com/r/wallstreetbets/comments/1gv8l0e/everyone_is_speculating_about_nvidia_but_who/,0.529,NEGATIVE,0.991
11/19/2024,Stocks shrug off war worries ahead of NVIDIA results?,54,https://www.reddit.com/r/wallstreetbets/comments/1gvaij5/stocks_shrug_off_war_worries_ahead_of_nvidia/,0.554,POSITIVE,0.952
11/20/2024,NVDA I trust 🐂🎯💣,24,https://www.reddit.com/r/wallstreetbets/comments/1gvibnz/nvda_i_trust/,0.507,POSITIVE,0.999
11/20/2024,I have taken a bearish position on ASML,73,https://www.reddit.com/r/wallstreetbets/comments/1gvjmvd/i_have_taken_a_bearish_position_on_asml/,0.522,NEGATIVE,0.896
11/20/2024,"NVIDIA Q3 earnings preview: strong AI chip growth, but supply chain and tariff risks raise market concerns?",14,https://www.reddit.com/r/wallstreetbets/comments/1gvqbll/nvidia_q3_earnings_preview_strong_ai_chip_growth/,0.606,NEGATIVE,0.884
11/20/2024,NVDA time,68,https://www.reddit.com/r/wallstreetbets/comments/1gvqeqs/nvda_time/,0.545,NEGATIVE,0.615
11/20/2024,Will Nvidia be the first company to reach $4 trillion market cap? Analysts raise the stakes,24,https://www.reddit.com/r/wallstreetbets/comments/1gvtojc/will_nvidia_be_the_first_company_to_reach_4/,0.629,NEGATIVE,0.616
11/20/2024,Options are gonna kill me one of these days.,91,https://www.reddit.com/r/wallstreetbets/comments/1gvwk6x/options_are_gonna_kill_me_one_of_these_days/,0.518,NEGATIVE,0.989
11/20/2024,Nvidia Forecast Fails to Meet the Loftiest Estimates for AI Star,110,https://www.reddit.com/r/wallstreetbets/comments/1gvzztd/nvidia_forecast_fails_to_meet_the_loftiest/,0.57,NEGATIVE,1.0
11/20/2024,Nvidia nearly doubles revenue on strong AI demand,441,https://www.reddit.com/r/wallstreetbets/comments/1gw06be/nvidia_nearly_doubles_revenue_on_strong_ai_demand/,0.601,POSITIVE,0.628
11/21/2024,Nvidia (NVDA) Price Targets Raised Across the Board From Massive Q3 Earnings Beat and Raised Forward Guidance,66,https://www.reddit.com/r/wallstreetbets/comments/1gw9osq/nvidia_nvda_price_targets_raised_across_the_board/,0.556,NEGATIVE,0.719
11/21/2024,Nvidia earnings: AI chip leader shows no signs of stopping mammoth growth,22,https://www.reddit.com/r/wallstreetbets/comments/1gwa4ka/nvidia_earnings_ai_chip_leader_shows_no_signs_of/,0.596,NEGATIVE,0.994
11/21/2024,Why Nvidia may not follow the same fate as Cisco,6,https://www.reddit.com/r/wallstreetbets/comments/1gwdl91/why_nvidia_may_not_follow_the_same_fate_as_cisco/,0.546,NEGATIVE,0.994
11/21/2024,Why I am bullish on SMCI. #Calls,31,https://www.reddit.com/r/wallstreetbets/comments/1gwnoy2/why_i_am_bullish_on_smci_calls/,0.512,NEGATIVE,0.977
11/21/2024,"CONGRATULATIONS all NVDA options gamblers for paying for the lesson on theta, volatility, and IV crush. Now make me a Dave’s Double to go.",11,https://www.reddit.com/r/wallstreetbets/comments/1gwo5rb/congratulations_all_nvda_options_gamblers_for/,0.506,POSITIVE,0.998
11/21/2024,CITRON RESEARCH: Nvidia has become ' casino stock' (June 2017 at $3.74 stock price),7,https://www.reddit.com/r/wallstreetbets/comments/1gwqcsg/citron_research_nvidia_has_become_casino_stock/,0.626,NEGATIVE,0.997
11/21/2024,NVDA gains. That position kept me up at night but also qualified me for this sub.,4,https://www.reddit.com/r/wallstreetbets/comments/1gwqnm7/nvda_gains_that_position_kept_me_up_at_night_but/,0.544,POSITIVE,1.0
11/25/2024,Stock Market: An Overspeculation Environment,27,https://www.reddit.com/r/wallstreetbets/comments/1gzvivj/stock_market_an_overspeculation_environment/
11/25/2024,PLTR: They said the quiet part out loud [DD],346,https://www.reddit.com/r/wallstreetbets/comments/1gz9jf7/pltr_they_said_the_quiet_part_out_loud_dd/
11/24/2024,Prepare for a significant NVDA pullback until the company reports more conclusively positive numbers on Blackwell,44,https://www.reddit.com/r/wallstreetbets/comments/1gz4w5n/prepare_for_a_significant_nvda_pullback_until_the/
11/24/2024,SPY 601+ Monday 🚀👀💥,343,https://www.reddit.com/r/wallstreetbets/comments/1gyhev6/spy_601_monday/
11/23/2024,NVDA may see red next week,120,https://www.reddit.com/r/wallstreetbets/comments/1gxnn8a/nvda_may_see_red_next_week/
11/22/2024,"Nvidia to build AI school in Indonesia, country's VP says",6,https://www.reddit.com/r/wallstreetbets/comments/1gwz88j/nvidia_to_build_ai_school_in_indonesia_countrys/
11/22/2024,Quantum Gains with $IONQ 🚀 350% and more upside,61,https://www.reddit.com/r/wallstreetbets/comments/1gwx77s/quantum_gains_with_ionq_350_and_more_upside/
11/27/2024,NVDA is about to take off (technically speaking): why I feel more confident following my previous post,1,https://www.reddit.com/r/wallstreetbets/comments/1h1fhpm/nvda_is_about_to_take_off_technically_speaking/
11/27/2024,Nvidia (NVDA) March 25/ 151 call options,16,https://www.reddit.com/r/wallstreetbets/comments/1h1cjbz/nvidia_nvda_march_25_151_call_options/
11/27/2024,Any hopes for a Santa rally or I am getting rekt?,56,https://www.reddit.com/r/wallstreetbets/comments/1h17kvw/any_hopes_for_a_santa_rally_or_i_am_getting_rekt/
11/26/2024,$Dell Earnings,28,https://www.reddit.com/r/wallstreetbets/comments/1h0q4ii/dell_earnings/
11/26/2024,dell earnings are going to be good,42,https://www.reddit.com/r/wallstreetbets/comments/1h0lm56/dell_earnings_are_going_to_be_good/
11/26/2024,$VSH - The Forgotten King of Chips,24,https://www.reddit.com/r/wallstreetbets/comments/1h0l658/vsh_the_forgotten_king_of_chips/
11/26/2024,Should I take profits,11,https://www.reddit.com/r/wallstreetbets/comments/1h0h7we/should_i_take_profits/
11/28/2024,"Ken Griffin Slashes Citadel's Palantir Stake By 91%, Incareases Nvidia Stake By 194% In Q3",80,https://www.reddit.com/r/wallstreetbets/comments/1h22ldh/ken_griffin_slashes_citadels_palantir_stake_by_91/,0.53,NEGATIVE,0.999
11/28/2024,"NVDA's stock is down 10% in a week, is he still worth following?",201,https://www.reddit.com/r/wallstreetbets/comments/1h21cl3/nvdas_stock_is_down_10_in_a_week_is_he_still/,0.613,NEGATIVE,1.0
11/28/2024,NVDA 🚀 🌕?,24,https://www.reddit.com/r/wallstreetbets/comments/1h219lg/nvda/,0.502,NEGATIVE,0.999
