date,post headline,comments,link,PTR Sentiment,Flair Outlook,Flair Score
11/28/2024,Good Buying Opportunity After NVDA Pullback,87,https://www.reddit.com/r/wallstreetbets/comments/1h1z8es/good_buying_opportunity_after_nvda_pullback/,0.524,POSITIVE,0.996
11/28/2024,Where are future returns even supposed to come from?,234,https://www.reddit.com/r/wallstreetbets/comments/1h1w2h9/where_are_future_returns_even_supposed_to_come/,0.511,NEGATIVE,1.0
11/28/2024,TSMC Will Be Worth More Than Nvidia By 2026,28,https://www.reddit.com/r/wallstreetbets/comments/1h1w0qq/tsmc_will_be_worth_more_than_nvidia_by_2026/,0.578,POSITIVE,0.987
11/28/2024,I have reasons to believe that Recursion (RXRX) will became quite popular in the next month.,81,https://www.reddit.com/r/wallstreetbets/comments/1h1volv/i_have_reasons_to_believe_that_recursion_rxrx/,0.526,POSITIVE,0.587
11/27/2024,"Samsung Adjusts Leadership Position Amidst AI Chip Woes, NVIDIA Corporation (NVDA) Targets AI Memory Chip Certification",5,https://www.reddit.com/r/wallstreetbets/comments/1h1fqs2/samsung_adjusts_leadership_position_amidst_ai/,0.57,NEGATIVE,0.715
11/29/2024,Could Rigetti Computing Become the Next Nvidia?,10,https://www.reddit.com/r/wallstreetbets/comments/1h2v3af/could_rigetti_computing_become_the_next_nvidia/,0.558,POSITIVE,0.627
11/29/2024,"Tech stocks rally: Nvidia, Alphabet, Microsoft in today's spotlight",26,https://www.reddit.com/r/wallstreetbets/comments/1h2ujf7/tech_stocks_rally_nvidia_alphabet_microsoft_in/,0.574,POSITIVE,0.71
11/29/2024,"IONQ : No. 1 quantum computer, the reason for the rise in IONQ?",13,https://www.reddit.com/r/wallstreetbets/comments/1h2pxgc/ionq_no_1_quantum_computer_the_reason_for_the/,0.517,POSITIVE,0.974
11/29/2024,did i cook,6,https://www.reddit.com/r/wallstreetbets/comments/1h2p99c/did_i_cook/,0.5,NEGATIVE,0.965
11/29/2024,Moon this dog shi,105,https://www.reddit.com/r/wallstreetbets/comments/1h2cer0/moon_this_dog_shi/,0.505,POSITIVE,0.986
11/30/2024,"All In on SMCI: $6,000,000 Bet Across Interactive Brokers and My Swiss Bank – Am I Crazy or a Genius?",412,https://www.reddit.com/r/wallstreetbets/comments/1h3pr42/all_in_on_smci_6000000_bet_across_interactive/,0.512,POSITIVE,0.614
12/01/2024,Top and bottom 10 performers YTD. What do your crystal balls say for next year?,88,https://www.reddit.com/r/wallstreetbets/comments/1h3yeka/top_and_bottom_10_performers_ytd_what_do_your/,0.589,POSITIVE,0.996
12/03/2024,"Apple's stock price hits a new high, recapturing the number one spot in market cap. Is a new 'super product cycle' on the horizon?",72,https://www.reddit.com/r/wallstreetbets/comments/1h5rq2e/apples_stock_price_hits_a_new_high_recapturing/,0.601,POSITIVE,0.991
12/03/2024,Rolling the dice,45,https://www.reddit.com/r/wallstreetbets/comments/1h5rgi0/rolling_the_dice/,0.502,POSITIVE,0.811
12/03/2024,"NVDA is best performing stock over last 5,10,15 & 20 years",289,https://www.reddit.com/r/wallstreetbets/comments/1h5n3y7/nvda_is_best_performing_stock_over_last_51015_20/,0.618,POSITIVE,1.0
12/02/2024,Planet Labs ($PL) - The next big space stock,282,https://www.reddit.com/r/wallstreetbets/comments/1h4wmp7/planet_labs_pl_the_next_big_space_stock/,0.589,POSITIVE,0.997
12/04/2024,NVIDIA's share price surge and the outlook for the AI arithmetic market: bubble risk and rational layout of industry giants ’,14,https://www.reddit.com/r/wallstreetbets/comments/1h6ph5g/nvidias_share_price_surge_and_the_outlook_for_the/,0.57,POSITIVE,0.99
12/04/2024,It’s not much but I like it,2,https://www.reddit.com/r/wallstreetbets/comments/1h6ofl2/its_not_much_but_i_like_it/,0.507,NEGATIVE,0.918
12/04/2024,Nebius Group (NBIS) your new AI baby that's set to double or triple,23,https://www.reddit.com/r/wallstreetbets/comments/1h6lzo7/nebius_group_nbis_your_new_ai_baby_thats_set_to/,0.617,NEGATIVE,1.0
12/04/2024,I see a future for Apple Intelligence,15,https://www.reddit.com/r/wallstreetbets/comments/1h6k7ep/i_see_a_future_for_apple_intelligence/,0.532,POSITIVE,0.717
12/04/2024,Exploring the Future of 3D Digital,4,https://www.reddit.com/r/wallstreetbets/comments/1h6iyt8/exploring_the_future_of_3d_digital/,0.52,POSITIVE,1.0
12/04/2024,Microsoft to buy Bitcoin?!?!?!?!!?,15,https://www.reddit.com/r/wallstreetbets/comments/1h6i4or/microsoft_to_buy_bitcoin/,0.587,NEGATIVE,0.999
12/06/2024,xAI plans to expand its Colossus Supercomputer in Memphis to house 1 million+ GPUs,1,https://www.reddit.com/r/wallstreetbets/comments/1h7q4b8/xai_plans_to_expand_its_colossus_supercomputer_in/,0.568,POSITIVE,0.97
12/05/2024,"Foxconn Sees Record Third-Quarter Revenue as AI Server Demand, Nvidia Partnership Boosts Earnings",6,https://www.reddit.com/r/wallstreetbets/comments/1h7ldgr/foxconn_sees_record_thirdquarter_revenue_as_ai/,0.587,POSITIVE,0.759
12/05/2024,"Nvidia to build AI research, data centres in Vietnam with govt",2,https://www.reddit.com/r/wallstreetbets/comments/1h7jr79/nvidia_to_build_ai_research_data_centres_in/,0.569,POSITIVE,0.991
12/05/2024,"TSMC in talks with Nvidia for AI chip production in Arizona, sources say",24,https://www.reddit.com/r/wallstreetbets/comments/1h79whi/tsmc_in_talks_with_nvidia_for_ai_chip_production/,0.558,NEGATIVE,0.948
12/05/2024,NVIDIA's Rubin architecture to be released six months early,13,https://www.reddit.com/r/wallstreetbets/comments/1h6ywif/nvidias_rubin_architecture_to_be_released_six/,0.545,NEGATIVE,0.912
12/07/2024,420k gains in last 3 months,18,https://www.reddit.com/r/wallstreetbets/comments/1h8je0t/420k_gains_in_last_3_months/,0.565,POSITIVE,0.974
12/06/2024,What are your top picks for 2025,652,https://www.reddit.com/r/wallstreetbets/comments/1h8c8i2/what_are_your_top_picks_for_2025/,0.535,POSITIVE,0.997
12/06/2024,Which one of you regards writes for Forbes?,110,https://www.reddit.com/r/wallstreetbets/comments/1h8agfw/which_one_of_you_regards_writes_for_forbes/,0.518,NEGATIVE,0.911
12/06/2024,Market is still cheap,32,https://www.reddit.com/r/wallstreetbets/comments/1h838yo/market_is_still_cheap/,0.597,NEGATIVE,0.994
12/06/2024,NVidia CEO Just Announced Bad News for Nvidia's Rivals,10,https://www.reddit.com/r/wallstreetbets/comments/1h82cr1/nvidia_ceo_just_announced_bad_news_for_nvidias/,0.587,NEGATIVE,0.999
12/07/2024,College Student with $18 in their checking account. All in.,157,https://www.reddit.com/r/wallstreetbets/comments/1h92v0w/college_student_with_18_in_their_checking_account/,0.501,NEGATIVE,0.963
12/07/2024,My thesis on INTC going into 2025,112,https://www.reddit.com/r/wallstreetbets/comments/1h8n76e/my_thesis_on_intc_going_into_2025/,0.518,POSITIVE,0.916
12/09/2024,MSTR Achilles Heel p/2,19,https://www.reddit.com/r/wallstreetbets/comments/1hajmkv/mstr_achilles_heel_p2/,0.505,NEGATIVE,0.722
12/09/2024,"Here's why I'm shorting Soundhound, a current WSB darling",252,https://www.reddit.com/r/wallstreetbets/comments/1hagtg0/heres_why_im_shorting_soundhound_a_current_wsb/,0.579,POSITIVE,0.99
12/09/2024,Nvidia Under Investigation by China for Suspected Anti-Monopoly Violations Amid U.S. Chip Crackdown,17,https://www.reddit.com/r/wallstreetbets/comments/1haeogm/nvidia_under_investigation_by_china_for_suspected/,0.523,NEGATIVE,0.995
12/09/2024,China Antimonopoly fight against NVDA,39,https://www.reddit.com/r/wallstreetbets/comments/1ha81ws/china_antimonopoly_fight_against_nvda/,0.52,NEGATIVE,0.979
12/09/2024,$NVMI the final time I will post about this company then stfu,206,https://www.reddit.com/r/wallstreetbets/comments/1ha1xbu/nvmi_the_final_time_i_will_post_about_this/,0.642,NEGATIVE,1.0
12/09/2024,"Chinese data centers told to stick to Nvidia chips, domestic chips not compatible",142,https://www.reddit.com/r/wallstreetbets/comments/1ha1iiw/chinese_data_centers_told_to_stick_to_nvidia/,0.529,NEGATIVE,1.0
12/08/2024,$200k in Core Scientific gains - Do I sell or keep hodl'ing,50,https://www.reddit.com/r/wallstreetbets/comments/1h9mr5u/200k_in_core_scientific_gains_do_i_sell_or_keep/,0.516,POSITIVE,0.628
12/10/2024,MicroStrategy $MSTR will be added to the Nasdaq 100 on Friday,33,https://www.reddit.com/r/wallstreetbets/comments/1hbcg6w/microstrategy_mstr_will_be_added_to_the_nasdaq/,0.516,NEGATIVE,0.954
12/10/2024,NVIDIA Positioned for Growth Amid AI Boom Fueled by TSMC's Strong Revenue,15,https://www.reddit.com/r/wallstreetbets/comments/1hb3ywu/nvidia_positioned_for_growth_amid_ai_boom_fueled/,0.588,POSITIVE,0.988
12/12/2024,K let’s go 150 EOW,15,https://www.reddit.com/r/wallstreetbets/comments/1hc8d66/k_lets_go_150_eow/,0.505,NEGATIVE,0.926
12/11/2024,"$50,000 NVDA Long YOLo",17,https://www.reddit.com/r/wallstreetbets/comments/1hbxkhd/50000_nvda_long_yolo/,0.537,NEGATIVE,0.651
12/11/2024,US Supreme Court tosses case involving securities fraud suit against Nvidia,53,https://www.reddit.com/r/wallstreetbets/comments/1hbvybg/us_supreme_court_tosses_case_involving_securities/,0.526,NEGATIVE,0.967
12/11/2024,Englander just 10X'd his fund's stake in Walgreens,9,https://www.reddit.com/r/wallstreetbets/comments/1hbqc3p/englander_just_10xd_his_funds_stake_in_walgreens/,0.513,NEGATIVE,0.998
12/12/2024,"Magnificent 7 return since 2010: 14,890% (Average)",35,https://www.reddit.com/r/wallstreetbets/comments/1hcoqem/magnificent_7_return_since_2010_14890_average/,0.524,POSITIVE,0.999
12/12/2024,Google Cloud Against the Odds: Beating Microsoft and OpenAI in the AI race to the top!,12,https://www.reddit.com/r/wallstreetbets/comments/1hcmqwe/google_cloud_against_the_odds_beating_microsoft/,0.547,POSITIVE,0.992
12/13/2024,NVIDIA: A Victim of Its Own Success,35,https://www.reddit.com/r/wallstreetbets/comments/1hdkgah/nvidia_a_victim_of_its_own_success/,0.56,NEGATIVE,1.0
12/13/2024,Am I doing this right ?,249,https://www.reddit.com/r/wallstreetbets/comments/1hdfsip/am_i_doing_this_right/,0.515,POSITIVE,0.767
12/13/2024,AVGO > NVDA,36,https://www.reddit.com/r/wallstreetbets/comments/1hddzup/avgo_nvda/,0.5,POSITIVE,0.867
12/13/2024,What a fucking year thanks MSTR and NVIDIA,108,https://www.reddit.com/r/wallstreetbets/comments/1hddnnb/what_a_fucking_year_thanks_mstr_and_nvidia/,0.662,POSITIVE,0.999
12/14/2024,I Used AI to Make a Visual Metaphor of NVIDIA's Stock Performance in 2024 (Tendy Generator),4,https://www.reddit.com/r/wallstreetbets/comments/1he7vxd/i_used_ai_to_make_a_visual_metaphor_of_nvidias/,0.593,POSITIVE,0.99
12/14/2024,Where do we go from here?,245,https://www.reddit.com/r/wallstreetbets/comments/1he5m4h/where_do_we_go_from_here/,0.505,NEGATIVE,0.928
