date,post headline,comments,link,PTR Sentiment,Flair Outlook,Flair Score
08/29/2024,Never was just the start! There’s a pattern here. Nvidia lol,9,https://www.reddit.com/r/wallstreetbets/comments/1f4c4ub/never_was_just_the_start_theres_a_pattern_here/,0.525,POSITIVE,0.961
08/29/2024,$100 billion: Apple and Nvidia in talks to join OpenAI funding round,42,https://www.reddit.com/r/wallstreetbets/comments/1f4fspi/100_billion_apple_and_nvidia_in_talks_to_join/,0.537,POSITIVE,0.618
08/30/2024,"Apple, Nvidia Might Join OpenAI's Billion-Dollar Funding",4,https://www.reddit.com/r/wallstreetbets/comments/1f4r40b/apple_nvidia_might_join_openais_billiondollar/,0.536,NEGATIVE,0.76
08/30/2024,SMCI - this is far from over,32,https://www.reddit.com/r/wallstreetbets/comments/1f4xep2/smci_this_is_far_from_over/,0.502,POSITIVE,0.999
08/31/2024,Nvidia loss porn,626,https://www.reddit.com/r/wallstreetbets/comments/1f5d2l1/nvidia_loss_porn/,0.56,NEGATIVE,1.0
09/02/2024,SeptemBEAR is a fluke and a lie,76,https://www.reddit.com/r/wallstreetbets/comments/1f71vky/septembear_is_a_fluke_and_a_lie/,0.5,NEGATIVE,1.0
09/02/2024,4 Reasons to Buy Nvidia Stock Hand Over Fist After Its Latest Pullback,455,https://www.reddit.com/r/wallstreetbets/comments/1f762ii/4_reasons_to_buy_nvidia_stock_hand_over_fist/,0.602,NEGATIVE,0.777
09/02/2024,INTC - Acquisition Potential?,85,https://www.reddit.com/r/wallstreetbets/comments/1f79nop/intc_acquisition_potential/,0.55,POSITIVE,0.501
09/03/2024,NVIDIA Options Expiry: Max Pain $100 – September 20th,49,https://www.reddit.com/r/wallstreetbets/comments/1f7vwuj/nvidia_options_expiry_max_pain_100_september_20th/,0.537,NEGATIVE,0.998
09/03/2024,Told you about nvida short,61,https://www.reddit.com/r/wallstreetbets/comments/1f806hj/told_you_about_nvida_short/,0.497,NEGATIVE,0.992
09/03/2024,NVIDIA Short Today!!!,48,https://www.reddit.com/r/wallstreetbets/comments/1f82g4w/nvidia_short_today/,0.6,NEGATIVE,0.999
09/03/2024,NVDAs drop today is the largest-ever destruction of market cap (-$278B),1.1K,https://www.reddit.com/r/wallstreetbets/comments/1f8ailu/nvdas_drop_today_is_the_largestever_destruction/,0.55,NEGATIVE,1.0
09/03/2024,Nvidia Gets DOJ Subpoena in Escalating Antitrust Investigation,199,https://www.reddit.com/r/wallstreetbets/comments/1f8aj1i/nvidia_gets_doj_subpoena_in_escalating_antitrust/,0.52,POSITIVE,0.723
09/03/2024,Nvidia Gets DOJ Subpoena in Escalating Antitrust Probe,63,https://www.reddit.com/r/wallstreetbets/comments/1f8an3o/nvidia_gets_doj_subpoena_in_escalating_antitrust/,0.524,NEGATIVE,0.517
09/03/2024,AMD Appoints Keith Strier (VP Worldwide AI Initiatives at NVIDIA) to Expand Global AI Capabilities and Engagements,2,https://www.reddit.com/r/wallstreetbets/comments/1f8atjl/amd_appoints_keith_strier_vp_worldwide_ai/,0.602,POSITIVE,0.979
09/03/2024,"NVDA Futures, 2$ Gap Down a Asian open.",57,https://www.reddit.com/r/wallstreetbets/comments/1f8czo7/nvda_futures_2_gap_down_a_asian_open/,0.509,POSITIVE,0.623
09/03/2024,Should I just cut my losses on nvidia?,193,https://www.reddit.com/r/wallstreetbets/comments/1f8eyga/should_i_just_cut_my_losses_on_nvidia/,0.53,NEGATIVE,1.0
09/04/2024,Fundamentals behind a USA market drop this week & some positives,31,https://www.reddit.com/r/wallstreetbets/comments/1f8htux/fundamentals_behind_a_usa_market_drop_this_week/,0.553,POSITIVE,0.979
09/04/2024,Asian AI Chipmaker Stocks Slide Following Nvidia’s Record Rout,5,https://www.reddit.com/r/wallstreetbets/comments/1f8ka2i/asian_ai_chipmaker_stocks_slide_following_nvidias/,0.554,NEGATIVE,0.997
09/04/2024,"NVIDIA's suppliers in Taiwan prep for Order's of GB200 NVL36 AI servers in September, NVL72 in October",8,https://www.reddit.com/r/wallstreetbets/comments/1f8ui1m/nvidias_suppliers_in_taiwan_prep_for_orders_of/,0.563,NEGATIVE,0.677
09/04/2024,1k Account Challenge Progress,20,https://www.reddit.com/r/wallstreetbets/comments/1f8ygh9/1k_account_challenge_progress/,0.51,NEGATIVE,0.931
09/04/2024,"Nvidia did not receive a US Justice Department subpoena, spokesperson says",178,https://www.reddit.com/r/wallstreetbets/comments/1f93uuz/nvidia_did_not_receive_a_us_justice_department/,0.553,NEGATIVE,0.999
09/04/2024,Nvidia Says It Has ‘Not Been Subpoenaed’ by the DOJ in Probe,59,https://www.reddit.com/r/wallstreetbets/comments/1f94kb8/nvidia_says_it_has_not_been_subpoenaed_by_the_doj/,0.548,NEGATIVE,0.99
09/05/2024,Changes,5,https://www.reddit.com/r/wallstreetbets/comments/1f9av3i/changes/,0.5,POSITIVE,0.987
09/05/2024,I sold Nvidia puts + ASTS and LUNR calls,139,https://www.reddit.com/r/wallstreetbets/comments/1f9m9he/i_sold_nvidia_puts_asts_and_lunr_calls/,0.533,NEGATIVE,0.993
09/06/2024,Why do these data spikes happen?,32,https://www.reddit.com/r/wallstreetbets/comments/1fa7uur/why_do_these_data_spikes_happen/,0.52,NEGATIVE,1.0
09/06/2024,A list of interesting calls I’ve made in 2023,8,https://www.reddit.com/r/wallstreetbets/comments/1faijfx/a_list_of_interesting_calls_ive_made_in_2023/,0.512,POSITIVE,0.97
09/08/2024,I didn't hear no bell,58,https://www.reddit.com/r/wallstreetbets/comments/1fbqh09/i_didnt_hear_no_bell/,0.502,NEGATIVE,0.995
09/08/2024,Jensen Huang Q2 2025 conference call comment : This is what tells me Ai is still in the very first inning of a nine inning game,170,https://www.reddit.com/r/wallstreetbets/comments/1fc0luj/jensen_huang_q2_2025_conference_call_comment_this/,0.538,NEGATIVE,0.997
09/08/2024,Opinions on NVDA?,256,https://www.reddit.com/r/wallstreetbets/comments/1fc4tw7/opinions_on_nvda/,0.502,POSITIVE,0.567
09/09/2024,Intel is a pretty safe bet and are undervalued,85,https://www.reddit.com/r/wallstreetbets/comments/1fcqxl3/intel_is_a_pretty_safe_bet_and_are_undervalued/,0.52,POSITIVE,0.591
09/09/2024,"Coreweave the scam that is inflating SMCI and NVDA growth numbers backed by Crypto bros, Energy traders Private Equity, HF",56,https://www.reddit.com/r/wallstreetbets/comments/1fcxevz/coreweave_the_scam_that_is_inflating_smci_and/,0.519,NEGATIVE,0.92
09/09/2024,Avengers: INTC War,79,https://www.reddit.com/r/wallstreetbets/comments/1fcz6qf/avengers_intc_war/,0.503,POSITIVE,0.603
09/09/2024,What Investors Don't Understand About Nvidia's Recurring Revenue Model Via DGX Cloud - Oracle's Bombshell ER - Acres of Nvidia GPUs and AWS,104,https://www.reddit.com/r/wallstreetbets/comments/1fd2g3z/what_investors_dont_understand_about_nvidias/,0.53,NEGATIVE,0.995
09/10/2024,"NVIDIA’s Blackwell Overcomes Delays, as GB200 Reportedly Sets for December Mass Production",182,https://www.reddit.com/r/wallstreetbets/comments/1fdw857/nvidias_blackwell_overcomes_delays_as_gb200/,0.51,POSITIVE,0.916
09/11/2024,"""U.S. Nears Approval for Nvidia Chip Sales to Saudi Arabia""",7,https://www.reddit.com/r/wallstreetbets/comments/1feg88f/us_nears_approval_for_nvidia_chip_sales_to_saudi/,0.595,NEGATIVE,0.975
09/11/2024,US closer to greenlighting Nvidia chips for Saudi Arabia,23,https://www.reddit.com/r/wallstreetbets/comments/1feh5gh/us_closer_to_greenlighting_nvidia_chips_for_saudi/,0.546,POSITIVE,0.972
09/11/2024,Nvidia CEO Says Customer Relations Are ‘Tense’ Due to Shortages,67,https://www.reddit.com/r/wallstreetbets/comments/1fehjvh/nvidia_ceo_says_customer_relations_are_tense_due/,0.548,NEGATIVE,0.992
09/11/2024,Relax on Nvidia: Why Both Bulls and Bears are Wrong and Overinflated,12,https://www.reddit.com/r/wallstreetbets/comments/1fehzas/relax_on_nvidia_why_both_bulls_and_bears_are/,0.526,NEGATIVE,0.584
09/11/2024,Thank you my sweet NVIDIA,1,https://www.reddit.com/r/wallstreetbets/comments/1fekmmv/thank_you_my_sweet_nvidia/,0.555,POSITIVE,0.967
09/11/2024,Nvidia call delivered on a roll…finally,8,https://www.reddit.com/r/wallstreetbets/comments/1fenjvn/nvidia_call_delivered_on_a_rollfinally/,0.554,POSITIVE,0.995
09/11/2024,"$NVDA, thoughts?",64,https://www.reddit.com/r/wallstreetbets/comments/1feogcm/nvda_thoughts/,0.512,NEGATIVE,0.999
09/12/2024,Needed this so badly,9,https://www.reddit.com/r/wallstreetbets/comments/1fewcxf/needed_this_so_badly/,0.495,NEGATIVE,0.686
09/12/2024,Nvidia’s Margin Forecast Shake-Up: How September 9-10 Set Off Alarms in the Semiconductor Sector Amid Tesla’s China Surge and Apple’s Roller,27,https://www.reddit.com/r/wallstreetbets/comments/1ff1wwt/nvidias_margin_forecast_shakeup_how_september_910/,0.519,NEGATIVE,0.945
09/13/2024,NVIDIA IS GOING TO THE MOOOOOOOOON,68,https://www.reddit.com/r/wallstreetbets/comments/1ffkj4z/nvidia_is_going_to_the_mooooooooon/,0.568,NEGATIVE,0.967
09/13/2024,OpenAI Released a New Model GPT-o1 That Only Allows 35 Messages Per Week Because It Thinks - It Also Hasn't Been Trained With All Data,168,https://www.reddit.com/r/wallstreetbets/comments/1ffog0r/openai_released_a_new_model_gpto1_that_only/,0.565,NEGATIVE,1.0
09/13/2024,🚀 Unleash the Power of AI with Core Scientific (CORZ) – The Next Big Thing! 🚀,11,https://www.reddit.com/r/wallstreetbets/comments/1fftl99/unleash_the_power_of_ai_with_core_scientific_corz/,0.547,POSITIVE,0.899
09/13/2024,Saudi Arabia expects to get access to Nvidia's high performance chips 'within the next year',30,https://www.reddit.com/r/wallstreetbets/comments/1fg0x6e/saudi_arabia_expects_to_get_access_to_nvidias/,0.598,NEGATIVE,0.761
09/13/2024,"$80 Nvidia put buyer strikes again in the January 2025 contract $$$ 5,000 contracts costing about a million",318,https://www.reddit.com/r/wallstreetbets/comments/1fg1qeu/80_nvidia_put_buyer_strikes_again_in_the_january/,0.601,NEGATIVE,1.0
09/13/2024,See you guys behind the Wendy’s dumpster next week when I YOLO more Nvidia calls,37,https://www.reddit.com/r/wallstreetbets/comments/1fg3672/see_you_guys_behind_the_wendys_dumpster_next_week/,0.544,POSITIVE,0.633
09/14/2024,U.S. Govt pushes Nvidia and Apple to use Intel's foundries — Department of Commerce Secretary makes appeal for US-based chip production,461,https://www.reddit.com/r/wallstreetbets/comments/1fgimc7/us_govt_pushes_nvidia_and_apple_to_use_intels/,0.544,NEGATIVE,0.981
09/14/2024,"New AI Chip Beats Nvidia, AMD and Intel by a Mile with 20x Faster Speeds and Over 4 Trillion Transistors",35,https://www.reddit.com/r/wallstreetbets/comments/1fgq2g3/new_ai_chip_beats_nvidia_amd_and_intel_by_a_mile/,0.617,POSITIVE,0.999
09/14/2024,"Nvidia CEO says customer relations are ‘tense’ “The demand on it is so great, and everyone wants to be first and everyone wants to be most”",146,https://www.reddit.com/r/wallstreetbets/comments/1fgw94t/nvidia_ceo_says_customer_relations_are_tense_the/,0.542,POSITIVE,0.981
09/15/2024,U.S. Govt pushes Nvidia and Apple to use Intel's foundries,376,https://www.reddit.com/r/wallstreetbets/comments/1fhd0nt/us_govt_pushes_nvidia_and_apple_to_use_intels/,0.544,NEGATIVE,0.946
09/15/2024,Now go play with your new friend!,219,https://www.reddit.com/r/wallstreetbets/comments/1fhfzzm/now_go_play_with_your_new_friend/,0.605,POSITIVE,0.997
09/15/2024,Intel is a good buy,64,https://www.reddit.com/r/wallstreetbets/comments/1fhi4n9/intel_is_a_good_buy/,0.627,POSITIVE,0.995
09/16/2024,Gold & Silver $$$ Inelastic Supply vs Asymmetric Demand $$$ Market Internals for Sunday Night September 15th 2024 Part 1,30,https://www.reddit.com/r/wallstreetbets/comments/1fhw3un/gold_silver_inelastic_supply_vs_asymmetric_demand/,0.545,POSITIVE,0.971
09/16/2024,NVDA before fed rate cut,21,https://www.reddit.com/r/wallstreetbets/comments/1fic6pn/nvda_before_fed_rate_cut/,0.49,NEGATIVE,0.877
09/16/2024,NVIDIA (NVDA) CEO Jensen Huang Points to $1 Trillion Opportunity for the Company,14,https://www.reddit.com/r/wallstreetbets/comments/1fiav3u/nvidia_nvda_ceo_jensen_huang_points_to_1_trillion/,0.619,POSITIVE,0.65
09/17/2024,Elon Musk And Oracle's Larry Ellison 'Begged' Jensen Huang For Nvidia GPUs At A Dinner: 'Please Take Our Money,302,https://www.reddit.com/r/wallstreetbets/comments/1fiviv4/elon_musk_and_oracles_larry_ellison_begged_jensen/,0.516,NEGATIVE,1.0
09/17/2024,"Well as they say, easy come easy go, and I lucked into getting there lol",6,https://www.reddit.com/r/wallstreetbets/comments/1fj033v/well_as_they_say_easy_come_easy_go_and_i_lucked/,0.514,POSITIVE,0.978
09/18/2024,The Pager Incident Is Bearish For US Tech Exports,75,https://www.reddit.com/r/wallstreetbets/comments/1fjo7cs/the_pager_incident_is_bearish_for_us_tech_exports/,0.523,NEGATIVE,0.85
09/18/2024,-1.5k portfolio> 3k,19,https://www.reddit.com/r/wallstreetbets/comments/1fjsyjr/15k_portfolio_3k/,0.518,POSITIVE,0.953
09/18/2024,The Turning of the Tide,43,https://www.reddit.com/r/wallstreetbets/comments/1fjw24q/the_turning_of_the_tide/,0.508,POSITIVE,0.831
09/18/2024,Basic DD,23,https://www.reddit.com/r/wallstreetbets/comments/1fk6vl8/basic_dd/,0.51,NEGATIVE,0.806
09/19/2024,"NIKE, Inc. Board of Directors Announces Long-Time Nike Veteran Elliott Hill to Return as President and Chief Executive Officer John Donahoe",37,https://www.reddit.com/r/wallstreetbets/comments/1fku26y/nike_inc_board_of_directors_announces_longtime/,0.527,NEGATIVE,0.7
09/23/2024,Nobody will read this title im gay AMZN,21,https://www.reddit.com/r/wallstreetbets/comments/1fniwev/nobody_will_read_this_title_im_gay_amzn/,0.502,NEGATIVE,0.999
09/23/2024,NVDA Crayons and Confirmation Bias to start the week,57,https://www.reddit.com/r/wallstreetbets/comments/1fnp4do/nvda_crayons_and_confirmation_bias_to_start_the/,0.522,NEGATIVE,0.998
09/24/2024,Microsoft stock receives rare downgrade as analyst says it's 'beholden' to Nvidia,183,https://www.reddit.com/r/wallstreetbets/comments/1fo71ef/microsoft_stock_receives_rare_downgrade_as/,0.584,NEGATIVE,0.998
09/24/2024,Selling Amazon - Jassy is a failure grasping at a scapegoat,100,https://www.reddit.com/r/wallstreetbets/comments/1fo999z/selling_amazon_jassy_is_a_failure_grasping_at_a/,0.507,NEGATIVE,0.996
09/24/2024,Nvidia CEO Jensen Huang Sold $713 Million of Stock. He’s Done—for Now,303,https://www.reddit.com/r/wallstreetbets/comments/1foh3ic/nvidia_ceo_jensen_huang_sold_713_million_of_stock/,0.634,NEGATIVE,0.999
09/24/2024,Morgan Stanley: NVIDIA To Earn $10 Billion In Revenue From Blackwell Chips Alone In Q4 2024,152,https://www.reddit.com/r/wallstreetbets/comments/1foiu41/morgan_stanley_nvidia_to_earn_10_billion_in/,0.532,POSITIVE,0.904
09/24/2024,30k NVDA Puts,235,https://www.reddit.com/r/wallstreetbets/comments/1fon2rl/30k_nvda_puts/,0.497,NEGATIVE,0.884
09/25/2024,"My Uncle’s Nvidia leaps have given him sleepless nights, Pressure, depression, anxiety, even 12Pack with a Cigar at 12A.M",36,https://www.reddit.com/r/wallstreetbets/comments/1fp9yvq/my_uncles_nvidia_leaps_have_given_him_sleepless/,0.542,NEGATIVE,0.989
09/25/2024,Nvidia stock edges up as industry report predicts 'unprecedented levels' of investment in AI data centers,48,https://www.reddit.com/r/wallstreetbets/comments/1fpeiwt/nvidia_stock_edges_up_as_industry_report_predicts/,0.594,NEGATIVE,0.999
09/25/2024,Intel Releases New AI Chips That Beat AMD In Performance and Nvidia in Cost,214,https://www.reddit.com/r/wallstreetbets/comments/1fpj03m/intel_releases_new_ai_chips_that_beat_amd_in/,0.663,POSITIVE,0.947
09/26/2024,How would Mag-7 stocks compare against their leverages over 1 year?,29,https://www.reddit.com/r/wallstreetbets/comments/1fpnn9z/how_would_mag7_stocks_compare_against_their/,0.628,NEGATIVE,0.737
09/26/2024,What can we conclude with this info?,29,https://www.reddit.com/r/wallstreetbets/comments/1fpq78h/what_can_we_conclude_with_this_info/,0.5,POSITIVE,0.85
09/26/2024,Don’t trade in the red - delete instead! Deleting the app works fellow regards,3,https://www.reddit.com/r/wallstreetbets/comments/1fpxg5c/dont_trade_in_the_red_delete_instead_deleting_the/,0.504,NEGATIVE,0.997
09/26/2024,Those buying Costco calls today are actually betting against Costco,36,https://www.reddit.com/r/wallstreetbets/comments/1fpzmxx/those_buying_costco_calls_today_are_actually/,0.529,NEGATIVE,0.969
09/26/2024,"Nvidia $80Put whale surfaces again 33,000 contracts",133,https://www.reddit.com/r/wallstreetbets/comments/1fq5xbt/nvidia_80put_whale_surfaces_again_33000_contracts/,0.534,NEGATIVE,0.586
09/26/2024,BULLISH,5,https://www.reddit.com/r/wallstreetbets/comments/1fq8w68/bullish/,0.515,NEGATIVE,0.998
09/27/2024,"Hey guys, got time to follow the East Asian stock market?",5,https://www.reddit.com/r/wallstreetbets/comments/1fqjivs/hey_guys_got_time_to_follow_the_east_asian_stock/,0.586,NEGATIVE,0.958
09/27/2024,What the impending stagflation in Russia (might) mean for you: An in-depth look,27,https://www.reddit.com/r/wallstreetbets/comments/1fr0abv/what_the_impending_stagflation_in_russia_might/,0.524,POSITIVE,1.0
09/28/2024,"A ‘iPhone of AI’ Makes No Sense. What Is Jony Ive Really Building along with Laurene Powell Jobs, OpenAI and Sam Altman? Why Apple is pissed",72,https://www.reddit.com/r/wallstreetbets/comments/1frj9q1/a_iphone_of_ai_makes_no_sense_what_is_jony_ive/,0.502,NEGATIVE,1.0
09/28/2024,Intel sleeps with the fishes,76,https://www.reddit.com/r/wallstreetbets/comments/1frknh6/intel_sleeps_with_the_fishes/,0.533,NEGATIVE,0.978
09/28/2024,Part 2: Archer Aviation is a Table Pounding Buy as the Grizzly Research Report Caused Over ~27% Short - Dare I say I stand with Cathie Wood,217,https://www.reddit.com/r/wallstreetbets/comments/1frqceh/part_2_archer_aviation_is_a_table_pounding_buy_as/,0.516,POSITIVE,0.974
09/29/2024,9/30 Nvidia is going to drop (repost with charting),147,https://www.reddit.com/r/wallstreetbets/comments/1frs73t/930_nvidia_is_going_to_drop_repost_with_charting/,0.532,NEGATIVE,1.0
09/30/2024,China AI Chip Leader Soars 20% Limit as Beijing Warns on Nvidia,54,https://www.reddit.com/r/wallstreetbets/comments/1fst8ap/china_ai_chip_leader_soars_20_limit_as_beijing/,0.569,NEGATIVE,0.988
10/01/2024,AI chipmaker Cerebras files for IPO to take on Nvidia - But 87% of its revenues have come from the UAE-G42 and U.S. Now Allows Nvidia Chips,42,https://www.reddit.com/r/wallstreetbets/comments/1ftc23m/ai_chipmaker_cerebras_files_for_ipo_to_take_on/,0.548,NEGATIVE,0.908
10/02/2024,SeptemBull,6,https://www.reddit.com/r/wallstreetbets/comments/1fu4lb6/septembull/,0.5,POSITIVE,0.998
10/02/2024,DD: Chinese stock market is undergoing a once in a life time generational wealth building opportunity.,267,https://www.reddit.com/r/wallstreetbets/comments/1fufj36/dd_chinese_stock_market_is_undergoing_a_once_in_a/,0.578,NEGATIVE,0.95
10/02/2024,It’s looking good for $NVDA,37,https://www.reddit.com/r/wallstreetbets/comments/1fuhr9v/its_looking_good_for_nvda/,0.525,POSITIVE,0.957
10/02/2024,"Nvidia just dropped a bombshell: Its new AI model is open, massive, and ready to rival GPT-4",376,https://www.reddit.com/r/wallstreetbets/comments/1furppm/nvidia_just_dropped_a_bombshell_its_new_ai_model/,0.575,POSITIVE,0.82
10/03/2024,Nvidia CEO Jensen Huang says demand for next-generation Blackwell AI chip is 'insane',147,https://www.reddit.com/r/wallstreetbets/comments/1fv9gqy/nvidia_ceo_jensen_huang_says_demand_for/,0.58,NEGATIVE,0.998
10/03/2024,Jensen Huang On Transformative Partnership With Accenture: AI As 'Digital Employees' Will Revolutionize Productivity - NVDA,12,https://www.reddit.com/r/wallstreetbets/comments/1fve64h/jensen_huang_on_transformative_partnership_with/,0.528,POSITIVE,0.994
10/03/2024,"NVDA 10 more days like this, 🙏🏼",152,https://www.reddit.com/r/wallstreetbets/comments/1fvi2io/nvda_10_more_days_like_this/,0.503,NEGATIVE,0.979
10/04/2024,US SEC and DOJ Backs Nvidia Investor Lawsuit on Crypto Sales Misrepresentation,1,https://www.reddit.com/r/wallstreetbets/comments/1fw00up/us_sec_and_doj_backs_nvidia_investor_lawsuit_on/,0.573,NEGATIVE,0.997
10/04/2024,Is there any justification for AMD’s stock price,34,https://www.reddit.com/r/wallstreetbets/comments/1fw08un/is_there_any_justification_for_amds_stock_price/,0.623,NEGATIVE,0.996
10/04/2024,In INTC I trust,215,https://www.reddit.com/r/wallstreetbets/comments/1fw14ev/in_intc_i_trust/,0.51,POSITIVE,0.999
10/04/2024,NVIDIA calls go BRRRRR,10,https://www.reddit.com/r/wallstreetbets/comments/1fw2xg4/nvidia_calls_go_brrrrr/,0.549,NEGATIVE,0.991
10/04/2024,Being called out for dumping Nvidia right before it’s massive run,132,https://www.reddit.com/r/wallstreetbets/comments/1fwac09/being_called_out_for_dumping_nvidia_right_before/,0.531,NEGATIVE,1.0
10/05/2024,Intel stock Short term and long-term pros and cons,26,https://www.reddit.com/r/wallstreetbets/comments/1fwjhl5/intel_stock_short_term_and_longterm_pros_and_cons/,0.601,POSITIVE,0.589
10/05/2024,Nvidia CEO's bombshell raises the bar for the stock,86,https://www.reddit.com/r/wallstreetbets/comments/1fx1mf4/nvidia_ceos_bombshell_raises_the_bar_for_the_stock/,0.618,POSITIVE,0.951
10/06/2024,Help me understand Ferrari as an investment,314,https://www.reddit.com/r/wallstreetbets/comments/1fxochv/help_me_understand_ferrari_as_an_investment/,0.525,POSITIVE,0.992
10/06/2024,Despite ridiculous P/E’s the risk of not buying outweighs that of buying.,86,https://www.reddit.com/r/wallstreetbets/comments/1fxog3z/despite_ridiculous_pes_the_risk_of_not_buying/,0.508,NEGATIVE,0.926
10/07/2024,NVIDIA's Jensen Huang CES 2025 keynote confirmed for January 6: possible RTX 50 series reveal - VideoCardz.com - This guy sleeps 3 hours,21,https://www.reddit.com/r/wallstreetbets/comments/1fybvy9/nvidias_jensen_huang_ces_2025_keynote_confirmed/,0.518,NEGATIVE,1.0
10/07/2024,Just exited from NVIDIA,113,https://www.reddit.com/r/wallstreetbets/comments/1fybwfq/just_exited_from_nvidia/,0.585,NEGATIVE,0.973
10/07/2024,Is INTC undervalued ?,107,https://www.reddit.com/r/wallstreetbets/comments/1fye8fl/is_intc_undervalued/,0.505,NEGATIVE,0.913
10/07/2024,Today is a RED day... But let's be thankful for NVDA & NVDL,16,https://www.reddit.com/r/wallstreetbets/comments/1fye983/today_is_a_red_day_but_lets_be_thankful_for_nvda/,0.528,POSITIVE,0.969
10/07/2024,Long-time $AMD Holder (Cost Basis $19.04) Starting to Sell - Anyone Else Disappointed in the Stock in 2024?,8,https://www.reddit.com/r/wallstreetbets/comments/1fykaa3/longtime_amd_holder_cost_basis_1904_starting_to/,0.604,NEGATIVE,1.0
10/07/2024,Inflection AI Enterprise offering ditches Nvidia GPUs for Intel's Gaudi 3,8,https://www.reddit.com/r/wallstreetbets/comments/1fylnp8/inflection_ai_enterprise_offering_ditches_nvidia/,0.567,NEGATIVE,1.0
10/08/2024,"Nvidia's $21.9 Billion Profit Surge: Smashes Rivals, Reclaims $3.19 Trillion Valuation Amid AI Boom",11,https://www.reddit.com/r/wallstreetbets/comments/1fys7wb/nvidias_219_billion_profit_surge_smashes_rivals/,0.561,POSITIVE,0.784
10/08/2024,"Why I think Intel is a Misunderstood, Undervalued Play – A Bet on 18A (+EV DD)",90,https://www.reddit.com/r/wallstreetbets/comments/1fyvlo8/why_i_think_intel_is_a_misunderstood_undervalued/,0.517,NEGATIVE,0.999
10/08/2024,Bought the dip part 4,9,https://www.reddit.com/r/wallstreetbets/comments/1fyxjy3/bought_the_dip_part_4/,0.528,POSITIVE,0.962
10/08/2024,MSFT deployed NVIDIA Blackwell chip,144,https://www.reddit.com/r/wallstreetbets/comments/1fz1zdh/msft_deployed_nvidia_blackwell_chip/,0.549,POSITIVE,0.897
10/08/2024,NVDA bears being squeezed to death pucker-factor lvl10 NVDA all time highest weekly close ever,17,https://www.reddit.com/r/wallstreetbets/comments/1fz9w67/nvda_bears_being_squeezed_to_death_puckerfactor/,0.505,NEGATIVE,0.884
10/08/2024,Nvidia gain let go,21,https://www.reddit.com/r/wallstreetbets/comments/1fzd8do/nvidia_gain_let_go/,0.555,NEGATIVE,0.999
10/09/2024,Hit 200k today. Also fuk u to everyone who called me regarded for buying Nvidia earnings. 65% return ytd shares no options.,337,https://www.reddit.com/r/wallstreetbets/comments/1fzh325/hit_200k_today_also_fuk_u_to_everyone_who_called/,0.555,NEGATIVE,0.997
10/09/2024,TSMC Earnings Ahead: Could this cause NVDA to reach new highs?,14,https://www.reddit.com/r/wallstreetbets/comments/1g05kre/tsmc_earnings_ahead_could_this_cause_nvda_to/,0.583,POSITIVE,0.808
10/10/2024,"‘We Underestimated’ Nvidia, Says $50 Billion Manager Impax",106,https://www.reddit.com/r/wallstreetbets/comments/1g0jk2x/we_underestimated_nvidia_says_50_billion_manager/,0.556,NEGATIVE,0.643
10/10/2024,womp womp (started early july),12,https://www.reddit.com/r/wallstreetbets/comments/1g0rb9m/womp_womp_started_early_july/,0.522,POSITIVE,0.911
10/10/2024,NVIDIA IS TRASH TIER,44,https://www.reddit.com/r/wallstreetbets/comments/1g0sgzy/nvidia_is_trash_tier/,0.555,NEGATIVE,1.0
10/11/2024,Overstock.com (BYON) - DD - Bath Towels Are Back In Stock,46,https://www.reddit.com/r/wallstreetbets/comments/1g19wop/overstockcom_byon_dd_bath_towels_are_back_in_stock/,0.562,NEGATIVE,0.835
10/11/2024,Got extremely lucky,12,https://www.reddit.com/r/wallstreetbets/comments/1g1c1b4/got_extremely_lucky/,0.503,POSITIVE,0.995
10/12/2024,NVIDIA 🚀,122,https://www.reddit.com/r/wallstreetbets/comments/1g2aw2j/nvidia/,0.585,NEGATIVE,0.624
10/13/2024,Intel CEO: Intel foundry business now have 12 active customer engagements,131,https://www.reddit.com/r/wallstreetbets/comments/1g2pkxs/intel_ceo_intel_foundry_business_now_have_12/,0.584,POSITIVE,0.997
10/13/2024,Strong AI and Semiconductor weeks ahead,42,https://www.reddit.com/r/wallstreetbets/comments/1g30ztz/strong_ai_and_semiconductor_weeks_ahead/,0.602,NEGATIVE,0.949
10/14/2024,"53% Gains, Still Too Dumb to Sell 🚀🦍",151,https://www.reddit.com/r/wallstreetbets/comments/1g3gizc/53_gains_still_too_dumb_to_sell/,0.516,NEGATIVE,0.998
10/14/2024,Western Digital Corporation jumps on NVIDIA Rocket?!🚀🚀,2,https://www.reddit.com/r/wallstreetbets/comments/1g3h79u/western_digital_corporation_jumps_on_nvidia_rocket/,0.552,NEGATIVE,1.0
10/14/2024,Fed up of people complaining about markets ATHing,30,https://www.reddit.com/r/wallstreetbets/comments/1g3msdg/fed_up_of_people_complaining_about_markets_athing/,0.518,NEGATIVE,0.999
10/14/2024,I'm not used to seeing this color,11,https://www.reddit.com/r/wallstreetbets/comments/1g3pur5/im_not_used_to_seeing_this_color/,0.614,NEGATIVE,1.0
