date of comment,main comment,comment,depth,PTR Sentiment,Flair Outlook,Flair Sentiment
,nan,GPT-REEEE,0,0.5,NEGATIVE,0.999
,nan,"Aramco controls all oil and gas production in Saudi Arabia. Aramco has been around for decades, but it was privately held by the Saudi government and royal family during that time. It was always bigger than Apple, but wasn't traded as a stock until recently.",0,0.535,POSITIVE,0.986
,nan,"This is the thing, cant believe ppl dont think/know Aramco was always way larger than any other company, they just weren’t public",1,0.56,NEGATIVE,0.999
,nan,"Basically it still is, the public float is super small, like 1.5% - IMO, it should not be on this list.",1,0.506,NEGATIVE,1.0
,nan,"Nothing from China should be on this list either. Just list the total government assets of China if you want to include them as a ""company.""",2,0.585,NEGATIVE,1.0
,nan,Yep 1st thing i learned as an intern at Chevron 20 years ago when they were making like 11k a second and compared to Aramco they were like peasants.,1,0.514,POSITIVE,0.634
,nan,"You obviously have no idea how large Aramco is. It has been the world's largest privately owned company for 50+ years. Aramco's immense proven oil and gas reserves, land holdings, refineries, pipelines, and other assets are incredibly vast. The only other company that rivaled Aramco in size was China Resources, which was broken up into about a dozen mega companies.Apple achieved all of its big success in the 2000s. Apple almost went bankrupt more than once in the 1990s. In contrast, Aramco has been the world's largest energy company since the 1960s.",1,0.567,POSITIVE,0.995
,nan,"You obviously have no idea how large Aramco is. It has been the world's largest privately owned company for 50+ years. Aramco's immense proven oil and gas reserves, land holdings, refineries, pipelines, and other assets are incredibly vast. The only other company that rivaled Aramco in size was China Resources, which was broken up into about a dozen mega companies.Apple achieved all of its big success in the 2000s. Apple almost went bankrupt more than once in the 1990s. In contrast, Aramco has been the world's largest energy company since the 1960s.",2,0.567,POSITIVE,0.995
,nan,Not actually true but seems like starting your company name with A = recipe for success?4/5 biggest market caps agree!,0,0.579,NEGATIVE,0.997
,nan,Thats why i'm naming my company Aardvark,1,0.734,POSITIVE,0.901
,nan,I named my Wifi this so it shows up top of the list every time. Funny story my wife did it and it’s Aardwark but hey,2,0.513,POSITIVE,0.992
,nan,"Gonna name mine Aaardvark for A+ Aardvark Consulting, LLC",2,0.504,POSITIVE,0.999
,nan,Damnit Microsoft why do you got to ruin everything.,1,0.512,NEGATIVE,0.998
,nan,Bear With An Identity Crisis,0,0.493,NEGATIVE,0.891
,nan,"Saudi Aramco doesn’t count it’s not a company, it’s a publicly listed country",0,0.577,NEGATIVE,0.948
,nan,Walmart only grew 10% in 20 years?,0,0.577,NEGATIVE,1.0
,nan,They had massive growth in the late 90's of 5x over 4 years from '96-'00 that peaked in 2000 and then went down and sideways for 18 years. They were also paying a dividend that steadily increased to 8x what it was back in 2000.https://stockanalysis.com/stocks/wmt/market-cap/,1,0.565,NEGATIVE,0.996
,nan,That was also the negative press period. Notice how almost all negativity surrounding Walmart online has disappeared. That isn't an accident,2,0.543,NEGATIVE,0.999
,nan,I imagine there were lots of dividend payments in those 20 years,1,0.519,POSITIVE,0.602
,nan,Saudi Aramco XD probably just a money laundering shell company,0,0.597,NEGATIVE,0.999
,nan,"Based on what's going on around me, Dollar General will be #1 in 20 years",0,0.547,POSITIVE,0.998
,nan,"Dollar General are proliferating like locusts in a Biblical plague. I walked out a Dollar General Store in Texas and saw another one directly across the highway. It was a big highway with tons of stores in the area, but why would there be two? LOLI immediately assumed this was the Gate to Hell. Satan could appear at any moment, probably eating Skittles bought at Dollar General.",1,0.512,NEGATIVE,1.0
,nan,Wow Walmarts market cap only increased by 10% in 22 years,0,0.617,NEGATIVE,0.999
,nan,Armaco rev is the entire countries revenue,0,0.528,POSITIVE,0.993
,nan,*public company,0,0.875,POSITIVE,0.997
,nan,Curious what private company has a shot of being as big/valuable as Saudi Aramco or AAPL?,1,0.594,NEGATIVE,0.966
,nan,DOD,2,0.5,NEGATIVE,0.964
,nan,Wtf where is bbby and gme?,0,0.5,NEGATIVE,1.0
,nan,GME,1,0.5,NEGATIVE,1.0
,nan,Because amc is for losers,1,0.497,NEGATIVE,1.0
,nan,Because amc is for losers,2,0.497,NEGATIVE,1.0
,nan,If you're going to compare Aramco to regular companies you might as well toss the US economy and other countries into the rankings too.,0,0.535,NEGATIVE,0.959
,nan,Aramco is way bigger. But only a small part of aramco is listed and traded.,0,0.514,NEGATIVE,0.903
,nan,True. But the market cap listed here is taking the publicly traded value and applying it to the whole company.,1,0.595,POSITIVE,0.651
,nan,Aramco’s valuation is a house of cards,0,0.504,POSITIVE,0.654
,nan,I'd short it.,1,0.505,NEGATIVE,0.997
,nan,On a badly regulated market it’s listed on where the Saudi government has an interest in them succeeding? You must have grandes cojones,2,0.528,NEGATIVE,0.717
,nan,I'll buy big calls on it,3,0.573,POSITIVE,0.985
,nan,Where’s BBBY?,0,0.5,NEGATIVE,0.96
,nan,Taiwan number 1(3),0,0.49,POSITIVE,0.994
,nan,"Ah yes, Aramco - the most innovative company in the world! They completely changed the game of having oil under your land. Very impressive feat of engineering.",0,0.575,POSITIVE,0.998
,nan,Not news. They swap often. Who cares.,0,0.521,NEGATIVE,1.0
,nan,"Owned by Saudi Government, lovely",0,0.521,POSITIVE,0.974
,nan,Seeikg Nokia there makes me sad.,0,0.551,NEGATIVE,0.942
,nan,"Interesting as I just read a totally unrelated article talking about how the Saudi's are likely lying about how much oil is left and how them selling shares in Aramco is a sign of the decline following peak oil, who knows?",0,0.511,NEGATIVE,0.998
,nan,"Agreed. If your shares hold true value there's not much need to sell them, especially if you're already rich like the people were talking about",1,0.515,POSITIVE,0.962
,nan,Haven’t the Saudi’s been lying about how much oil is left for decades? It’s likely part of OPEC membership at this point.,1,0.512,POSITIVE,0.695
,nan,Oil still sells nicely.,0,0.525,POSITIVE,0.997
,nan,According to those 2 graphs it never was...,0,0.53,NEGATIVE,1.0
,nan,Poor intel,0,0.55,NEGATIVE,1.0
,nan,Poor GE 👀,1,0.5,NEGATIVE,1.0
,nan,Lol China entered and Japan exited. Who’s gonna get replaced in 2042,0,0.518,NEGATIVE,0.894
,nan,Microsoft might be last man standing in 50 years.,0,0.544,NEGATIVE,0.986
,nan,General Electric tho.,0,0.51,POSITIVE,0.582
,nan,"Apple is no longer the largest company in the world.Then again it never was. Market Cap != Company size/Company revenue.A lot of those ""smaller"" companies on that list are killing ""bigger"" ones",0,0.655,NEGATIVE,0.995
,nan,We're simps for Saudi oil,0,0.524,NEGATIVE,0.972
,nan,i would not consider aramco a public company...,0,0.657,NEGATIVE,0.882
,nan,You don't know the size of Saudi family.,1,0.522,NEGATIVE,0.846
,nan,Nobody profits from war quite like the Saudi oil companies,0,0.528,NEGATIVE,0.994
,nan,I grew up watching Peter North,1,0.558,POSITIVE,0.976
,nan,Good to remember for the next one,1,0.568,POSITIVE,0.997
,nan,fuck aramco,0,0.495,NEGATIVE,0.999
,nan,🔜 gmerica 🫡,1,0.5,NEGATIVE,0.997
,nan,They are again as of last week or so,0,0.63,NEGATIVE,0.969
,nan,Remember GE?,0,0.5,POSITIVE,0.511
,nan,Pepperidge Farm remembers.,1,0.5,POSITIVE,0.992
,nan,Oh I member,1,0.505,POSITIVE,0.935
,nan,fucking saudis,0,0.5,NEGATIVE,0.998
,nan,Saw deez nuts.,1,0.5,POSITIVE,0.572
,nan,Underrated comm,1,0.5,POSITIVE,0.957
,nan,"Aramco IPO was a mistake from the beginning and it's real value is unknown!!!The stock it's self is boring,,,the good thing every time it gets near it's ipo price someone push it up",0,0.544,NEGATIVE,1.0
,nan,ya we know japan is fked lol,0,0.519,POSITIVE,0.765
,nan,If those top 5 weren't sucking on the government's teats they wouldn't be half that big...,0,0.504,NEGATIVE,0.532
,nan,"aramco was at 5000 few years ago. so apple never was, but now on the good way to be first.",0,0.539,POSITIVE,0.999
,nan,"I find it completely retard when people starts comparing a company’s market cap on a given day. In reality, none of the companies are that worth, it’s all based on speculation and sentiments. One day, market likes MBS and other day Tim Cook. It’s that simple.",0,0.535,NEGATIVE,1.0
,nan,Give it six months. Oil being back is only temporary,0,0.531,NEGATIVE,0.986
,nan,"Good for us plebs not able to trade Aramco, a new ETF will follow it I think",0,0.57,POSITIVE,0.761
,nan,The oracle of Omaha is killing it 💪🏼,0,0.5,NEGATIVE,0.999
,nan,I'm shock not to find apple in the list from10 yrs ago. Crazy...,0,0.558,POSITIVE,0.987
,nan,The top list is not from 10 years ago. You belong here.,1,0.538,POSITIVE,0.998
,nan,Lmao. 🤭,2,0.5,NEGATIVE,0.766
,nan,When it comes to the stock market europe is really kind of pathetic :-(,0,0.609,NEGATIVE,1.0
,nan,I wonder how Visa got so big.,0,0.517,NEGATIVE,1.0
,nan,"Everytime someone buys anything, they make 1.5%",1,0.504,NEGATIVE,0.975
,nan,Seems like a pretty fuckin nice deal.,2,0.513,POSITIVE,0.997
,nan,A few days ago I bought 2 stocks of Visa,1,0.541,NEGATIVE,0.811
,nan,One of my best stocks,1,0.598,POSITIVE,0.999
,nan,Where is Samsung?,0,0.495,NEGATIVE,0.952
,nan,"Keep it easy, 10 years and Aramco is gone.",0,0.519,POSITIVE,0.959
,nan,Take aramco out this list Pathetic,0,0.505,NEGATIVE,1.0
,nan,"all Tim Cook has to do is stone women for being raped like they do in Saudi and Apple, too, could become valuable again.",0,0.51,NEGATIVE,0.978
,nan,"Chinese tech still there despite being shafted royalty by CCP.Also PnG, JnJ and United health are nice surprise.",0,0.527,POSITIVE,0.98
,nan,It means only one thing… short everything with leverage 💥🚀🚀🌚🌚,0,0.51,NEGATIVE,0.852
,nan,Thanks uncle Joe,0,0.508,POSITIVE,0.987
,nan,Sleepy joe is blocking route 12,1,0.5,NEGATIVE,0.99
