date of comment,main comment,comment,depth,sentiment,PTR Sentiment,Flair Outlook,Flair Sentiment
,,GPT-REEEE,0,,0.5,NEGATIVE,0.999
,,Puts cooked,0,,0.492,POSITIVE,0.999
,,Never short Jensen,0,,0.495,POSITIVE,0.771
,,"Jensen stops selling, shares start sailing",1,,0.503,NEGATIVE,0.999
,,Bro is absolutely cooked,2,,0.5,POSITIVE,1.0
,,r.i.p,3,,0.518,NEGATIVE,0.624
,,30k gone just like that,0,,0.498,POSITIVE,0.918
,,I bought more shares. Your puts are cooked,0,,0.506,POSITIVE,1.0
,,I’m leveraged on NVD thinking this popped a bit too much today,1,,0.521,NEGATIVE,0.999
,,It passed resistance and settled. Algos buy upwards. Be careful,2,,0.528,NEGATIVE,1.0
,,Lol already sold at open and jumped in NVDX - not going to stand in the way of a freight train.,3,,0.517,NEGATIVE,0.997
,,Thank god that I’m in calls,0,,0.504,NEGATIVE,0.797
,,"On Call with your banker , because you’re broke hahahaha sorry",1,,0.503,NEGATIVE,0.999
,,"Sold calls for 30% at open, averaged into puts now I’m up 80%",2,,0.509,NEGATIVE,0.999
,,Oh dear,0,,0.5,NEGATIVE,0.929
,,I loaded more yesterday and today. Puts will be smoked. She’s headed to 130 test 135.,0,,0.522,POSITIVE,0.979
,,If it hits 130 I'll buy you a drink.,1,,0.554,POSITIVE,0.893
,,"If it hits that, am getting a real leather jacket.",2,,0.512,NEGATIVE,0.709
,,Sounds good. Just give it a week or so. Old Fashioned with Woodford Reserve. Double oaked,2,,0.53,POSITIVE,0.995
,,I think your cooked brother is certain these puts will pay!,1,,0.5,NEGATIVE,0.932
,,,2,,,,
,,Cooked,2,,0.5,POSITIVE,0.999
,,cant wait to watch these print in spirit,0,,0.505,POSITIVE,0.998
,,Lol. Maybe micron will go full cuck and save your puts.,0,,0.501,NEGATIVE,0.513
,,"Ima be real, if somehow Micron goes down over earnings when it's 100% gona beat this is the dumbest fucking market ever. I get going down from 140-160 range, but in the low 90s?Dumb as shit. That being said I still closed all my positions today because im scared as shit.",1,,0.557,NEGATIVE,1.0
,,this comment didnt turn out well,1,,0.539,NEGATIVE,0.998
,,"Got puts as well. But earlier, around 11:40AM. Got fucked. Then came close to break even and the mofo sky rocketed again. Good news is I’ve got till 10/18. Bad news…I am already shitting myself as I am down. Worse news: fucking thing is going up after market and there r a lot of liquidity sitting at the 122-123 level.",0,,0.521,NEGATIVE,1.0
,,GotBannedAgain is losing again?,1,,0.49,POSITIVE,0.777
,,Yeah the whole chip sector based out and we are in a bull market. That was a buy shares opportunity. Don’t fight the market or fed,1,,0.565,POSITIVE,0.904
,,How much are you down,1,,0.525,NEGATIVE,0.845
,,"Bought 10 contracts: 107P 10/18 $115 per contract. As of right now, I am down about $250; according to Robinhood contracts r at about $90.",2,,0.549,NEGATIVE,0.982
,,Not bad,3,,0.49,NEGATIVE,0.818
,,What exactly is the issue with lots of liquidity at 122-123. How does that affect things,1,,0.5,NEGATIVE,0.984
,,"They bought puts. When the price enters these levels, volatility may decrease. It probably won't be enough to justify an IV crush because it's short term, but, price getting caught up at these levels will destroy out of the money puts.",2,,0.521,NEGATIVE,1.0
,,"Good luck. Waiting for my TQQQ to print, looks like it’s breaking out even if slowly. Nasdaq closed above that August peak.",1,,0.509,NEGATIVE,1.0
,,U r gonna bank brother. Fucking NVDA is up almost a $1. It’ll keep going up tonight.,2,,0.513,NEGATIVE,1.0
,,get rekt gaybear,1,,0.508,NEGATIVE,0.964
,,Meet me behind Wendy’s?,2,,0.507,NEGATIVE,0.708
,,They bought calls so you better get their meal ready.,3,,0.527,NEGATIVE,0.88
,,Fuck. I wish I wasn't gay like you and op. Cept I have tsla puts. Still fukt,1,,0.5,NEGATIVE,1.0
,,,0,,,,
,,These are cooked i can confirm,0,,0.5,POSITIVE,0.996
,,"Don't fight the leather jacket. You simply can not win, it is far too powerful",0,,0.506,NEGATIVE,0.994
,,Anddd its gone,0,,0.5,NEGATIVE,0.69
,,I’m so sorry for your loss.  ,0,,0.503,POSITIVE,0.836
,,I wouldn’t short the stock at this moment. The risk / reward isn’t worth it.. It also looks like it definitely has more steam up to 122.60.Not financial adviseRegardless.. Goodluck and god speed! I love a good yolo trade. I’ve burnt several accounts so far lol,0,,0.534,NEGATIVE,1.0
,,quaint slim payment pot mourn stupendous oatmeal coordinated squeamish innocent,0,,0.499,NEGATIVE,0.949
,,Maybe they'll turn green for a few minutes at open. ☺️,0,,0.511,NEGATIVE,0.982
,,Rip,0,,0.495,POSITIVE,0.982
,,Atleast it is not 600k,0,,0.5,NEGATIVE,1.0
,,This didn’t age well,0,,0.54,NEGATIVE,1.0
,,U fukt up,0,,0.485,NEGATIVE,0.985
,,I got some 120 puts too...after picking up some Feb 2025 120 calls 🤣,0,,0.502,POSITIVE,0.777
,,RIP,0,,0.495,POSITIVE,0.982
,,It is about that time,0,,0.585,NEGATIVE,0.953
,,Sorry dude those puts are cooked well done.,0,,0.52,NEGATIVE,0.979
,,"Your cooked, I wish the best regard.",0,,0.527,POSITIVE,1.0
,,SOMEONE HATES MONEY,0,,0.51,NEGATIVE,0.998
,,The amount of bag holders burning this guy has me eyeing puts now,0,,0.499,NEGATIVE,0.992
,,any thoughts behind it or just sending it?,0,,0.508,NEGATIVE,0.986
,,Under $120. These are printing it seems.,0,,0.5,NEGATIVE,0.972
,,FK im on the opposite of this trade. I sold those puts to you,0,,0.509,NEGATIVE,0.999
,,"There is a chance it might print……Im saying this because mine will expire this 9/27 tooIf it doesn't print, then we got a shift to pick up at Wendy, and if it does, then the call holder got a hotdog to suck behind a Wendy",0,,0.501,NEGATIVE,1.0
,,All about timing,0,,0.5,POSITIVE,0.999
,,"RemindMe! 3 daysHats off to you, regard",0,,0.502,POSITIVE,0.848
,,"Could go up, could go down!Remindme 68h",0,,0.513,POSITIVE,0.605
,,Balls of steel...Sailing in the reverse wind direction! Gamble! Hope you should win. All the best. Reply to this if you win my friend.,0,,0.52,POSITIVE,0.999
,,lol this just double bottomed Aug into Sep. 50 bps cut and 50B buy back. NVDA about to retest highs. This might have been the move a month ago buts it not the move now,0,,0.518,NEGATIVE,1.0
,,"damnit I did the same, looks like I'm cooked",0,,0.587,POSITIVE,0.826
,,"Well, this won't end well.",0,,0.614,NEGATIVE,0.996
,,Remindme in 10 hours,0,,0.51,POSITIVE,0.989
,,"Now got FED support behind , why still put ? Share market will up to new high record before election",0,,0.585,POSITIVE,0.65
,,Ur hedging a long position right? Right?,0,,0.54,NEGATIVE,0.83
,,money printer goes brrrrrrrr?,0,,0.51,NEGATIVE,0.993
,,Why don’t you donate those money to a charity like cancer research or something?,0,,0.504,NEGATIVE,0.989
,,Ya dun goof'd,0,,0.508,POSITIVE,0.999
,,RIP,0,,0.495,POSITIVE,0.982
,,"That’s a pure gamble with such a short DTE. Maybe some profit taking later in the week will save you but that’s pretty risky, given how unpredictable this stock has been over the past 4-5 months.",0,,0.545,NEGATIVE,0.999
,,welp rip your port lol,0,,0.501,NEGATIVE,0.992
,,Down about 50% this morning,0,,0.515,NEGATIVE,0.962
,,RIP to that $30k OP. I'll take a frosty please.,0,,0.501,NEGATIVE,0.99
,,!GUH,0,,0.5,POSITIVE,0.875
,,Aged like milk,0,,0.498,NEGATIVE,1.0
,,Op can we get an update LOL,0,,0.508,NEGATIVE,0.873
,,Only a hope and a prayer can save this guy now,0,,0.501,POSITIVE,0.992
,,"Better pray for bad PCE, GDP, unemployment claims, and durable goods (if that even matters)",0,,0.504,NEGATIVE,1.0
,,"I know y’all degens in here but Jesus man, at least get a bit more theta lol",0,,0.512,POSITIVE,0.897
,,Portfolio update please,0,,0.52,NEGATIVE,0.834
,,"his 200 contracts are currently worth between $2,006-2,206. he has lost roughly $27k if he is still holding.",1,,0.513,POSITIVE,0.717
,,"Mentally ill, do calls. ",0,,0.507,NEGATIVE,1.0
,,Not gonna work,0,,0.508,NEGATIVE,0.999
,,Fully regarded.,0,,0.508,POSITIVE,0.999
,,"Yikes. If these go green I’d dump them asap, but hey that’s just me. I don’t fight the green monster.",0,,0.502,NEGATIVE,0.999
,,"Long as it keeps failing at 121.80, it could good money. This one is down to the wire. 😬",0,,0.539,NEGATIVE,0.999
,,Failing. For now.,1,,0.5,NEGATIVE,1.0
,,"Dang…I got jacked for my calls last week, and now it is rising this week. I definitely wouldn’t save there isn’t a chance this flatlines tomorrow, 😝. Or NVDA could jump 5%again",0,,0.525,NEGATIVE,1.0
,,"Lol I'd say likely down 1% or flat tomorrow. But with any catalyst overnight you lose it all before open. Dumb money indeed, even if you get lucky",0,,0.505,NEGATIVE,1.0
,,How in the world does a CEO saying he’s done selling a stock make it soar? Pretty sure his transactions weren’t hurting the SP much.,0,,0.546,POSITIVE,0.869
,,You answered your own question,1,,0.502,POSITIVE,0.952
,,"It went up because JPM reported that Blackwell will generate $10 billion in revenue in Q4, not because Jensen stopped selling",1,,0.52,NEGATIVE,0.858
