date of comment,main comment,comment,depth,PTR Sentiment,Flair Outlook,Flair Sentiment
,nan,GPT-REEEE,0,0.5,NEGATIVE,0.999
,nan,Take profits so you won’t end up staying with $18,0,0.511,NEGATIVE,0.995
,nan,"he's actually -$15,000 it appears. he better take all that money out besides maybe $1k-$2k or he is gonna be up shit creek",1,0.51,NEGATIVE,1.0
,nan,12k in total lol,2,0.507,POSITIVE,0.945
,nan,"That’s the cash balance lmao, can you also explain the Market Value and Net Account Value for me?Edit: 39,550.75 (stonks) -15363.83 (freedom units on margin) =?",2,0.573,NEGATIVE,0.982
,nan,I know. So if he has $18 in his checking and -15k cash in portfolio he's actually in the negative until he sells,3,0.516,NEGATIVE,0.981
,nan,Trading on margin,4,0.52,POSITIVE,0.516
,nan,That’s what I thought,5,0.5,NEGATIVE,0.527
,nan,"Market value: the total value of all his holding, in this case 100% equity. This is what all his stocks are worth if he sells right now for market price.Net account value: the actual value of his account. Market value and the loan he took from his broker to purchase these equity. Most likely, he had some money in the account, then requested margin and used borrowed money to buy more stocks.Not sure why though. The interest on margin is pretty high.",3,0.56,POSITIVE,0.896
,nan,"Why’s it show negative, why does it even allow you to do that?",2,0.5,NEGATIVE,0.999
,nan,"When you buy stocks or options using margin, your balance will show as a negative number which isn’t necessarily a bad thing. It just shows how much money you need to either deposit or earn from trades that’ll lower that balance number. Because when you buy using margin, you’re borrowing money from the brokerage and you have to pay it back. If you’re smart with it then using margin is actually pretty helpful",3,0.511,NEGATIVE,0.97
,nan,Being in debt is a terrible idea. The entire point of investing is to be independent imo lol,4,0.504,NEGATIVE,0.998
,nan,The whole point of margin is to increase the profit you make from a stock going up. I think it’s fine especially if you’re buying into a good company and plan on holding the shares for a long time. You can also write off the interest you accrue on your tax returns and if you really wanna get fancy you can 50 shares of a stock and buy another 50 shares on margin and sell a covered call every week and it would pay down the margin balance for you instead of using your own money 😏😎,5,0.567,NEGATIVE,0.888
,nan,This is a gambling subreddit.,5,0.497,NEGATIVE,0.996
,nan,Ik lol I was just explaining the concept of margin for some people that wasn’t aware,6,0.498,NEGATIVE,0.955
,nan,"Its margin, it's basically a loan given by the platform. ",3,0.507,NEGATIVE,0.998
,nan,It’s the holidays. Temporary retail job and no family time can help float OP while waits on his tenbaggers to cash. Will look good on the resume,2,0.513,NEGATIVE,0.983
,nan,This is the much faster way to Wendys compared to after college,1,0.515,POSITIVE,0.993
,nan,"Came here to say this, scrape money off the top and stash it, leave money in the game.",1,0.516,NEGATIVE,0.999
,nan,Oh no,0,0.5,NEGATIVE,0.994
,nan,Let me guess... Finance major?,0,0.51,NEGATIVE,0.997
,nan,It was the LuLu & heavy tech that gave it away,1,0.518,NEGATIVE,0.985
,nan,Hey hey I’m all in tech too don’t lump me with him I feel offended,2,0.51,NEGATIVE,0.964
,nan,"Yes, dual finance/accounting major lol",1,0.508,POSITIVE,0.99
,nan,What is your name in Webull will follow you,2,0.503,POSITIVE,0.995
,nan,Is Webull Instagram with stonks now?,3,0.5,NEGATIVE,0.996
,nan,"Pretty much, especially with the comments section",4,0.512,POSITIVE,0.991
,nan,yes,3,0.5,POSITIVE,0.992
,nan,You are trading on margin?,0,0.52,NEGATIVE,0.947
,nan,Yuh,1,0.5,POSITIVE,1.0
,nan,Guh,2,0.5,NEGATIVE,0.501
,nan,Bruh,3,0.5,POSITIVE,0.534
,nan,Duh.,4,0.5,POSITIVE,0.997
,nan,Huh?,6,0.5,NEGATIVE,0.968
,nan,"Cash out now then, you’re fucked if this goes down even a little.",2,0.503,NEGATIVE,0.63
,nan,"Hi this is Charles with Acme Debt Collections, this call is monitored and recorded for quality assurances.",2,0.509,POSITIVE,0.862
,nan,"bro, stop",2,0.5,NEGATIVE,0.958
,nan,Oh no.deep breathOooohhh nooooo,2,0.502,POSITIVE,0.73
,nan,Take your profits before you lose it and owe them money…,2,0.499,NEGATIVE,0.968
,nan,What does that mean?,1,0.505,NEGATIVE,0.941
,nan,"OP's actual cash invested is $12.2k + he took $15.3k margin. He has $12k in unrealized gains right now, making the total value of his holdings $39.5k currently.If he cashes out now, he will be basically making a 100% return — $12k gains on $12.2k invested.If the margin requirement of his current holdings is something like 0.4 (i.e., he is allowed to use a 2.5x margin) and his current holdings somehow drop by $15k here, he is gonna get margin called.Also, note that he is paying margin interests daily.",2,0.516,NEGATIVE,1.0
,nan,"Yo idk what you said, but you snapped on that shit.",3,0.653,NEGATIVE,0.85
,nan,no options?,0,0.515,NEGATIVE,0.999
,nan,This shit is like dangling car keys in front of a drunk 💀,1,0.499,NEGATIVE,1.0
,nan,Tbh I don’t play them often but that’s how my Affirm position got started was an exercised call.,1,0.515,NEGATIVE,0.965
,nan,You’re gonna be Affirming groceries soon my guy 💀,2,0.502,POSITIVE,0.995
,nan,Affirm deez nuts,3,0.5,POSITIVE,0.979
,nan,Affirming behind Wendy's.,4,0.5,POSITIVE,0.995
,nan,Are you asking him to commit suicide?,1,0.502,NEGATIVE,0.995
,nan,yes.,2,0.5,POSITIVE,0.996
,nan,Lol u bad,1,0.487,NEGATIVE,0.999
,nan,Lol.,1,0.5,POSITIVE,0.96
,nan,This comment funny asf lmfaooo,1,0.501,POSITIVE,0.998
,nan,We’re going red next week huh,0,0.55,NEGATIVE,0.972
,nan,"SPY 604.25 before I expect to see more sustained buying sending it up through 610+, so a red day or two early in the week would track.",1,0.531,NEGATIVE,0.644
,nan,At least you are trading shares and not options 👏,0,0.518,NEGATIVE,0.999
,nan,"Pshhhh, what is this? R/investing?",1,0.517,NEGATIVE,1.0
,nan,But he is using margin,1,0.505,NEGATIVE,0.945
,nan,"Yeah, I have pointed out the risks in a different reply.OP's actual cash invested is $12.2k + he took $15.3k margin. He has $12k in unrealized gains right now, making the total value of his holdings $39.5k currently.If he cashes out now, he will be basically making a 100% return — $12k gains on $12.2k invested.If the margin requirement of his current holdings is something like 0.4 (i.e., he is allowed to use a 2.5x margin) and his current holdings somehow drop by $15k here, he is gonna get margin called.Also, note that he is paying margin interests daily.",2,0.515,NEGATIVE,1.0
,nan,But this inherently has more risk. It would be safer to buy an option with a delta or 1 than to use margin. He could buy a call with a delta of 1 for $12,3,0.544,NEGATIVE,0.999
,nan,Guess he's gonna be hungry soon then since he's on margin,0,0.507,POSITIVE,0.988
,nan,Guess he's gonna be hungry soon then since he's on margin,1,0.507,POSITIVE,0.988
,nan,We will show him how to throw away the left over food “”correctly” so we can dig it out of the dumpster after our Wendy’s shifts.,2,0.504,POSITIVE,0.817
,nan,"Seems to be working good for you! Make sure to use your student loans that will be disbursed next month to help achieve your investing goals…Obviously /s, it looks like you are already down. Close your positions take the wins. Keep the money for savings, nothing kills a college semester quicker than running low on funds and having to stop focusing on classes to work. The worst losses come from failing out of a college degree when you’ve already taken a 10k+ in loans.",0,0.514,NEGATIVE,0.736
,nan,SMCI good take it’s gonna get to 150 in 2025,0,0.519,POSITIVE,0.983
,nan,Until it comes out they were a fraud the whole time… They might not be but i still dont trust any company that has sketchy earnings reports,1,0.579,NEGATIVE,0.998
,nan,They’ve been cooking the books for years. They literally fired the management team that was behind the fraud and then rehired them 3 months later. Fucking Hindenburg is short on then for Christ sake.,2,0.515,NEGATIVE,1.0
,nan,Easy 💯,1,0.502,POSITIVE,0.825
,nan,"Oh man, this ones gonna be a banger. Saving this bad boy to come back in a month.",0,0.508,POSITIVE,1.0
,nan,"Доброе утро, the gulag is this way, please follow me",0,0.505,NEGATIVE,0.956
,nan,On margin. 😮‍💨,0,0.497,NEGATIVE,0.772
,nan,Why did LULU pop? Earnings?,0,0.573,NEGATIVE,0.816
,nan,Yeah 18% move,1,0.51,POSITIVE,0.753
,nan,"SMCI 50 call is my only other call besides RIVN 12 12/20. I think both will go to the moon. I’m holding until I feel disgustingly wealthy, then holding another day after that.. could just fly straight up on good earnings",0,0.523,NEGATIVE,0.623
,nan,When is the expiration date on the SMCI call? I may just start copying people here can't be worse than whatever play I come up with,1,0.503,NEGATIVE,1.0
,nan,"That’s the spirit lol I like it because smci has been super promising lately and could cause shorts to panic, cover and cause a squeeze. It’s for this week might be worth around 200 bucks at open. I’m also looking at calls in February and June because it could take a while. Volume looks promising on all calls",2,0.523,POSITIVE,0.975
,nan,Smci going higher when US legislation passes. Im buying that and more MARA,0,0.527,POSITIVE,0.947
,nan,I'm trying to plan my first options trade. Should I buy calls on SMCI?,1,0.587,NEGATIVE,0.997
,nan,Everyone telling you to take profits doesn't understand that you will win big because you are the 1% of gamblers that do not quit,0,0.511,NEGATIVE,1.0
,nan,Be careful OP. Trading margin is a great way to blow up an account.,0,0.511,NEGATIVE,1.0
,nan,"Been doing for well over a year. When the carry trade crashed the market, I survived. But I’m gonna cash some out pretty soon.",1,0.59,POSITIVE,0.989
,nan,Risk Level: Safe,0,0.507,POSITIVE,0.996
,nan,Get out,0,0.525,NEGATIVE,0.996
,nan,If this isn’t the top…,0,0.5,POSITIVE,0.755
,nan,This will end very well,0,0.59,POSITIVE,0.994
,nan,"Good on you to invest early while you’re young. Notttt the best idea to be on margin but hey, it’s not the worst portfolio at least.",0,0.522,POSITIVE,0.975
,nan,Bro buying high and selling low,0,0.52,NEGATIVE,0.967
,nan,"So those student loans are going with you to the grave, huh?",0,0.507,NEGATIVE,0.995
,nan,Nice plays! I was tempted to go in heavy on SMCI.,0,0.504,POSITIVE,1.0
,nan,Majority of your position is in a super risky stock that’s been delisted before. Not a smart move especially on margin,0,0.548,NEGATIVE,1.0
,nan,"Can I ask how you chose Ventyx? I am interested in choosing a biotech company to invest in and never heard of this company, what’re your thoughts on it’s price target?",0,0.605,NEGATIVE,0.977
,nan,This is way too conservative. More risk less security please,0,0.509,NEGATIVE,1.0
,nan,you are doing better than most lol,0,0.532,POSITIVE,0.997
,nan,All in $smci,0,0.5,NEGATIVE,0.96
,nan,I am on Smci since the dip. Lets go,0,0.507,NEGATIVE,0.938
