date of comment,main comment,comment,depth,PTR Sentiment (Comment),Flair Outlook,Flair Score,PTR Sentiment,Flair Sentiment
,,GPT-REEEE,0,0.5,NEGATIVE,0.999,0.5,0.999
,,Oooo that’s a Spicy meatball… 🤌,0,0.5,POSITIVE,1.0,0.5,1.0
,,Wouldn't at all be surprised if Nvidia turns out to be more closely related to SMCI than we all thought.,1,0.528,NEGATIVE,0.955,0.528,0.955
,,Dirty HODLer,2,0.5,NEGATIVE,1.0,0.5,1.0
,,Perfect for this sub,3,0.505,POSITIVE,0.999,0.505,0.999
,,It’s not like they haven’t misled investors before,3,0.508,NEGATIVE,0.998,0.508,0.998
,,Puts on ability to sue,0,0.497,POSITIVE,0.984,0.497,0.984
,,"So I know Supreme Court decisions are goal-seeked and backsolved and the actual law doesn't matter. But I would love to know what legal arguments Facebook and NVidia are trying to use here.Scalia famously went for the ""corporations are people"" argument in Citizens United. So in that case, isn't a class-action lawsuit against a Big Tech company just one large group of people acting as a collective, suing another large group of people acting as a collective? It seems like the class-action group would absolutely have standing.",0,0.541,NEGATIVE,0.981,0.541,0.981
,,That would be true if they actually relied on precedent and not pseudo supply side Jesus intuition based on the best bribe being offered at the time.,1,0.537,NEGATIVE,0.988,0.537,0.988
,,"I feel like Jesus was carryin to many slices of that NY dough on top of his heavy Domino slice. Let me explain to you why, he would rather take the Monday off to sit behind a statue in front of a building he was supposed to attend the day before. He would say sorry no bible verse today, my Koran in my backpocket only holds numbers. Only comes out on Friday, my eyes only. He would add like next respawn I want to be a crow but make sure to put a Buddha close by for that extra 🍀. Hit me Up, bmx.",2,0.511,NEGATIVE,1.0,0.511,1.0
,,What the fuck did I just read?,3,0.497,NEGATIVE,0.975,0.497,0.975
,,absolute poetry,4,0.5,POSITIVE,1.0,0.5,1.0
,,Once the ruling is released you should be able to look it up on Oyez and even hear the oral arguements and justice questions,1,0.509,POSITIVE,0.992,0.509,0.992
,,Once the ruling is released you should be able to look it up on Oyez and even hear the oral arguements and justice questions,2,0.509,POSITIVE,0.992,0.509,0.992
,,"I appreciate that link.So the question isn't about standing like I thought. It's about whether telling investors that ""Bad Stuff may happen in the future"", when you are aware that Bad Stuff is already happening is misleading.I would say for sure it is, so I guess I have to dive into the next layer of the legal onion there.",2,0.51,NEGATIVE,0.979,0.51,0.979
,,"The basic premise is that under current law (or lack of) every negative thing that happens to a company can be viewed as securities fraud, and many company’s are inundated by civil suits that don’t hold merit.  An example would be Elon Musk tweeting on his personal account while being the CEO of a public company. Is his private behavior which negatively affects the company and causing harm to shareholders considered securities fraud? Matt Levine breaks down some interesting ones here: https://www.bloomberg.com/news/articles/2023-08-25/podcast-matt-levine-makes-the-argument-that-everything-is-securities-fraud",1,0.545,NEGATIVE,0.991,0.545,0.991
,,"Lol, you mean tweeting materially important information as ceo.  Like securing funding to take the stock private and sales projections.If you can't see how that's distinct from ""Elon Musk tweeting on his personal account"" about politics or something you're a fool or an Elon simp probably both.",2,0.539,NEGATIVE,0.986,0.539,0.986
,,"Just an easy example, don’t bring your weird energy. ",3,0.517,POSITIVE,0.737,0.517,0.737
,,,0,,,,,
,,So is it Facebook or Nvidia who asks Supreme Court? What kind of headline is that?,0,0.526,NEGATIVE,1.0,0.526,1.0
,,"2 separate lawsuits.Nvidia dealing with lawsuit regarding an answer given to how much of its sales were attributed to crypto mining.Facebook was about data breach with Cambridge analytica.They don’t want to be sued, these are edge cases being used with the Supreme Court.",1,0.529,NEGATIVE,0.995,0.529,0.995
,,It's actually the city of Facebook in the newly formed independent country of Nvidia that is being sued,1,0.526,NEGATIVE,1.0,0.526,1.0
,,AVGO exits chat quickly- nothing to see there,0,0.501,NEGATIVE,1.0,0.501,1.0
,,CVNA be like oO,0,0.5,NEGATIVE,0.978,0.5,0.978
,,Imagine if SMCI and NVIDIA both turn out to be fraudsters and AMD is the real king of semis,0,0.579,NEGATIVE,0.999,0.579,0.999
,,cope kekw,1,0.5,POSITIVE,0.533,0.5,0.533
,,Wishful,2,0.5,POSITIVE,0.661,0.5,0.661
,,"Their pleading is related to the Supreme Court decision to overturn the 40 year old Chevron Doctrine. They are simply making an affirmative action case based on safe harbor language. Normally a matter like this would have been settled by the SEC (they were fined, so was META and SCMI) but now because we have a rogue court overturning settled Doctrine from 40 years ago, these matters end up before Supreme Court Justices.",0,0.525,NEGATIVE,1.0,0.525,1.0
,,Save me Obi Wan Jensoni- You're our only hope!,0,0.503,POSITIVE,0.933,0.503,0.933
,,Should I sell my SOXL then?,0,0.518,NEGATIVE,0.675,0.518,0.675
,,When is Tesla's turn?,0,0.515,POSITIVE,0.58,0.515,0.58
,,sooon! because elon is a stupid guy,1,0.501,POSITIVE,0.529,0.501,0.529
,,Nvdia made too many people rich to be subject to penalties,0,0.499,NEGATIVE,0.999,0.499,0.999
,,,1,,,,,
,,No.,0,0.5,NEGATIVE,0.994,0.5,0.994
,,,0,,,,,
,,How many boats have they offered?,0,0.512,POSITIVE,0.964,0.512,0.964
,,NVDA gonna open green on this news,0,0.526,NEGATIVE,0.641,0.526,0.641
,,Really making me not sure if buying for the Dow Jones jump is a good idea,0,0.519,NEGATIVE,0.958,0.519,0.958
,,Depends on what the Dons stock portfolio looks like.,0,0.579,NEGATIVE,0.998,0.579,0.998
