date of comment,main comment,comment,depth,PTR Sentiment (Comment),Flair Outlook,Flair Score,PTR Sentiment,Flair Sentiment
,,GPT-REEEE,0,0.5,NEGATIVE,0.999,0.5,0.999
,,Reddit only being worth 12bn and it being the 6th biggest website in the world is a steal,0,0.527,NEGATIVE,0.997,0.527,0.997
,,Djt worth more rn lmao,1,0.518,POSITIVE,0.863,0.518,0.863
,,Djt being priced in for cuk mods not banning people…,2,0.5,NEGATIVE,0.994,0.5,0.994
,,It’s anonymous therefore difficult to capitalise of ads and data farming . Also there’s a fuck ton of bots ,1,0.522,NEGATIVE,1.0,0.522,1.0
,,Buy call options then,0,0.577,NEGATIVE,0.924,0.577,0.924
,,Lol,1,0.5,POSITIVE,0.737,0.5,0.737
,,"As they say, “positions or ban”These zero stake posts are fake and gay AF if you don’t even have positions ",0,0.503,NEGATIVE,0.997,0.503,0.997
,,am fake and gay yes,1,0.5,NEGATIVE,0.991,0.5,0.991
,,"Anything can be faked, so doesn't matter.",1,0.498,POSITIVE,0.97,0.498,0.97
,,I drank the Kool-Aid.I'm in.... let's see what happens after the earnings call.,0,0.574,NEGATIVE,0.995,0.574,0.995
,,"Easy. If you feel wheezy, nervous, or weak, drink more Kool-Aid.",1,0.498,POSITIVE,0.996,0.498,0.996
,,How much u made?,1,0.505,NEGATIVE,1.0,0.505,1.0
,,just a couple of Benny's.I'm new so I didnt want to blow my load. but the DD was pretty solid. and its up 25% in after market. so I cashed out.https://www.reddit.com/r/wallstreetbets/comments/1g6flb6/reddits_data_ai_crack_why_im_betting_big_on_rddt/?utm_source=share&utm_medium=web3x&utm_name=web3xcss&utm_term=1&utm_content=share_button,2,0.55,NEGATIVE,0.94,0.55,0.94
,,Are people dumping in anticipation of a miss tomorrow?,0,0.491,NEGATIVE,0.994,0.491,0.994
,,Selling the news. They already bought the rumour,1,0.533,NEGATIVE,0.989,0.533,0.989
,,aged like milk,2,0.498,NEGATIVE,1.0,0.498,1.0
,,This sub is extremely bullish on RDDT so I'm leaning towards puts.,0,0.556,NEGATIVE,1.0,0.556,1.0
,,,1,,,,,
,,I got in when it was 40. Still holding,0,0.513,POSITIVE,0.956,0.513,0.956
,,don't you sell a single damn share till it hits $200,1,0.543,NEGATIVE,0.725,0.543,0.725
,,"I’m at 200 shares at 40 avg, which I know isn’t much… but I do believe it will only go up.",0,0.511,NEGATIVE,0.995,0.511,0.995
,,sheesh,1,0.5,POSITIVE,0.992,0.5,0.992
,,That's a good position. I've also been holding since the IPO.,1,0.569,POSITIVE,0.998,0.569,0.998
,,*First chance to buy $RDDT over $80,0,0.568,POSITIVE,0.996,0.568,0.996
,,What’s your dd?,0,0.512,NEGATIVE,0.991,0.512,0.991
,,RDDT is like the google of internet blogsHas a shit ton of answers about topics and problems from other real people.Gets money from advertisement and providing data to AI models.That's all the DD you need,1,0.52,NEGATIVE,0.756,0.52,0.756
,,Every single regard here is using Reddit to talk about investing in shit companies. Investing in reddit itself is a no brainier,2,0.521,NEGATIVE,0.997,0.521,0.997
,,Unfortunately I'm was dumb to notice it after it dropped like 20%,3,0.557,NEGATIVE,0.999,0.557,0.999
,,People are going to regret not buying rddt the same way they regret not buying up meta((This is financial advice) ),2,0.515,POSITIVE,0.963,0.515,0.963
,,Only getting increased traffic cause googles search is fucking trashed. They fix that and traffic dumps.Any AI made from redditors is going to be beyond annoying to deal with. I'd literally rather it train from prison inmates.,2,0.535,NEGATIVE,1.0,0.535,1.0
,,"Google is ranking Reddit high in search because it has great CTR. Google search is the flagship product of a multi trillion dollar company, this feature has been tested and is absolutely intentional.The original and current versions of chatGPT and Gemini were all trained on Reddit data.You have no idea what the fuck you’re talking about when it comes to either of these topics.",3,0.531,POSITIVE,0.726,0.531,0.726
,,"Yay, so is quora and whatever the fuck... wikihow (forgot its name)",2,0.5,NEGATIVE,0.997,0.5,0.997
,,I missed this!!! Holy! Nice call. I’m following you.,0,0.506,NEGATIVE,0.871,0.506,0.871
,,This dude called it haha,0,0.51,NEGATIVE,0.848,0.51,0.848
,,I’ll get it at 20. This stock will crumble,0,0.61,NEGATIVE,1.0,0.61,1.0
,,,1,,,,,
,,is,1,0.5,POSITIVE,0.75,0.5,0.75
,,lol,1,0.5,POSITIVE,0.737,0.5,0.737
,,*120,1,0.5,POSITIVE,0.976,0.5,0.976
,,If it pumps I buy tendiesIf it dumps I buy more. That simple!!,0,0.57,POSITIVE,0.993,0.57,0.993
,,"I'm in, gooch deep and willing to baghold for years.",0,0.585,POSITIVE,0.996,0.585,0.996
,,Almost doubled in 3 weeks. This could have made many people a millionaire if they'd listened and gone all in on 30 dte calls.,0,0.51,NEGATIVE,1.0,0.51,1.0
