date of comment,main comment,comment,depth,PTR Sentiment,Flair Outlook,Flair Sentiment
,,GPT-REEEE,0,0.5,NEGATIVE,0.999
,,MSTR - the only company with the revolutionary technology of money glitching - and some janky two decades old BI dashboards.,0,0.594,NEGATIVE,0.999
,,"The janky dashboards let them in. Now they're a ""software"" company instead of a financial company.QQQ doesn't take financial companies.",1,0.64,NEGATIVE,0.994
,,What could go wrong?,1,0.508,POSITIVE,0.998
,,I think Saylor said their product is 'vol'? 🤔,1,0.641,NEGATIVE,0.999
,,"They're talking about having LESS oversight of US stock markets and crypto businesses, and yet Saylor's allowed to pull a second scam.",1,0.546,NEGATIVE,0.999
,,You should go all in on it.,2,0.505,POSITIVE,0.998
,,Maybe not right now. But many people are rich for having gone all in on MSTR in the past year,3,0.569,NEGATIVE,0.806
,,MSTR market cap is higher than Intel Nana isn't proud of that,0,0.559,NEGATIVE,0.994
,,Imagine actually producing something of value like real products lol. This is the future holmes.,1,0.531,POSITIVE,0.889
,,"jesus, what the fkk were nasdaq committee thinking",0,0.506,NEGATIVE,0.997
,,Probably bag holding convertible notes and they wanna get out,1,0.506,NEGATIVE,0.999
,,the convertible bonds have printed for holders.,2,0.502,POSITIVE,0.999
,,It really is the infinite money glitch 😂 ,3,0.507,NEGATIVE,0.997
,,Ah yes. The infinite money glitch - the inevitable precursor to an almighty GUH,4,0.503,NEGATIVE,0.942
,,"Nasdaq committee just wanted a front-row seat to the Bitcoin rollercoaster. Buckle up, everyone!",1,0.506,NEGATIVE,0.579
,,So when BTC enters a bear phase how fast and hard will this thing fall? More on a percentage basis the BTC itself? Any thoughts?,0,0.5,NEGATIVE,1.0
,,"very thorough discussion offered by Richard Byworth here:https://www.youtube.com/watch?v=u3oT_IevEGUto paraphrase, if corn fell substantially, the multiple on NAV would probably shrink to ~1, or could even trade at a discount to the corn holdings if insolvency became a risk.it trades at 2.53 mNAV per diluted share currently, at 377.32 / sh, so a 1x multiple would be ~149 / sh at current btc price, then drop that figure by whatever haircut you want to give to corn.80% drop in corn would be ~$30 / share, unless I'm mistaken on the mNAV math.",1,0.518,NEGATIVE,1.0
,,80% drop on corn isn’t going to happen bruh lol. It never revists the previous local top after it’s been confirmed as support.,2,0.51,NEGATIVE,0.998
,,it was the % drop scenario discussed in the interview I linked.,3,0.491,NEGATIVE,0.998
,,"For sure , just saying if it goes down 80%, you’ll see SPY 300 again. Not very likely.",4,0.506,NEGATIVE,0.999
,,btc price has nothing to do with spy price,5,0.535,NEGATIVE,0.99
,,Probably similar percent to its recent rise vs bitcoin,1,0.559,POSITIVE,0.766
,,"It would unwind spectacularly, Saylors MSTR would drop like it did in 2000 for different reasons but still, the man will have managed to pop that shit again.",1,0.504,POSITIVE,0.772
,,hell pltr made it? i should held my calls.,0,0.509,NEGATIVE,0.992
,,Oh man was I happy to sell at 50% profit last week,1,0.575,POSITIVE,0.942
,,Planitar pleas fly again 🚀,1,0.5,NEGATIVE,0.625
,,"So now a bunch of grandmas living off their index fund pensions now own btc? 🤔Ie if one owns a QQQ ETF, they indirectly own BTC (and a highly levered version of BTC). Neat. 🤷‍♂️",0,0.507,NEGATIVE,0.957
,,Is that confirmed?,0,0.505,POSITIVE,0.697
,,No. This is just the speculation.,1,0.5,NEGATIVE,0.994
,,Pics or it didn’t happen. I mean links or it didn’t happen.,2,0.501,NEGATIVE,1.0
,,Ignore the people downvoting! Is this from your BB terminal?,2,0.495,NEGATIVE,1.0
,,Allegedly,0,0.495,NEGATIVE,0.975
,,"Today, Bloomberg ETF analysts Eric Balchunas and James Seyffart announced that MicroStrategy (MSTR) is expected to enter into the Nasdaq 100 (QQQ) later this month on December 23....“MicroStrategy will likely enter the Nasdaq 100 Index on Dec. 23, and we expect net buying of at least $2.1 billion in shares by ETFs to follow, equal to about 20% of daily volume,” Seyffart explained. “Joining the S&P 500 will be tougher because of a lack of profit, though an accounting-rule change surrounding Bitcoin valuations could make MicroStrategy eligible in 2025.”",2,0.527,NEGATIVE,0.998
,,100% confirmed to be expected,3,0.548,POSITIVE,0.999
,,It's 100% confirmed to be a possibility.,2,0.502,POSITIVE,0.995
,,“Likely to join”,2,0.5,POSITIVE,0.981
,,... then can't wait until they are delisted...,3,0.5,NEGATIVE,0.516
,,It’s not.,2,0.5,NEGATIVE,0.982
,,Do you see the price action? It isn't doing jack shit. That means it's not confirmed.,2,0.509,NEGATIVE,1.0
,,link？,2,0.5,NEGATIVE,0.998
,,Expected and likely are not confirmed,2,0.533,NEGATIVE,0.996
,,"I wish it is confirmed, but it is not.. the results will be out on Friday",0,0.52,NEGATIVE,0.997
,,Does this mean MSTR go up or down and QQQ go up or down?,0,0.506,NEGATIVE,0.995
,,Yes,1,0.5,POSITIVE,0.992
,,Haha I knew that would be the response,2,0.508,NEGATIVE,0.804
,,Yes,3,0.5,POSITIVE,0.992
,,definitely to the right,1,0.508,POSITIVE,0.999
,,No chance Palantir doesn't even move on this news...this must mean it's still not confirmed,0,0.516,NEGATIVE,1.0
,,PLTR joining Nasdaq was confirmed weeks ago and it jumped 10%. Was posted on Reddit my guy,1,0.514,NEGATIVE,0.997
,,Lol dudeMoving their listing onto nasdaq and being included into the nasdaq 100 are totally different thingsThey moved their listing from NYSE to nasdaq a couple of weeks backThe Nasdaq will announce which companies are going to get added to the Nasdaq 100 on the 13th...google the news...there is no confirmation of Palantir getting added as of this moment,2,0.517,NEGATIVE,1.0
,,Don't you think it'll be too late to buy after they make it official?,1,0.543,NEGATIVE,0.946
,,Ohh AXON getting added too. Interesting.,0,0.502,POSITIVE,0.999
,,That’s what caught my eye the most!,1,0.5,POSITIVE,0.979
,,"I'm amazed indexes haven't taken steps to stop obvious scams and manipulation from polluting them. It's just financial engineering to take money from index holders, and it's pretty fuckin gross.",0,0.533,NEGATIVE,0.999
,,I believe S&P 500 screens companies but Nasdaq operates mechanically,1,0.529,NEGATIVE,0.684
,,sorry you missed the ride bro but now you and the rest of the working class can buy it at the top through forced buys in your 401k and IRA,1,0.525,POSITIVE,0.998
,,PUTS PUTS PUTS PUTS PUTS PUTS PUTS PUTS PUTS PUTS PUTS PUTS PUTS PUTS PUTS PUTS PUTS PUTS PUTS PUTS PUTS PUTS PUTS PUTS PUTS PUTS PUTS PUTS PUTS PUTS PUTS PUTS PUTS PUTS PUTS PUTS PUTS PUTS PUTS PUTS PUTS PUTS PUTS PUTS PUTS PUTS PUTS PUTS PUTS PUTS PUTS PUTS PUTS PUTS PUTS PUTS PUTS PUTS PUTS PUTS PUTS PUTS PUTS PUTS PUTS PUTS PUTS PUTS PUTS PUTS PUTS PUTS PUTS PUTS PUTS PUTS PUTS PUTS PUTS PUTS PUTS PUTS PUTS PUTS PUTS PUTS PUTS PUTS PUTS PUTS PUTS PUTS PUTS PUTS PUTS PUTS PUTS PUTS PUTS PUTS PUTS PUTS,0,0.485,NEGATIVE,0.518
,,"That's not bad, Michael Saylor wants you to YOLO puts :)",1,0.496,POSITIVE,0.778
,,"Bagholder spotted.I am a bot, and this action was performed automatically. Please contact the moderators of this subreddit if you have any questions or concerns.",1,0.502,NEGATIVE,0.89
,,Gluck loserrr….,1,0.5,NEGATIVE,0.966
,,🐻🌈,1,0.5,NEGATIVE,0.761
,,NASDAQ classic ponzi schemes again?,0,0.508,NEGATIVE,0.998
,,Mstr send it 🚀🌚,0,0.503,NEGATIVE,0.997
,,L F GROW!,0,0.52,POSITIVE,0.999
,,How are they a tech company? Don't they just buy BTC financed through their stock?,0,0.738,NEGATIVE,0.995
,,Yes!!! $800 coming soon!!! BUY MORE!!!!!!!!!!!!!,0,0.554,POSITIVE,0.996
,,I’ll buy it only on the top,1,0.59,NEGATIVE,0.997
,,Such bullshit. They should be dropped entirely!,0,0.48,NEGATIVE,1.0
,,Puts just like all the SMCI back when it was 1300,0,0.499,POSITIVE,0.999
,,Fuckin LOL,0,0.5,NEGATIVE,0.833
,,Haha so many butthurt buttcoiners here. You guys been scrapping your shitty gains and getting rekt in options when you realise you could have just invested in bitcoin a decade ago?I would love to see genuine statistics on how many of you sad fuckers actually just missed the boat and are now letting your bitterness drive your view in bitcoin.,0,0.506,NEGATIVE,0.998
,,Yep,1,0.5,POSITIVE,0.998
,,"I don’t get it, either the boat has been missed or bitcoin is going to continue to outperform equities. If it’s the former then it’s time to sell and go elsewhere, if it’s the latter then mocking potential hodlers is weird.",1,0.513,NEGATIVE,1.0
,,So everyone will be forced to buy their shitty worthless shares in their 401k. Nice! Love the manipulation.,0,0.521,POSITIVE,0.98
,,🚀🚀🚀🚀🚀,0,0.5,NEGATIVE,0.761
,,"In case MSTR actually gets added to the index, it would likely be bearish for the ETFs in the long run (a bad omen), since it is just degenerate nonsense. The index (its maintainers, to be precise) would instantly become way more clownish than it already is, and lose confidence of some of the more sophisticated investors.MSTR is not a business worthy of adding to the index. They don't produce any signature goods or services. It's just a greater fool scheme. If it was suddenly erased from existence by divine intervention, it would not affect the real economy or the citizens in any significant way (not that PLTR is super essential).",0,0.522,NEGATIVE,1.0
,,Can you imagine selling a winner for 1 company you disagree with taking up less than 0.5% of the total weight?! Lol,1,0.576,POSITIVE,0.548
,,"Did the math, if MSTR drops or goes up 10%, it is a mere .046% change on QQQ, that is basically nothing lol.",2,0.501,NEGATIVE,0.999
,,Thank you for doing the math! It proves a very good point that this guy is handicapping himself for no reason.,3,0.51,POSITIVE,0.998
,,Oh hell no,0,0.5,NEGATIVE,0.99
