date of comment,main comment,comment,depth,PTR Sentiment,Flair Outlook,Flair Sentiment
,nan,GPT-REEEE,0,0.5,NEGATIVE,0.999
,nan,Theoretical Nuclear Physicist,0,0.5,POSITIVE,0.999
,nan,How can you have this much money and you can't spell photo,0,0.514,NEGATIVE,0.639
,nan,My just be spanish my brother…,1,0.5,POSITIVE,0.954
,nan,Phor phuck sakes.,1,0.5,POSITIVE,0.999
,nan,Because languages outside of English exist and this person is most likely a Spanish speaker.,1,0.502,NEGATIVE,0.633
,nan,"I’d have to look between buying and selling only a few times leaving over $1 million on the table for selling too much in 2018. I think my total cost basis was 40,000 for almost 1.2M in profit. I’m still holding almost 7 Figures",0,0.546,NEGATIVE,0.993
,nan,"I’d have to look between buying and selling only a few times leaving over $1 million on the table for selling too much in 2018. I think my total cost basis was 40,000 for almost 1.2M in profit. I’m still holding almost 7 Figures",1,0.546,NEGATIVE,0.993
,nan,"Nah, homie is probably holding a bunch of bags in the other hand, carryover losses from prior years, and has a CPA ensuring much of this is not taken by the IRS.",0,0.505,NEGATIVE,0.649
,nan,"Nah, homie is probably holding a bunch of bags in the other hand, carryover losses from prior years, and has a CPA ensuring much of this is not taken by the IRS.",1,0.505,NEGATIVE,0.649
,nan,Too much information.,0,0.512,NEGATIVE,0.999
