date of comment,main comment,comment,depth,PTR Sentiment,Flair Outlook,Flair Sentiment
,nan,GPT-REEEE,0,0.5,NEGATIVE,0.999
,nan,"Remember guys, you too can be a millionaire from trading, as long as you start with a million.",0,0.587,POSITIVE,0.706
,nan,"Says up 18% YTD so around $2.6MEdit: he losing to spy btw, with high risk MSTR",1,0.521,NEGATIVE,0.999
,nan,Ya going up 18% when SPY is up 28% YTD is not so good.,2,0.528,NEGATIVE,0.998
,nan,Lmfaoooooo $2.6 million?? All that work just to lose to SPY,2,0.597,NEGATIVE,0.987
,nan,Soooo less than SPY,2,0.5,NEGATIVE,0.995
,nan,"Oh yeah, I forgot that throwing my entire life savings into a company that buys fake money while diluting shareholders is such a robust and risk-averse play, much better risk profile than a basic S&P Fund and Bonds.Let’s call it a buck, this guy is not investing with his life savings, he’s gambling with a million dollars. There is a great chance there’s no amount of smart strategy with his plays other than guessing and basic financial analysis, and you believing it’s safe and repeatable is why this Sub got so huge in the first place.It’s a Degenerate Gambler’s Paradise.",2,0.534,NEGATIVE,1.0
,nan,See at least someone gets it,4,0.504,POSITIVE,0.996
,nan,"There’s no point in trying to explain basic financial theory and economic concepts to people who believe their fake money will keep appreciating in value “because line go up”Missing out, it’s the future, it’s scarce, do you cultists ever have any new arguments?Saylor’s entire strategy is to keep leveraging, to keep making bitcoin purchases, to keep selling his shares, and to keep getting you all to drink the Kool-Aid while he rides his massive stack of cash into the sunset. Pretty obvious. It’ll work really well until it doesn’t.I wonder if any of the cultists have ever pondered the reality of what would happen if the largest holder of their fake money wanted to start selling it.",4,0.519,NEGATIVE,1.0
,nan,This is how I felt riding a $1000 investment with LABZ from May 2024 until they changed exchange platforms in September and suddenly my $4.45/share turned into $0.24/share.,5,0.552,NEGATIVE,1.0
,nan,Left my job at Apple and said fuck you to corporate. Decided to day trade instead of lead peons down the corporate tech track trying to climb up the ladder. Not sure if making this money was more stressful or presenting to Tim Cook and telling my teams to fuck off,0,0.539,NEGATIVE,1.0
,nan,Might as well join a hedge fund at that point and become a finance bro,1,0.519,NEGATIVE,0.987
,nan,Not having anyone to be accountable to but myself is gdamn amazing. I also don't need to listen to whiney ass new MBA's and PHD's from top universities asking me to mentor their asses to be a corpo slave,2,0.538,POSITIVE,0.999
,nan,Can you mentor me to make regarded profitable trades like you?,3,0.506,POSITIVE,0.994
,nan,"Step 1: start with $100,000.step 2: be in an insane bull market",4,0.545,NEGATIVE,0.998
,nan,Was there a step 1.5? I just lost 100k,5,0.502,NEGATIVE,0.882
,nan,I only have half that amount and decided to sell covered calls on NVDA and AAPL in this insane bull market,5,0.515,NEGATIVE,1.0
,nan,"He’ll be in for trouble if he wants to do this long-term. He got lucky the first time, but he’ll be bound to face a much tougher road making money like this than at Apple. He’d have been much better off placing large savings on SPY.",5,0.528,NEGATIVE,1.0
,nan,Take me with you.,5,0.51,POSITIVE,0.987
,nan,You think the next couple years might be an even more insane bull run since trump is gonna be running things?,5,0.518,NEGATIVE,0.999
,nan,You are a rare breed my friend. I'm so sick of corporate ass kissing culture. Hope 2 be like you soon my man.,3,0.538,POSITIVE,1.0
,nan,"Then you have to have an investment that makes money while you sleep, which OP clearly does not have.",4,0.523,NEGATIVE,1.0
,nan,"Congrates you, Envy you, Fuck you.",3,0.497,NEGATIVE,0.696
,nan,*Tim Apple,1,0.52,POSITIVE,0.994
,nan,Ok now I hate myself for not writing Tim 🍏,2,0.502,NEGATIVE,0.6
,nan,Mad respect for making it work. I tried but it's 10x more stressful than being a wage cuck,1,0.507,NEGATIVE,0.765
,nan,The reward of not being a wage cuck is 1000x worth it.,2,0.514,NEGATIVE,0.99
,nan,"Nah most people just blow their entire savingsYou got lucky, congrats",3,0.494,POSITIVE,0.996
,nan,next correction he'll lose it all and he'll be back to slave wagingmany such casesproblem is not making the money it's keeping it,4,0.518,NEGATIVE,1.0
,nan,Sir you are a gigachad,1,0.502,POSITIVE,1.0
,nan,Dude,1,0.5,POSITIVE,0.969
,nan,What was your salary at Apple tho,1,0.513,NEGATIVE,0.999
,nan,Can you detail about your approach and strategy in day trading? How did you learn everything you knew today? Any resource recommendations? Good on you,1,0.537,POSITIVE,0.954
,nan,He bought high volatile tech in an insane bull market. It's 99% luck,2,0.552,POSITIVE,0.987
,nan,bro you’re performing worse than buying VTI and doing literally nothing. calm down lol,1,0.501,NEGATIVE,1.0
,nan,Congratulations and go fuck yourself,0,0.498,NEGATIVE,0.901
,nan,"Thanks man it's been a real fucking year. I left my tech job and basically left all my ""friends"" they all still talk the MAG7 garbage that's been drilled into their heads about corporate. Makes me sick",1,0.542,NEGATIVE,1.0
,nan,"Idk, $200-400k total comp, PTO, benefits, hybrid work, doesn’t sound half bad vs one lucky big year of returns",2,0.54,POSITIVE,0.999
,nan,"I was making only half that years ago in IT with all the benefits you mention (more actually) and I can tell you it was absolutely not worth all the stress and physical/emotional drain that bled into all parts of life (family and personal relationships etc.) From the outside looking in most people will say, shit for $200k ""doesn't sound bad"" and ""I can deal with it""... and that's all fine and good people are welcome to their opinions but the reality of it is much MUCH different. Being in large corporate IT you try and exist somewhere in the middle, in between the hollow cogs all your peers have become, and the others who simply don't give a shit and are 100% checked out... but balancing this long term will kill you.That was my experience anyway and why I got out as soon as financially able, I can 100% relate to OP. NOPE NOT WORTH IT.",3,0.512,NEGATIVE,1.0
,nan,"Ok… but people who earn less than half of that can face the same problems too. That’s probably why you often hear it’s not too bad. For these people, they’ll eat the same shit but earn multiple times the pay.Nonetheless, agreed it’s not worth it and everyone should strive to be financially independent and get out asap.",4,0.497,NEGATIVE,1.0
,nan,"The phrase ""golden handcuffs"" comes to mind. There are only so many Apples, Googles, METAs, etc... highly desirable and well-paying roles with highly desirable companies, people will put up with alot for as long as possible because they know they have it better than 99.9%. Yes, people earning much less in the workforce deal with similar things but having been in both I wouldn't necessarily say they deal with the same things.Yep agreed on the financial independence... it's definitely what people should strive for (though admittedly very difficult to achieve.)",5,0.514,POSITIVE,1.0
,nan,"you try and exist somewhere in the middle, in between the hollow cogs all your peers have become, and the others who simply don't give a shit and are 100% checked out..Yeah, that's lifebalancing this long term will kill youThat's also life (well, the end of it)",4,0.531,NEGATIVE,1.0
,nan,There are plenty of $200k jobs in tech without all that stress.,4,0.503,POSITIVE,0.998
,nan,Sorry congratulations and go fuck yourself,2,0.499,NEGATIVE,0.996
,nan,Still some days left in the year for this to go to zero.,0,0.61,NEGATIVE,1.0
,nan,nvda not touching 140 today blew up my entire account.,0,0.525,NEGATIVE,1.0
,nan,"lol you couldn’t have actually bet on that… oh, you did lol",1,0.5,POSITIVE,0.982
,nan,Murphy's Law,1,0.5,POSITIVE,0.825
,nan,"Met a young man on his way from New Jersey to fl at a rest stop. He was a day trader, He put his life savings into nvida back in 2017, 100k. Good for him.",0,0.539,POSITIVE,0.996
,nan,MSTR is a shit stock tho right regards,0,0.572,NEGATIVE,0.994
,nan,word please short it,1,0.493,NEGATIVE,0.976
,nan,"I was just mentioning what people think here, but I love money so I love MSTR as well.",2,0.519,POSITIVE,0.976
,nan,"how about u eat my ASSI am a bot, and this action was performed automatically. Please contact the moderators of this subreddit if you have any questions or concerns.",2,0.499,POSITIVE,0.783
,nan,Why are so many people saying to buy it,1,0.544,NEGATIVE,0.815
,nan,"So am I right in thinking your original investment was circa $254,000?",0,0.516,NEGATIVE,0.993
,nan,Bro got lucky on one singular Ponzi stock and acts like he made itGo back to your mall Apple Store job homie,0,0.534,NEGATIVE,0.822
,nan,Teach me all seeing one 👁👀,0,0.518,POSITIVE,0.968
,nan,Congratulations!,0,0.5,POSITIVE,0.996
,nan,Do not forget about taxes !!,0,0.495,POSITIVE,0.933
,nan,Tax time.Uncle Sam thanks thee,0,0.519,POSITIVE,0.942
,nan,IT doesn't count until you sell,0,0.51,NEGATIVE,0.973
,nan,How much did you start with?,0,0.505,POSITIVE,0.743
,nan,A small loan of a million dollars,1,0.616,NEGATIVE,0.864
,nan,$2.6M,1,0.5,NEGATIVE,0.888
,nan,Rookie mistake assuming that the average commenter here can do simple math,2,0.506,NEGATIVE,1.0
,nan,except it only shows percentage gain on the positions he's chosen to show us. We want to know what his starting capital was,3,0.52,NEGATIVE,0.992
,nan,"it’s faintly visible under the total gain, he’s lower than the S&P return this year",4,0.559,NEGATIVE,1.0
,nan,word i see it,5,0.502,POSITIVE,0.997
,nan,"-100%, so you started with what, infinity?",2,0.54,POSITIVE,0.995
,nan,gdamn you guys really are regarded,3,0.5,POSITIVE,0.998
,nan,wow,5,0.5,POSITIVE,0.996
,nan,I love this sub,5,0.505,POSITIVE,0.99
,nan,I can’t tell if some of you in this sub are LARPing or being serious.,5,0.501,NEGATIVE,0.967
,nan,Fastlyfast the mathamagican!Vegas residency starting soon! Buy tickets now!,5,0.524,POSITIVE,0.999
,nan,This guy gets it. MSTR NVDA ftw,0,0.499,POSITIVE,1.0
,nan,just me over here kicking myself for selling because nvda was disappointing me and i got impatient,0,0.503,NEGATIVE,0.999
,nan,im on that same path. im up over 2000% in the last 3 months alone. I'll be jobless next year. Dont think about working after this years success in the stock market. ive only been trading one stock. no more gambling on earnings,0,0.611,NEGATIVE,1.0
,nan,Diamonds for hands.,0,0.5,POSITIVE,0.999
,nan,Probably I’m regarded but the bottom numbers and total number don’t seem to add up,0,0.503,NEGATIVE,0.909
,nan,"I’m not even close, had a good period in July, but no I keep losing and looking…",0,0.538,NEGATIVE,0.989
,nan,damn congratulations I cant do good at all with the 11 rate hikes in 3 years,0,0.522,NEGATIVE,0.98
