date of comment,main comment,comment,depth,PTR Sentiment,Flair Outlook,Flair Sentiment
,,GPT-REEEE,0,0.5,NEGATIVE,0.999
,,Bank Stocks usually Trade at below price/book. Look at some of the most stable Swiss regional banks. They all trading below 0.5 price/book. Doesn’t say anything. The reason for that is the risk adjusted rate for their investments.,0,0.525,NEGATIVE,0.998
,,I am currently in a Business Theory class for my MBA and there is an entire chapter dedicated to how fucked Deutsche Bank is for refusing to update their policies (read: not bankrolling corrupt fuckheads).The book was written in 2019.,0,0.522,NEGATIVE,0.998
,,DB is propped up by Germany over and over. Anyway they bag enough they should post here.,1,0.503,POSITIVE,0.619
,,"Bail-outs or bail-ins are coming, would the US sit back and continue its rate plan? as it would expand and cement US dollar dominance over all of EuropeOr pivot and risk US market long term instability to help the world",0,0.54,POSITIVE,0.616
,,Yeah all central banks should have raised rates in same pace as the fed certainly europe.,1,0.522,NEGATIVE,0.921
,,"One will be allowed to fail per Lehman, and the others will shit the bed and get bailed out, probably.",1,0.518,NEGATIVE,0.936
,,"Zombie Banks, the lot of 'em.",0,0.5,NEGATIVE,0.973
,,"what does a ""warm-blooded, alive"" bank look like? That rinky-dink local co-operative bank stuffed with retired curmudgeons whose only growth strategy is letting physical paper rot in the vault?The whole point of banks is to transform low risk assets (savings) to high risk assets (loans), which fuels the economy. They are all potential Zombies. A successful Bank is doomed to implode from the risks it creates. Then Central Bank swoops in and cleans out the mess in the aftermath. Credit and risks are the bloodline of all the growth that has led to the technological innovations of the 5-7 decades.",1,0.523,NEGATIVE,0.924
,,"Cad banks, 5 bank oligopoly, 5% yields, large cash holdings, and government guarenteed mortgage debts already",2,0.518,NEGATIVE,0.634
,,"You can't do PB ratios on financial stocks, they hold funds on their books that technically is not theirs.",0,0.53,NEGATIVE,0.823
,,What is the proposed strategy here?,0,0.552,NEGATIVE,0.97
,,"Could look to short some of these banks, but some form of debt relief or bailout is coming because that’s the world we live inIf you believe a bail-in is to occur short their largest debt holders (joke is it’s about to be all of Europe)Or if you’re in Europe invest in the US dollar",1,0.518,NEGATIVE,0.972
,,"hopefully ECB and EC learnt something from the 2012 credit crisis. There are some multi-billion dollar packages and mechanisms in place. They'll likely survive it, but at the cost of a EUR with M2 finally exceeding USD's. Bad time to get paid in EURs T-T",2,0.536,NEGATIVE,1.0
,,"Since the average everyday investor cannot get into shorting stocks, what would you suggest?",2,0.524,POSITIVE,0.624
,,Average American you mean,3,0.512,NEGATIVE,0.996
,,So what is the strategy?,4,0.59,NEGATIVE,0.993
,,I meant in Australia any retail trader yoir average Australian can short stocks .,5,0.521,NEGATIVE,0.995
,,"I hear you. Regardless, what would be the strategy in the abscence of the ability to short?",6,0.516,NEGATIVE,0.707
,,Can i buy gold/rare earths to hold for the next year or two instead or will that fuck me over I don't trust the economy in europe right now,2,0.583,NEGATIVE,1.0
,,"Unless you expect a massive boost in the jewelry market gold just proxies dollars, and it risks huge selloffs from major holders and discovery of new supply. You would be better off with diversified land holdings.",3,0.545,NEGATIVE,1.0
,,Ok so i just buy dollars or land holdings since i want to chill 👍,4,0.529,NEGATIVE,0.741
,,Regardless of bailouts there will be banks that will be sacrificed. CS and DB are in bed together. It wouldn’t surprise me if they take the fall when market collapses for the other banks.,0,0.513,NEGATIVE,0.996
,,Bullets or Dollars?,0,0.508,NEGATIVE,0.999
,,"nobody believes the book value they report, in other words",0,0.523,NEGATIVE,0.839
