date of comment,main comment,comment,depth,PTR Sentiment,Flair Outlook,Flair Sentiment
,,GPT-REEEE,0,0.5,NEGATIVE,0.999
,,That's a big week,0,0.605,POSITIVE,0.849
,,100 %,1,0.5,POSITIVE,0.999
,,One of the largest companies in the world is missing from your list.Alphabet also reports on 25th.,2,0.565,NEGATIVE,0.999
,,Yuge,1,0.5,POSITIVE,0.998
,,Huge,1,0.515,NEGATIVE,0.914
,,Meta 133 Ps for 10/28,0,0.5,NEGATIVE,0.967
,,Fuck META and Mark Zuckerberg :D hopefully it'll go to zero one day,1,0.513,NEGATIVE,0.999
,,Someone lost money investing in META,2,0.51,NEGATIVE,0.997
,,I’d never invest in something like that. Lol,3,0.507,NEGATIVE,0.543
,,The whole company is lame af,1,0.676,NEGATIVE,1.0
,,The whole company is lame af,2,0.676,NEGATIVE,1.0
,,Big facts,3,0.532,POSITIVE,0.946
,,Meta is the next MySpace you heard it here first!,1,0.536,NEGATIVE,0.596
,,Coke,0,0.5,NEGATIVE,0.963
,,Calls,1,0.52,NEGATIVE,0.614
,,Where is Google ?,0,0.505,NEGATIVE,0.981
,,came here to say that,1,0.502,POSITIVE,0.697
,,Tuesday,1,0.53,POSITIVE,0.6
,,Google it dummy!,1,0.502,NEGATIVE,1.0
,,No name calling Asshole! A little bit of respect goes a long ways. You can respectfully disagree with without calling me names Mr douchebag,2,0.51,POSITIVE,0.954
,,XOM fucks?,0,0.5,NEGATIVE,0.997
,,All in calls,1,0.52,POSITIVE,0.958
,,Calls it is for Coca Cola,0,0.503,NEGATIVE,0.997
,,Meta is my biggest holding rn,0,0.508,POSITIVE,0.996
,,Rip,1,0.495,POSITIVE,0.982
,,The epicness of next week will be glorious closing in on FOMC.,0,0.547,POSITIVE,0.998
,,Apple ‘refreshed’ their iPad without a whisper…a silly PR touting their new M2 chip’s powers and then will likely put on a show using the same fucking chips in the new MacBook Pro models to be announced shortly. How stupid do they think are the WSB regards?? Puts on Apple.,0,0.533,NEGATIVE,1.0
,,"Yeah, and I don’t think schools are buying as much for iPads either anymore as they were last year or a couple years ago. No one wants to fork up money they don’t have for the same new iphone and the macbook / imacs look like shit",1,0.555,NEGATIVE,1.0
,,"!Remindme 8 days ""Believe it or not, puts don't print""",1,0.499,NEGATIVE,0.996
,,I will be messaging you in 8 days on 2022-10-29 05:47:10 UTC to remind you of this link1 OTHERS CLICKED THIS LINK to send a PM to also be reminded and to reduce spam.Parent commenter can delete this message to hide from others.Info Custom Your Reminders Feedback,2,0.509,NEGATIVE,0.968
,,Lol how'd the puts go,1,0.505,POSITIVE,0.959
,,Puts on ups following fed ex?,0,0.501,NEGATIVE,0.967
,,"Be careful ups does serve different clientele and thanks to the fedex Amazon contract ups ended up with a lot of the target and Walmart shipping contracts. Though probably puts regardless. Puts on ups, meta, Amazon and apple",1,0.515,NEGATIVE,0.813
,,Thank you dear. Thoughts on visa calls? Credit delinquencies take awhile to simmer?,2,0.504,NEGATIVE,0.706
,,lol is visa it probably ain’t going up or down from earnings not enough to make money.,3,0.534,NEGATIVE,0.995
,,Amazon puts or calls ?,0,0.508,NEGATIVE,0.903
,,Puts always on Amazon,1,0.502,POSITIVE,0.997
,,Calls. Bezos throwing out negative expectations is a pump fake.,1,0.502,NEGATIVE,0.995
,,No love for Comcast which will be on the 27th?,0,0.503,NEGATIVE,1.0
,,"dont get iv crushed on earnings, play fedex instead of ups. I know UPS/Fedex play well off each other.",0,0.534,NEGATIVE,0.718
,,Weirdest fucking table I’ve ever seen.,0,0.507,NEGATIVE,0.999
,,Earnings per share (EPS) is a company's net profit divided by the number of common shares it has outstanding. EPS indicates how much money a company makes for each share of its stock and is a widely used metric for estimating corporate value,0,0.637,POSITIVE,0.991
,,Earnings per share (EPS) is a company's net profit divided by the number of common shares it has outstanding. EPS indicates how much money a company makes for each share of its stock and is a widely used metric for estimating corporate value,1,0.637,POSITIVE,0.991
,,GDP numbers are being released next week as well which are going to overshadow any decent earnings,0,0.563,NEGATIVE,1.0
,,Agree,1,0.5,POSITIVE,0.985
,,So call on the VIX,1,0.508,NEGATIVE,0.986
,,May they all fall down,0,0.502,NEGATIVE,1.0
,,"Puts on Amazon, Microsoft, meta, apple, ups and Intel",0,0.527,POSITIVE,0.996
,,"So if I learned anything this week: if EPS is bad, stock go down. OR if revenue bad, stock go down. Seems like both have to be good for “stock go up.”",0,0.57,NEGATIVE,0.998
,,"Can’t wait for Intel to tank, and then cause my AMD calls to tank even harder than they already have 😭",0,0.551,NEGATIVE,0.99
,,Puts or calls printing for Verizon Wireless tomorrow?,0,0.503,NEGATIVE,0.935
,,If AT&T earnings are any indicator better go calls.,1,0.563,NEGATIVE,0.994
,,You’re missing handle lease releases,0,0.509,NEGATIVE,0.923
,,So all in all a bad earnings week is upon us.,0,0.591,NEGATIVE,1.0
,,So buy calls on spy and be ready to dump again got it,0,0.543,NEGATIVE,0.998
,,Yeah these are going to prolong the bear rally…this would not be the week for put-tang. Just accept that at the very least earnings will be mixed.,0,0.533,NEGATIVE,0.995
,,I'm watching UPS... because i work there.,0,0.614,POSITIVE,0.996
,,Next week will be important,0,0.597,POSITIVE,0.629
,,Thinking DFS 90Ps,0,0.497,NEGATIVE,1.0
,,Oh my,0,0.5,NEGATIVE,0.646
,,Fuk,0,0.5,NEGATIVE,0.999
,,If any bastard post dd on meta I will all in,0,0.509,POSITIVE,0.753
