date of comment,main comment,comment,depth,PTR Sentiment,Flair Outlook,Flair Sentiment
,,GPT-REEEE,0,0.5,NEGATIVE,0.999
,,"It doesn't matter, in two weeks Powell and the boys will screw everyone",0,0.511,NEGATIVE,0.989
,,If this rally continues I expect a 50bps hike to slap us down for sure,1,0.516,NEGATIVE,0.985
,,There is no way for a 50bps… it’s not fed’s job to crash the market,2,0.537,NEGATIVE,0.984
,,no way? i'm pretty sure several of the voting members have called for 50bps and a lot of the institutions are predicting a good chance. i'd say there is definitely a possibility.,3,0.536,NEGATIVE,0.999
,,99.3% for a 25bps hike fyi lol. https://www.cmegroup.com/markets/interest-rates/cme-fedwatch-tool.html,4,0.516,POSITIVE,0.995
,,In to weeks Covid will kill Papa and we will all be fucked by the 100 point rate hike of the new hawkish chair,1,0.535,NEGATIVE,0.999
,,Fun week.ASML had that -7% move in AH on Friday. Wonder if something is up with their ER or that was just a short-term lack of liquidity with the AH order book on a large order?,0,0.545,POSITIVE,0.982
,,Which company is ASML?,1,0.88,NEGATIVE,0.975
,,The one that makes laser machines to make microchipsI hope I got that right,2,0.519,POSITIVE,1.0
,,Portfolio staple of most global equity funds.,2,0.538,POSITIVE,0.999
,,If I had an award to give you would get it op. This is fantastic. I wish something like this would go up on the front page every sunday. I always have to spend a good hour or so researching trying to find all the market catalysts for the next week so I don't blind trade and get fucked by a Fed announcement in AH or premarket.What do you guys use to help remain aware of market catalysts?,0,0.527,POSITIVE,0.998
,,I’ll take Microsoft to $260 please,0,0.516,NEGATIVE,0.993
,,Thank you for your service,0,0.593,POSITIVE,0.92
,,3M... short the shit out of it.,0,0.495,NEGATIVE,0.94
,,Next week - three weeks winning streak of Nasdaq will end All my executives friends are under weather,0,0.538,NEGATIVE,0.995
,,TSLA CALLS,0,0.512,POSITIVE,0.768
,,Everyone buy tsla calls!!!!,0,0.559,POSITIVE,0.998
