date of comment,main comment,comment,depth,PTR Sentiment,Flair Outlook,Flair Sentiment
,,Wasn’t IPOE the SPAC behind SoFi?,0,0.499,NEGATIVE,0.979
,,yup!,1,0.5,POSITIVE,1.0
,,,1,,,
,,I know you don't know how to read but it was IPOE.,2,0.534,POSITIVE,0.686
,,He was clarifying the title...first guy misread title..,3,0.511,NEGATIVE,0.997
,,Apparently I cannot read. Makes sense though,4,0.505,NEGATIVE,1.0
,,what am i meant to buy here,0,0.6,POSITIVE,0.998
,,Zero attention on this post but its curcial,0,0.504,NEGATIVE,0.797
,,When is da mooning?,0,0.5,POSITIVE,0.738
,,Also GSAH,0,0.623,POSITIVE,0.852
,,"True, but it looks like Chadmath is already tryna slide into Plaid's DMs. Also, his background is in tech so just feels like more of a natural fit.",1,0.523,POSITIVE,0.603
,,https://twitter.com/chamath/status/1349136603197755392?ref_src=twsrc%5Egoogle%7Ctwcamp%5Eserp%7Ctwgr%5Etweet,0,0.502,NEGATIVE,0.798
,,He communicates in hyrogliphs. I like that.,1,0.498,POSITIVE,0.999
,,"ah, looks like they're flirting already.",1,0.508,POSITIVE,0.846
,,Anyone considering V calls,0,0.506,NEGATIVE,0.887
