date of comment,main comment,comment,depth,PTR Sentiment,Flair Outlook,Flair Sentiment
,,Looks like I was right...NVDA will ne north of $140 my Monday,0,0.512,NEGATIVE,0.983
,,Banbet PLTR 37 8 days,0,0.503,NEGATIVE,0.997
,,Apple is trying to groom gsat into challenging spacex. You heard it here first.Wonder how long until gsat announces mega constellation,0,0.515,NEGATIVE,0.958
,,"Amazon beef with 200, they don’t want to meet",0,0.508,NEGATIVE,0.981
,,Monday after close: $PLTR,0,0.485,NEGATIVE,0.998
,,GPT-REEEE,0,0.5,NEGATIVE,0.999
,,GPT-REEEE,1,0.5,NEGATIVE,0.999
,,I got really crushed by meta earnings. $615 call exp 11/8Should I hold till next week?,0,0.543,NEGATIVE,1.0
,,Anyone checking on ONTO Innovation? Is this a dying stock?,0,0.574,NEGATIVE,0.983
,,Are sofi 11 dollar calls for 11/25 a bad idea?,0,0.504,NEGATIVE,0.999
,,The jig is up. Fkers baited retail again,0,0.511,NEGATIVE,0.944
,,Next week calendar is posted on EPSwhispers in case anyone wants to see,0,0.534,NEGATIVE,0.97
,,link?,1,0.495,NEGATIVE,0.989
,,Search epswhispers,2,0.505,NEGATIVE,0.844
,,"I decided against buing RDDT calls, the biggest mover so far. Today Reddit suspends my 10 years old account ""due to suspicious activity"". Stop punishing me, Reddit, I punished myself already.",0,0.511,NEGATIVE,1.0
,,"This account I'm on got a perma ban because some dude reported me for ""harassment"" because I said he was an embarrassment to his familyAll of my accounts got permanently bannedI appealed, and I guess reddit agreed that the dude is an embarrassment to his family and it wasn't harassment because they lifted the ban on this accountBut the rest of my accounts are still permanently bannedAnd yet were both still here using reddit, and both were too regarded to get calls pre-earnings",1,0.54,NEGATIVE,1.0
,,Why tf is intel up fat with semi shitty earnings but amzn cant break 200,0,0.538,NEGATIVE,0.835
,,My calls somehow went down too,1,0.515,NEGATIVE,0.999
,,When Apple turns green. It is gonna be unstoppable...,0,0.51,POSITIVE,0.999
,,Of course I just stepped out of SIRI yesterday after their bad earnings report. You're welcome guys,0,0.534,POSITIVE,0.951
,,F that stock! It treats me like Intel's twin and punishes me everytime I put it in my account.,1,0.553,NEGATIVE,0.997
,,Intel in fact is shitting the bed 💩,0,0.521,NEGATIVE,1.0
,,"The classic earnings movement, pumps to dump before anyone can make any money on options. Gotta love it",0,0.527,POSITIVE,1.0
,,DJT may double if he wins,0,0.53,NEGATIVE,0.998
,,Over 100 if he wins is my guess,1,0.508,NEGATIVE,0.879
,,if,1,0.5,POSITIVE,0.747
,,"Not really because the company loses money and has pathetic revenue and will likely go bankrupt, plus Trump will sell his shares into any pump.",1,0.565,NEGATIVE,1.0
,,Wtf W...you're supposed to be rigged like CVNA,0,0.503,NEGATIVE,1.0
,,"the pump of wayfair is all gone , wtf",0,0.499,NEGATIVE,0.996
,,wtf happened,1,0.5,NEGATIVE,0.997
,,another classic example of manipulation,2,0.508,POSITIVE,0.995
,,Apple 240 eod,0,0.515,POSITIVE,0.711
,,I’ll reward your post and subscribe to your only fans if this is true remindme! 8 hours,1,0.504,NEGATIVE,0.773
,,"I feel like a bitch i sold my AMZN calls yesterday for a $200 loss fml, could have been a 5k gain today",0,0.526,NEGATIVE,1.0
,,"I did this the last Target earnings, got nervous for my calls, took some profit before they announced and it moon'd",1,0.563,NEGATIVE,0.989
,,Believe it or not I had target calls a few earning ago and I got absolutely destroyed holding through earnings,2,0.533,NEGATIVE,1.0
,,Ouch. It be like that sometimes.,1,0.498,NEGATIVE,0.967
,,it be like that all the times,2,0.515,POSITIVE,0.63
,,,1,,,
,,"oh fuk hell , wayfair dropping from the 14%",0,0.498,NEGATIVE,1.0
,,"Short interest for Wayfair stands at 21.4%, and earnings just beat expectations by 69%.Search upWatch out above: Highly shorted Wayfair soars after flipping to a profit in Q3",0,0.533,NEGATIVE,1.0
,,i hate wayfair.,1,0.5,NEGATIVE,1.0
,,how would 21.4% short interest impact wayfair today? can it squeeze to $60?,1,0.527,NEGATIVE,1.0
,,Probably 55,2,0.495,NEGATIVE,0.853
,,"Reddit (the company, not r/WallStreetBets, the subreddit) has banned Seeking Alpha articles everywhere on Reddit.To get around this, please repost your comment/thread with the link removed, and the relevant parts of the article copy and pasted.I am a bot, and this action was performed automatically. Please contact the moderators of this subreddit if you have any questions or concerns.",0,0.526,NEGATIVE,1.0
,,"Reddit (the company, not r/WallStreetBets, the subreddit) has banned Seeking Alpha articles everywhere on Reddit.To get around this, please repost your comment/thread with the link removed, and the relevant parts of the article copy and pasted.I am a bot, and this action was performed automatically. Please contact the moderators of this subreddit if you have any questions or concerns.",1,0.526,NEGATIVE,1.0
,,Fucking W saving my port,0,0.505,NEGATIVE,0.827
,,"it is fuked, wayfair fuk up",1,0.5,NEGATIVE,1.0
,,Sometimes you gotta just laugh,2,0.498,POSITIVE,0.997
,,I have faith that it will rebound as I cry.,3,0.5,POSITIVE,0.998
,,Anyone have access to next weeks calendar? I believe it's a paid subscription no?,0,0.522,NEGATIVE,0.958
,,Just go on the nasdaq website don’t pay,1,0.507,NEGATIVE,1.0
,,Does nasdaq have the option to see a weekly chart with most anticipated earnings? I'm not a fan of scrolling through 40+ company earnings for each day. Maybe i need to adjust how I filter my searches,2,0.597,NEGATIVE,1.0
,,"I do, dm me",1,0.5,POSITIVE,0.847
,,Nice report on XOM,0,0.51,POSITIVE,0.986
,,Will wayfair fuk me up like msft?,0,0.5,NEGATIVE,0.977
,,It fucked you bro,1,0.492,NEGATIVE,0.737
,,"Getting really tired for loss and loss , bullshit of double beat and then plummet , i am not playing until the election finishes",2,0.511,NEGATIVE,0.999
,,"I feel you bro, it’s the most disappointing thing to see it happen with mins too. That’s earnings for you honestly.",3,0.52,NEGATIVE,0.999
,,No it’s up like 14%,1,0.497,NEGATIVE,0.864
,,i want more,2,0.505,POSITIVE,0.979
,,"It's up from earnings surprise, and it was shorted over 20% To begin with",2,0.551,NEGATIVE,0.994
,,Yeah it should run 15-20% today,3,0.55,POSITIVE,0.875
,,Can someone tell me why UBER dumped?They demolished their earnings no?,0,0.537,NEGATIVE,1.0
,,Bookings missed estimatesUber will recover quickly...dump is over reaction...several analysts raised PT after earnings was released,1,0.524,NEGATIVE,0.999
,,Any chance intc will go to 25,0,0.505,NEGATIVE,0.996
,,I bought putsIt could go to 25...never bet against nana,1,0.509,NEGATIVE,0.999
,,GPT-REEEE,0,0.5,NEGATIVE,0.999
,,GPT-REEEE,1,0.5,NEGATIVE,0.999
,,Read if ur gay,2,0.502,NEGATIVE,0.996
,,!banbet $SPY 577 1d,0,0.507,NEGATIVE,0.999
,,GPT-REEEE,1,0.5,NEGATIVE,0.999
,,Any recommendations on what calls to buy next?,0,0.586,NEGATIVE,0.86
,,Dodged a bullet on INTC puts. Markets reactions are regards.,0,0.516,POSITIVE,0.842
,,I got deep OTM Apple puts in preparation for earnings.Give it to me straight bros… am I fucked?,0,0.521,NEGATIVE,0.999
,,What’s was your strike price?,1,0.522,POSITIVE,0.756
,,How far OTM are we talking,1,0.502,POSITIVE,0.824
,,200 expiring in two weeks,2,0.535,NEGATIVE,0.606
,,bruh why would you go that far?,3,0.51,NEGATIVE,0.938
,,The play came to me in a dream,4,0.52,POSITIVE,0.997
,,Apparently it was a nightmare,5,0.49,NEGATIVE,1.0
,,You're cooked my guy,3,0.505,POSITIVE,1.0
